543803,21058,PARTY INVITES WOODLAND,4,2/13/2011 12:05,0.85,17126,United Kingdom
543803,21062,PARTY INVITES SPACEMAN,2,2/13/2011 12:05,0.85,17126,United Kingdom
543803,22156,HEART DECORATION WITH PEARLS ,6,2/13/2011 12:05,0.85,17126,United Kingdom
543803,22924,FRIDGE MAGNETS LA VIE EN ROSE,12,2/13/2011 12:05,0.85,17126,United Kingdom
543803,84380,SET OF 3 BUTTERFLY COOKIE CUTTERS,3,2/13/2011 12:05,1.25,17126,United Kingdom
543803,84378,SET OF 3 HEART COOKIE CUTTERS,3,2/13/2011 12:05,1.25,17126,United Kingdom
543803,21259,VICTORIAN SEWING BOX SMALL ,1,2/13/2011 12:05,5.95,17126,United Kingdom
543803,47566B,TEA TIME PARTY BUNTING,3,2/13/2011 12:05,4.95,17126,United Kingdom
543803,47590A,BLUE HAPPY BIRTHDAY BUNTING,2,2/13/2011 12:05,5.45,17126,United Kingdom
543803,47590B,PINK HAPPY BIRTHDAY BUNTING,2,2/13/2011 12:05,5.45,17126,United Kingdom
543804,21621,VINTAGE UNION JACK BUNTING,2,2/13/2011 12:17,8.5,16434,United Kingdom
543804,22722,SET OF 6 SPICE TINS PANTRY DESIGN,3,2/13/2011 12:17,3.95,16434,United Kingdom
543804,21527,RED RETROSPOT TRADITIONAL TEAPOT ,2,2/13/2011 12:17,7.95,16434,United Kingdom
543804,22791,T-LIGHT GLASS FLUTED ANTIQUE,12,2/13/2011 12:17,1.25,16434,United Kingdom
543804,22720,SET OF 3 CAKE TINS PANTRY DESIGN ,3,2/13/2011 12:17,4.95,16434,United Kingdom
543804,22775,PURPLE DRAWERKNOB ACRYLIC EDWARDIAN,12,2/13/2011 12:17,1.25,16434,United Kingdom
543804,22773,GREEN DRAWER KNOB ACRYLIC EDWARDIAN,12,2/13/2011 12:17,1.25,16434,United Kingdom
543804,22798,ANTIQUE GLASS DRESSING TABLE POT,4,2/13/2011 12:17,2.95,16434,United Kingdom
543804,22078,RIBBON REEL LACE DESIGN ,5,2/13/2011 12:17,2.1,16434,United Kingdom
543804,22624,IVORY KITCHEN SCALES,2,2/13/2011 12:17,8.5,16434,United Kingdom
543804,22800,ANTIQUE TALL SWIRLGLASS TRINKET POT,4,2/13/2011 12:17,3.75,16434,United Kingdom
543804,22805,BLUE DRAWER KNOB ACRYLIC EDWARDIAN,12,2/13/2011 12:17,1.25,16434,United Kingdom
543804,22771,CLEAR DRAWER KNOB ACRYLIC EDWARDIAN,12,2/13/2011 12:17,1.25,16434,United Kingdom
543804,22774,RED DRAWER KNOB ACRYLIC EDWARDIAN,12,2/13/2011 12:17,1.25,16434,United Kingdom
543804,22772,PINK DRAWER KNOB ACRYLIC EDWARDIAN,12,2/13/2011 12:17,1.25,16434,United Kingdom
543804,22178,VICTORIAN GLASS HANGING T-LIGHT,6,2/13/2011 12:17,1.25,16434,United Kingdom
543804,22178,VICTORIAN GLASS HANGING T-LIGHT,6,2/13/2011 12:17,1.25,16434,United Kingdom
543804,22914,BLUE COAT RACK PARIS FASHION,6,2/13/2011 12:17,4.95,16434,United Kingdom
543804,22173,METAL 4 HOOK HANGER FRENCH CHATEAU,8,2/13/2011 12:17,2.95,16434,United Kingdom
543804,22822,CREAM WALL PLANTER HEART SHAPED,4,2/13/2011 12:17,5.95,16434,United Kingdom
543804,21669,BLUE STRIPE CERAMIC DRAWER KNOB,12,2/13/2011 12:17,1.25,16434,United Kingdom
543804,21671,RED SPOT CERAMIC DRAWER KNOB,12,2/13/2011 12:17,1.25,16434,United Kingdom
543804,21668,RED STRIPE CERAMIC DRAWER KNOB,12,2/13/2011 12:17,1.25,16434,United Kingdom
543804,21670,BLUE SPOT CERAMIC DRAWER KNOB,12,2/13/2011 12:17,1.25,16434,United Kingdom
543804,21673,WHITE SPOT BLUE CERAMIC DRAWER KNOB,12,2/13/2011 12:17,1.25,16434,United Kingdom
543804,21672,WHITE SPOT RED CERAMIC DRAWER KNOB,12,2/13/2011 12:17,1.25,16434,United Kingdom
543805,47566,PARTY BUNTING,3,2/13/2011 12:41,4.95,17050,United Kingdom
543805,21894,POTTING SHED SEED ENVELOPES,3,2/13/2011 12:41,1.25,17050,United Kingdom
543805,22966,GINGERBREAD MAN COOKIE CUTTER,1,2/13/2011 12:41,1.25,17050,United Kingdom
543805,22907,PACK OF 20 NAPKINS PANTRY DESIGN,2,2/13/2011 12:41,0.85,17050,United Kingdom
543805,22557,PLASTERS IN TIN VINTAGE PAISLEY ,4,2/13/2011 12:41,1.65,17050,United Kingdom
543805,84380,SET OF 3 BUTTERFLY COOKIE CUTTERS,2,2/13/2011 12:41,1.25,17050,United Kingdom
543805,22965,3 TRADITIONAl BISCUIT CUTTERS  SET,2,2/13/2011 12:41,2.1,17050,United Kingdom
543805,47503A,ASS FLORAL PRINT MULTI SCREWDRIVER,12,2/13/2011 12:41,1.25,17050,United Kingdom
543805,22652,TRAVEL SEWING KIT,6,2/13/2011 12:41,1.65,17050,United Kingdom
543805,22624,IVORY KITCHEN SCALES,1,2/13/2011 12:41,8.5,17050,United Kingdom
543805,22989,SET 2 PANTRY DESIGN TEA TOWELS,2,2/13/2011 12:41,3.25,17050,United Kingdom
543805,22990,COTTON APRON PANTRY DESIGN,2,2/13/2011 12:41,4.95,17050,United Kingdom
543805,22966,GINGERBREAD MAN COOKIE CUTTER,1,2/13/2011 12:41,1.25,17050,United Kingdom
543805,20996,JAZZ HEARTS ADDRESS BOOK,6,2/13/2011 12:41,0.42,17050,United Kingdom
543805,21984,PACK OF 12 PINK PAISLEY TISSUES ,12,2/13/2011 12:41,0.29,17050,United Kingdom
543805,22722,SET OF 6 SPICE TINS PANTRY DESIGN,2,2/13/2011 12:41,3.95,17050,United Kingdom
543805,21382,SET/4 SPRING FLOWER DECORATION,4,2/13/2011 12:41,2.95,17050,United Kingdom
543805,22720,SET OF 3 CAKE TINS PANTRY DESIGN ,2,2/13/2011 12:41,4.95,17050,United Kingdom
543805,85232A,SET/3 POLKADOT STACKING TINS,2,2/13/2011 12:41,4.95,17050,United Kingdom
543806,21174,POTTERING IN THE SHED METAL SIGN,2,2/13/2011 12:48,2.08,17085,United Kingdom
543806,21175,GIN + TONIC DIET METAL SIGN,2,2/13/2011 12:48,2.55,17085,United Kingdom
543806,22413,METAL SIGN TAKE IT OR LEAVE IT ,2,2/13/2011 12:48,2.95,17085,United Kingdom
543806,21181,PLEASE ONE PERSON METAL SIGN,3,2/13/2011 12:48,2.1,17085,United Kingdom
543806,22412,METAL SIGN NEIGHBOURHOOD WITCH ,1,2/13/2011 12:48,2.1,17085,United Kingdom
543806,85150,LADIES & GENTLEMEN METAL SIGN,2,2/13/2011 12:48,2.55,17085,United Kingdom
543806,85152,HAND OVER THE CHOCOLATE   SIGN ,2,2/13/2011 12:48,2.1,17085,United Kingdom
543806,82583,HOT BATHS METAL SIGN,2,2/13/2011 12:48,2.1,17085,United Kingdom
543806,21908,CHOCOLATE THIS WAY METAL SIGN,1,2/13/2011 12:48,2.1,17085,United Kingdom
543806,82582,AREA PATROLLED METAL SIGN,2,2/13/2011 12:48,2.1,17085,United Kingdom
543806,21907,I'M ON HOLIDAY METAL SIGN,2,2/13/2011 12:48,2.1,17085,United Kingdom
543806,22457,NATURAL SLATE HEART CHALKBOARD ,3,2/13/2011 12:48,2.95,17085,United Kingdom
543806,10002,INFLATABLE POLITICAL GLOBE ,1,2/13/2011 12:48,0.85,17085,United Kingdom
543806,22193,RED DINER WALL CLOCK,1,2/13/2011 12:48,8.5,17085,United Kingdom
543806,22192,BLUE DINER WALL CLOCK,1,2/13/2011 12:48,8.5,17085,United Kingdom
543806,22191,IVORY DINER WALL CLOCK,1,2/13/2011 12:48,8.5,17085,United Kingdom
543806,22813,PACK 3 BOXES BIRD PANNETONE ,4,2/13/2011 12:48,1.95,17085,United Kingdom
543806,21733,RED HANGING HEART T-LIGHT HOLDER,4,2/13/2011 12:48,2.95,17085,United Kingdom
543806,22470,HEART OF WICKER LARGE,4,2/13/2011 12:48,2.95,17085,United Kingdom
543806,22469,HEART OF WICKER SMALL,4,2/13/2011 12:48,1.65,17085,United Kingdom
543806,71477,COLOUR GLASS. STAR T-LIGHT HOLDER,1,2/13/2011 12:48,3.25,17085,United Kingdom
543806,22371,AIRLINE BAG VINTAGE TOKYO 78,2,2/13/2011 12:48,4.25,17085,United Kingdom
543806,85104,SILVER GLASS T-LIGHT SET,3,2/13/2011 12:48,2.95,17085,United Kingdom
543806,84949,SILVER HANGING T-LIGHT HOLDER,6,2/13/2011 12:48,1.65,17085,United Kingdom
543806,22502,PICNIC BASKET WICKER SMALL,2,2/13/2011 12:48,5.95,17085,United Kingdom
543806,22501,PICNIC BASKET WICKER LARGE,2,2/13/2011 12:48,9.95,17085,United Kingdom
543806,20966,SANDWICH BATH SPONGE,5,2/13/2011 12:48,1.25,17085,United Kingdom
543806,79321,CHILLI LIGHTS,3,2/13/2011 12:48,5.75,17085,United Kingdom
543806,21324,HANGING MEDINA LANTERN SMALL,3,2/13/2011 12:48,2.95,17085,United Kingdom
543806,20679,EDWARDIAN PARASOL RED,1,2/13/2011 12:48,5.95,17085,United Kingdom
543806,17021,NAMASTE SWAGAT INCENSE,42,2/13/2011 12:48,0.3,17085,United Kingdom
543807,22470,HEART OF WICKER LARGE,3,2/13/2011 13:15,2.95,14692,United Kingdom
543807,20971,PINK BLUE FELT CRAFT TRINKET BOX,3,2/13/2011 13:15,1.25,14692,United Kingdom
543807,22147,FELTCRAFT BUTTERFLY HEARTS,3,2/13/2011 13:15,1.45,14692,United Kingdom
543807,22296,HEART IVORY TRELLIS LARGE,12,2/13/2011 13:15,1.65,14692,United Kingdom
543807,22557,PLASTERS IN TIN VINTAGE PAISLEY ,12,2/13/2011 13:15,1.65,14692,United Kingdom
543807,22241,GARLAND WOODEN HAPPY EASTER,12,2/13/2011 13:15,1.25,14692,United Kingdom
543807,20854,BLUE PATCH PURSE PINK HEART,3,2/13/2011 13:15,1.65,14692,United Kingdom
543807,21992,VINTAGE PAISLEY STATIONERY SET,3,2/13/2011 13:15,2.95,14692,United Kingdom
543807,20969,RED FLORAL FELTCRAFT SHOULDER BAG,2,2/13/2011 13:15,3.75,14692,United Kingdom
543807,22271,FELTCRAFT DOLL ROSIE,2,2/13/2011 13:15,2.95,14692,United Kingdom
543807,22749,FELTCRAFT PRINCESS CHARLOTTE DOLL,3,2/13/2011 13:15,3.75,14692,United Kingdom
543807,20970,PINK FLORAL FELTCRAFT SHOULDER BAG,3,2/13/2011 13:15,3.75,14692,United Kingdom
543808,21987,PACK OF 6 SKULL PAPER CUPS,4,2/13/2011 13:22,0.65,17454,United Kingdom
543808,21086,SET/6 RED SPOTTY PAPER CUPS,4,2/13/2011 13:22,0.65,17454,United Kingdom
543808,21988,PACK OF 6 SKULL PAPER PLATES,4,2/13/2011 13:22,0.85,17454,United Kingdom
543808,21989,PACK OF 20 SKULL PAPER NAPKINS,2,2/13/2011 13:22,0.85,17454,United Kingdom
543808,21213,PACK OF 72 SKULL CAKE CASES,2,2/13/2011 13:22,0.55,17454,United Kingdom
543808,21212,PACK OF 72 RETROSPOT CAKE CASES,2,2/13/2011 13:22,0.55,17454,United Kingdom
543808,22551,PLASTERS IN TIN SPACEBOY,1,2/13/2011 13:22,1.65,17454,United Kingdom
543808,22557,PLASTERS IN TIN VINTAGE PAISLEY ,1,2/13/2011 13:22,1.65,17454,United Kingdom
543808,22556,PLASTERS IN TIN CIRCUS PARADE ,1,2/13/2011 13:22,1.65,17454,United Kingdom
543808,22554,PLASTERS IN TIN WOODLAND ANIMALS,1,2/13/2011 13:22,1.65,17454,United Kingdom
543808,22553,PLASTERS IN TIN SKULLS,1,2/13/2011 13:22,1.65,17454,United Kingdom
543808,21094,SET/6 RED SPOTTY PAPER PLATES,4,2/13/2011 13:22,0.85,17454,United Kingdom
543808,21080,SET/20 RED RETROSPOT PAPER NAPKINS ,2,2/13/2011 13:22,0.85,17454,United Kingdom
543808,22469,HEART OF WICKER SMALL,2,2/13/2011 13:22,1.65,17454,United Kingdom
543808,22470,HEART OF WICKER LARGE,2,2/13/2011 13:22,2.95,17454,United Kingdom
543808,79321,CHILLI LIGHTS,1,2/13/2011 13:22,5.75,17454,United Kingdom
543808,22179,SET 10 LIGHTS NIGHT OWL,1,2/13/2011 13:22,6.75,17454,United Kingdom
543808,82494L,WOODEN FRAME ANTIQUE WHITE ,2,2/13/2011 13:22,2.95,17454,United Kingdom
543808,82482,WOODEN PICTURE FRAME WHITE FINISH,2,2/13/2011 13:22,2.55,17454,United Kingdom
543808,22719,GUMBALL MONOCHROME COAT RACK,2,2/13/2011 13:22,1.25,17454,United Kingdom
543808,47590B,PINK HAPPY BIRTHDAY BUNTING,1,2/13/2011 13:22,5.45,17454,United Kingdom
543808,47590A,BLUE HAPPY BIRTHDAY BUNTING,1,2/13/2011 13:22,5.45,17454,United Kingdom
543808,47566,PARTY BUNTING,1,2/13/2011 13:22,4.95,17454,United Kingdom
543808,22721,SET OF 3 CAKE TINS SKETCHBOOK,1,2/13/2011 13:22,4.95,17454,United Kingdom
543808,22720,SET OF 3 CAKE TINS PANTRY DESIGN ,1,2/13/2011 13:22,4.95,17454,United Kingdom
543808,20725,LUNCH BAG RED RETROSPOT,10,2/13/2011 13:22,1.65,17454,United Kingdom
543808,85099B,JUMBO BAG RED RETROSPOT,10,2/13/2011 13:22,1.95,17454,United Kingdom
543808,20724,RED RETROSPOT CHARLOTTE BAG,10,2/13/2011 13:22,0.85,17454,United Kingdom
543808,21034,REX CASH+CARRY JUMBO SHOPPER,1,2/13/2011 13:22,0.95,17454,United Kingdom
543809,44089C,LILAC GAUZE BUTTERFLY LAMPSHADE,8,2/13/2011 13:52,0.42,17095,United Kingdom
543809,44236,PINK/PURPLE CIRCLE CURTAIN,4,2/13/2011 13:52,4.65,17095,United Kingdom
543809,71038,WHITE HANGING BEADS CANDLE HOLDER,4,2/13/2011 13:52,5.45,17095,United Kingdom
543809,22507,MEMO BOARD RETROSPOT  DESIGN,2,2/13/2011 13:52,4.95,17095,United Kingdom
543809,51008,AFGHAN SLIPPER SOCK PAIR,10,2/13/2011 13:52,3.45,17095,United Kingdom
543809,22505,MEMO BOARD COTTAGE DESIGN,2,2/13/2011 13:52,4.95,17095,United Kingdom
543809,84029G,KNITTED UNION FLAG HOT WATER BOTTLE,4,2/13/2011 13:52,3.75,17095,United Kingdom
543809,22835,HOT WATER BOTTLE I AM SO POORLY,2,2/13/2011 13:52,4.65,17095,United Kingdom
543809,22925,BLUE GIANT GARDEN THERMOMETER,2,2/13/2011 13:52,5.95,17095,United Kingdom
543809,22926,IVORY GIANT GARDEN THERMOMETER,2,2/13/2011 13:52,5.95,17095,United Kingdom
543809,22927,GREEN GIANT GARDEN THERMOMETER,2,2/13/2011 13:52,5.95,17095,United Kingdom
543809,47504K,ENGLISH ROSE GARDEN SECATEURS,2,2/13/2011 13:52,1.95,17095,United Kingdom
543809,15036,ASSORTED COLOURS SILK FAN,36,2/13/2011 13:52,0.75,17095,United Kingdom
543809,21465,PINK FLOWER CROCHET FOOD COVER,2,2/13/2011 13:52,3.75,17095,United Kingdom
543809,21466,RED FLOWER CROCHET FOOD COVER,2,2/13/2011 13:52,3.75,17095,United Kingdom
543809,21467,CHERRY CROCHET FOOD COVER,2,2/13/2011 13:52,3.75,17095,United Kingdom
543809,22424,ENAMEL BREAD BIN CREAM,1,2/13/2011 13:52,12.75,17095,United Kingdom
543809,22561,WOODEN SCHOOL COLOURING SET,4,2/13/2011 13:52,1.65,17095,United Kingdom
543810,21781,MA CAMPAGNE CUTLERY BOX,1,2/13/2011 14:16,14.95,13171,United Kingdom
543810,20717,STRAWBERRY SHOPPER BAG,2,2/13/2011 14:16,1.25,13171,United Kingdom
543810,22843,BISCUIT TIN VINTAGE GREEN,1,2/13/2011 14:16,6.75,13171,United Kingdom
543810,22720,SET OF 3 CAKE TINS PANTRY DESIGN ,1,2/13/2011 14:16,4.95,13171,United Kingdom
543810,22841,ROUND CAKE TIN VINTAGE GREEN,1,2/13/2011 14:16,7.95,13171,United Kingdom
543810,22825,DECORATIVE PLANT POT WITH FRIEZE,2,2/13/2011 14:16,7.95,13171,United Kingdom
543810,22469,HEART OF WICKER SMALL,1,2/13/2011 14:16,1.65,13171,United Kingdom
543810,22470,HEART OF WICKER LARGE,1,2/13/2011 14:16,2.95,13171,United Kingdom
543810,22457,NATURAL SLATE HEART CHALKBOARD ,2,2/13/2011 14:16,2.95,13171,United Kingdom
543810,84509A,SET OF 4 ENGLISH ROSE PLACEMATS,1,2/13/2011 14:16,3.75,13171,United Kingdom
543810,84510A,SET OF 4 ENGLISH ROSE COASTERS,1,2/13/2011 14:16,1.25,13171,United Kingdom
543810,22722,SET OF 6 SPICE TINS PANTRY DESIGN,2,2/13/2011 14:16,3.95,13171,United Kingdom
543810,22831,WHITE BROCANTE SOAP DISH,2,2/13/2011 14:16,2.95,13171,United Kingdom
543810,21756,BATH BUILDING BLOCK WORD,1,2/13/2011 14:16,5.95,13171,United Kingdom
543810,21533,RETROSPOT LARGE MILK JUG,1,2/13/2011 14:16,4.95,13171,United Kingdom
543810,21260,FIRST AID TIN,1,2/13/2011 14:16,3.25,13171,United Kingdom
543810,22426,ENAMEL WASH BOWL CREAM,2,2/13/2011 14:16,3.75,13171,United Kingdom
543810,22494,EMERGENCY FIRST AID TIN ,1,2/13/2011 14:16,1.25,13171,United Kingdom
543810,21534,DAIRY MAID LARGE MILK JUG,1,2/13/2011 14:16,4.95,13171,United Kingdom
543810,21385,IVORY HANGING DECORATION  HEART,24,2/13/2011 14:16,0.85,13171,United Kingdom
543810,21363,HOME SMALL WOOD LETTERS,1,2/13/2011 14:16,4.95,13171,United Kingdom
543810,22496,SET OF 2 ROUND TINS DUTCH CHEESE,1,2/13/2011 14:16,2.95,13171,United Kingdom
543810,21034,REX CASH+CARRY JUMBO SHOPPER,2,2/13/2011 14:16,0.95,13171,United Kingdom
C543811,22423,REGENCY CAKESTAND 3 TIER,-1,2/13/2011 14:28,12.75,15640,United Kingdom
C543811,22634,CHILDS BREAKFAST SET SPACEBOY ,-1,2/13/2011 14:28,9.95,15640,United Kingdom
543812,22948,METAL DECORATION NAUGHTY CHILDREN ,24,2/13/2011 14:40,0.85,17472,United Kingdom
543812,71459,HANGING JAM JAR T-LIGHT HOLDER,12,2/13/2011 14:40,0.85,17472,United Kingdom
543812,22457,NATURAL SLATE HEART CHALKBOARD ,3,2/13/2011 14:40,2.95,17472,United Kingdom
543812,22488,NATURAL SLATE RECTANGLE CHALKBOARD,8,2/13/2011 14:40,1.65,17472,United Kingdom
543812,79321,CHILLI LIGHTS,1,2/13/2011 14:40,5.75,17472,United Kingdom
543812,21889,WOODEN BOX OF DOMINOES,1,2/13/2011 14:40,1.25,17472,United Kingdom
543812,22530,MAGIC DRAWING SLATE DOLLY GIRL ,4,2/13/2011 14:40,0.42,17472,United Kingdom
543812,22285,HANGING HEN ON NEST DECORATION,1,2/13/2011 14:40,1.65,17472,United Kingdom
543812,85049H,URBAN BLACK RIBBONS ,1,2/13/2011 14:40,1.25,17472,United Kingdom
543812,21061,PARTY INVITES FOOTBALL,2,2/13/2011 14:40,0.85,17472,United Kingdom
543812,21058,PARTY INVITES WOODLAND,1,2/13/2011 14:40,0.85,17472,United Kingdom
543812,22083,PAPER CHAIN KIT RETROSPOT,1,2/13/2011 14:40,2.95,17472,United Kingdom
543812,22085,PAPER CHAIN KIT SKULLS ,1,2/13/2011 14:40,2.95,17472,United Kingdom
543812,21584,RETROSPOT SMALL TUBE MATCHES,1,2/13/2011 14:40,1.65,17472,United Kingdom
543812,21592,RETROSPOT CIGAR BOX MATCHES ,1,2/13/2011 14:40,1.25,17472,United Kingdom
543812,21164,HOME SWEET HOME METAL SIGN ,1,2/13/2011 14:40,2.95,17472,United Kingdom
543812,21790,VINTAGE SNAP CARDS,1,2/13/2011 14:40,0.85,17472,United Kingdom
543812,21868,POTTING SHED TEA MUG,3,2/13/2011 14:40,1.25,17472,United Kingdom
543812,22948,METAL DECORATION NAUGHTY CHILDREN ,1,2/13/2011 14:40,0.85,17472,United Kingdom
543812,22914,BLUE COAT RACK PARIS FASHION,1,2/13/2011 14:40,4.95,17472,United Kingdom
543812,22250,DECORATION  BUTTERFLY  MAGIC GARDEN,2,2/13/2011 14:40,0.85,17472,United Kingdom
543812,22249,DECORATION WHITE CHICK MAGIC GARDEN,2,2/13/2011 14:40,0.85,17472,United Kingdom
543812,22242,5 HOOK HANGER MAGIC TOADSTOOL,1,2/13/2011 14:40,1.65,17472,United Kingdom
543812,22243,5 HOOK HANGER RED MAGIC TOADSTOOL,1,2/13/2011 14:40,1.65,17472,United Kingdom
543812,47590B,PINK HAPPY BIRTHDAY BUNTING,1,2/13/2011 14:40,5.45,17472,United Kingdom
543812,47590A,BLUE HAPPY BIRTHDAY BUNTING,1,2/13/2011 14:40,5.45,17472,United Kingdom
543812,22410,MONEY BOX HOUSEKEEPING DESIGN,4,2/13/2011 14:40,1.25,17472,United Kingdom
543812,22956,36 FOIL HEART CAKE CASES,1,2/13/2011 14:40,2.1,17472,United Kingdom
543812,21896,POTTING SHED TWINE,2,2/13/2011 14:40,2.1,17472,United Kingdom
543812,84978,HANGING HEART JAR T-LIGHT HOLDER,6,2/13/2011 14:40,1.25,17472,United Kingdom
543812,22667,RECIPE BOX RETROSPOT ,1,2/13/2011 14:40,2.95,17472,United Kingdom
543812,22722,SET OF 6 SPICE TINS PANTRY DESIGN,1,2/13/2011 14:40,3.95,17472,United Kingdom
543812,22241,GARLAND WOODEN HAPPY EASTER,2,2/13/2011 14:40,1.25,17472,United Kingdom
543812,22720,SET OF 3 CAKE TINS PANTRY DESIGN ,2,2/13/2011 14:40,4.95,17472,United Kingdom
543812,22666,RECIPE BOX PANTRY YELLOW DESIGN,3,2/13/2011 14:40,2.95,17472,United Kingdom
543812,22477,WATERING CAN GARDEN MARKER,10,2/13/2011 14:40,1.25,17472,United Kingdom
543812,22456,NATURAL SLATE CHALKBOARD LARGE ,1,2/13/2011 14:40,4.95,17472,United Kingdom
543812,22488,NATURAL SLATE RECTANGLE CHALKBOARD,2,2/13/2011 14:40,1.65,17472,United Kingdom
543812,22470,HEART OF WICKER LARGE,1,2/13/2011 14:40,2.95,17472,United Kingdom
543812,20984,12 PENCILS TALL TUBE POSY,1,2/13/2011 14:40,0.85,17472,United Kingdom
543812,22555,PLASTERS IN TIN STRONGMAN,1,2/13/2011 14:40,1.65,17472,United Kingdom
543812,22557,PLASTERS IN TIN VINTAGE PAISLEY ,1,2/13/2011 14:40,1.65,17472,United Kingdom
543812,21790,VINTAGE SNAP CARDS,1,2/13/2011 14:40,0.85,17472,United Kingdom
543812,22558,CLOTHES PEGS RETROSPOT PACK 24 ,1,2/13/2011 14:40,1.49,17472,United Kingdom
543812,22280,POCKET BAG PINK PAISELY BROWN SPOT,2,2/13/2011 14:40,1.25,17472,United Kingdom
543812,22099,CARAVAN SQUARE TISSUE BOX,1,2/13/2011 14:40,1.25,17472,United Kingdom
543812,22960,JAM MAKING SET WITH JARS,1,2/13/2011 14:40,4.25,17472,United Kingdom
543812,82600,NO SINGING METAL SIGN,1,2/13/2011 14:40,2.1,17472,United Kingdom
543812,21430,SET/3 RED GINGHAM ROSE STORAGE BOX,1,2/13/2011 14:40,3.75,17472,United Kingdom
543812,84763,ZINC FINISH 15CM PLANTER POTS,4,2/13/2011 14:40,1.25,17472,United Kingdom
543812,85049E,SCANDINAVIAN REDS RIBBONS,1,2/13/2011 14:40,1.25,17472,United Kingdom
543812,85049D,BRIGHT BLUES RIBBONS ,1,2/13/2011 14:40,1.25,17472,United Kingdom
543812,22077,6 RIBBONS RUSTIC CHARM,1,2/13/2011 14:40,1.65,17472,United Kingdom
543812,85049G,CHOCOLATE BOX RIBBONS ,1,2/13/2011 14:40,1.25,17472,United Kingdom
543812,85049A,TRADITIONAL CHRISTMAS RIBBONS,1,2/13/2011 14:40,1.25,17472,United Kingdom
543812,22284,HEN HOUSE DECORATION,1,2/13/2011 14:40,1.65,17472,United Kingdom
543812,22674,FRENCH TOILET SIGN BLUE METAL,1,2/13/2011 14:40,1.25,17472,United Kingdom
543812,85214,TUB 24 PINK FLOWER PEGS,2,2/13/2011 14:40,1.65,17472,United Kingdom
543812,21106,CREAM SLICE FLANNEL CHOCOLATE SPOT ,1,2/13/2011 14:40,2.95,17472,United Kingdom
543812,84849B,FAIRY SOAP SOAP HOLDER,1,2/13/2011 14:40,1.69,17472,United Kingdom
543812,22268,EASTER DECORATION SITTING BUNNY,1,2/13/2011 14:40,0.85,17472,United Kingdom
543812,22925,BLUE GIANT GARDEN THERMOMETER,3,2/13/2011 14:40,5.95,17472,United Kingdom
543812,22667,RECIPE BOX RETROSPOT ,1,2/13/2011 14:40,2.95,17472,United Kingdom
543812,22666,RECIPE BOX PANTRY YELLOW DESIGN,1,2/13/2011 14:40,2.95,17472,United Kingdom
543812,22722,SET OF 6 SPICE TINS PANTRY DESIGN,2,2/13/2011 14:40,3.95,17472,United Kingdom
543813,21038,SET/4 MODERN VINTAGE COTTON NAPKINS,2,2/13/2011 15:02,2.95,16897,United Kingdom
543813,22138,BAKING SET 9 PIECE RETROSPOT ,2,2/13/2011 15:02,4.95,16897,United Kingdom
543813,21876,POTTERING MUG,3,2/13/2011 15:02,1.25,16897,United Kingdom
543813,85071B,RED CHARLIE+LOLA PERSONAL DOORSIGN,2,2/13/2011 15:02,2.95,16897,United Kingdom
543813,85071A,BLUE CHARLIE+LOLA PERSONAL DOORSIGN,2,2/13/2011 15:02,2.95,16897,United Kingdom
543813,22622,BOX OF VINTAGE ALPHABET BLOCKS,2,2/13/2011 15:02,9.95,16897,United Kingdom
543813,22423,REGENCY CAKESTAND 3 TIER,2,2/13/2011 15:02,12.75,16897,United Kingdom
543814,21875,KINGS CHOICE MUG,6,2/13/2011 15:17,1.25,15640,United Kingdom
543814,84987,SET OF 36 TEATIME PAPER DOILIES,24,2/13/2011 15:17,1.45,15640,United Kingdom
543814,21383,PACK OF 12 STICKY BUNNIES,48,2/13/2011 15:17,0.65,15640,United Kingdom
543814,20751,FUNKY WASHING UP GLOVES ASSORTED,12,2/13/2011 15:17,2.1,15640,United Kingdom
543814,22281,EASTER TREE YELLOW BIRDS,4,2/13/2011 15:17,5.95,15640,United Kingdom
543814,22957,SET 3 PAPER VINTAGE CHICK PAPER EGG,10,2/13/2011 15:17,2.95,15640,United Kingdom
543814,84991,60 TEATIME FAIRY CAKE CASES,24,2/13/2011 15:17,0.55,15640,United Kingdom
543814,21212,PACK OF 72 RETROSPOT CAKE CASES,24,2/13/2011 15:17,0.55,15640,United Kingdom
543814,22971,QUEENS GUARD COFFEE MUG,12,2/13/2011 15:17,2.55,15640,United Kingdom
543814,22636,CHILDS BREAKFAST SET CIRCUS PARADE,4,2/13/2011 15:17,8.5,15640,United Kingdom
543814,22084,PAPER CHAIN KIT EMPIRE,6,2/13/2011 15:17,2.95,15640,United Kingdom
543814,21457,2 PICTURE BOOK EGGS EASTER DUCKS,24,2/13/2011 15:17,1.25,15640,United Kingdom
543814,22988,SOLDIERS EGG CUP ,6,2/13/2011 15:17,1.25,15640,United Kingdom
543814,22972,CHILDREN'S SPACEBOY MUG,6,2/13/2011 15:17,1.65,15640,United Kingdom
543814,21975,PACK OF 60 DINOSAUR CAKE CASES,48,2/13/2011 15:17,0.55,15640,United Kingdom
543814,22241,GARLAND WOODEN HAPPY EASTER,24,2/13/2011 15:17,1.25,15640,United Kingdom
543814,21843,RED RETROSPOT CAKE STAND,24,2/13/2011 15:17,9.95,15640,United Kingdom
543814,22423,REGENCY CAKESTAND 3 TIER,16,2/13/2011 15:17,10.95,15640,United Kingdom
543814,22585,PACK OF 6 BIRDY GIFT TAGS,12,2/13/2011 15:17,1.25,15640,United Kingdom
543814,48184,DOORMAT ENGLISH ROSE ,6,2/13/2011 15:17,7.95,15640,United Kingdom
543814,79321,CHILLI LIGHTS,6,2/13/2011 15:17,5.75,15640,United Kingdom
543814,22089,PAPER BUNTING VINTAGE PAISLEY,6,2/13/2011 15:17,2.95,15640,United Kingdom
543814,22088,PAPER BUNTING COLOURED LACE,12,2/13/2011 15:17,2.95,15640,United Kingdom
543814,22084,PAPER CHAIN KIT EMPIRE,6,2/13/2011 15:17,2.95,15640,United Kingdom
543814,22087,PAPER BUNTING WHITE LACE,12,2/13/2011 15:17,2.95,15640,United Kingdom
543815,22443,GROW YOUR OWN HERBS SET OF 3,1,2/13/2011 15:18,7.95,17255,United Kingdom
543815,21896,POTTING SHED TWINE,2,2/13/2011 15:18,2.1,17255,United Kingdom
543815,21894,POTTING SHED SEED ENVELOPES,4,2/13/2011 15:18,1.25,17255,United Kingdom
543815,21709,FOLDING UMBRELLA CHOCOLATE POLKADOT,1,2/13/2011 15:18,4.95,17255,United Kingdom
543815,22488,NATURAL SLATE RECTANGLE CHALKBOARD,3,2/13/2011 15:18,1.65,17255,United Kingdom
543815,22185,SLATE TILE NATURAL HANGING,3,2/13/2011 15:18,1.65,17255,United Kingdom
543815,21900,"KEY FOB , SHED",3,2/13/2011 15:18,0.65,17255,United Kingdom
543815,82600,NO SINGING METAL SIGN,1,2/13/2011 15:18,2.1,17255,United Kingdom
543815,82583,HOT BATHS METAL SIGN,1,2/13/2011 15:18,2.1,17255,United Kingdom
543815,21181,PLEASE ONE PERSON METAL SIGN,1,2/13/2011 15:18,2.1,17255,United Kingdom
543815,82551,LAUNDRY 15C METAL SIGN,2,2/13/2011 15:18,1.45,17255,United Kingdom
543815,82580,BATHROOM METAL SIGN,2,2/13/2011 15:18,0.55,17255,United Kingdom
543815,82578,KITCHEN METAL SIGN,2,2/13/2011 15:18,0.55,17255,United Kingdom
543815,82581,TOILET METAL SIGN,2,2/13/2011 15:18,0.55,17255,United Kingdom
543815,21894,POTTING SHED SEED ENVELOPES,2,2/13/2011 15:18,1.25,17255,United Kingdom
543815,22916,HERB MARKER THYME,2,2/13/2011 15:18,0.65,17255,United Kingdom
543815,21124,SET/10 BLUE POLKADOT PARTY CANDLES,2,2/13/2011 15:18,1.25,17255,United Kingdom
543815,21123,SET/10 IVORY POLKADOT PARTY CANDLES,2,2/13/2011 15:18,1.25,17255,United Kingdom
543815,21122,SET/10 PINK POLKADOT PARTY CANDLES,2,2/13/2011 15:18,1.25,17255,United Kingdom
543815,22938,CUPCAKE LACE PAPER SET 6,1,2/13/2011 15:18,1.95,17255,United Kingdom
543815,22919,HERB MARKER MINT,2,2/13/2011 15:18,0.65,17255,United Kingdom
543815,22917,HERB MARKER ROSEMARY,2,2/13/2011 15:18,0.65,17255,United Kingdom
543815,22918,HERB MARKER PARSLEY,2,2/13/2011 15:18,0.65,17255,United Kingdom
543815,22921,HERB MARKER CHIVES ,2,2/13/2011 15:18,0.65,17255,United Kingdom
543815,22920,HERB MARKER BASIL,2,2/13/2011 15:18,0.65,17255,United Kingdom
543815,21896,POTTING SHED TWINE,2,2/13/2011 15:18,2.1,17255,United Kingdom
543815,22231,JIGSAW TREE WITH BIRDHOUSE,2,2/13/2011 15:18,1.45,17255,United Kingdom
543815,22230,JIGSAW TREE WITH WATERING CAN,2,2/13/2011 15:18,0.85,17255,United Kingdom
543815,22233,JIGSAW RABBIT AND BIRDHOUSE,2,2/13/2011 15:18,1.65,17255,United Kingdom
543815,22283,6 EGG HOUSE PAINTED WOOD,1,2/13/2011 15:18,7.95,17255,United Kingdom
543815,21383,PACK OF 12 STICKY BUNNIES,3,2/13/2011 15:18,0.65,17255,United Kingdom
543815,22148,EASTER CRAFT 4 CHICKS ,2,2/13/2011 15:18,1.95,17255,United Kingdom
543815,84459A,PINK METAL CHICKEN HEART ,2,2/13/2011 15:18,1.49,17255,United Kingdom
543815,84531B,BLUE KNITTED EGG COSY,2,2/13/2011 15:18,1.95,17255,United Kingdom
543815,84531A,PINK KNITTED EGG COSY,2,2/13/2011 15:18,1.95,17255,United Kingdom
543815,84459B,YELLOW METAL CHICKEN HEART ,2,2/13/2011 15:18,1.49,17255,United Kingdom
543815,22861,EASTER TIN CHICKS IN GARDEN,2,2/13/2011 15:18,1.65,17255,United Kingdom
543815,22860,EASTER TIN CHICKS PINK DAISY,2,2/13/2011 15:18,1.65,17255,United Kingdom
