541995,22138,BAKING SET 9 PIECE RETROSPOT ,3,1/25/2011 9:58,4.95,13158,United Kingdom
541995,22196,SMALL HEART MEASURING SPOONS,12,1/25/2011 9:58,0.85,13158,United Kingdom
541995,84997B,RED 3 PIECE RETROSPOT CUTLERY SET,6,1/25/2011 9:58,3.75,13158,United Kingdom
541995,84997C,BLUE 3 PIECE POLKADOT CUTLERY SET,6,1/25/2011 9:58,3.75,13158,United Kingdom
541995,84997D,PINK 3 PIECE POLKADOT CUTLERY SET,6,1/25/2011 9:58,3.75,13158,United Kingdom
541995,22637,PIGGY BANK RETROSPOT ,4,1/25/2011 9:58,2.55,13158,United Kingdom
541995,22644,CERAMIC CHERRY CAKE MONEY BANK,12,1/25/2011 9:58,1.45,13158,United Kingdom
541996,22791,T-LIGHT GLASS FLUTED ANTIQUE,12,1/25/2011 10:20,1.25,18075,United Kingdom
541996,84946,ANTIQUE SILVER TEA GLASS ETCHED,12,1/25/2011 10:20,1.25,18075,United Kingdom
541996,21916,SET 12 RETRO WHITE CHALK STICKS,24,1/25/2011 10:20,0.42,18075,United Kingdom
541996,22456,NATURAL SLATE CHALKBOARD LARGE ,3,1/25/2011 10:20,4.95,18075,United Kingdom
541996,82484,WOOD BLACK BOARD ANT WHITE FINISH,3,1/25/2011 10:20,6.45,18075,United Kingdom
541996,22171,3 HOOK PHOTO SHELF ANTIQUE WHITE,2,1/25/2011 10:20,8.5,18075,United Kingdom
541996,20846,ZINC HEART LATTICE T-LIGHT HOLDER,12,1/25/2011 10:20,1.25,18075,United Kingdom
541996,22156,HEART DECORATION WITH PEARLS ,12,1/25/2011 10:20,0.85,18075,United Kingdom
541996,22178,VICTORIAN GLASS HANGING T-LIGHT,12,1/25/2011 10:20,1.25,18075,United Kingdom
541996,21733,RED HANGING HEART T-LIGHT HOLDER,12,1/25/2011 10:20,2.95,18075,United Kingdom
541996,22804,CANDLEHOLDER PINK HANGING HEART,6,1/25/2011 10:20,2.95,18075,United Kingdom
541996,85062,PEARL CRYSTAL PUMPKIN T-LIGHT HLDR,12,1/25/2011 10:20,1.65,18075,United Kingdom
541996,85123A,WHITE HANGING HEART T-LIGHT HOLDER,12,1/25/2011 10:20,2.95,18075,United Kingdom
541996,21385,IVORY HANGING DECORATION  HEART,24,1/25/2011 10:20,0.85,18075,United Kingdom
541996,22469,HEART OF WICKER SMALL,12,1/25/2011 10:20,1.65,18075,United Kingdom
541996,22470,HEART OF WICKER LARGE,12,1/25/2011 10:20,2.95,18075,United Kingdom
541996,22457,NATURAL SLATE HEART CHALKBOARD ,6,1/25/2011 10:20,2.95,18075,United Kingdom
541997,85177,BASKET OF FLOWERS SEWING KIT,10,1/25/2011 10:38,0.85,18077,United Kingdom
541997,85176,SEWING SUSAN 21 NEEDLE SET,9,1/25/2011 10:38,0.85,18077,United Kingdom
541997,85178,VICTORIAN SEWING KIT,6,1/25/2011 10:38,1.25,18077,United Kingdom
541997,22651,GENTLEMAN SHIRT REPAIR KIT ,13,1/25/2011 10:38,0.85,18077,United Kingdom
541997,22429,ENAMEL MEASURING JUG CREAM,2,1/25/2011 10:38,4.25,18077,United Kingdom
541997,22919,HERB MARKER MINT,5,1/25/2011 10:38,0.65,18077,United Kingdom
541997,22916,HERB MARKER THYME,5,1/25/2011 10:38,0.65,18077,United Kingdom
541997,22917,HERB MARKER ROSEMARY,5,1/25/2011 10:38,0.65,18077,United Kingdom
541997,22920,HERB MARKER BASIL,5,1/25/2011 10:38,0.65,18077,United Kingdom
541997,22721,SET OF 3 CAKE TINS SKETCHBOOK,1,1/25/2011 10:38,4.95,18077,United Kingdom
541997,21786,POLKADOT RAIN HAT ,24,1/25/2011 10:38,0.42,18077,United Kingdom
541997,20751,FUNKY WASHING UP GLOVES ASSORTED,6,1/25/2011 10:38,2.1,18077,United Kingdom
541997,22961,JAM MAKING SET PRINTED,8,1/25/2011 10:38,1.45,18077,United Kingdom
541997,22976,CIRCUS PARADE CHILDRENS EGG CUP ,12,1/25/2011 10:38,1.25,18077,United Kingdom
541997,85049D,BRIGHT BLUES RIBBONS ,6,1/25/2011 10:38,1.25,18077,United Kingdom
541997,85049C,ROMANTIC PINKS RIBBONS ,6,1/25/2011 10:38,1.25,18077,United Kingdom
541997,85049E,SCANDINAVIAN REDS RIBBONS,6,1/25/2011 10:38,1.25,18077,United Kingdom
541997,85049G,CHOCOLATE BOX RIBBONS ,6,1/25/2011 10:38,1.25,18077,United Kingdom
541997,16016,LARGE CHINESE STYLE SCISSOR,10,1/25/2011 10:38,0.85,18077,United Kingdom
541997,16014,SMALL CHINESE STYLE SCISSOR,10,1/25/2011 10:38,0.42,18077,United Kingdom
541997,16015,MEDIUM CHINESE STYLE SCISSOR,20,1/25/2011 10:38,0.5,18077,United Kingdom
541997,21868,POTTING SHED TEA MUG,12,1/25/2011 10:38,1.25,18077,United Kingdom
541997,22859,EASTER TIN BUNNY BOUQUET,6,1/25/2011 10:38,1.65,18077,United Kingdom
541997,22301,COFFEE MUG CAT + BIRD DESIGN,6,1/25/2011 10:38,2.55,18077,United Kingdom
541997,22300,COFFEE MUG DOG + BALL DESIGN,6,1/25/2011 10:38,2.55,18077,United Kingdom
541997,22951,60 CAKE CASES DOLLY GIRL DESIGN,24,1/25/2011 10:38,0.55,18077,United Kingdom
541997,22928,YELLOW GIANT GARDEN THERMOMETER,14,1/25/2011 10:38,5.95,18077,United Kingdom
541998,21980,PACK OF 12 RED RETROSPOT TISSUES ,144,1/25/2011 10:42,0.29,12348,Finland
541998,21985,PACK OF 12 HEARTS DESIGN TISSUES ,144,1/25/2011 10:42,0.29,12348,Finland
541998,21726,MULTI HEARTS  STICKERS,24,1/25/2011 10:42,0.85,12348,Finland
541998,21983,PACK OF 12 BLUE PAISLEY TISSUES ,144,1/25/2011 10:42,0.29,12348,Finland
541998,21967,PACK OF 12 SKULL TISSUES,144,1/25/2011 10:42,0.29,12348,Finland
541998,POST,POSTAGE,1,1/25/2011 10:42,40,12348,Finland
541999,21012,ANTIQUE ALL GLASS CANDLESTICK,10,1/25/2011 10:45,2.46,,United Kingdom
541999,16236,KITTY PENCIL ERASERS,1,1/25/2011 10:45,0.42,,United Kingdom
541999,20685,DOORMAT RED RETROSPOT,1,1/25/2011 10:45,7.46,,United Kingdom
541999,20711,JUMBO BAG TOYS ,1,1/25/2011 10:45,4.13,,United Kingdom
541999,20712,JUMBO BAG WOODLAND ANIMALS,1,1/25/2011 10:45,4.13,,United Kingdom
541999,20717,STRAWBERRY SHOPPER BAG,1,1/25/2011 10:45,2.46,,United Kingdom
541999,20725,LUNCH BAG RED RETROSPOT,1,1/25/2011 10:45,4.13,,United Kingdom
541999,20727,LUNCH BAG  BLACK SKULL.,1,1/25/2011 10:45,4.13,,United Kingdom
541999,20728,LUNCH BAG CARS BLUE,1,1/25/2011 10:45,4.13,,United Kingdom
541999,20752,BLUE POLKADOT WASHING UP GLOVES,1,1/25/2011 10:45,4.13,,United Kingdom
541999,20831,GOLD PHOTO FRAME,4,1/25/2011 10:45,4.13,,United Kingdom
541999,20963,APPLE BATH SPONGE,1,1/25/2011 10:45,2.46,,United Kingdom
541999,21668,RED STRIPE CERAMIC DRAWER KNOB,2,1/25/2011 10:45,2.46,,United Kingdom
541999,22132,RED LOVE HEART SHAPE CUP,1,1/25/2011 10:45,1.63,,United Kingdom
541999,22197,SMALL POPCORN HOLDER,10,1/25/2011 10:45,1.63,,United Kingdom
541999,22256,FELT FARM ANIMAL CHICKEN,1,1/25/2011 10:45,2.46,,United Kingdom
541999,22386,JUMBO BAG PINK POLKADOT,1,1/25/2011 10:45,4.13,,United Kingdom
541999,22444,GROW YOUR OWN PLANT IN A CAN ,2,1/25/2011 10:45,2.46,,United Kingdom
541999,22502,PICNIC BASKET WICKER SMALL,1,1/25/2011 10:45,5.95,,United Kingdom
541999,22549,PICTURE DOMINOES,1,1/25/2011 10:45,3.29,,United Kingdom
541999,22583,PACK OF 6 HANDBAG GIFT BOXES,7,1/25/2011 10:45,4.96,,United Kingdom
541999,22678,FRENCH BLUE METAL DOOR SIGN 3,1,1/25/2011 10:45,2.46,,United Kingdom
541999,22681,FRENCH BLUE METAL DOOR SIGN 6,1,1/25/2011 10:45,2.46,,United Kingdom
541999,22685,FRENCH BLUE METAL DOOR SIGN 0,1,1/25/2011 10:45,2.46,,United Kingdom
541999,22683,FRENCH BLUE METAL DOOR SIGN 8,1,1/25/2011 10:45,2.46,,United Kingdom
541999,22686,FRENCH BLUE METAL DOOR SIGN No,1,1/25/2011 10:45,2.46,,United Kingdom
541999,22699,ROSES REGENCY TEACUP AND SAUCER ,2,1/25/2011 10:45,5.79,,United Kingdom
541999,22754,SMALL RED BABUSHKA NOTEBOOK ,1,1/25/2011 10:45,1.63,,United Kingdom
541999,22756,LARGE YELLOW BABUSHKA NOTEBOOK ,1,1/25/2011 10:45,2.46,,United Kingdom
541999,22679,FRENCH BLUE METAL DOOR SIGN 4,2,1/25/2011 10:45,2.46,,United Kingdom
541999,22697,GREEN REGENCY TEACUP AND SAUCER,6,1/25/2011 10:45,5.79,,United Kingdom
541999,84755,COLOUR GLASS T-LIGHT HOLDER HANGING,12,1/25/2011 10:45,1.24,,United Kingdom
541999,84813,SET OF 4 DIAMOND NAPKIN RINGS,1,1/25/2011 10:45,24.96,,United Kingdom
541999,84970L,SINGLE HEART ZINC T-LIGHT HOLDER,4,1/25/2011 10:45,2.08,,United Kingdom
541999,84970S,HANGING HEART ZINC T-LIGHT HOLDER,2,1/25/2011 10:45,2.08,,United Kingdom
541999,84991,60 TEATIME FAIRY CAKE CASES,1,1/25/2011 10:45,1.25,,United Kingdom
541999,21688,SILVER PLATE CANDLE BOWL SMALL,1,1/25/2011 10:45,5.79,,United Kingdom
541999,21773,DECORATIVE ROSE BATHROOM BOTTLE,1,1/25/2011 10:45,2.46,,United Kingdom
541999,21774,DECORATIVE CATS BATHROOM BOTTLE,1,1/25/2011 10:45,2.46,,United Kingdom
541999,21775,DECORATIVE FLORE BATHROOM BOTTLE,1,1/25/2011 10:45,2.46,,United Kingdom
541999,21790,VINTAGE SNAP CARDS,1,1/25/2011 10:45,1.63,,United Kingdom
541999,21791,VINTAGE HEADS AND TAILS CARD GAME ,1,1/25/2011 10:45,2.46,,United Kingdom
541999,21802,CHRISTMAS TREE HEART DECORATION,2,1/25/2011 10:45,0.42,,United Kingdom
541999,21879,HEARTS GIFT TAPE,1,1/25/2011 10:45,1.63,,United Kingdom
541999,21891,TRADITIONAL WOODEN SKIPPING ROPE,18,1/25/2011 10:45,2.46,,United Kingdom
541999,21892,TRADITIONAL WOODEN CATCH CUP GAME ,19,1/25/2011 10:45,2.46,,United Kingdom
541999,21907,I'M ON HOLIDAY METAL SIGN,1,1/25/2011 10:45,4.13,,United Kingdom
541999,21915,RED  HARMONICA IN BOX ,10,1/25/2011 10:45,2.46,,United Kingdom
541999,21931,JUMBO STORAGE BAG SUKI,1,1/25/2011 10:45,4.13,,United Kingdom
541999,21935,SUKI  SHOULDER BAG,2,1/25/2011 10:45,3.29,,United Kingdom
541999,21977,PACK OF 60 PINK PAISLEY CAKE CASES,1,1/25/2011 10:45,1.25,,United Kingdom
541999,21990,MODERN FLORAL STATIONERY SET,2,1/25/2011 10:45,2.46,,United Kingdom
541999,22680,FRENCH BLUE METAL DOOR SIGN 5,3,1/25/2011 10:45,2.46,,United Kingdom
541999,22682,FRENCH BLUE METAL DOOR SIGN 7,2,1/25/2011 10:45,2.46,,United Kingdom
541999,22677,FRENCH BLUE METAL DOOR SIGN 2,3,1/25/2011 10:45,2.46,,United Kingdom
541999,22556,PLASTERS IN TIN CIRCUS PARADE ,1,1/25/2011 10:45,3.29,,United Kingdom
541999,22557,PLASTERS IN TIN VINTAGE PAISLEY ,1,1/25/2011 10:45,3.29,,United Kingdom
541999,22507,MEMO BOARD RETROSPOT  DESIGN,1,1/25/2011 10:45,10.79,,United Kingdom
541999,22529,MAGIC DRAWING SLATE GO TO THE FAIR ,1,1/25/2011 10:45,0.83,,United Kingdom
541999,22530,MAGIC DRAWING SLATE DOLLY GIRL ,1,1/25/2011 10:45,0.83,,United Kingdom
541999,22531,MAGIC DRAWING SLATE CIRCUS PARADE  ,1,1/25/2011 10:45,0.83,,United Kingdom
541999,22536,MAGIC DRAWING SLATE PURDEY,1,1/25/2011 10:45,0.83,,United Kingdom
541999,21633,SUNFLOWER DECORATIVE PARASOL,1,1/25/2011 10:45,24.96,,United Kingdom
541999,22090,PAPER BUNTING RETROSPOT,1,1/25/2011 10:45,5.79,,United Kingdom
541999,22196,SMALL HEART MEASURING SPOONS,1,1/25/2011 10:45,1.63,,United Kingdom
541999,22255,FELT TOADSTOOL  SMALL,1,1/25/2011 10:45,1.63,,United Kingdom
541999,22383,LUNCH BAG SUKI  DESIGN ,1,1/25/2011 10:45,4.13,,United Kingdom
541999,22422,TOOTHPASTE TUBE PEN,1,1/25/2011 10:45,1.25,,United Kingdom
541999,22489,PACK OF 12 TRADITIONAL CRAYONS,2,1/25/2011 10:45,0.83,,United Kingdom
541999,22537,MAGIC DRAWING SLATE DINOSAUR,1,1/25/2011 10:45,0.83,,United Kingdom
541999,22558,CLOTHES PEGS RETROSPOT PACK 24 ,2,1/25/2011 10:45,2.46,,United Kingdom
541999,22597,MUSICAL ZINC HEART DECORATION ,3,1/25/2011 10:45,1.63,,United Kingdom
541999,22613,PACK OF 20 SPACEBOY NAPKINS,1,1/25/2011 10:45,1.63,,United Kingdom
541999,22629,SPACEBOY LUNCH BOX ,1,1/25/2011 10:45,4.13,,United Kingdom
541999,22663,JUMBO BAG DOLLY GIRL DESIGN,1,1/25/2011 10:45,4.13,,United Kingdom
541999,22676,FRENCH BLUE METAL DOOR SIGN 1,1,1/25/2011 10:45,2.46,,United Kingdom
541999,22457,NATURAL SLATE HEART CHALKBOARD ,1,1/25/2011 10:45,5.79,,United Kingdom
541999,22468,BABUSHKA LIGHTS STRING OF 10,1,1/25/2011 10:45,13.29,,United Kingdom
541999,22469,HEART OF WICKER SMALL,18,1/25/2011 10:45,3.29,,United Kingdom
541999,22470,HEART OF WICKER LARGE,2,1/25/2011 10:45,5.79,,United Kingdom
541999,22418,10 COLOUR SPACEBOY PEN,1,1/25/2011 10:45,1.63,,United Kingdom
541999,22258,FELT FARM ANIMAL RABBIT,1,1/25/2011 10:45,2.46,,United Kingdom
541999,22296,HEART IVORY TRELLIS LARGE,5,1/25/2011 10:45,3.29,,United Kingdom
541999,22314,OFFICE MUG WARMER CHOC+BLUE,1,1/25/2011 10:45,5.79,,United Kingdom
541999,22321,BIRD DECORATION RED RETROSPOT,1,1/25/2011 10:45,1.63,,United Kingdom
541999,22342,HOME GARLAND PAINTED ZINC ,1,1/25/2011 10:45,3.29,,United Kingdom
541999,22375,AIRLINE BAG VINTAGE JET SET BROWN,1,1/25/2011 10:45,8.29,,United Kingdom
541999,22212,FOUR HOOK  WHITE LOVEBIRDS,2,1/25/2011 10:45,4.13,,United Kingdom
541999,22219,LOVEBIRD HANGING DECORATION WHITE ,1,1/25/2011 10:45,1.63,,United Kingdom
541999,22228,BUNNY WOODEN PAINTED WITH BIRD ,1,1/25/2011 10:45,1.63,,United Kingdom
541999,22241,GARLAND WOODEN HAPPY EASTER,1,1/25/2011 10:45,2.46,,United Kingdom
541999,22246,MAGIC GARDEN FELT GARLAND ,1,1/25/2011 10:45,4.13,,United Kingdom
541999,20985,HEART CALCULATOR,1,1/25/2011 10:45,2.46,,United Kingdom
541999,22161,HEART DECORATION RUSTIC HANGING ,2,1/25/2011 10:45,0.79,,United Kingdom
541999,22162,HEART GARLAND RUSTIC PADDED,6,1/25/2011 10:45,3.29,,United Kingdom
541999,22173,METAL 4 HOOK HANGER FRENCH CHATEAU,1,1/25/2011 10:45,5.79,,United Kingdom
541999,22178,VICTORIAN GLASS HANGING T-LIGHT,28,1/25/2011 10:45,2.46,,United Kingdom
541999,22189,CREAM HEART CARD HOLDER,1,1/25/2011 10:45,8.29,,United Kingdom
541999,21069,VINTAGE BILLBOARD TEA MUG,1,1/25/2011 10:45,2.46,,United Kingdom
541999,21080,SET/20 RED RETROSPOT PAPER NAPKINS ,1,1/25/2011 10:45,1.63,,United Kingdom
541999,21098,CHRISTMAS TOILET ROLL,1,1/25/2011 10:45,2.46,,United Kingdom
541999,21116,OWL DOORSTOP,2,1/25/2011 10:45,8.29,,United Kingdom
541999,21187,WHITE BELL HONEYCOMB PAPER GARLAND ,1,1/25/2011 10:45,3.29,,United Kingdom
541999,21240,BLUE POLKADOT CUP,2,1/25/2011 10:45,1.63,,United Kingdom
541999,21313,GLASS HEART T-LIGHT HOLDER ,4,1/25/2011 10:45,1.63,,United Kingdom
541999,21314,SMALL GLASS HEART TRINKET POT,1,1/25/2011 10:45,4.13,,United Kingdom
541999,21355,TOAST ITS - I LOVE YOU ,2,1/25/2011 10:45,2.46,,United Kingdom
541999,21381,MINI WOODEN HAPPY BIRTHDAY GARLAND,1,1/25/2011 10:45,3.29,,United Kingdom
541999,21422,PORCELAIN ROSE SMALL,3,1/25/2011 10:45,1.63,,United Kingdom
541999,21455,PAINTED YELLOW WOODEN DAISY,1,1/25/2011 10:45,1.63,,United Kingdom
541999,22759,SET OF 3 NOTEBOOKS IN PARCEL,1,1/25/2011 10:45,3.29,,United Kingdom
541999,22764,"RUSTIC WOODEN CABINET, GLASS DOORS",2,1/25/2011 10:45,49.96,,United Kingdom
541999,22776,SWEETHEART CAKESTAND 3 TIER,1,1/25/2011 10:45,19.96,,United Kingdom
541999,22795,SWEETHEART RECIPE BOOK STAND,1,1/25/2011 10:45,13.29,,United Kingdom
541999,22814,CARD PARTY GAMES ,1,1/25/2011 10:45,0.83,,United Kingdom
541999,22817,CARD SUKI BIRTHDAY,1,1/25/2011 10:45,0.83,,United Kingdom
541999,22858,EASTER TIN KEEPSAKE,1,1/25/2011 10:45,3.29,,United Kingdom
541999,22859,EASTER TIN BUNNY BOUQUET,1,1/25/2011 10:45,3.29,,United Kingdom
541999,22860,EASTER TIN CHICKS PINK DAISY,1,1/25/2011 10:45,3.29,,United Kingdom
541999,22903,CALENDAR FAMILY FAVOURITES,1,1/25/2011 10:45,5.79,,United Kingdom
541999,22908,PACK OF 20 NAPKINS RED APPLES,1,1/25/2011 10:45,1.63,,United Kingdom
541999,22931,BAKING MOULD HEART WHITE CHOCOLATE,1,1/25/2011 10:45,4.96,,United Kingdom
541999,22937,BAKING MOULD CHOCOLATE CUPCAKES,1,1/25/2011 10:45,4.96,,United Kingdom
541999,90120A,PINK MURANO TWIST BRACELET,5,1/25/2011 10:45,4.25,,United Kingdom
541999,90120B,BLUE MURANO TWIST BRACELET,8,1/25/2011 10:45,4.15,,United Kingdom
541999,90120C,GREEN MURANO TWIST BRACELET,6,1/25/2011 10:45,4.15,,United Kingdom
541999,90120D,WHITE MURANO TWIST BRACELET,6,1/25/2011 10:45,4.15,,United Kingdom
541999,90134,OLD ROSE COMBO BEAD NECKLACE,2,1/25/2011 10:45,2.9,,United Kingdom
541999,90161A,ANT COPPER RED BOUDICCA BRACELET,1,1/25/2011 10:45,4.98,,United Kingdom
541999,90175B,PINK GLASS CHUNKY CHARM BRACELET,1,1/25/2011 10:45,9.15,,United Kingdom
541999,90200D,PINK SWEETHEART BRACELET,1,1/25/2011 10:45,4.15,,United Kingdom
541999,90214B,"LETTER ""B"" BLING KEY RING",1,1/25/2011 10:45,0.83,,United Kingdom
541999,90214E,"LETTER ""E"" BLING KEY RING",4,1/25/2011 10:45,0.83,,United Kingdom
541999,90214N,"LETTER ""N"" BLING KEY RING",1,1/25/2011 10:45,0.83,,United Kingdom
541999,DOT,DOTCOM POSTAGE,1,1/25/2011 10:45,216.11,,United Kingdom
541999,21533,RETROSPOT LARGE MILK JUG,1,1/25/2011 10:45,9.96,,United Kingdom
541999,85014B,RED RETROSPOT UMBRELLA,1,1/25/2011 10:45,12.46,,United Kingdom
541999,85015,SET OF 12  VINTAGE POSTCARD SET,1,1/25/2011 10:45,2.46,,United Kingdom
541999,85088,CANDY SPOT HAND BAG,1,1/25/2011 10:45,4.13,,United Kingdom
541999,85099B,JUMBO BAG RED RETROSPOT,1,1/25/2011 10:45,4.13,,United Kingdom
541999,85129D,BEADED CRYSTAL HEART PINK SMALL,1,1/25/2011 10:45,2.46,,United Kingdom
541999,85131A,BEADED PEARL HEART WHITE ON STICK,4,1/25/2011 10:45,0.83,,United Kingdom
541999,85131B,BEADED CRYSTAL HEART GREEN ON STICK,5,1/25/2011 10:45,0.83,,United Kingdom
541999,85131C,BEADED CRYSTAL HEART BLUE ON STICK,3,1/25/2011 10:45,0.83,,United Kingdom
541999,85131D,BEADED CRYSTAL HEART PINK ON STICK,5,1/25/2011 10:45,0.83,,United Kingdom
541999,85176,SEWING SUSAN 21 NEEDLE SET,1,1/25/2011 10:45,1.63,,United Kingdom
541999,85186A,EASTER BUNNY GARLAND OF FLOWERS,1,1/25/2011 10:45,0.83,,United Kingdom
541999,90037A,TINY CRYSTAL BRACELET RED,1,1/25/2011 10:45,2.48,,United Kingdom
541999,90040A,MURANO STYLE GLASS BRACELET RED,6,1/25/2011 10:45,4.15,,United Kingdom
541999,90040B,MURANO STYLE GLASS BRACELET BLACK,6,1/25/2011 10:45,3.73,,United Kingdom
541999,90115,SUMMER BUTTERFLIES BAG CHARM,1,1/25/2011 10:45,2.46,,United Kingdom
541999,22024,RAINY LADIES BIRTHDAY CARD,1,1/25/2011 10:45,0.83,,United Kingdom
541999,22025,RING OF ROSES BIRTHDAY CARD,1,1/25/2011 10:45,0.83,,United Kingdom
541999,22037,ROBOT BIRTHDAY CARD,1,1/25/2011 10:45,0.83,,United Kingdom
541999,22041,"RECORD FRAME 7"" SINGLE SIZE ",4,1/25/2011 10:45,4.96,,United Kingdom
541999,22077,6 RIBBONS RUSTIC CHARM,1,1/25/2011 10:45,3.29,,United Kingdom
541999,21535,RED RETROSPOT SMALL MILK JUG,1,1/25/2011 10:45,4.96,,United Kingdom
541999,21564,PINK  HEART SHAPE LOVE BUCKET ,2,1/25/2011 10:45,5.79,,United Kingdom
541999,22939,APRON APPLE DELIGHT,1,1/25/2011 10:45,10.79,,United Kingdom
541999,22951,60 CAKE CASES DOLLY GIRL DESIGN,1,1/25/2011 10:45,1.25,,United Kingdom
541999,35241,ENAMEL BLUE RIM BISCUIT BIN,1,1/25/2011 10:45,9.96,,United Kingdom
541999,35809A,ENAMEL PINK TEA CONTAINER,1,1/25/2011 10:45,4.13,,United Kingdom
541999,35810A,ENAMEL PINK COFFEE CONTAINER,1,1/25/2011 10:45,4.13,,United Kingdom
541999,35965,FOLKART HEART NAPKIN RINGS,1,1/25/2011 10:45,3.29,,United Kingdom
541999,40001,WHITE BAMBOO RIBS LAMPSHADE,1,1/25/2011 10:45,1.63,,United Kingdom
541999,47559B,TEA TIME OVEN GLOVE,1,1/25/2011 10:45,2.46,,United Kingdom
541999,47591B,SCOTTIES CHILDRENS APRON,1,1/25/2011 10:45,1.63,,United Kingdom
541999,47593B,SCOTTIE DOGS BABY BIB,2,1/25/2011 10:45,0.83,,United Kingdom
541999,79321,CHILLI LIGHTS,1,1/25/2011 10:45,9.96,,United Kingdom
541999,82580,BATHROOM METAL SIGN,1,1/25/2011 10:45,1.25,,United Kingdom
541999,84077,WORLD WAR 2 GLIDERS ASSTD DESIGNS,2,1/25/2011 10:45,0.42,,United Kingdom
541999,84378,SET OF 3 HEART COOKIE CUTTERS,1,1/25/2011 10:45,2.46,,United Kingdom
541999,84535B,FAIRY CAKES NOTEBOOK A6 SIZE,1,1/25/2011 10:45,1.46,,United Kingdom
541999,84536A,ENGLISH ROSE NOTEBOOK A7 SIZE,1,1/25/2011 10:45,0.83,,United Kingdom
541999,84598,BOYS ALPHABET IRON ON PATCHES,4,1/25/2011 10:45,0.42,,United Kingdom
542000,22148,EASTER CRAFT 4 CHICKS ,12,1/25/2011 10:49,1.95,14257,United Kingdom
542000,84741C,CITRUS GARLAND FELT FLOWERS ,6,1/25/2011 10:49,1.95,14257,United Kingdom
542000,22021,BLUE FELT EASTER EGG BASKET,6,1/25/2011 10:49,1.65,14257,United Kingdom
542000,85206A,CREAM FELT EASTER EGG BASKET,6,1/25/2011 10:49,1.65,14257,United Kingdom
542000,22967,SET 3 SONG BIRD PAPER EGGS ASSORTED,6,1/25/2011 10:49,2.95,14257,United Kingdom
542000,22961,JAM MAKING SET PRINTED,12,1/25/2011 10:49,1.45,14257,United Kingdom
542000,21506,"FANCY FONT BIRTHDAY CARD, ",12,1/25/2011 10:49,0.42,14257,United Kingdom
542000,16161P,WRAP ENGLISH ROSE ,25,1/25/2011 10:49,0.42,14257,United Kingdom
542000,22040,BOTANICAL ROSE GIFT WRAP,25,1/25/2011 10:49,0.42,14257,United Kingdom
542000,23231,WRAP DOILEY DESIGN,25,1/25/2011 10:49,0.42,14257,United Kingdom
542000,22356,CHARLOTTE BAG PINK POLKADOT,10,1/25/2011 10:49,0.85,14257,United Kingdom
542000,20723,STRAWBERRY CHARLOTTE BAG,10,1/25/2011 10:49,0.85,14257,United Kingdom
542000,20724,RED RETROSPOT CHARLOTTE BAG,10,1/25/2011 10:49,0.85,14257,United Kingdom
542000,20718,RED RETROSPOT SHOPPER BAG,10,1/25/2011 10:49,1.25,14257,United Kingdom
542000,20717,STRAWBERRY SHOPPER BAG,10,1/25/2011 10:49,1.25,14257,United Kingdom
542000,21033,JUMBO BAG CHARLIE AND LOLA TOYS,10,1/25/2011 10:49,2.95,14257,United Kingdom
542000,21929,JUMBO BAG PINK VINTAGE PAISLEY,10,1/25/2011 10:49,1.95,14257,United Kingdom
542000,22379,RECYCLING BAG RETROSPOT ,5,1/25/2011 10:49,2.1,14257,United Kingdom
542000,22668,PINK BABY BUNTING,5,1/25/2011 10:49,2.95,14257,United Kingdom
542000,47566,PARTY BUNTING,5,1/25/2011 10:49,4.65,14257,United Kingdom
542000,47566B,TEA TIME PARTY BUNTING,5,1/25/2011 10:49,4.65,14257,United Kingdom
542000,22669,RED BABY BUNTING ,5,1/25/2011 10:49,2.95,14257,United Kingdom
542000,22296,HEART IVORY TRELLIS LARGE,12,1/25/2011 10:49,1.65,14257,United Kingdom
542000,22297,HEART IVORY TRELLIS SMALL,24,1/25/2011 10:49,1.25,14257,United Kingdom
542000,82482,WOODEN PICTURE FRAME WHITE FINISH,6,1/25/2011 10:49,2.55,14257,United Kingdom
542000,84378,SET OF 3 HEART COOKIE CUTTERS,12,1/25/2011 10:49,1.25,14257,United Kingdom
542000,84380,SET OF 3 BUTTERFLY COOKIE CUTTERS,12,1/25/2011 10:49,1.25,14257,United Kingdom
542000,84375,SET OF 20 KIDS COOKIE CUTTERS,12,1/25/2011 10:49,2.1,14257,United Kingdom
542000,21200,MULTICOLOUR HONEYCOMB PAPER GARLAND,12,1/25/2011 10:49,1.65,14257,United Kingdom
542000,21206,STRAWBERRY HONEYCOMB  GARLAND ,12,1/25/2011 10:49,1.65,14257,United Kingdom
542000,22469,HEART OF WICKER SMALL,12,1/25/2011 10:49,1.65,14257,United Kingdom
542000,22470,HEART OF WICKER LARGE,6,1/25/2011 10:49,2.95,14257,United Kingdom
542000,22776,SWEETHEART CAKESTAND 3 TIER,2,1/25/2011 10:49,9.95,14257,United Kingdom
542000,21212,PACK OF 72 RETROSPOT CAKE CASES,24,1/25/2011 10:49,0.55,14257,United Kingdom
542000,21232,STRAWBERRY CERAMIC TRINKET BOX,12,1/25/2011 10:49,1.25,14257,United Kingdom
542000,20725,LUNCH BAG RED RETROSPOT,10,1/25/2011 10:49,1.65,14257,United Kingdom
542000,22382,LUNCH BAG SPACEBOY DESIGN ,10,1/25/2011 10:49,1.65,14257,United Kingdom
542000,20726,LUNCH BAG WOODLAND,10,1/25/2011 10:49,1.65,14257,United Kingdom
542000,21155,RED RETROSPOT PEG BAG,6,1/25/2011 10:49,2.1,14257,United Kingdom
542001,62096A,PINK/YELLOW FLOWERS HANDBAG,24,1/25/2011 10:56,1.25,14298,United Kingdom
542001,62086A,PINK RETRO BIG FLOWER BAG,30,1/25/2011 10:56,1.95,14298,United Kingdom
542001,90125D,PURPLE BERTIE GLASS BEAD BAG CHARM,12,1/25/2011 10:56,0.85,14298,United Kingdom
542001,90125C,TURQUOISE BERTIE GLASS BEAD CHARM,24,1/25/2011 10:56,0.85,14298,United Kingdom
542001,90125A,PINK BERTIE GLASS BEAD BAG CHARM,24,1/25/2011 10:56,0.85,14298,United Kingdom
542001,85184C,S/4 VALENTINE DECOUPAGE HEART BOX,48,1/25/2011 10:56,1.25,14298,United Kingdom
542001,22610,PENS ASSORTED FUNNY FACE,72,1/25/2011 10:56,0.21,14298,United Kingdom
542001,22609,PENS ASSORTED SPACEBALL,72,1/25/2011 10:56,0.21,14298,United Kingdom
542001,22608,PENS ASSORTED FUNKY JEWELED ,72,1/25/2011 10:56,0.21,14298,United Kingdom
542001,22504,CABIN BAG VINTAGE RETROSPOT,3,1/25/2011 10:56,12.75,14298,United Kingdom
542001,22503,CABIN BAG VINTAGE PAISLEY,3,1/25/2011 10:56,12.75,14298,United Kingdom
542001,21884,CAKES AND BOWS GIFT  TAPE,48,1/25/2011 10:56,0.19,14298,United Kingdom
542001,21881,CUTE CATS TAPE,48,1/25/2011 10:56,0.19,14298,United Kingdom
542001,21879,HEARTS GIFT TAPE,96,1/25/2011 10:56,0.19,14298,United Kingdom
542001,21650,ASSORTED TUTTI FRUTTI BRACELET,96,1/25/2011 10:56,0.19,14298,United Kingdom
542001,21200,MULTICOLOUR HONEYCOMB PAPER GARLAND,48,1/25/2011 10:56,0.65,14298,United Kingdom
542001,21206,STRAWBERRY HONEYCOMB  GARLAND ,48,1/25/2011 10:56,0.65,14298,United Kingdom
542001,21202,DOLLY HONEYCOMB GARLAND,48,1/25/2011 10:56,0.65,14298,United Kingdom
542001,21199,PINK  HEART CONFETTI IN TUBE,48,1/25/2011 10:56,0.42,14298,United Kingdom
542001,21198,WHITE HEART CONFETTI IN TUBE,48,1/25/2011 10:56,0.42,14298,United Kingdom
542001,21112,"SWISS ROLL TOWEL, PINK  SPOTS",24,1/25/2011 10:56,1.25,14298,United Kingdom
542001,21111,"SWISS ROLL TOWEL, CHOCOLATE  SPOTS",24,1/25/2011 10:56,1.25,14298,United Kingdom
542001,21110,LARGE CAKE TOWEL PINK SPOTS,24,1/25/2011 10:56,1.95,14298,United Kingdom
542001,21109,LARGE CAKE TOWEL CHOCOLATE SPOTS,24,1/25/2011 10:56,1.95,14298,United Kingdom
542001,21065,BOOM BOX SPEAKER GIRLS,48,1/25/2011 10:56,1.25,14298,United Kingdom
542002,20723,STRAWBERRY CHARLOTTE BAG,30,1/25/2011 10:57,0.72,14298,United Kingdom
542002,20719,WOODLAND CHARLOTTE BAG,30,1/25/2011 10:57,0.72,14298,United Kingdom
542002,22661,CHARLOTTE BAG DOLLY GIRL DESIGN,30,1/25/2011 10:57,0.72,14298,United Kingdom
542002,22355,CHARLOTTE BAG SUKI DESIGN,40,1/25/2011 10:57,0.72,14298,United Kingdom
542002,85099F,JUMBO BAG STRAWBERRY,20,1/25/2011 10:57,1.65,14298,United Kingdom
542002,85099C,JUMBO  BAG BAROQUE BLACK WHITE,20,1/25/2011 10:57,1.65,14298,United Kingdom
542002,85099B,JUMBO BAG RED RETROSPOT,20,1/25/2011 10:57,1.65,14298,United Kingdom
542002,22663,JUMBO BAG DOLLY GIRL DESIGN,20,1/25/2011 10:57,1.65,14298,United Kingdom
542002,22411,JUMBO SHOPPER VINTAGE RED PAISLEY,20,1/25/2011 10:57,1.65,14298,United Kingdom
542002,22386,JUMBO BAG PINK POLKADOT,30,1/25/2011 10:57,1.65,14298,United Kingdom
542002,22385,JUMBO BAG SPACEBOY DESIGN,20,1/25/2011 10:57,1.65,14298,United Kingdom
542002,21931,JUMBO STORAGE BAG SUKI,40,1/25/2011 10:57,1.65,14298,United Kingdom
542002,21930,JUMBO STORAGE BAG SKULLS,20,1/25/2011 10:57,1.65,14298,United Kingdom
542002,21929,JUMBO BAG PINK VINTAGE PAISLEY,30,1/25/2011 10:57,1.65,14298,United Kingdom
542002,21928,JUMBO BAG SCANDINAVIAN PAISLEY,20,1/25/2011 10:57,1.65,14298,United Kingdom
542002,20713,JUMBO BAG OWLS,20,1/25/2011 10:57,1.65,14298,United Kingdom
542002,20712,JUMBO BAG WOODLAND ANIMALS,20,1/25/2011 10:57,1.65,14298,United Kingdom
542002,20711,JUMBO BAG TOYS ,20,1/25/2011 10:57,1.65,14298,United Kingdom
542003,21559,STRAWBERRY LUNCH BOX WITH CUTLERY,60,1/25/2011 11:07,2.1,15311,United Kingdom
542003,21561,DINOSAUR LUNCH BOX WITH CUTLERY,60,1/25/2011 11:07,2.1,15311,United Kingdom
