548703,22224,WHITE LOVEBIRD LANTERN,2,4/3/2011 11:37,2.95,16010,United Kingdom
548703,85123A,WHITE HANGING HEART T-LIGHT HOLDER,2,4/3/2011 11:37,2.95,16010,United Kingdom
548703,22804,CANDLEHOLDER PINK HANGING HEART,1,4/3/2011 11:37,2.95,16010,United Kingdom
548703,85123A,WHITE HANGING HEART T-LIGHT HOLDER,3,4/3/2011 11:37,2.95,16010,United Kingdom
548703,22804,CANDLEHOLDER PINK HANGING HEART,1,4/3/2011 11:37,2.95,16010,United Kingdom
548703,21985,PACK OF 12 HEARTS DESIGN TISSUES ,5,4/3/2011 11:37,0.29,16010,United Kingdom
548703,22296,HEART IVORY TRELLIS LARGE,1,4/3/2011 11:37,1.65,16010,United Kingdom
548703,84535A,ENGLISH ROSE NOTEBOOK A6 SIZE,3,4/3/2011 11:37,0.65,16010,United Kingdom
548703,21411,GINGHAM HEART  DOORSTOP RED,2,4/3/2011 11:37,4.25,16010,United Kingdom
548703,22175,PINK OWL SOFT TOY,2,4/3/2011 11:37,2.95,16010,United Kingdom
548703,20967,GREY FLORAL FELTCRAFT SHOULDER BAG,1,4/3/2011 11:37,3.75,16010,United Kingdom
548703,22148,EASTER CRAFT 4 CHICKS ,2,4/3/2011 11:37,1.95,16010,United Kingdom
548703,22147,FELTCRAFT BUTTERFLY HEARTS,2,4/3/2011 11:37,1.45,16010,United Kingdom
548703,22084,PAPER CHAIN KIT EMPIRE,1,4/3/2011 11:37,2.95,16010,United Kingdom
548703,21982,PACK OF 12 SUKI TISSUES ,6,4/3/2011 11:37,0.29,16010,United Kingdom
548703,85049G,CHOCOLATE BOX RIBBONS ,1,4/3/2011 11:37,1.25,16010,United Kingdom
548703,22297,HEART IVORY TRELLIS SMALL,2,4/3/2011 11:37,1.25,16010,United Kingdom
548703,22804,CANDLEHOLDER PINK HANGING HEART,1,4/3/2011 11:37,2.95,16010,United Kingdom
548703,21891,TRADITIONAL WOODEN SKIPPING ROPE,1,4/3/2011 11:37,1.45,16010,United Kingdom
548703,22297,HEART IVORY TRELLIS SMALL,2,4/3/2011 11:37,1.25,16010,United Kingdom
548703,22296,HEART IVORY TRELLIS LARGE,3,4/3/2011 11:37,1.65,16010,United Kingdom
548703,22895,SET OF 2 TEA TOWELS APPLE AND PEARS,2,4/3/2011 11:37,3.25,16010,United Kingdom
548703,22908,PACK OF 20 NAPKINS RED APPLES,2,4/3/2011 11:37,0.85,16010,United Kingdom
548703,22185,SLATE TILE NATURAL HANGING,12,4/3/2011 11:37,1.65,16010,United Kingdom
548703,20752,BLUE POLKADOT WASHING UP GLOVES,1,4/3/2011 11:37,2.1,16010,United Kingdom
548703,20754,RETROSPOT RED WASHING UP GLOVES,1,4/3/2011 11:37,2.1,16010,United Kingdom
548703,22999,TRAVEL CARD WALLET RETRO PETALS,1,4/3/2011 11:37,0.42,16010,United Kingdom
548703,22907,PACK OF 20 NAPKINS PANTRY DESIGN,2,4/3/2011 11:37,0.85,16010,United Kingdom
548703,47567B,TEA TIME KITCHEN APRON,1,4/3/2011 11:37,5.95,16010,United Kingdom
548703,22908,PACK OF 20 NAPKINS RED APPLES,1,4/3/2011 11:37,0.85,16010,United Kingdom
548703,22265,EASTER DECORATION NATURAL CHICK,1,4/3/2011 11:37,0.65,16010,United Kingdom
548703,22896,PEG BAG APPLES DESIGN,1,4/3/2011 11:37,2.55,16010,United Kingdom
548703,22908,PACK OF 20 NAPKINS RED APPLES,1,4/3/2011 11:37,0.85,16010,United Kingdom
548703,20866,BLUE ROSE FABRIC MIRROR,2,4/3/2011 11:37,1.25,16010,United Kingdom
548703,84755,COLOUR GLASS T-LIGHT HOLDER HANGING,6,4/3/2011 11:37,0.65,16010,United Kingdom
548703,21408,SPOTTY PINK DUCK DOORSTOP,1,4/3/2011 11:37,4.25,16010,United Kingdom
548703,20725,LUNCH BAG RED RETROSPOT,1,4/3/2011 11:37,1.65,16010,United Kingdom
548703,84978,HANGING HEART JAR T-LIGHT HOLDER,6,4/3/2011 11:37,1.25,16010,United Kingdom
548704,22563,HAPPY STENCIL CRAFT,96,4/3/2011 11:45,1.06,17381,United Kingdom
548704,21703,BAG 125g SWIRLY MARBLES,96,4/3/2011 11:45,0.42,17381,United Kingdom
548704,84077,WORLD WAR 2 GLIDERS ASSTD DESIGNS,576,4/3/2011 11:45,0.21,17381,United Kingdom
548704,22619,SET OF 6 SOLDIER SKITTLES,25,4/3/2011 11:45,3.39,17381,United Kingdom
548704,21791,VINTAGE HEADS AND TAILS CARD GAME ,96,4/3/2011 11:45,1.06,17381,United Kingdom
548704,22616,PACK OF 12 LONDON TISSUES ,864,4/3/2011 11:45,0.29,17381,United Kingdom
548704,22555,PLASTERS IN TIN STRONGMAN,144,4/3/2011 11:45,1.65,17381,United Kingdom
548705,84598,BOYS ALPHABET IRON ON PATCHES,288,4/3/2011 11:47,0.21,17381,United Kingdom
548705,22560,TRADITIONAL MODELLING CLAY,48,4/3/2011 11:47,1.06,17381,United Kingdom
548705,22610,PENS ASSORTED FUNNY FACE,108,4/3/2011 11:47,0.72,17381,United Kingdom
548706,22957,SET 3 PAPER VINTAGE CHICK PAPER EGG,48,4/3/2011 11:51,2.55,13408,United Kingdom
548706,22771,CLEAR DRAWER KNOB ACRYLIC EDWARDIAN,36,4/3/2011 11:51,1.25,13408,United Kingdom
548706,22189,CREAM HEART CARD HOLDER,12,4/3/2011 11:51,3.95,13408,United Kingdom
548706,20725,LUNCH BAG RED RETROSPOT,10,4/3/2011 11:51,1.65,13408,United Kingdom
548707,22497,SET OF 2 TINS VINTAGE BATHROOM ,1,4/3/2011 12:08,4.25,13781,United Kingdom
548707,85152,HAND OVER THE CHOCOLATE   SIGN ,2,4/3/2011 12:08,2.1,13781,United Kingdom
548707,22413,METAL SIGN TAKE IT OR LEAVE IT ,2,4/3/2011 12:08,2.95,13781,United Kingdom
548707,21166,COOK WITH WINE METAL SIGN ,2,4/3/2011 12:08,2.08,13781,United Kingdom
548707,21181,PLEASE ONE PERSON METAL SIGN,2,4/3/2011 12:08,2.1,13781,United Kingdom
548707,82600,NO SINGING METAL SIGN,2,4/3/2011 12:08,2.1,13781,United Kingdom
548707,21175,GIN + TONIC DIET METAL SIGN,2,4/3/2011 12:08,2.55,13781,United Kingdom
548707,21165,BEWARE OF THE CAT METAL SIGN ,2,4/3/2011 12:08,1.69,13781,United Kingdom
548707,22117,METAL SIGN HER DINNER IS SERVED ,2,4/3/2011 12:08,2.95,13781,United Kingdom
548707,21907,I'M ON HOLIDAY METAL SIGN,2,4/3/2011 12:08,2.1,13781,United Kingdom
548707,21905,MORE BUTTER METAL SIGN ,2,4/3/2011 12:08,2.1,13781,United Kingdom
548707,20750,RED RETROSPOT MINI CASES,1,4/3/2011 12:08,7.95,13781,United Kingdom
548707,22139,RETROSPOT TEA SET CERAMIC 11 PC ,1,4/3/2011 12:08,4.95,13781,United Kingdom
548707,82483,WOOD 2 DRAWER CABINET WHITE FINISH,2,4/3/2011 12:08,6.95,13781,United Kingdom
548707,21257,VICTORIAN SEWING BOX MEDIUM,2,4/3/2011 12:08,7.95,13781,United Kingdom
548707,22890,NOVELTY BISCUITS CAKE STAND 3 TIER,1,4/3/2011 12:08,9.95,13781,United Kingdom
548707,85066,CREAM SWEETHEART MINI CHEST,2,4/3/2011 12:08,12.75,13781,United Kingdom
548708,21878,PACK OF 6 SANDCASTLE FLAGS ASSORTED,9,4/3/2011 12:41,0.85,13269,United Kingdom
548708,22371,AIRLINE BAG VINTAGE TOKYO 78,3,4/3/2011 12:41,4.25,13269,United Kingdom
548708,22376,AIRLINE BAG VINTAGE JET SET WHITE,2,4/3/2011 12:41,4.25,13269,United Kingdom
548708,22372,AIRLINE BAG VINTAGE WORLD CHAMPION ,2,4/3/2011 12:41,4.25,13269,United Kingdom
548708,22535,MAGIC DRAWING SLATE BUNNIES ,3,4/3/2011 12:41,0.42,13269,United Kingdom
548708,22532,MAGIC DRAWING SLATE LEAP FROG ,4,4/3/2011 12:41,0.42,13269,United Kingdom
548708,22530,MAGIC DRAWING SLATE DOLLY GIRL ,6,4/3/2011 12:41,0.42,13269,United Kingdom
548708,22536,MAGIC DRAWING SLATE PURDEY,5,4/3/2011 12:41,0.42,13269,United Kingdom
548708,22534,MAGIC DRAWING SLATE SPACEBOY ,5,4/3/2011 12:41,0.42,13269,United Kingdom
548708,22533,MAGIC DRAWING SLATE BAKE A CAKE ,2,4/3/2011 12:41,0.42,13269,United Kingdom
548708,47566,PARTY BUNTING,6,4/3/2011 12:41,4.95,13269,United Kingdom
548708,85099B,JUMBO BAG RED RETROSPOT,10,4/3/2011 12:41,2.08,13269,United Kingdom
548708,21703,BAG 125g SWIRLY MARBLES,12,4/3/2011 12:41,0.42,13269,United Kingdom
548708,21790,VINTAGE SNAP CARDS,4,4/3/2011 12:41,0.85,13269,United Kingdom
548708,21918,SET 12 KIDS COLOUR  CHALK STICKS,9,4/3/2011 12:41,0.42,13269,United Kingdom
548708,22439,6 ROCKET BALLOONS ,10,4/3/2011 12:41,0.65,13269,United Kingdom
548708,21791,VINTAGE HEADS AND TAILS CARD GAME ,2,4/3/2011 12:41,1.25,13269,United Kingdom
548708,22549,PICTURE DOMINOES,3,4/3/2011 12:41,1.45,13269,United Kingdom
548708,22553,PLASTERS IN TIN SKULLS,2,4/3/2011 12:41,1.65,13269,United Kingdom
548708,22551,PLASTERS IN TIN SPACEBOY,5,4/3/2011 12:41,1.65,13269,United Kingdom
548708,22555,PLASTERS IN TIN STRONGMAN,4,4/3/2011 12:41,1.65,13269,United Kingdom
548708,23232,WRAP VINTAGE PETALS  DESIGN,25,4/3/2011 12:41,0.42,13269,United Kingdom
548708,23233,WRAP POPPIES  DESIGN,25,4/3/2011 12:41,0.42,13269,United Kingdom
548708,22968,ROSE COTTAGE KEEPSAKE BOX ,1,4/3/2011 12:41,9.95,13269,United Kingdom
548708,22971,QUEENS GUARD COFFEE MUG,3,4/3/2011 12:41,2.55,13269,United Kingdom
548708,22963,JAM JAR WITH GREEN LID,6,4/3/2011 12:41,0.85,13269,United Kingdom
548708,22972,CHILDREN'S SPACEBOY MUG,6,4/3/2011 12:41,1.65,13269,United Kingdom
548708,84461,12 PINK HEN+CHICKS IN BASKET,1,4/3/2011 12:41,2.55,13269,United Kingdom
548708,21401,BLUE PUDDING SPOON,24,4/3/2011 12:41,0.12,13269,United Kingdom
548708,22197,SMALL POPCORN HOLDER,22,4/3/2011 12:41,0.85,13269,United Kingdom
548708,21084,SET/6 COLLAGE PAPER CUPS,14,4/3/2011 12:41,0.19,13269,United Kingdom
548708,22359,GLASS JAR KINGS CHOICE,1,4/3/2011 12:41,2.95,13269,United Kingdom
548708,22364,GLASS JAR DIGESTIVE BISCUITS,1,4/3/2011 12:41,2.95,13269,United Kingdom
548708,22364,GLASS JAR DIGESTIVE BISCUITS,1,4/3/2011 12:41,2.95,13269,United Kingdom
548708,22360,GLASS JAR ENGLISH CONFECTIONERY,1,4/3/2011 12:41,2.95,13269,United Kingdom
548708,84596B,SMALL DOLLY MIX DESIGN ORANGE BOWL,16,4/3/2011 12:41,0.42,13269,United Kingdom
548708,22975,SPACEBOY CHILDRENS EGG CUP,3,4/3/2011 12:41,1.25,13269,United Kingdom
548708,22860,EASTER TIN CHICKS PINK DAISY,1,4/3/2011 12:41,1.65,13269,United Kingdom
548708,22858,EASTER TIN KEEPSAKE,1,4/3/2011 12:41,1.65,13269,United Kingdom
548708,22859,EASTER TIN BUNNY BOUQUET,2,4/3/2011 12:41,1.65,13269,United Kingdom
548708,22892,SET OF SALT AND PEPPER TOADSTOOLS,4,4/3/2011 12:41,1.25,13269,United Kingdom
548708,23184,BULL DOG BOTTLE OPENER,2,4/3/2011 12:41,4.95,13269,United Kingdom
548708,47310M,"SMALL POP BOX,FUNKY MONKEY",1,4/3/2011 12:41,1.25,13269,United Kingdom
548708,79190B,RETRO PLASTIC POLKA TRAY,9,4/3/2011 12:41,0.42,13269,United Kingdom
548708,22859,EASTER TIN BUNNY BOUQUET,1,4/3/2011 12:41,1.65,13269,United Kingdom
548708,85123A,WHITE HANGING HEART T-LIGHT HOLDER,3,4/3/2011 12:41,2.95,13269,United Kingdom
548708,22673,FRENCH GARDEN SIGN BLUE METAL,2,4/3/2011 12:41,1.25,13269,United Kingdom
548708,22675,FRENCH KITCHEN SIGN BLUE METAL,2,4/3/2011 12:41,1.25,13269,United Kingdom
548708,21171,BATHROOM METAL SIGN ,4,4/3/2011 12:41,1.45,13269,United Kingdom
548708,21172,PARTY METAL SIGN ,2,4/3/2011 12:41,1.45,13269,United Kingdom
548708,82600,NO SINGING METAL SIGN,3,4/3/2011 12:41,2.1,13269,United Kingdom
548708,82583,HOT BATHS METAL SIGN,2,4/3/2011 12:41,2.1,13269,United Kingdom
548708,82552,WASHROOM METAL SIGN,3,4/3/2011 12:41,1.45,13269,United Kingdom
548708,22488,NATURAL SLATE RECTANGLE CHALKBOARD,3,4/3/2011 12:41,1.65,13269,United Kingdom
548708,22970,LONDON BUS COFFEE MUG,6,4/3/2011 12:41,2.55,13269,United Kingdom
548708,21232,STRAWBERRY CERAMIC TRINKET BOX,7,4/3/2011 12:41,1.25,13269,United Kingdom
548708,22649,STRAWBERRY FAIRY CAKE TEAPOT,2,4/3/2011 12:41,4.95,13269,United Kingdom
548708,84751B,BLACK MEDIUM GLASS CAKE STAND,2,4/3/2011 12:41,0.79,13269,United Kingdom
548708,22629,SPACEBOY LUNCH BOX ,4,4/3/2011 12:41,1.95,13269,United Kingdom
548708,22630,DOLLY GIRL LUNCH BOX,4,4/3/2011 12:41,1.95,13269,United Kingdom
548708,21213,PACK OF 72 SKULL CAKE CASES,8,4/3/2011 12:41,0.55,13269,United Kingdom
548708,21977,PACK OF 60 PINK PAISLEY CAKE CASES,6,4/3/2011 12:41,0.55,13269,United Kingdom
548708,21976,PACK OF 60 MUSHROOM CAKE CASES,4,4/3/2011 12:41,0.55,13269,United Kingdom
548708,21975,PACK OF 60 DINOSAUR CAKE CASES,7,4/3/2011 12:41,0.55,13269,United Kingdom
548708,22417,PACK OF 60 SPACEBOY CAKE CASES,5,4/3/2011 12:41,0.55,13269,United Kingdom
548708,22951,60 CAKE CASES DOLLY GIRL DESIGN,6,4/3/2011 12:41,0.55,13269,United Kingdom
548708,84991,60 TEATIME FAIRY CAKE CASES,6,4/3/2011 12:41,0.55,13269,United Kingdom
548708,22428,ENAMEL FIRE BUCKET CREAM,2,4/3/2011 12:41,6.95,13269,United Kingdom
548708,22424,ENAMEL BREAD BIN CREAM,2,4/3/2011 12:41,12.75,13269,United Kingdom
548708,84313C,ORANGE TV TRAY TABLE ,2,4/3/2011 12:41,1.95,13269,United Kingdom
548708,21090,SET/6 COLLAGE PAPER PLATES,4,4/3/2011 12:41,0.39,13269,United Kingdom
548708,22961,JAM MAKING SET PRINTED,4,4/3/2011 12:41,1.45,13269,United Kingdom
548708,22492,MINI PAINT SET VINTAGE ,36,4/3/2011 12:41,0.65,13269,United Kingdom
548708,22425,ENAMEL COLANDER CREAM,3,4/3/2011 12:41,4.95,13269,United Kingdom
548708,22429,ENAMEL MEASURING JUG CREAM,3,4/3/2011 12:41,4.25,13269,United Kingdom
548708,22431,WATERING CAN BLUE ELEPHANT,3,4/3/2011 12:41,1.95,13269,United Kingdom
548708,22432,WATERING CAN PINK BUNNY,3,4/3/2011 12:41,1.95,13269,United Kingdom
548708,22667,RECIPE BOX RETROSPOT ,4,4/3/2011 12:41,2.95,13269,United Kingdom
548708,21137,BLACK RECORD COVER FRAME,4,4/3/2011 12:41,3.75,13269,United Kingdom
548708,22041,"RECORD FRAME 7"" SINGLE SIZE ",5,4/3/2011 12:41,2.55,13269,United Kingdom
548708,22966,GINGERBREAD MAN COOKIE CUTTER,4,4/3/2011 12:41,1.25,13269,United Kingdom
548708,84692,BOX OF 24 COCKTAIL PARASOLS,25,4/3/2011 12:41,0.42,13269,United Kingdom
548708,21257,VICTORIAN SEWING BOX MEDIUM,1,4/3/2011 12:41,7.95,13269,United Kingdom
548708,22933,BAKING MOULD EASTER EGG MILK CHOC,1,4/3/2011 12:41,2.95,13269,United Kingdom
548708,22255,FELT TOADSTOOL  SMALL,8,4/3/2011 12:41,0.85,13269,United Kingdom
548708,22254,FELT TOADSTOOL LARGE,1,4/3/2011 12:41,1.25,13269,United Kingdom
548708,22982,PANTRY PASTRY BRUSH,4,4/3/2011 12:41,1.25,13269,United Kingdom
548708,22604,SET OF 4 NAPKIN CHARMS CUTLERY,2,4/3/2011 12:41,2.55,13269,United Kingdom
548708,22767,TRIPLE PHOTO FRAME CORNICE ,2,4/3/2011 12:41,9.95,13269,United Kingdom
548708,22979,PANTRY WASHING UP BRUSH,4,4/3/2011 12:41,1.45,13269,United Kingdom
548708,82494L,WOODEN FRAME ANTIQUE WHITE ,6,4/3/2011 12:41,2.95,13269,United Kingdom
548708,82482,WOODEN PICTURE FRAME WHITE FINISH,6,4/3/2011 12:41,2.55,13269,United Kingdom
548708,21735,TWO DOOR CURIO CABINET,2,4/3/2011 12:41,12.75,13269,United Kingdom
548708,22170,PICTURE FRAME WOOD TRIPLE PORTRAIT,2,4/3/2011 12:41,6.75,13269,United Kingdom
548708,22501,PICNIC BASKET WICKER LARGE,2,4/3/2011 12:41,9.95,13269,United Kingdom
548709,21043,APRON MODERN VINTAGE COTTON,12,4/3/2011 12:46,1.95,17744,United Kingdom
548709,51020A,SUMMER FUN DESIGN SHOWER CAP,48,4/3/2011 12:46,0.29,17744,United Kingdom
548709,51020B,STRIPY DESIGN SHOWER CAP,48,4/3/2011 12:46,0.29,17744,United Kingdom
548709,84313C,ORANGE TV TRAY TABLE ,6,4/3/2011 12:46,1.95,17744,United Kingdom
548709,85019B,BLOSSOM  IMAGES NOTEBOOK SET,24,4/3/2011 12:46,1.25,17744,United Kingdom
548709,22123,PING MICROWAVE APRON,12,4/3/2011 12:46,1.95,17744,United Kingdom
548709,85019A,ROMANTIC IMAGES NOTEBOOK SET,24,4/3/2011 12:46,1.25,17744,United Kingdom
548709,22197,SMALL POPCORN HOLDER,12,4/3/2011 12:46,0.85,17744,United Kingdom
548709,22066,LOVE HEART TRINKET POT,96,4/3/2011 12:46,0.39,17744,United Kingdom
548709,84596B,SMALL DOLLY MIX DESIGN ORANGE BOWL,24,4/3/2011 12:46,0.42,17744,United Kingdom
548709,85019C,CURIOUS  IMAGES NOTEBOOK SET,48,4/3/2011 12:46,1.25,17744,United Kingdom
548709,21935,SUKI  SHOULDER BAG,10,4/3/2011 12:46,1.65,17744,United Kingdom
548710,84978,HANGING HEART JAR T-LIGHT HOLDER,24,4/3/2011 13:24,1.25,16678,United Kingdom
548710,71459,HANGING JAM JAR T-LIGHT HOLDER,24,4/3/2011 13:24,0.85,16678,United Kingdom
548710,22996,TRAVEL CARD WALLET VINTAGE TICKET,24,4/3/2011 13:24,0.42,16678,United Kingdom
548710,22718,CARD CAT AND TREE ,24,4/3/2011 13:24,0.42,16678,United Kingdom
548710,22961,JAM MAKING SET PRINTED,12,4/3/2011 13:24,1.45,16678,United Kingdom
548710,21375,LARGE CAMPHOR WOOD FIELD MUSHROOM ,2,4/3/2011 13:24,5.45,16678,United Kingdom
548710,21376,LARGE  TALL CAMPHOR WOOD TOADSTOOL ,2,4/3/2011 13:24,5.45,16678,United Kingdom
548710,22855,FINE WICKER HEART ,12,4/3/2011 13:24,1.25,16678,United Kingdom
548710,21928,JUMBO BAG SCANDINAVIAN BLUE PAISLEY,10,4/3/2011 13:24,1.95,16678,United Kingdom
548710,22902,TOTE BAG I LOVE LONDON,12,4/3/2011 13:24,2.1,16678,United Kingdom
548710,22652,TRAVEL SEWING KIT,10,4/3/2011 13:24,1.65,16678,United Kingdom
548710,22570,FELTCRAFT CUSHION RABBIT,4,4/3/2011 13:24,3.75,16678,United Kingdom
548710,22568,FELTCRAFT CUSHION OWL,4,4/3/2011 13:24,3.75,16678,United Kingdom
548710,23126,FELTCRAFT GIRL AMELIE KIT,4,4/3/2011 13:24,4.95,16678,United Kingdom
548710,23127,FELTCRAFT GIRL NICOLE KIT,4,4/3/2011 13:24,4.95,16678,United Kingdom
548710,21135,VICTORIAN  METAL POSTCARD SPRING,8,4/3/2011 13:24,1.69,16678,United Kingdom
548710,21136,PAINTED METAL PEARS ASSORTED,8,4/3/2011 13:24,1.69,16678,United Kingdom
548711,48187,DOORMAT NEW ENGLAND,1,4/3/2011 14:24,7.95,18116,United Kingdom
548711,48185,DOORMAT FAIRY CAKE,1,4/3/2011 14:24,7.95,18116,United Kingdom
548711,85150,LADIES & GENTLEMEN METAL SIGN,1,4/3/2011 14:24,2.55,18116,United Kingdom
548711,82580,BATHROOM METAL SIGN,1,4/3/2011 14:24,0.55,18116,United Kingdom
548711,21163,DO NOT TOUCH MY STUFF DOOR HANGER ,1,4/3/2011 14:24,1.45,18116,United Kingdom
548711,21169,YOU'RE CONFUSING ME METAL SIGN ,1,4/3/2011 14:24,1.69,18116,United Kingdom
548711,21162,TOXIC AREA  DOOR HANGER ,1,4/3/2011 14:24,1.45,18116,United Kingdom
548711,21158,MOODY GIRL DOOR HANGER ,1,4/3/2011 14:24,1.45,18116,United Kingdom
548711,21181,PLEASE ONE PERSON METAL SIGN,1,4/3/2011 14:24,2.1,18116,United Kingdom
548711,21770,OPEN CLOSED METAL SIGN,1,4/3/2011 14:24,4.95,18116,United Kingdom
548711,21165,BEWARE OF THE CAT METAL SIGN ,1,4/3/2011 14:24,1.69,18116,United Kingdom
548711,82578,KITCHEN METAL SIGN,1,4/3/2011 14:24,0.55,18116,United Kingdom
548711,21900,"KEY FOB , SHED",1,4/3/2011 14:24,0.65,18116,United Kingdom
548711,21899,"KEY FOB , GARAGE DESIGN",1,4/3/2011 14:24,0.65,18116,United Kingdom
548711,21901,"KEY FOB , BACK DOOR ",2,4/3/2011 14:24,0.65,18116,United Kingdom
548711,21933,PINK VINTAGE PAISLEY PICNIC BAG,1,4/3/2011 14:24,2.95,18116,United Kingdom
548711,22064,PINK DOUGHNUT TRINKET POT ,1,4/3/2011 14:24,1.65,18116,United Kingdom
548711,85040A,S/4 PINK FLOWER CANDLES IN BOWL,1,4/3/2011 14:24,1.65,18116,United Kingdom
548711,84828,JUNGLE POPSICLES ICE LOLLY MOULDS,1,4/3/2011 14:24,1.25,18116,United Kingdom
548711,22979,PANTRY WASHING UP BRUSH,1,4/3/2011 14:24,1.45,18116,United Kingdom
548711,22965,3 TRADITIONAl BISCUIT CUTTERS  SET,1,4/3/2011 14:24,2.1,18116,United Kingdom
548711,22553,PLASTERS IN TIN SKULLS,1,4/3/2011 14:24,1.65,18116,United Kingdom
548711,22989,SET 2 PANTRY DESIGN TEA TOWELS,1,4/3/2011 14:24,3.25,18116,United Kingdom
548711,22441,GROW YOUR OWN BASIL IN ENAMEL MUG,1,4/3/2011 14:24,2.1,18116,United Kingdom
548711,22906,12 MESSAGE CARDS WITH ENVELOPES,2,4/3/2011 14:24,1.65,18116,United Kingdom
548711,22966,GINGERBREAD MAN COOKIE CUTTER,1,4/3/2011 14:24,1.25,18116,United Kingdom
548711,22523,CHILDS GARDEN FORK PINK,2,4/3/2011 14:24,0.85,18116,United Kingdom
548711,22520,CHILDS GARDEN TROWEL BLUE ,2,4/3/2011 14:24,0.85,18116,United Kingdom
548711,85231G,ORANGE SCENTED SET/9 T-LIGHTS,1,4/3/2011 14:24,0.85,18116,United Kingdom
548711,85231B,CINAMMON SET OF 9 T-LIGHTS,1,4/3/2011 14:24,0.85,18116,United Kingdom
548711,47471,RAINBOW PEGS PHOTO CLIP STRING,1,4/3/2011 14:24,0.65,18116,United Kingdom
548711,22766,PHOTO FRAME CORNICE,1,4/3/2011 14:24,2.95,18116,United Kingdom
548711,20971,PINK BLUE FELT CRAFT TRINKET BOX,1,4/3/2011 14:24,1.25,18116,United Kingdom
548711,22694,WICKER STAR ,1,4/3/2011 14:24,2.1,18116,United Kingdom
548711,85123A,WHITE HANGING HEART T-LIGHT HOLDER,3,4/3/2011 14:24,2.95,18116,United Kingdom
548711,21786,POLKADOT RAIN HAT ,1,4/3/2011 14:24,0.42,18116,United Kingdom
548711,21787,RAIN PONCHO RETROSPOT,2,4/3/2011 14:24,0.85,18116,United Kingdom
548711,21786,POLKADOT RAIN HAT ,1,4/3/2011 14:24,0.42,18116,United Kingdom
548711,22723,SET OF 6 HERB TINS SKETCHBOOK,1,4/3/2011 14:24,3.95,18116,United Kingdom
548711,22722,SET OF 6 SPICE TINS PANTRY DESIGN,1,4/3/2011 14:24,3.95,18116,United Kingdom
548711,85040B,SET/4 BLUE FLOWER CANDLES IN BOWL,2,4/3/2011 14:24,1.65,18116,United Kingdom
548711,85040A,S/4 PINK FLOWER CANDLES IN BOWL,1,4/3/2011 14:24,1.65,18116,United Kingdom
548711,22558,CLOTHES PEGS RETROSPOT PACK 24 ,1,4/3/2011 14:24,1.65,18116,United Kingdom
548711,84763,ZINC FINISH 15CM PLANTER POTS,2,4/3/2011 14:24,1.25,18116,United Kingdom
548711,21870,I CAN ONLY PLEASE ONE PERSON MUG,1,4/3/2011 14:24,1.25,18116,United Kingdom
548711,84993B,75 BLACK PETIT FOUR CASES,1,4/3/2011 14:24,0.42,18116,United Kingdom
548711,84993A,75 GREEN PETIT FOUR CASES,1,4/3/2011 14:24,0.42,18116,United Kingdom
548711,22417,PACK OF 60 SPACEBOY CAKE CASES,1,4/3/2011 14:24,0.55,18116,United Kingdom
548711,21215,IVORY PAPER CUP CAKE CASES ,1,4/3/2011 14:24,0.55,18116,United Kingdom
548711,84992,72 SWEETHEART FAIRY CAKE CASES,1,4/3/2011 14:24,0.55,18116,United Kingdom
548711,21975,PACK OF 60 DINOSAUR CAKE CASES,1,4/3/2011 14:24,0.55,18116,United Kingdom
548711,84991,60 TEATIME FAIRY CAKE CASES,1,4/3/2011 14:24,0.55,18116,United Kingdom
548711,21977,PACK OF 60 PINK PAISLEY CAKE CASES,1,4/3/2011 14:24,0.55,18116,United Kingdom
548711,21976,PACK OF 60 MUSHROOM CAKE CASES,1,4/3/2011 14:24,0.55,18116,United Kingdom
548711,22197,SMALL POPCORN HOLDER,3,4/3/2011 14:24,0.85,18116,United Kingdom
548711,20971,PINK BLUE FELT CRAFT TRINKET BOX,1,4/3/2011 14:24,1.25,18116,United Kingdom
548711,22200,FRYING PAN PINK POLKADOT,1,4/3/2011 14:24,4.25,18116,United Kingdom
548711,22201,FRYING PAN BLUE POLKADOT,1,4/3/2011 14:24,4.25,18116,United Kingdom
548711,22207,FRYING PAN UNION FLAG,1,4/3/2011 14:24,4.25,18116,United Kingdom
548711,84050,PINK HEART SHAPE EGG FRYING PAN,1,4/3/2011 14:24,1.65,18116,United Kingdom
548711,20754,RETROSPOT RED WASHING UP GLOVES,1,4/3/2011 14:24,2.1,18116,United Kingdom
548711,20751,FUNKY WASHING UP GLOVES ASSORTED,1,4/3/2011 14:24,2.1,18116,United Kingdom
548711,20752,BLUE POLKADOT WASHING UP GLOVES,1,4/3/2011 14:24,2.1,18116,United Kingdom
548711,22719,GUMBALL MONOCHROME COAT RACK,1,4/3/2011 14:24,1.25,18116,United Kingdom
548711,22467,GUMBALL COAT RACK,4,4/3/2011 14:24,2.55,18116,United Kingdom
548711,85014A,BLACK/BLUE POLKADOT UMBRELLA,1,4/3/2011 14:24,5.95,18116,United Kingdom
548711,85014B,RED RETROSPOT UMBRELLA,1,4/3/2011 14:24,5.95,18116,United Kingdom
548711,15056N,EDWARDIAN PARASOL NATURAL,2,4/3/2011 14:24,5.95,18116,United Kingdom
548711,84596B,SMALL DOLLY MIX DESIGN ORANGE BOWL,1,4/3/2011 14:24,0.42,18116,United Kingdom
548711,20674,GREEN POLKADOT BOWL,1,4/3/2011 14:24,1.25,18116,United Kingdom
548711,20675,BLUE POLKADOT BOWL,1,4/3/2011 14:24,1.25,18116,United Kingdom
548711,84596G,SMALL CHOCOLATES PINK BOWL,1,4/3/2011 14:24,0.42,18116,United Kingdom
548711,84596L,BISCUITS SMALL BOWL LIGHT BLUE,1,4/3/2011 14:24,0.42,18116,United Kingdom
548711,84596J,MIXED NUTS LIGHT GREEN BOWL,1,4/3/2011 14:24,0.42,18116,United Kingdom
548711,20677,PINK POLKADOT BOWL,1,4/3/2011 14:24,1.25,18116,United Kingdom
548711,84378,SET OF 3 HEART COOKIE CUTTERS,1,4/3/2011 14:24,1.25,18116,United Kingdom
548711,84380,SET OF 3 BUTTERFLY COOKIE CUTTERS,1,4/3/2011 14:24,1.25,18116,United Kingdom
548711,47591D,PINK FAIRY CAKE CHILDRENS APRON,1,4/3/2011 14:24,1.95,18116,United Kingdom
548711,22899,CHILDREN'S APRON DOLLY GIRL ,1,4/3/2011 14:24,2.1,18116,United Kingdom
548711,47593B,SCOTTIE DOGS BABY BIB,2,4/3/2011 14:24,0.39,18116,United Kingdom
548711,84279B,CHERRY BLOSSOM DECORATIVE FLASK,1,4/3/2011 14:24,3.75,18116,United Kingdom
548711,85030,FRENCH CHATEAU OVAL PLATTER,1,4/3/2011 14:24,1.95,18116,United Kingdom
548711,85027L,FRENCH CHATEAU LARGE PLATTER ,1,4/3/2011 14:24,1.95,18116,United Kingdom
548711,47013C,WINE BOTTLE DRESSING DARK BLUE,3,4/3/2011 14:24,0.12,18116,United Kingdom
548711,47013A,WINE BOTTLE DRESSING LT.BLUE,1,4/3/2011 14:24,0.12,18116,United Kingdom
548711,37444A,YELLOW BREAKFAST CUP AND SAUCER,1,4/3/2011 14:24,0.39,18116,United Kingdom
548711,37333,"RETRO ""TEA FOR ONE"" ",1,4/3/2011 14:24,1.95,18116,United Kingdom
548711,37342,POLKADOT COFFEE CUP & SAUCER PINK,3,4/3/2011 14:24,0.79,18116,United Kingdom
548711,35265,COLOURFUL FLOWER FRUIT BOWL,1,4/3/2011 14:24,1.95,18116,United Kingdom
548711,85159B,"WHITE TEA,COFFEE,SUGAR JARS",1,4/3/2011 14:24,1.95,18116,United Kingdom
548711,85028S,FRENCH CHATEAU SMALL FRUITBOWL,3,4/3/2011 14:24,1.95,18116,United Kingdom
548712,22721,SET OF 3 CAKE TINS SKETCHBOOK,4,4/3/2011 14:42,4.95,17050,United Kingdom
548712,84763,ZINC FINISH 15CM PLANTER POTS,11,4/3/2011 14:42,1.25,17050,United Kingdom
548712,22720,SET OF 3 CAKE TINS PANTRY DESIGN ,4,4/3/2011 14:42,4.95,17050,United Kingdom
548712,22768,FAMILY PHOTO FRAME CORNICE,1,4/3/2011 14:42,9.95,17050,United Kingdom
548712,22767,TRIPLE PHOTO FRAME CORNICE ,1,4/3/2011 14:42,9.95,17050,United Kingdom
548712,22558,CLOTHES PEGS RETROSPOT PACK 24 ,8,4/3/2011 14:42,1.65,17050,United Kingdom
548712,21216,"SET 3 RETROSPOT TEA,COFFEE,SUGAR",1,4/3/2011 14:42,4.95,17050,United Kingdom
548712,22625,RED KITCHEN SCALES,1,4/3/2011 14:42,8.5,17050,United Kingdom
548712,22841,ROUND CAKE TIN VINTAGE GREEN,3,4/3/2011 14:42,7.95,17050,United Kingdom
548712,22840,ROUND CAKE TIN VINTAGE RED,3,4/3/2011 14:42,7.95,17050,United Kingdom
548712,22666,RECIPE BOX PANTRY YELLOW DESIGN,3,4/3/2011 14:42,2.95,17050,United Kingdom
548712,22665,RECIPE BOX BLUE SKETCHBOOK DESIGN,13,4/3/2011 14:42,2.95,17050,United Kingdom
548712,84510C,SET OF 4 POLKADOT COASTERS,1,4/3/2011 14:42,1.25,17050,United Kingdom
548712,22960,JAM MAKING SET WITH JARS,8,4/3/2011 14:42,4.25,17050,United Kingdom
548712,21035,SET/2 RED RETROSPOT TEA TOWELS ,2,4/3/2011 14:42,3.25,17050,United Kingdom
548712,21155,RED RETROSPOT PEG BAG,1,4/3/2011 14:42,2.55,17050,United Kingdom
548712,20914,SET/5 RED RETROSPOT LID GLASS BOWLS,4,4/3/2011 14:42,2.95,17050,United Kingdom
548712,21216,"SET 3 RETROSPOT TEA,COFFEE,SUGAR",1,4/3/2011 14:42,4.95,17050,United Kingdom
548712,21889,WOODEN BOX OF DOMINOES,4,4/3/2011 14:42,1.25,17050,United Kingdom
548712,22625,RED KITCHEN SCALES,1,4/3/2011 14:42,8.5,17050,United Kingdom
548712,22624,IVORY KITCHEN SCALES,1,4/3/2011 14:42,8.5,17050,United Kingdom
548712,84457,SET/3 RABBITS FLOWER SKIPPPING ROPE,4,4/3/2011 14:42,0.85,17050,United Kingdom
548712,85202,HANGING WOOD AND FELT HEART,16,4/3/2011 14:42,0.42,17050,United Kingdom
548712,85203,HANGING WOOD AND FELT BUTTERFLY ,20,4/3/2011 14:42,0.42,17050,United Kingdom
548712,85186A,EASTER BUNNY GARLAND OF FLOWERS,4,4/3/2011 14:42,0.42,17050,United Kingdom
