567805,21381,MINI WOODEN HAPPY BIRTHDAY GARLAND,24,9/22/2011 12:15,1.69,12854,United Kingdom
567805,21380,WOODEN HAPPY BIRTHDAY GARLAND,12,9/22/2011 12:15,2.95,12854,United Kingdom
567805,20972,PINK CREAM FELT CRAFT TRINKET BOX ,12,9/22/2011 12:15,1.25,12854,United Kingdom
567805,85123A,WHITE HANGING HEART T-LIGHT HOLDER,6,9/22/2011 12:15,2.95,12854,United Kingdom
567805,22586,FELTCRAFT HAIRBAND PINK AND BLUE,12,9/22/2011 12:15,0.85,12854,United Kingdom
567805,22566,FELTCRAFT HAIRBAND PINK AND PURPLE,12,9/22/2011 12:15,0.85,12854,United Kingdom
567805,22565,FELTCRAFT HAIRBANDS PINK AND WHITE ,12,9/22/2011 12:15,0.85,12854,United Kingdom
567805,22587,FELTCRAFT HAIRBAND RED AND BLUE,12,9/22/2011 12:15,0.85,12854,United Kingdom
567805,22668,PINK BABY BUNTING,15,9/22/2011 12:15,2.95,12854,United Kingdom
567805,22669,RED BABY BUNTING ,15,9/22/2011 12:15,2.95,12854,United Kingdom
567805,47590B,PINK HAPPY BIRTHDAY BUNTING,6,9/22/2011 12:15,5.45,12854,United Kingdom
567805,22147,FELTCRAFT BUTTERFLY HEARTS,6,9/22/2011 12:15,1.45,12854,United Kingdom
567805,22149,FELTCRAFT 6 FLOWER FRIENDS,6,9/22/2011 12:15,2.1,12854,United Kingdom
567805,23331,DECORATIVE WICKER HEART SMALL,2,9/22/2011 12:15,0.63,12854,United Kingdom
567805,23334,IVORY WICKER HEART SMALL,2,9/22/2011 12:15,0.63,12854,United Kingdom
567805,23333,IVORY WICKER HEART MEDIUM,2,9/22/2011 12:15,1.25,12854,United Kingdom
567805,23330,DECORATIVE WICKER HEART MEDIUM,2,9/22/2011 12:15,1.25,12854,United Kingdom
567805,23329,DECORATIVE WICKER HEART LARGE,2,9/22/2011 12:15,1.65,12854,United Kingdom
567805,23332,IVORY WICKER HEART LARGE,2,9/22/2011 12:15,1.65,12854,United Kingdom
567805,22696,WICKER WREATH LARGE,3,9/22/2011 12:15,1.95,12854,United Kingdom
567805,22694,WICKER STAR ,2,9/22/2011 12:15,2.1,12854,United Kingdom
567805,23322,LARGE WHITE HEART OF WICKER,2,9/22/2011 12:15,2.95,12854,United Kingdom
567805,22695,WICKER WREATH SMALL,2,9/22/2011 12:15,1.45,12854,United Kingdom
567805,23323,WHITE WICKER STAR ,2,9/22/2011 12:15,2.1,12854,United Kingdom
567805,23298,SPOTTY BUNTING,6,9/22/2011 12:15,4.95,12854,United Kingdom
567805,47590B,PINK HAPPY BIRTHDAY BUNTING,1,9/22/2011 12:15,5.45,12854,United Kingdom
567805,47590A,BLUE HAPPY BIRTHDAY BUNTING,6,9/22/2011 12:15,5.45,12854,United Kingdom
567805,47566B,TEA TIME PARTY BUNTING,5,9/22/2011 12:15,4.95,12854,United Kingdom
567805,47566,PARTY BUNTING,7,9/22/2011 12:15,4.95,12854,United Kingdom
567806,22170,PICTURE FRAME WOOD TRIPLE PORTRAIT,12,9/22/2011 12:22,4.62,18102,United Kingdom
567806,22169,FAMILY ALBUM WHITE PICTURE FRAME,16,9/22/2011 12:22,5.64,18102,United Kingdom
567806,22768,FAMILY PHOTO FRAME CORNICE,16,9/22/2011 12:22,6.72,18102,United Kingdom
567806,22767,TRIPLE PHOTO FRAME CORNICE ,16,9/22/2011 12:22,6.72,18102,United Kingdom
567806,23092,LARGE ANTIQUE WHITE PHOTO FRAME,12,9/22/2011 12:22,5.49,18102,United Kingdom
567806,23093,SMALL PARISIENNE HEART PHOTO FRAME ,16,9/22/2011 12:22,1.64,18102,United Kingdom
567807,22113,GREY HEART HOT WATER BOTTLE,2,9/22/2011 12:23,4.25,17027,United Kingdom
567807,22111,SCOTTIE DOG HOT WATER BOTTLE,2,9/22/2011 12:23,4.95,17027,United Kingdom
567807,23520,EMBROIDERED RIBBON REEL RUBY ,1,9/22/2011 12:23,3.75,17027,United Kingdom
567807,23511,EMBROIDERED RIBBON REEL EMILY ,1,9/22/2011 12:23,2.08,17027,United Kingdom
567807,23320,GIANT 50'S CHRISTMAS CRACKER,1,9/22/2011 12:23,2.89,17027,United Kingdom
567807,23152,IVORY SWEETHEART WIRE LETTER RACK ,2,9/22/2011 12:23,3.75,17027,United Kingdom
567807,23275,SET OF 3 HANGING OWLS OLLIE BEAK,12,9/22/2011 12:23,1.25,17027,United Kingdom
567807,84030E,ENGLISH ROSE HOT WATER BOTTLE,2,9/22/2011 12:23,4.25,17027,United Kingdom
567807,23265,SET OF 3 WOODEN TREE DECORATIONS,3,9/22/2011 12:23,1.25,17027,United Kingdom
567807,22601,CHRISTMAS RETROSPOT ANGEL WOOD,1,9/22/2011 12:23,0.85,17027,United Kingdom
567807,23266,SET OF 3 WOODEN STOCKING DECORATION,12,9/22/2011 12:23,1.25,17027,United Kingdom
567807,22572,ROCKING HORSE GREEN CHRISTMAS ,16,9/22/2011 12:23,0.85,17027,United Kingdom
567807,23511,EMBROIDERED RIBBON REEL EMILY ,1,9/22/2011 12:23,2.08,17027,United Kingdom
567807,23517,EMBROIDERED RIBBON REEL REBECCA ,2,9/22/2011 12:23,2.89,17027,United Kingdom
567807,22601,CHRISTMAS RETROSPOT ANGEL WOOD,2,9/22/2011 12:23,0.85,17027,United Kingdom
567807,22603,CHRISTMAS RETROSPOT TREE WOOD,6,9/22/2011 12:23,0.85,17027,United Kingdom
567807,23265,SET OF 3 WOODEN TREE DECORATIONS,6,9/22/2011 12:23,1.25,17027,United Kingdom
567807,22854,CREAM SWEETHEART EGG HOLDER,2,9/22/2011 12:23,4.95,17027,United Kingdom
567807,22738,RIBBON REEL SNOWY VILLAGE,5,9/22/2011 12:23,1.65,17027,United Kingdom
567807,22735,RIBBON REEL SOCKS AND MITTENS,10,9/22/2011 12:23,1.65,17027,United Kingdom
567807,23148,MINIATURE ANTIQUE ROSE HOOK IVORY,10,9/22/2011 12:23,0.83,17027,United Kingdom
567807,23147,SINGLE ANTIQUE ROSE HOOK IVORY,18,9/22/2011 12:23,1.45,17027,United Kingdom
567807,23146,TRIPLE HOOK ANTIQUE IVORY ROSE,12,9/22/2011 12:23,3.29,17027,United Kingdom
567808,22720,SET OF 3 CAKE TINS PANTRY DESIGN ,2,9/22/2011 12:24,4.95,17027,United Kingdom
567808,22993,SET OF 4 PANTRY JELLY MOULDS,2,9/22/2011 12:24,1.25,17027,United Kingdom
567809,22086,PAPER CHAIN KIT 50'S CHRISTMAS ,18,9/22/2011 12:29,2.95,13804,United Kingdom
567809,23319,BOX OF 6 MINI 50'S CRACKERS,12,9/22/2011 12:29,2.49,13804,United Kingdom
567809,23320,GIANT 50'S CHRISTMAS CRACKER,12,9/22/2011 12:29,2.89,13804,United Kingdom
567809,23247,BISCUIT TIN 50'S CHRISTMAS,6,9/22/2011 12:29,2.89,13804,United Kingdom
567809,23274,STAR T-LIGHT HOLDER WILLIE WINKIE,12,9/22/2011 12:29,1.65,13804,United Kingdom
567809,23271,CHRISTMAS TABLE SILVER CANDLE SPIKE,16,9/22/2011 12:29,0.83,13804,United Kingdom
567809,84347,ROTATING SILVER ANGELS T-LIGHT HLDR,6,9/22/2011 12:29,2.55,13804,United Kingdom
567809,23109,PACK OF SIX LED TEA LIGHTS,24,9/22/2011 12:29,2.89,13804,United Kingdom
567809,23102,SILVER HEARTS TABLE DECORATION,12,9/22/2011 12:29,0.83,13804,United Kingdom
567809,23101,SILVER STARS TABLE DECORATION,12,9/22/2011 12:29,0.83,13804,United Kingdom
567809,23100,SILVER BELLS TABLE DECORATION,12,9/22/2011 12:29,1.25,13804,United Kingdom
567809,23426,METAL SIGN DROP YOUR PANTS,6,9/22/2011 12:29,2.89,13804,United Kingdom
567809,22693,GROW A FLYTRAP OR SUNFLOWER IN TIN,24,9/22/2011 12:29,1.25,13804,United Kingdom
567809,22835,HOT WATER BOTTLE I AM SO POORLY,4,9/22/2011 12:29,4.95,13804,United Kingdom
567809,22112,CHOCOLATE HOT WATER BOTTLE,3,9/22/2011 12:29,4.95,13804,United Kingdom
567809,23254,CHILDRENS CUTLERY DOLLY GIRL ,4,9/22/2011 12:29,4.15,13804,United Kingdom
567809,21790,VINTAGE SNAP CARDS,12,9/22/2011 12:29,0.85,13804,United Kingdom
567809,22560,TRADITIONAL MODELLING CLAY,24,9/22/2011 12:29,1.25,13804,United Kingdom
567809,22560,TRADITIONAL MODELLING CLAY,24,9/22/2011 12:29,1.25,13804,United Kingdom
567809,22622,BOX OF VINTAGE ALPHABET BLOCKS,4,9/22/2011 12:29,11.95,13804,United Kingdom
567809,23504,PLAYING CARDS JUBILEE UNION JACK,12,9/22/2011 12:29,1.25,13804,United Kingdom
567809,22174,PHOTO CUBE,12,9/22/2011 12:29,1.65,13804,United Kingdom
567809,23296,SET OF 6 TEA TIME BAKING CASES,8,9/22/2011 12:29,1.25,13804,United Kingdom
567809,22993,SET OF 4 PANTRY JELLY MOULDS,12,9/22/2011 12:29,1.25,13804,United Kingdom
567809,23295,SET OF 12 MINI LOAF BAKING CASES,8,9/22/2011 12:29,0.83,13804,United Kingdom
567809,23293,SET OF 12 FAIRY CAKE BAKING CASES,8,9/22/2011 12:29,0.83,13804,United Kingdom
567809,23189,SET OF 12 FORK CANDLES,6,9/22/2011 12:29,2.89,13804,United Kingdom
567809,23159,SET OF 5 PANCAKE DAY MAGNETS,12,9/22/2011 12:29,2.08,13804,United Kingdom
567809,23156,SET OF 5 MINI GROCERY MAGNETS,12,9/22/2011 12:29,2.08,13804,United Kingdom
567809,23012,GLASS APOTHECARY BOTTLE PERFUME,4,9/22/2011 12:29,3.95,13804,United Kingdom
567809,23014,GLASS APOTHECARY BOTTLE ELIXIR,4,9/22/2011 12:29,3.95,13804,United Kingdom
567809,23013,GLASS APOTHECARY BOTTLE TONIC,4,9/22/2011 12:29,3.95,13804,United Kingdom
567809,23328,SET 6 SCHOOL MILK BOTTLES IN CRATE,4,9/22/2011 12:29,3.75,13804,United Kingdom
567809,84880,WHITE WIRE EGG HOLDER,3,9/22/2011 12:29,7.5,13804,United Kingdom
567809,22151,PLACE SETTING WHITE HEART,24,9/22/2011 12:29,0.42,13804,United Kingdom
567816,21497,FANCY FONTS BIRTHDAY WRAP,25,9/22/2011 12:34,0.42,17243,United Kingdom
567816,23322,LARGE WHITE HEART OF WICKER,2,9/22/2011 12:34,2.95,17243,United Kingdom
567816,22695,WICKER WREATH SMALL,1,9/22/2011 12:34,1.45,17243,United Kingdom
567816,22469,HEART OF WICKER SMALL,3,9/22/2011 12:34,1.65,17243,United Kingdom
567816,48138,DOORMAT UNION FLAG,1,9/22/2011 12:34,8.25,17243,United Kingdom
567816,48187,DOORMAT NEW ENGLAND,1,9/22/2011 12:34,8.25,17243,United Kingdom
567816,48194,DOORMAT HEARTS,2,9/22/2011 12:34,8.25,17243,United Kingdom
567816,23439,HAND WARMER RED LOVE HEART,7,9/22/2011 12:34,2.1,17243,United Kingdom
567816,22633,HAND WARMER UNION JACK,8,9/22/2011 12:34,2.1,17243,United Kingdom
567816,23355,HOT WATER BOTTLE KEEP CALM,1,9/22/2011 12:34,4.95,17243,United Kingdom
567816,22114,HOT WATER BOTTLE TEA AND SYMPATHY,2,9/22/2011 12:34,4.25,17243,United Kingdom
567816,23356,LOVE HOT WATER BOTTLE,4,9/22/2011 12:34,5.95,17243,United Kingdom
567816,21034,REX CASH+CARRY JUMBO SHOPPER,1,9/22/2011 12:34,0.95,17243,United Kingdom
567816,72807A,SET/3 ROSE CANDLE IN JEWELLED BOX,3,9/22/2011 12:34,4.25,17243,United Kingdom
567816,72807C,SET/3 VANILLA SCENTED CANDLE IN BOX,2,9/22/2011 12:34,4.25,17243,United Kingdom
567816,85034A,3 GARDENIA MORRIS BOXED CANDLES,3,9/22/2011 12:34,4.25,17243,United Kingdom
567816,23412,HEART MIRROR ANTIQUE WHITE,4,9/22/2011 12:34,7.5,17243,United Kingdom
567816,23092,LARGE ANTIQUE WHITE PHOTO FRAME,2,9/22/2011 12:34,7.9,17243,United Kingdom
567816,82486,3 DRAWER ANTIQUE WHITE WOOD CABINET,2,9/22/2011 12:34,8.95,17243,United Kingdom
567816,82494L,WOODEN FRAME ANTIQUE WHITE ,6,9/22/2011 12:34,2.95,17243,United Kingdom
567816,21429,RED GINGHAM ROSE JEWELLERY BOX,4,9/22/2011 12:34,1.95,17243,United Kingdom
567817,22385,JUMBO BAG SPACEBOY DESIGN,4,9/22/2011 12:41,2.08,15005,United Kingdom
567817,22663,JUMBO BAG DOLLY GIRL DESIGN,3,9/22/2011 12:41,2.08,15005,United Kingdom
567817,23202,JUMBO BAG VINTAGE LEAF,4,9/22/2011 12:41,2.08,15005,United Kingdom
567817,23203,JUMBO BAG VINTAGE DOILY ,4,9/22/2011 12:41,2.08,15005,United Kingdom
567817,23199,JUMBO BAG APPLES,2,9/22/2011 12:41,2.08,15005,United Kingdom
567817,23343,JUMBO BAG VINTAGE CHRISTMAS ,4,9/22/2011 12:41,2.08,15005,United Kingdom
567817,23301,GARDENERS KNEELING PAD KEEP CALM ,6,9/22/2011 12:41,1.65,15005,United Kingdom
567817,23302,KNEELING MAT HOUSEWORK  DESIGN,2,9/22/2011 12:41,1.65,15005,United Kingdom
567817,22057,CERAMIC PLATE STRAWBERRY DESIGN,4,9/22/2011 12:41,1.49,15005,United Kingdom
567817,82483,WOOD 2 DRAWER CABINET WHITE FINISH,2,9/22/2011 12:41,6.95,15005,United Kingdom
567817,21232,STRAWBERRY CERAMIC TRINKET BOX,2,9/22/2011 12:41,1.25,15005,United Kingdom
567817,21231,SWEETHEART CERAMIC TRINKET BOX,2,9/22/2011 12:41,1.25,15005,United Kingdom
567817,23389,SPACEBOY MINI BACKPACK,3,9/22/2011 12:41,4.15,15005,United Kingdom
567817,23390,DOLLY GIRL MINI BACKPACK,3,9/22/2011 12:41,4.15,15005,United Kingdom
567817,20677,PINK POLKADOT BOWL,2,9/22/2011 12:41,1.25,15005,United Kingdom
567817,23313,VINTAGE CHRISTMAS BUNTING,4,9/22/2011 12:41,4.95,15005,United Kingdom
567817,22661,CHARLOTTE BAG DOLLY GIRL DESIGN,6,9/22/2011 12:41,0.85,15005,United Kingdom
567817,20728,LUNCH BAG CARS BLUE,2,9/22/2011 12:41,1.65,15005,United Kingdom
567817,22356,CHARLOTTE BAG PINK POLKADOT,6,9/22/2011 12:41,0.85,15005,United Kingdom
567817,22355,CHARLOTTE BAG SUKI DESIGN,6,9/22/2011 12:41,0.85,15005,United Kingdom
567817,22630,DOLLY GIRL LUNCH BOX,2,9/22/2011 12:41,1.95,15005,United Kingdom
567817,22165,"DIAMANTE HEART SHAPED WALL MIRROR, ",1,9/22/2011 12:41,12.75,15005,United Kingdom
567817,21034,REX CASH+CARRY JUMBO SHOPPER,1,9/22/2011 12:41,0.95,15005,United Kingdom
567818,22195,LARGE HEART MEASURING SPOONS,1,9/22/2011 12:41,1.65,14395,United Kingdom
567818,22614,PACK OF 12 SPACEBOY TISSUES,12,9/22/2011 12:41,0.39,14395,United Kingdom
567818,21098,CHRISTMAS TOILET ROLL,1,9/22/2011 12:41,1.25,14395,United Kingdom
567818,21744,SNOWFLAKE PORTABLE TABLE LIGHT ,1,9/22/2011 12:41,2.95,14395,United Kingdom
567818,22551,PLASTERS IN TIN SPACEBOY,1,9/22/2011 12:41,1.65,14395,United Kingdom
567818,23389,SPACEBOY MINI BACKPACK,1,9/22/2011 12:41,4.15,14395,United Kingdom
567818,23371,SET 36 COLOUR PENCILS SPACEBOY ,1,9/22/2011 12:41,1.25,14395,United Kingdom
567818,23293,SET OF 12 FAIRY CAKE BAKING CASES,1,9/22/2011 12:41,0.83,14395,United Kingdom
567818,22382,LUNCH BAG SPACEBOY DESIGN ,1,9/22/2011 12:41,1.65,14395,United Kingdom
567818,22613,PACK OF 20 SPACEBOY NAPKINS,1,9/22/2011 12:41,0.85,14395,United Kingdom
567818,22474,SPACEBOY TV DINNER TRAY,1,9/22/2011 12:41,4.95,14395,United Kingdom
567818,23337,EGG FRYING PAN MINT ,1,9/22/2011 12:41,2.08,14395,United Kingdom
567818,23335,EGG FRYING PAN IVORY ,1,9/22/2011 12:41,2.08,14395,United Kingdom
567818,22196,SMALL HEART MEASURING SPOONS,1,9/22/2011 12:41,0.85,14395,United Kingdom
567818,21034,REX CASH+CARRY JUMBO SHOPPER,1,9/22/2011 12:41,0.95,14395,United Kingdom
567818,22507,MEMO BOARD RETROSPOT  DESIGN,4,9/22/2011 12:41,4.95,14395,United Kingdom
567818,22505,MEMO BOARD COTTAGE DESIGN,3,9/22/2011 12:41,4.95,14395,United Kingdom
567818,21623,VINTAGE UNION JACK MEMOBOARD,2,9/22/2011 12:41,9.95,14395,United Kingdom
567818,23412,HEART MIRROR ANTIQUE WHITE,2,9/22/2011 12:41,7.5,14395,United Kingdom
567818,82484,WOOD BLACK BOARD ANT WHITE FINISH,2,9/22/2011 12:41,7.95,14395,United Kingdom
567818,85150,LADIES & GENTLEMEN METAL SIGN,4,9/22/2011 12:41,2.55,14395,United Kingdom
567818,21175,GIN + TONIC DIET METAL SIGN,6,9/22/2011 12:41,2.55,14395,United Kingdom
567818,21907,I'M ON HOLIDAY METAL SIGN,6,9/22/2011 12:41,2.1,14395,United Kingdom
567818,21165,BEWARE OF THE CAT METAL SIGN ,4,9/22/2011 12:41,1.69,14395,United Kingdom
567818,21908,CHOCOLATE THIS WAY METAL SIGN,4,9/22/2011 12:41,2.1,14395,United Kingdom
567818,21903,MAN FLU METAL SIGN,7,9/22/2011 12:41,2.1,14395,United Kingdom
567818,21166,COOK WITH WINE METAL SIGN ,6,9/22/2011 12:41,2.08,14395,United Kingdom
567818,21169,YOU'RE CONFUSING ME METAL SIGN ,10,9/22/2011 12:41,1.69,14395,United Kingdom
567818,82582,AREA PATROLLED METAL SIGN,7,9/22/2011 12:41,2.1,14395,United Kingdom
567818,21174,POTTERING IN THE SHED METAL SIGN,4,9/22/2011 12:41,2.08,14395,United Kingdom
567818,82583,HOT BATHS METAL SIGN,5,9/22/2011 12:41,2.1,14395,United Kingdom
567818,22652,TRAVEL SEWING KIT,3,9/22/2011 12:41,1.65,14395,United Kingdom
567818,23493,VINTAGE DOILY TRAVEL SEWING KIT,3,9/22/2011 12:41,1.95,14395,United Kingdom
567818,47566,PARTY BUNTING,4,9/22/2011 12:41,4.95,14395,United Kingdom
567818,22632,HAND WARMER RED RETROSPOT,3,9/22/2011 12:41,2.1,14395,United Kingdom
567818,23439,HAND WARMER RED LOVE HEART,3,9/22/2011 12:41,2.1,14395,United Kingdom
567818,22633,HAND WARMER UNION JACK,3,9/22/2011 12:41,2.1,14395,United Kingdom
567818,23355,HOT WATER BOTTLE KEEP CALM,3,9/22/2011 12:41,4.95,14395,United Kingdom
567818,21485,RETROSPOT HEART HOT WATER BOTTLE,3,9/22/2011 12:41,4.95,14395,United Kingdom
567818,22112,CHOCOLATE HOT WATER BOTTLE,3,9/22/2011 12:41,4.95,14395,United Kingdom
567818,22835,HOT WATER BOTTLE I AM SO POORLY,3,9/22/2011 12:41,4.95,14395,United Kingdom
567818,21733,RED HANGING HEART T-LIGHT HOLDER,4,9/22/2011 12:41,2.95,14395,United Kingdom
567818,22804,CANDLEHOLDER PINK HANGING HEART,2,9/22/2011 12:41,2.95,14395,United Kingdom
567818,85123A,WHITE HANGING HEART T-LIGHT HOLDER,3,9/22/2011 12:41,2.95,14395,United Kingdom
567818,21902,"KEY FOB , FRONT  DOOR ",6,9/22/2011 12:41,0.65,14395,United Kingdom
567818,21901,"KEY FOB , BACK DOOR ",12,9/22/2011 12:41,0.65,14395,United Kingdom
567818,21900,"KEY FOB , SHED",12,9/22/2011 12:41,0.65,14395,United Kingdom
567818,21899,GARAGE KEY FOB,12,9/22/2011 12:41,0.65,14395,United Kingdom
567818,22276,WASH BAG VINTAGE ROSE PAISLEY,4,9/22/2011 12:41,2.55,14395,United Kingdom
567818,84912A,PINK ROSE WASHBAG,8,9/22/2011 12:41,3.75,14395,United Kingdom
567818,82494L,WOODEN FRAME ANTIQUE WHITE ,2,9/22/2011 12:41,2.95,14395,United Kingdom
567818,82482,WOODEN PICTURE FRAME WHITE FINISH,4,9/22/2011 12:41,2.95,14395,United Kingdom
567818,85208,SET/12 FUNKY FELT FLOWER PEG IN BAG,3,9/22/2011 12:41,2.1,14395,United Kingdom
567818,21098,CHRISTMAS TOILET ROLL,4,9/22/2011 12:41,1.25,14395,United Kingdom
567818,22737,RIBBON REEL CHRISTMAS PRESENT ,5,9/22/2011 12:41,1.65,14395,United Kingdom
567818,22152,PLACE SETTING WHITE STAR,12,9/22/2011 12:41,0.42,14395,United Kingdom
567818,22151,PLACE SETTING WHITE HEART,12,9/22/2011 12:41,0.42,14395,United Kingdom
567818,22077,6 RIBBONS RUSTIC CHARM,3,9/22/2011 12:41,1.95,14395,United Kingdom
567818,85049F,BABY BOOM RIBBONS ,4,9/22/2011 12:41,1.25,14395,United Kingdom
567818,85049A,TRADITIONAL CHRISTMAS RIBBONS,4,9/22/2011 12:41,1.25,14395,United Kingdom
567818,85049C,ROMANTIC PINKS RIBBONS ,3,9/22/2011 12:41,1.25,14395,United Kingdom
567818,82483,WOOD 2 DRAWER CABINET WHITE FINISH,2,9/22/2011 12:41,6.95,14395,United Kingdom
567818,82486,3 DRAWER ANTIQUE WHITE WOOD CABINET,2,9/22/2011 12:41,8.95,14395,United Kingdom
567818,82483,WOOD 2 DRAWER CABINET WHITE FINISH,2,9/22/2011 12:41,6.95,14395,United Kingdom
567818,22469,HEART OF WICKER SMALL,8,9/22/2011 12:41,1.65,14395,United Kingdom
567818,23321,SMALL WHITE HEART OF WICKER,8,9/22/2011 12:41,1.65,14395,United Kingdom
567818,23322,LARGE WHITE HEART OF WICKER,3,9/22/2011 12:41,2.95,14395,United Kingdom
567818,23329,DECORATIVE WICKER HEART LARGE,6,9/22/2011 12:41,1.65,14395,United Kingdom
567818,23332,IVORY WICKER HEART LARGE,6,9/22/2011 12:41,1.65,14395,United Kingdom
567818,22739,RIBBON REEL CHRISTMAS SOCK BAUBLE,5,9/22/2011 12:41,1.65,14395,United Kingdom
567818,22080,RIBBON REEL POLKADOTS ,5,9/22/2011 12:41,1.65,14395,United Kingdom
567818,22735,RIBBON REEL SOCKS AND MITTENS,5,9/22/2011 12:41,1.65,14395,United Kingdom
567818,22079,RIBBON REEL HEARTS DESIGN ,5,9/22/2011 12:41,1.65,14395,United Kingdom
567818,22694,WICKER STAR ,4,9/22/2011 12:41,2.1,14395,United Kingdom
567818,22470,HEART OF WICKER LARGE,4,9/22/2011 12:41,2.95,14395,United Kingdom
567819,23203,JUMBO BAG VINTAGE DOILY ,10,9/22/2011 12:42,2.08,14004,United Kingdom
567819,22910,PAPER CHAIN KIT VINTAGE CHRISTMAS,6,9/22/2011 12:42,2.95,14004,United Kingdom
567819,22086,PAPER CHAIN KIT 50'S CHRISTMAS ,12,9/22/2011 12:42,2.95,14004,United Kingdom
567819,23355,HOT WATER BOTTLE KEEP CALM,4,9/22/2011 12:42,4.95,14004,United Kingdom
567819,22835,HOT WATER BOTTLE I AM SO POORLY,4,9/22/2011 12:42,4.95,14004,United Kingdom
567819,23356,LOVE HOT WATER BOTTLE,3,9/22/2011 12:42,5.95,14004,United Kingdom
567819,22155,STAR DECORATION RUSTIC,48,9/22/2011 12:42,0.42,14004,United Kingdom
567819,22154,ANGEL DECORATION 3 BUTTONS ,48,9/22/2011 12:42,0.42,14004,United Kingdom
567819,22153,ANGEL DECORATION STARS ON DRESS,48,9/22/2011 12:42,0.42,14004,United Kingdom
567819,85176,SEWING SUSAN 21 NEEDLE SET,48,9/22/2011 12:42,0.85,14004,United Kingdom
567819,85178,VICTORIAN SEWING KIT,48,9/22/2011 12:42,1.25,14004,United Kingdom
567819,23307,SET OF 60 PANTRY DESIGN CAKE CASES ,24,9/22/2011 12:42,0.55,14004,United Kingdom
567819,23370,SET 36 COLOURING PENCILS DOILY,32,9/22/2011 12:42,1.25,14004,United Kingdom
567819,23504,PLAYING CARDS JUBILEE UNION JACK,12,9/22/2011 12:42,1.25,14004,United Kingdom
567819,23503,PLAYING CARDS KEEP CALM & CARRY ON,12,9/22/2011 12:42,1.25,14004,United Kingdom
567819,21914,BLUE HARMONICA IN BOX ,24,9/22/2011 12:42,1.25,14004,United Kingdom
567819,21915,RED  HARMONICA IN BOX ,24,9/22/2011 12:42,1.25,14004,United Kingdom
567819,22560,TRADITIONAL MODELLING CLAY,24,9/22/2011 12:42,1.25,14004,United Kingdom
567819,23371,SET 36 COLOUR PENCILS SPACEBOY ,32,9/22/2011 12:42,1.25,14004,United Kingdom
567819,22972,CHILDREN'S SPACEBOY MUG,12,9/22/2011 12:42,1.65,14004,United Kingdom
567819,22551,PLASTERS IN TIN SPACEBOY,12,9/22/2011 12:42,1.65,14004,United Kingdom
567819,85099B,JUMBO BAG RED RETROSPOT,10,9/22/2011 12:42,2.08,14004,United Kingdom
567821,22138,BAKING SET 9 PIECE RETROSPOT ,4,9/22/2011 12:45,4.95,14659,United Kingdom
567821,22617,BAKING SET SPACEBOY DESIGN,2,9/22/2011 12:45,4.95,14659,United Kingdom
567821,85099B,JUMBO BAG RED RETROSPOT,5,9/22/2011 12:45,2.08,14659,United Kingdom
567821,22386,JUMBO BAG PINK POLKADOT,3,9/22/2011 12:45,2.08,14659,United Kingdom
567821,23203,JUMBO BAG VINTAGE DOILY ,10,9/22/2011 12:45,2.08,14659,United Kingdom
567821,20727,LUNCH BAG  BLACK SKULL.,5,9/22/2011 12:45,1.65,14659,United Kingdom
567821,20725,LUNCH BAG RED RETROSPOT,5,9/22/2011 12:45,1.65,14659,United Kingdom
567821,22384,LUNCH BAG PINK POLKADOT,5,9/22/2011 12:45,1.65,14659,United Kingdom
567821,23209,LUNCH BAG VINTAGE DOILY ,5,9/22/2011 12:45,1.65,14659,United Kingdom
567821,48116,DOORMAT MULTICOLOUR STRIPE,1,9/22/2011 12:45,8.25,14659,United Kingdom
567821,22144,CHRISTMAS CRAFT LITTLE FRIENDS,5,9/22/2011 12:45,2.1,14659,United Kingdom
567821,22142,CHRISTMAS CRAFT WHITE FAIRY ,5,9/22/2011 12:45,1.45,14659,United Kingdom
567821,23329,DECORATIVE WICKER HEART LARGE,5,9/22/2011 12:45,1.65,14659,United Kingdom
567821,22720,SET OF 3 CAKE TINS PANTRY DESIGN ,4,9/22/2011 12:45,4.95,14659,United Kingdom
567821,22952,60 CAKE CASES VINTAGE CHRISTMAS,10,9/22/2011 12:45,0.55,14659,United Kingdom
567821,22130,PARTY CONE CHRISTMAS DECORATION ,18,9/22/2011 12:45,0.85,14659,United Kingdom
567821,22910,PAPER CHAIN KIT VINTAGE CHRISTMAS,3,9/22/2011 12:45,2.95,14659,United Kingdom
567821,22086,PAPER CHAIN KIT 50'S CHRISTMAS ,3,9/22/2011 12:45,2.95,14659,United Kingdom
567821,21329,DINOSAURS  WRITING SET ,5,9/22/2011 12:45,1.65,14659,United Kingdom
567821,20975,12 PENCILS SMALL TUBE RED RETROSPOT,5,9/22/2011 12:45,0.65,14659,United Kingdom
567821,23166,MEDIUM CERAMIC TOP STORAGE JAR,4,9/22/2011 12:45,1.25,14659,United Kingdom
567821,23167,SMALL CERAMIC TOP STORAGE JAR ,4,9/22/2011 12:45,0.83,14659,United Kingdom
567821,23368,SET 12 COLOUR PENCILS DOLLY GIRL ,5,9/22/2011 12:45,0.65,14659,United Kingdom
567821,23367,SET 12 COLOUR PENCILS SPACEBOY ,5,9/22/2011 12:45,0.65,14659,United Kingdom
567821,84997D,CHILDRENS CUTLERY POLKADOT PINK,5,9/22/2011 12:45,4.15,14659,United Kingdom
567821,22834,HAND WARMER BABUSHKA DESIGN,3,9/22/2011 12:45,2.1,14659,United Kingdom
567821,22633,HAND WARMER UNION JACK,3,9/22/2011 12:45,2.1,14659,United Kingdom
567821,23431,NATURAL HANGING QUILTED HEARTS ,12,9/22/2011 12:45,0.83,14659,United Kingdom
567821,22866,HAND WARMER SCOTTY DOG DESIGN,3,9/22/2011 12:45,2.1,14659,United Kingdom
567821,22550,HOLIDAY FUN LUDO,2,9/22/2011 12:45,3.75,14659,United Kingdom
567821,23067,HANGING ENGRAVED METAL HEART,4,9/22/2011 12:45,4.15,14659,United Kingdom
567821,23068,ALUMINIUM STAMPED HEART,4,9/22/2011 12:45,2.49,14659,United Kingdom
567821,85014B,RED RETROSPOT UMBRELLA,3,9/22/2011 12:45,5.95,14659,United Kingdom
567821,22113,GREY HEART HOT WATER BOTTLE,2,9/22/2011 12:45,4.25,14659,United Kingdom
567821,22114,HOT WATER BOTTLE TEA AND SYMPATHY,2,9/22/2011 12:45,4.25,14659,United Kingdom
567821,23355,HOT WATER BOTTLE KEEP CALM,2,9/22/2011 12:45,4.95,14659,United Kingdom
567821,22112,CHOCOLATE HOT WATER BOTTLE,2,9/22/2011 12:45,4.95,14659,United Kingdom
567821,23358,HOT STUFF HOT WATER BOTTLE,2,9/22/2011 12:45,3.75,14659,United Kingdom
567821,21484,CHICK GREY HOT WATER BOTTLE,1,9/22/2011 12:45,4.25,14659,United Kingdom
567821,20969,RED FLORAL FELTCRAFT SHOULDER BAG,3,9/22/2011 12:45,3.75,14659,United Kingdom
567821,20972,PINK CREAM FELT CRAFT TRINKET BOX ,5,9/22/2011 12:45,1.25,14659,United Kingdom
567821,21790,VINTAGE SNAP CARDS,10,9/22/2011 12:45,0.85,14659,United Kingdom
567821,21791,VINTAGE HEADS AND TAILS CARD GAME ,5,9/22/2011 12:45,1.25,14659,United Kingdom
567821,22549,PICTURE DOMINOES,5,9/22/2011 12:45,1.45,14659,United Kingdom
567821,22623,BOX OF VINTAGE JIGSAW BLOCKS ,3,9/22/2011 12:45,5.95,14659,United Kingdom
567822,23298,SPOTTY BUNTING,6,9/22/2011 12:54,4.95,17644,United Kingdom
567822,22144,CHRISTMAS CRAFT LITTLE FRIENDS,40,9/22/2011 12:54,1.85,17644,United Kingdom
567822,23110,PARISIENNE KEY CABINET ,2,9/22/2011 12:54,5.75,17644,United Kingdom
567822,23118,PARISIENNE JEWELLERY DRAWER ,2,9/22/2011 12:54,7.5,17644,United Kingdom
567822,23148,MINIATURE ANTIQUE ROSE HOOK IVORY,24,9/22/2011 12:54,0.83,17644,United Kingdom
567822,23321,SMALL WHITE HEART OF WICKER,12,9/22/2011 12:54,1.65,17644,United Kingdom
567822,23322,LARGE WHITE HEART OF WICKER,12,9/22/2011 12:54,2.95,17644,United Kingdom
567822,23327,HANGING CLEAR MINI BOTTLE,48,9/22/2011 12:54,0.63,17644,United Kingdom
567822,23227,FILIGREE HEART BUTTERFLY WHITE ,24,9/22/2011 12:54,1.25,17644,United Kingdom
567822,21877,HOME SWEET HOME MUG,12,9/22/2011 12:54,1.65,17644,United Kingdom
567822,23503,PLAYING CARDS KEEP CALM & CARRY ON,12,9/22/2011 12:54,1.25,17644,United Kingdom
567822,23381,PACK OF 12 VINTAGE LEAF TISSUES ,24,9/22/2011 12:54,0.39,17644,United Kingdom
567822,20724,RED RETROSPOT CHARLOTTE BAG,10,9/22/2011 12:54,0.85,17644,United Kingdom
567822,22149,FELTCRAFT 6 FLOWER FRIENDS,6,9/22/2011 12:54,2.1,17644,United Kingdom
567822,21429,RED GINGHAM ROSE JEWELLERY BOX,8,9/22/2011 12:54,1.95,17644,United Kingdom
567822,23232,WRAP VINTAGE LEAF DESIGN,25,9/22/2011 12:54,0.42,17644,United Kingdom
567822,23546,WRAP PAISLEY PARK ,25,9/22/2011 12:54,0.42,17644,United Kingdom
567822,23551,PACK OF 12 PAISLEY PARK TISSUES ,24,9/22/2011 12:54,0.39,17644,United Kingdom
567822,23326,HANGING MINI COLOURED BOTTLES,48,9/22/2011 12:54,0.63,17644,United Kingdom
567822,22818,CARD CHRISTMAS VILLAGE,24,9/22/2011 12:54,0.42,17644,United Kingdom
567822,23318,BOX OF 6 MINI VINTAGE CRACKERS,6,9/22/2011 12:54,2.49,17644,United Kingdom
567822,23350,ROLL WRAP VINTAGE SPOT ,12,9/22/2011 12:54,1.25,17644,United Kingdom
567822,23349,ROLL WRAP VINTAGE CHRISTMAS,24,9/22/2011 12:54,1.25,17644,United Kingdom
