548505,20655,QUEEN OF SKIES LUGGAGE TAG,1,3/31/2011 14:34,2.46,,United Kingdom
548505,20685,DOORMAT RED RETROSPOT,1,3/31/2011 14:34,16.63,,United Kingdom
548505,20711,JUMBO BAG TOYS ,1,3/31/2011 14:34,4.13,,United Kingdom
548505,20712,JUMBO BAG WOODLAND ANIMALS,3,3/31/2011 14:34,4.13,,United Kingdom
548505,20713,JUMBO BAG OWLS,3,3/31/2011 14:34,4.13,,United Kingdom
548505,20727,LUNCH BAG  BLACK SKULL.,1,3/31/2011 14:34,4.96,,United Kingdom
548505,21033,JUMBO BAG CHARLIE AND LOLA TOYS,5,3/31/2011 14:34,4.13,,United Kingdom
548505,21080,SET/20 RED RETROSPOT PAPER NAPKINS ,3,3/31/2011 14:34,2.46,,United Kingdom
548505,21169,YOU'RE CONFUSING ME METAL SIGN ,2,3/31/2011 14:34,4.13,,United Kingdom
548505,21172,PARTY METAL SIGN ,2,3/31/2011 14:34,4.13,,United Kingdom
548505,21181,PLEASE ONE PERSON METAL SIGN,1,3/31/2011 14:34,4.13,,United Kingdom
548505,21216,"SET 3 RETROSPOT TEA,COFFEE,SUGAR",1,3/31/2011 14:34,10.79,,United Kingdom
548505,21218,RED SPOTTY BISCUIT TIN,1,3/31/2011 14:34,8.29,,United Kingdom
548505,21232,STRAWBERRY CERAMIC TRINKET BOX,1,3/31/2011 14:34,3.29,,United Kingdom
548505,21272,SALLE DE BAIN HOOK,1,3/31/2011 14:34,2.46,,United Kingdom
548505,21428,SET3 BOOK BOX GREEN GINGHAM FLOWER ,1,3/31/2011 14:34,8.29,,United Kingdom
548505,21430,SET/3 RED GINGHAM ROSE STORAGE BOX,2,3/31/2011 14:34,7.46,,United Kingdom
548505,21494,ROTATING LEAVES T-LIGHT HOLDER,6,3/31/2011 14:34,5.79,,United Kingdom
548505,21658,GLASS  BEURRE DISH,1,3/31/2011 14:34,8.29,,United Kingdom
548505,21731,RED TOADSTOOL LED NIGHT LIGHT,1,3/31/2011 14:34,4.13,,United Kingdom
548505,21788,KIDS RAIN MAC BLUE,5,3/31/2011 14:34,1.63,,United Kingdom
548505,21789,KIDS RAIN MAC PINK,5,3/31/2011 14:34,1.63,,United Kingdom
548505,21866,UNION JACK FLAG LUGGAGE TAG,1,3/31/2011 14:34,3.29,,United Kingdom
548505,21931,JUMBO STORAGE BAG SUKI,4,3/31/2011 14:34,4.13,,United Kingdom
548505,21935,SUKI  SHOULDER BAG,1,3/31/2011 14:34,4.13,,United Kingdom
548505,21974,SET OF 36 PAISLEY FLOWER DOILIES,1,3/31/2011 14:34,3.75,,United Kingdom
548505,22055,MINI CAKE STAND  HANGING STRAWBERY,1,3/31/2011 14:34,3.29,,United Kingdom
548505,22063,CERAMIC BOWL WITH STRAWBERRY DESIGN,1,3/31/2011 14:34,5.79,,United Kingdom
548505,22073,RED RETROSPOT STORAGE JAR,3,3/31/2011 14:34,7.46,,United Kingdom
548505,22078,RIBBON REEL LACE DESIGN ,1,3/31/2011 14:34,4.71,,United Kingdom
548505,22088,PAPER BUNTING COLOURED LACE,1,3/31/2011 14:34,4.13,,United Kingdom
548505,22090,PAPER BUNTING RETROSPOT,1,3/31/2011 14:34,6.63,,United Kingdom
548505,22196,SMALL HEART MEASURING SPOONS,1,3/31/2011 14:34,1.63,,United Kingdom
548505,22197,SMALL POPCORN HOLDER,6,3/31/2011 14:34,1.63,,United Kingdom
548505,22199,FRYING PAN RED RETROSPOT,1,3/31/2011 14:34,8.29,,United Kingdom
548505,22200,FRYING PAN PINK POLKADOT,1,3/31/2011 14:34,8.29,,United Kingdom
548505,22203,MILK PAN RED RETROSPOT,1,3/31/2011 14:34,7.46,,United Kingdom
548505,22278,OVERNIGHT BAG VINTAGE ROSE PAISLEY,1,3/31/2011 14:34,10.79,,United Kingdom
548505,22352,LUNCH BOX WITH CUTLERY RETROSPOT ,1,3/31/2011 14:34,4.96,,United Kingdom
548505,22357,KINGS CHOICE BISCUIT TIN,1,3/31/2011 14:34,8.29,,United Kingdom
548505,22358,KINGS CHOICE TEA CADDY ,1,3/31/2011 14:34,5.79,,United Kingdom
548505,22378,WALL TIDY RETROSPOT ,1,3/31/2011 14:34,4.96,,United Kingdom
548505,22379,RECYCLING BAG RETROSPOT ,4,3/31/2011 14:34,4.96,,United Kingdom
548505,22386,JUMBO BAG PINK POLKADOT,1,3/31/2011 14:34,4.13,,United Kingdom
548505,22411,JUMBO SHOPPER VINTAGE RED PAISLEY,1,3/31/2011 14:34,4.13,,United Kingdom
548505,22424,ENAMEL BREAD BIN CREAM,1,3/31/2011 14:34,24.96,,United Kingdom
548505,22430,ENAMEL WATERING CAN CREAM,1,3/31/2011 14:34,9.96,,United Kingdom
548505,22467,GUMBALL COAT RACK,2,3/31/2011 14:34,4.96,,United Kingdom
548505,22476,EMPIRE UNION JACK TV DINNER TRAY,1,3/31/2011 14:34,10.79,,United Kingdom
548505,22501,PICNIC BASKET WICKER LARGE,1,3/31/2011 14:34,20.79,,United Kingdom
548505,22502,PICNIC BASKET WICKER SMALL,1,3/31/2011 14:34,8.29,,United Kingdom
548505,22607,WOODEN ROUNDERS GARDEN SET ,1,3/31/2011 14:34,20.79,,United Kingdom
548505,22629,SPACEBOY LUNCH BOX ,1,3/31/2011 14:34,2.46,,United Kingdom
548505,22637,PIGGY BANK RETROSPOT ,1,3/31/2011 14:34,5.79,,United Kingdom
548505,22659,LUNCH BOX I LOVE LONDON,1,3/31/2011 14:34,2.46,,United Kingdom
548505,22668,PINK BABY BUNTING,1,3/31/2011 14:34,5.79,,United Kingdom
548505,22669,RED BABY BUNTING ,2,3/31/2011 14:34,5.79,,United Kingdom
548505,22719,GUMBALL MONOCHROME COAT RACK,1,3/31/2011 14:34,2.46,,United Kingdom
548505,22720,SET OF 3 CAKE TINS PANTRY DESIGN ,1,3/31/2011 14:34,10.79,,United Kingdom
548505,22725,ALARM CLOCK BAKELIKE CHOCOLATE,1,3/31/2011 14:34,8.29,,United Kingdom
548505,22776,SWEETHEART CAKESTAND 3 TIER,1,3/31/2011 14:34,19.96,,United Kingdom
548505,22794,SWEETHEART WIRE MAGAZINE RACK,1,3/31/2011 14:34,15.79,,United Kingdom
548505,37340,MULTICOLOUR SPRING FLOWER MUG,1,3/31/2011 14:34,8.29,,United Kingdom
548505,47566b,TEA TIME PARTY BUNTING,5,3/31/2011 14:34,8.29,,United Kingdom
548505,48184,DOORMAT ENGLISH ROSE ,1,3/31/2011 14:34,14.13,,United Kingdom
548505,82482,WOODEN PICTURE FRAME WHITE FINISH,1,3/31/2011 14:34,4.96,,United Kingdom
548505,82580,BATHROOM METAL SIGN,2,3/31/2011 14:34,1.25,,United Kingdom
548505,84347,ROTATING SILVER ANGELS T-LIGHT HLDR,3,3/31/2011 14:34,5.79,,United Kingdom
548505,84380,SET OF 3 BUTTERFLY COOKIE CUTTERS,1,3/31/2011 14:34,3.29,,United Kingdom
548505,84519A,TOMATO CHARLIE+LOLA COASTER SET,1,3/31/2011 14:34,5.79,,United Kingdom
548505,85039a,SET/4 RED MINI ROSE CANDLE IN BOWL,1,3/31/2011 14:34,3.29,,United Kingdom
548505,85040a,S/4 PINK FLOWER CANDLES IN BOWL,1,3/31/2011 14:34,3.29,,United Kingdom
548505,85099B,JUMBO BAG RED RETROSPOT,1,3/31/2011 14:34,4.13,,United Kingdom
548505,DOT,DOTCOM POSTAGE,1,3/31/2011 14:34,236.88,,United Kingdom
548506,22659,LUNCH BOX I LOVE LONDON,1,3/31/2011 14:42,1.95,18037,United Kingdom
548506,22630,DOLLY GIRL LUNCH BOX,1,3/31/2011 14:42,1.95,18037,United Kingdom
548507,84596E,SMALL LICORICE DES PINK BOWL,1,3/31/2011 14:47,0.42,13573,United Kingdom
548507,22957,SET 3 PAPER VINTAGE CHICK PAPER EGG,3,3/31/2011 14:47,2.95,13573,United Kingdom
548507,21745,GAOLERS KEYS DECORATIVE GARDEN ,6,3/31/2011 14:47,3.75,13573,United Kingdom
C548508,23176,ABC TREASURE BOOK BOX ,-1,3/31/2011 14:51,2.25,14189,United Kingdom
548509,22487,WHITE WOOD GARDEN PLANT LADDER,4,3/31/2011 15:00,8.5,14543,United Kingdom
548509,22207,FRYING PAN UNION FLAG,40,3/31/2011 15:00,4.25,14543,United Kingdom
548509,22666,RECIPE BOX PANTRY YELLOW DESIGN,12,3/31/2011 15:00,2.95,14543,United Kingdom
548509,46000S,POLYESTER FILLER PAD 40x40cm,4,3/31/2011 15:00,1.45,14543,United Kingdom
548509,22605,WOODEN CROQUET GARDEN SET,4,3/31/2011 15:00,12.75,14543,United Kingdom
548510,22424,ENAMEL BREAD BIN CREAM,1,3/31/2011 15:02,12.75,17861,United Kingdom
548510,40001,WHITE BAMBOO RIBS LAMPSHADE,2,3/31/2011 15:02,0.85,17861,United Kingdom
548510,22090,PAPER BUNTING RETROSPOT,1,3/31/2011 15:02,2.95,17861,United Kingdom
548510,21471,STRAWBERRY RAFFIA FOOD COVER,1,3/31/2011 15:02,3.75,17861,United Kingdom
548510,22045,SPACEBOY GIFT WRAP,25,3/31/2011 15:02,0.42,17861,United Kingdom
548510,21495,SKULLS AND CROSSBONES WRAP,25,3/31/2011 15:02,0.42,17861,United Kingdom
548510,22710,WRAP I LOVE LONDON ,25,3/31/2011 15:02,0.42,17861,United Kingdom
548510,21497,FANCY FONTS BIRTHDAY WRAP,25,3/31/2011 15:02,0.42,17861,United Kingdom
548510,22029,SPACEBOY BIRTHDAY CARD,12,3/31/2011 15:02,0.42,17861,United Kingdom
548510,21509,COWBOYS AND INDIANS BIRTHDAY CARD ,12,3/31/2011 15:02,0.42,17861,United Kingdom
548510,21915,RED  HARMONICA IN BOX ,3,3/31/2011 15:02,1.25,17861,United Kingdom
548510,20750,RED RETROSPOT MINI CASES,1,3/31/2011 15:02,7.95,17861,United Kingdom
548510,22138,BAKING SET 9 PIECE RETROSPOT ,2,3/31/2011 15:02,4.95,17861,United Kingdom
548510,22333,RETROSPOT PARTY BAG + STICKER SET,3,3/31/2011 15:02,1.65,17861,United Kingdom
548510,22332,SKULLS PARTY BAG + STICKER SET,3,3/31/2011 15:02,1.65,17861,United Kingdom
548510,21988,PACK OF 6 SKULL PAPER PLATES,3,3/31/2011 15:02,0.85,17861,United Kingdom
548510,21989,PACK OF 20 SKULL PAPER NAPKINS,3,3/31/2011 15:02,0.85,17861,United Kingdom
548510,21094,SET/6 RED SPOTTY PAPER PLATES,3,3/31/2011 15:02,0.85,17861,United Kingdom
548510,21080,SET/20 RED RETROSPOT PAPER NAPKINS ,3,3/31/2011 15:02,0.85,17861,United Kingdom
548510,84077,WORLD WAR 2 GLIDERS ASSTD DESIGNS,48,3/31/2011 15:02,0.29,17861,United Kingdom
548510,21086,SET/6 RED SPOTTY PAPER CUPS,3,3/31/2011 15:02,0.65,17861,United Kingdom
548510,21987,PACK OF 6 SKULL PAPER CUPS,3,3/31/2011 15:02,0.65,17861,United Kingdom
548510,22148,EASTER CRAFT 4 CHICKS ,4,3/31/2011 15:02,1.95,17861,United Kingdom
548510,22971,QUEENS GUARD COFFEE MUG,4,3/31/2011 15:02,2.55,17861,United Kingdom
548510,22749,FELTCRAFT PRINCESS CHARLOTTE DOLL,3,3/31/2011 15:02,3.75,17861,United Kingdom
548510,84375,SET OF 20 KIDS COOKIE CUTTERS,4,3/31/2011 15:02,2.1,17861,United Kingdom
548510,22957,SET 3 PAPER VINTAGE CHICK PAPER EGG,3,3/31/2011 15:02,2.95,17861,United Kingdom
548510,22139,RETROSPOT TEA SET CERAMIC 11 PC ,3,3/31/2011 15:02,4.95,17861,United Kingdom
548510,79160,HEART SHAPE WIRELESS DOORBELL,3,3/31/2011 15:02,2.1,17861,United Kingdom
548510,22382,LUNCH BAG SPACEBOY DESIGN ,2,3/31/2011 15:02,1.65,17861,United Kingdom
548510,20725,LUNCH BAG RED RETROSPOT,2,3/31/2011 15:02,1.65,17861,United Kingdom
548510,22616,PACK OF 12 LONDON TISSUES ,12,3/31/2011 15:02,0.29,17861,United Kingdom
548510,20727,LUNCH BAG  BLACK SKULL.,2,3/31/2011 15:02,1.65,17861,United Kingdom
548510,22066,LOVE HEART TRINKET POT,6,3/31/2011 15:02,0.39,17861,United Kingdom
548511,48116,DOORMAT MULTICOLOUR STRIPE,1,3/31/2011 15:43,7.95,14056,United Kingdom
548511,20725,LUNCH BAG RED RETROSPOT,2,3/31/2011 15:43,1.65,14056,United Kingdom
548511,22844,VINTAGE CREAM DOG FOOD CONTAINER,5,3/31/2011 15:43,8.5,14056,United Kingdom
548511,22845,VINTAGE CREAM CAT FOOD CONTAINER,5,3/31/2011 15:43,6.35,14056,United Kingdom
548511,22087,PAPER BUNTING WHITE LACE,1,3/31/2011 15:43,2.95,14056,United Kingdom
548511,22899,CHILDREN'S APRON DOLLY GIRL ,1,3/31/2011 15:43,2.1,14056,United Kingdom
548511,22367,CHILDRENS APRON SPACEBOY DESIGN,2,3/31/2011 15:43,1.95,14056,United Kingdom
548511,21523,DOORMAT FANCY FONT HOME SWEET HOME,1,3/31/2011 15:43,7.95,14056,United Kingdom
548511,22551,PLASTERS IN TIN SPACEBOY,1,3/31/2011 15:43,1.65,14056,United Kingdom
548511,22556,PLASTERS IN TIN CIRCUS PARADE ,3,3/31/2011 15:43,1.65,14056,United Kingdom
548511,23003,TRAVEL CARD WALLET VINTAGE ROSE ,24,3/31/2011 15:43,0.42,14056,United Kingdom
548511,22489,PACK OF 12 TRADITIONAL CRAYONS,3,3/31/2011 15:43,0.42,14056,United Kingdom
548511,22326,ROUND SNACK BOXES SET OF4 WOODLAND ,1,3/31/2011 15:43,2.95,14056,United Kingdom
548511,22328,ROUND SNACK BOXES SET OF 4 FRUITS ,1,3/31/2011 15:43,2.95,14056,United Kingdom
548511,22441,GROW YOUR OWN BASIL IN ENAMEL MUG,5,3/31/2011 15:43,2.1,14056,United Kingdom
548511,22629,SPACEBOY LUNCH BOX ,2,3/31/2011 15:43,1.95,14056,United Kingdom
548511,22630,DOLLY GIRL LUNCH BOX,2,3/31/2011 15:43,1.95,14056,United Kingdom
548511,22722,SET OF 6 SPICE TINS PANTRY DESIGN,10,3/31/2011 15:43,3.95,14056,United Kingdom
548511,20914,SET/5 RED RETROSPOT LID GLASS BOWLS,1,3/31/2011 15:43,2.95,14056,United Kingdom
548511,21912,VINTAGE SNAKES & LADDERS,1,3/31/2011 15:43,3.75,14056,United Kingdom
548511,21210,SET OF 72 RETROSPOT PAPER  DOILIES,1,3/31/2011 15:43,1.45,14056,United Kingdom
548511,21888,BINGO SET,2,3/31/2011 15:43,3.75,14056,United Kingdom
548511,22550,HOLIDAY FUN LUDO,2,3/31/2011 15:43,3.75,14056,United Kingdom
548511,21913,VINTAGE SEASIDE JIGSAW PUZZLES,1,3/31/2011 15:43,3.75,14056,United Kingdom
548511,23050,RECYCLED ACAPULCO MAT GREEN,3,3/31/2011 15:43,8.25,14056,United Kingdom
548511,23051,RECYCLED ACAPULCO MAT BLUE,2,3/31/2011 15:43,8.25,14056,United Kingdom
548511,23052,RECYCLED ACAPULCO MAT TURQUOISE,3,3/31/2011 15:43,8.25,14056,United Kingdom
548512,21714,CITRONELLA CANDLE GARDEN POT,6,3/31/2011 15:54,1.25,14410,United Kingdom
548512,22859,EASTER TIN BUNNY BOUQUET,2,3/31/2011 15:54,1.65,14410,United Kingdom
548512,22858,EASTER TIN KEEPSAKE,2,3/31/2011 15:54,1.65,14410,United Kingdom
548512,22860,EASTER TIN CHICKS PINK DAISY,2,3/31/2011 15:54,1.65,14410,United Kingdom
548512,22162,HEART GARLAND RUSTIC PADDED,4,3/31/2011 15:54,2.95,14410,United Kingdom
548512,72134,COLUMBIAN  CUBE CANDLE ,4,3/31/2011 15:54,0.85,14410,United Kingdom
548512,21922,UNION STRIPE WITH FRINGE  HAMMOCK,2,3/31/2011 15:54,7.95,14410,United Kingdom
548512,21922,UNION STRIPE WITH FRINGE  HAMMOCK,1,3/31/2011 15:54,7.95,14410,United Kingdom
548512,21622,VINTAGE UNION JACK CUSHION COVER,4,3/31/2011 15:54,4.95,14410,United Kingdom
548512,21624,VINTAGE UNION JACK DOORSTOP,2,3/31/2011 15:54,5.95,14410,United Kingdom
548512,22498,WOODEN REGATTA BUNTING,2,3/31/2011 15:54,5.95,14410,United Kingdom
548512,22499,WOODEN UNION JACK BUNTING,2,3/31/2011 15:54,5.95,14410,United Kingdom
548512,21625,VINTAGE UNION JACK APRON,1,3/31/2011 15:54,6.95,14410,United Kingdom
548512,22084,PAPER CHAIN KIT EMPIRE,4,3/31/2011 15:54,2.95,14410,United Kingdom
548512,22176,BLUE OWL SOFT TOY,2,3/31/2011 15:54,2.95,14410,United Kingdom
C548513,85123A,WHITE HANGING HEART T-LIGHT HOLDER,-8,3/31/2011 15:54,2.55,13777,United Kingdom
548514,20615,BLUE POLKADOT PASSPORT COVER,1,3/31/2011 16:03,4.13,,United Kingdom
548514,20676,RED RETROSPOT BOWL,2,3/31/2011 16:03,2.46,,United Kingdom
548514,20685,DOORMAT RED RETROSPOT,1,3/31/2011 16:03,16.63,,United Kingdom
548514,20711,JUMBO BAG TOYS ,5,3/31/2011 16:03,4.13,,United Kingdom
548514,20712,JUMBO BAG WOODLAND ANIMALS,7,3/31/2011 16:03,4.13,,United Kingdom
548514,20717,STRAWBERRY SHOPPER BAG,1,3/31/2011 16:03,2.46,,United Kingdom
548514,20726,LUNCH BAG WOODLAND,4,3/31/2011 16:03,4.96,,United Kingdom
548514,21033,JUMBO BAG CHARLIE AND LOLA TOYS,2,3/31/2011 16:03,4.13,,United Kingdom
548514,21035,SET/2 RED RETROSPOT TEA TOWELS ,4,3/31/2011 16:03,6.25,,United Kingdom
548514,21042,RED RETROSPOT APRON ,1,3/31/2011 16:03,12.46,,United Kingdom
548514,21063,PARTY INVITES JAZZ HEARTS,1,3/31/2011 16:03,1.63,,United Kingdom
548514,21080,SET/20 RED RETROSPOT PAPER NAPKINS ,1,3/31/2011 16:03,2.46,,United Kingdom
548514,21086,SET/6 RED SPOTTY PAPER CUPS,4,3/31/2011 16:03,1.63,,United Kingdom
548514,21116,OWL DOORSTOP,1,3/31/2011 16:03,8.29,,United Kingdom
548514,21215,IVORY PAPER CUP CAKE CASES ,1,3/31/2011 16:03,1.25,,United Kingdom
548514,21216,"SET 3 RETROSPOT TEA,COFFEE,SUGAR",1,3/31/2011 16:03,10.79,,United Kingdom
548514,21218,RED SPOTTY BISCUIT TIN,1,3/31/2011 16:03,8.29,,United Kingdom
548514,21232,STRAWBERRY CERAMIC TRINKET BOX,1,3/31/2011 16:03,3.29,,United Kingdom
548514,21354,TOAST ITS - BEST MUM,2,3/31/2011 16:03,2.46,,United Kingdom
548514,21658,GLASS  BEURRE DISH,1,3/31/2011 16:03,8.29,,United Kingdom
548514,21700,BIG DOUGHNUT FRIDGE MAGNETS,1,3/31/2011 16:03,8.29,,United Kingdom
548514,21714,CITRONELLA CANDLE GARDEN POT,1,3/31/2011 16:03,2.46,,United Kingdom
548514,21731,RED TOADSTOOL LED NIGHT LIGHT,2,3/31/2011 16:03,4.13,,United Kingdom
548514,21820,GLITTER HEART GARLAND WITH BELLS ,1,3/31/2011 16:03,7.46,,United Kingdom
548514,21928,JUMBO BAG SCANDINAVIAN BLUE PAISLEY,1,3/31/2011 16:03,4.13,,United Kingdom
548514,21930,JUMBO STORAGE BAG SKULLS,5,3/31/2011 16:03,4.96,,United Kingdom
548514,21931,JUMBO STORAGE BAG SUKI,5,3/31/2011 16:03,4.13,,United Kingdom
548514,21935,SUKI  SHOULDER BAG,1,3/31/2011 16:03,4.13,,United Kingdom
548514,21936,RED RETROSPOT PICNIC BAG,1,3/31/2011 16:03,5.79,,United Kingdom
548514,21977,PACK OF 60 PINK PAISLEY CAKE CASES,1,3/31/2011 16:03,2.08,,United Kingdom
548514,22041,"RECORD FRAME 7"" SINGLE SIZE ",1,3/31/2011 16:03,4.96,,United Kingdom
548514,22055,MINI CAKE STAND  HANGING STRAWBERY,3,3/31/2011 16:03,3.29,,United Kingdom
548514,22088,PAPER BUNTING COLOURED LACE,3,3/31/2011 16:03,4.13,,United Kingdom
548514,22089,PAPER BUNTING VINTAGE PAISLEY,1,3/31/2011 16:03,4.13,,United Kingdom
548514,22090,PAPER BUNTING RETROSPOT,7,3/31/2011 16:03,6.63,,United Kingdom
548514,22166,WALL MIRROR RECTANGLE DIAMANTE PINK,1,3/31/2011 16:03,15.79,,United Kingdom
548514,22167, OVAL WALL MIRROR DIAMANTE ,2,3/31/2011 16:03,19.96,,United Kingdom
548514,22175,PINK OWL SOFT TOY,1,3/31/2011 16:03,5.79,,United Kingdom
548514,22197,SMALL POPCORN HOLDER,1,3/31/2011 16:03,1.63,,United Kingdom
548514,22219,LOVEBIRD HANGING DECORATION WHITE ,1,3/31/2011 16:03,1.63,,United Kingdom
548514,22282,12 EGG HOUSE PAINTED WOOD,1,3/31/2011 16:03,24.96,,United Kingdom
548514,22379,RECYCLING BAG RETROSPOT ,1,3/31/2011 16:03,4.96,,United Kingdom
548514,22411,JUMBO SHOPPER VINTAGE RED PAISLEY,5,3/31/2011 16:03,4.13,,United Kingdom
548514,22431,WATERING CAN BLUE ELEPHANT,1,3/31/2011 16:03,4.13,,United Kingdom
548514,22433,WATERING CAN GREEN DINOSAUR,1,3/31/2011 16:03,4.13,,United Kingdom
548514,22456,NATURAL SLATE CHALKBOARD LARGE ,1,3/31/2011 16:03,9.96,,United Kingdom
548514,22499,WOODEN UNION JACK BUNTING,4,3/31/2011 16:03,8.29,,United Kingdom
548514,22502,PICNIC BASKET WICKER SMALL,2,3/31/2011 16:03,8.29,,United Kingdom
548514,22513,DOORSTOP FOOTBALL DESIGN,1,3/31/2011 16:03,7.46,,United Kingdom
548514,22629,SPACEBOY LUNCH BOX ,2,3/31/2011 16:03,2.46,,United Kingdom
548514,22630,DOLLY GIRL LUNCH BOX,4,3/31/2011 16:03,2.46,,United Kingdom
548514,22659,LUNCH BOX I LOVE LONDON,2,3/31/2011 16:03,2.46,,United Kingdom
548514,22697,GREEN REGENCY TEACUP AND SAUCER,2,3/31/2011 16:03,5.79,,United Kingdom
548514,22720,SET OF 3 CAKE TINS PANTRY DESIGN ,1,3/31/2011 16:03,10.79,,United Kingdom
548514,22775,PURPLE DRAWERKNOB ACRYLIC EDWARDIAN,6,3/31/2011 16:03,2.46,,United Kingdom
548514,22786,CUSHION COVER PINK UNION JACK,2,3/31/2011 16:03,15.79,,United Kingdom
548514,22891,TEA FOR ONE POLKADOT,1,3/31/2011 16:03,8.29,,United Kingdom
548514,22960,JAM MAKING SET WITH JARS,1,3/31/2011 16:03,8.29,,United Kingdom
548514,22966,GINGERBREAD MAN COOKIE CUTTER,1,3/31/2011 16:03,2.46,,United Kingdom
548514,22998,TRAVEL CARD WALLET KEEP CALM,2,3/31/2011 16:03,0.83,,United Kingdom
548514,23182,TOILET SIGN OCCUPIED OR VACANT,1,3/31/2011 16:03,2.5,,United Kingdom
548514,35241,ENAMEL BLUE RIM BISCUIT BIN,1,3/31/2011 16:03,9.96,,United Kingdom
548514,37340,MULTICOLOUR SPRING FLOWER MUG,3,3/31/2011 16:03,8.29,,United Kingdom
548514,47566b,TEA TIME PARTY BUNTING,1,3/31/2011 16:03,8.29,,United Kingdom
548514,48116,DOORMAT MULTICOLOUR STRIPE,1,3/31/2011 16:03,14.13,,United Kingdom
548514,48138,DOORMAT UNION FLAG,1,3/31/2011 16:03,14.13,,United Kingdom
548514,48184,DOORMAT ENGLISH ROSE ,1,3/31/2011 16:03,14.13,,United Kingdom
548514,72349b,SET/6 PURPLE BUTTERFLY T-LIGHTS,2,3/31/2011 16:03,4.13,,United Kingdom
548514,82482,WOODEN PICTURE FRAME WHITE FINISH,1,3/31/2011 16:03,4.96,,United Kingdom
548514,84380,SET OF 3 BUTTERFLY COOKIE CUTTERS,2,3/31/2011 16:03,3.29,,United Kingdom
548514,84970s,HANGING HEART ZINC T-LIGHT HOLDER,12,3/31/2011 16:03,2.08,,United Kingdom
548514,85099B,JUMBO BAG RED RETROSPOT,8,3/31/2011 16:03,4.13,,United Kingdom
548514,DOT,DOTCOM POSTAGE,1,3/31/2011 16:03,282.88,,United Kingdom
548515,M,Manual,3,3/31/2011 16:19,0.65,,United Kingdom
548516,21564,PINK  HEART SHAPE LOVE BUCKET ,1,3/31/2011 16:28,5.79,,United Kingdom
548516,21581,SKULLS  DESIGN  COTTON TOTE BAG,1,3/31/2011 16:28,4.96,,United Kingdom
548516,21627,ELEPHANT CARNIVAL POUFFE,1,3/31/2011 16:28,29.17,,United Kingdom
548516,21709,FOLDING UMBRELLA CHOCOLATE POLKADOT,1,3/31/2011 16:28,9.96,,United Kingdom
548516,21716,BOYS VINTAGE TIN SEASIDE BUCKET,1,3/31/2011 16:28,4.96,,United Kingdom
548516,21718,RED METAL BEACH SPADE ,1,3/31/2011 16:28,2.46,,United Kingdom
548516,21730,GLASS STAR FROSTED T-LIGHT HOLDER,1,3/31/2011 16:28,9.96,,United Kingdom
548516,21731,RED TOADSTOOL LED NIGHT LIGHT,1,3/31/2011 16:28,3.29,,United Kingdom
548516,21746,SMALL RED RETROSPOT WINDMILL,6,3/31/2011 16:28,2.46,,United Kingdom
548516,21747,SMALL SKULL WINDMILL,5,3/31/2011 16:28,2.46,,United Kingdom
548516,21755,LOVE BUILDING BLOCK WORD,1,3/31/2011 16:28,11.63,,United Kingdom
548516,21773,DECORATIVE ROSE BATHROOM BOTTLE,1,3/31/2011 16:28,2.46,,United Kingdom
548516,21775,DECORATIVE FLORE BATHROOM BOTTLE,1,3/31/2011 16:28,2.46,,United Kingdom
548516,21867,PINK UNION JACK  LUGGAGE TAG,3,3/31/2011 16:28,2.46,,United Kingdom
548516,21874,GIN AND TONIC MUG,1,3/31/2011 16:28,3.29,,United Kingdom
548516,21880,RED RETROSPOT TAPE,3,3/31/2011 16:28,0.42,,United Kingdom
548516,21884,CAKES AND BOWS GIFT  TAPE,2,3/31/2011 16:28,1.63,,United Kingdom
548516,21888,BINGO SET,1,3/31/2011 16:28,7.46,,United Kingdom
548516,21932,SCANDINAVIAN PAISLEY PICNIC BAG,1,3/31/2011 16:28,5.79,,United Kingdom
548516,21975,PACK OF 60 DINOSAUR CAKE CASES,1,3/31/2011 16:28,1.25,,United Kingdom
548516,21977,PACK OF 60 PINK PAISLEY CAKE CASES,4,3/31/2011 16:28,1.25,,United Kingdom
548516,21981,PACK OF 12 WOODLAND TISSUES ,1,3/31/2011 16:28,0.83,,United Kingdom
548516,21990,MODERN FLORAL STATIONERY SET,2,3/31/2011 16:28,2.46,,United Kingdom
548516,21992,VINTAGE PAISLEY STATIONERY SET,1,3/31/2011 16:28,2.46,,United Kingdom
548516,22027,TEA PARTY BIRTHDAY CARD,1,3/31/2011 16:28,0.83,,United Kingdom
548516,22061,LARGE CAKE STAND  HANGING STRAWBERY,1,3/31/2011 16:28,20.79,,United Kingdom
548516,22079,RIBBON REEL HEARTS DESIGN ,1,3/31/2011 16:28,3.29,,United Kingdom
548516,22083,PAPER CHAIN KIT RETROSPOT,2,3/31/2011 16:28,5.79,,United Kingdom
548516,22087,PAPER BUNTING WHITE LACE,5,3/31/2011 16:28,5.79,,United Kingdom
548516,22090,PAPER BUNTING RETROSPOT,1,3/31/2011 16:28,5.79,,United Kingdom
548516,22091,EMPIRE TISSUE BOX,1,3/31/2011 16:28,2.46,,United Kingdom
548516,22102,MIRROR MOSAIC T-LIGHT HOLDER ,2,3/31/2011 16:28,3.29,,United Kingdom
548516,22133,PINK LOVE HEART SHAPE CUP,1,3/31/2011 16:28,1.63,,United Kingdom
548516,22156,HEART DECORATION WITH PEARLS ,1,3/31/2011 16:28,1.63,,United Kingdom
548516,22161,HEART DECORATION RUSTIC HANGING ,1,3/31/2011 16:28,0.79,,United Kingdom
548516,22183,CAKE STAND VICTORIAN FILIGREE MED,1,3/31/2011 16:28,5.79,,United Kingdom
548516,22192,BLUE DINER WALL CLOCK,1,3/31/2011 16:28,16.63,,United Kingdom
548516,22193,RED DINER WALL CLOCK,1,3/31/2011 16:28,16.63,,United Kingdom
548516,22195,LARGE HEART MEASURING SPOONS,1,3/31/2011 16:28,3.29,,United Kingdom
548516,22196,SMALL HEART MEASURING SPOONS,1,3/31/2011 16:28,1.63,,United Kingdom
548516,22211,WOOD STAMP SET FLOWERS,1,3/31/2011 16:28,3.29,,United Kingdom
548516,22227,HANGING HEART MIRROR DECORATION ,3,3/31/2011 16:28,1.25,,United Kingdom
548516,22250,DECORATION  BUTTERFLY  MAGIC GARDEN,1,3/31/2011 16:28,1.63,,United Kingdom
548516,22260,FELT EGG COSY BLUE RABBIT ,5,3/31/2011 16:28,1.63,,United Kingdom
548516,22262,FELT EGG COSY CHICKEN,5,3/31/2011 16:28,1.63,,United Kingdom
548516,22282,12 EGG HOUSE PAINTED WOOD,2,3/31/2011 16:28,24.96,,United Kingdom
548516,22283,6 EGG HOUSE PAINTED WOOD,1,3/31/2011 16:28,15.79,,United Kingdom
548516,22289,HANGING METAL CHICKEN DECORATION,1,3/31/2011 16:28,2.46,,United Kingdom
548516,22297,HEART IVORY TRELLIS SMALL,5,3/31/2011 16:28,2.46,,United Kingdom
548516,22309,TEA COSY RED  STRIPE,1,3/31/2011 16:28,4.96,,United Kingdom
548516,22318,FIVE HEART HANGING DECORATION,1,3/31/2011 16:28,5.79,,United Kingdom
548516,22322,BIRD DECORATION GREEN POLKADOT,3,3/31/2011 16:28,1.63,,United Kingdom
548516,22335,HEART DECORATION PAINTED ZINC ,1,3/31/2011 16:28,1.25,,United Kingdom
548516,22352,LUNCH BOX WITH CUTLERY RETROSPOT ,1,3/31/2011 16:28,4.96,,United Kingdom
548516,22364,GLASS JAR DIGESTIVE BISCUITS,2,3/31/2011 16:28,5.79,,United Kingdom
548516,22377,BOTTLE BAG RETROSPOT ,1,3/31/2011 16:28,4.13,,United Kingdom
548516,22378,WALL TIDY RETROSPOT ,1,3/31/2011 16:28,4.13,,United Kingdom
548516,22379,RECYCLING BAG RETROSPOT ,2,3/31/2011 16:28,4.13,,United Kingdom
548516,22413,METAL SIGN TAKE IT OR LEAVE IT ,2,3/31/2011 16:28,5.79,,United Kingdom
548516,22421,LIPSTICK PEN FUSCHIA,1,3/31/2011 16:28,0.83,,United Kingdom
548516,22423,REGENCY CAKESTAND 3 TIER,1,3/31/2011 16:28,24.96,,United Kingdom
548516,22427,ENAMEL FLOWER JUG CREAM,1,3/31/2011 16:28,11.63,,United Kingdom
548516,22469,HEART OF WICKER SMALL,1,3/31/2011 16:28,1.65,,United Kingdom
548516,22477,WATERING CAN GARDEN MARKER,1,3/31/2011 16:28,2.46,,United Kingdom
548516,22479,DAISY GARDEN MARKER,1,3/31/2011 16:28,2.46,,United Kingdom
548516,22487,WHITE WOOD GARDEN PLANT LADDER,1,3/31/2011 16:28,19.96,,United Kingdom
548516,22500,SET OF 2 TINS JARDIN DE PROVENCE,1,3/31/2011 16:28,10.79,,United Kingdom
548516,22501,PICNIC BASKET WICKER LARGE,1,3/31/2011 16:28,20.79,,United Kingdom
548516,22502,PICNIC BASKET WICKER SMALL,1,3/31/2011 16:28,10.79,,United Kingdom
548516,22585,PACK OF 6 BIRDY GIFT TAGS,1,3/31/2011 16:28,2.46,,United Kingdom
548516,22602,RETROSPOT WOODEN HEART DECORATION,2,3/31/2011 16:28,1.63,,United Kingdom
548516,22659,LUNCH BOX I LOVE LONDON,1,3/31/2011 16:28,4.13,,United Kingdom
548516,22697,GREEN REGENCY TEACUP AND SAUCER,1,3/31/2011 16:28,5.79,,United Kingdom
548516,22712,CARD DOLLY GIRL ,1,3/31/2011 16:28,0.83,,United Kingdom
548516,22714,CARD BIRTHDAY COWBOY,1,3/31/2011 16:28,0.83,,United Kingdom
548516,22718,CARD CAT AND TREE ,1,3/31/2011 16:28,0.83,,United Kingdom
548516,22721,SET OF 3 CAKE TINS SKETCHBOOK,1,3/31/2011 16:28,10.79,,United Kingdom
548516,22725,ALARM CLOCK BAKELIKE CHOCOLATE,2,3/31/2011 16:28,7.46,,United Kingdom
548516,22729,ALARM CLOCK BAKELIKE ORANGE,1,3/31/2011 16:28,7.46,,United Kingdom
548516,22740,POLKADOT PEN,2,3/31/2011 16:28,1.63,,United Kingdom
548516,22742,MAKE YOUR OWN PLAYTIME CARD KIT,1,3/31/2011 16:28,5.79,,United Kingdom
548516,22743,MAKE YOUR OWN FLOWERPOWER CARD KIT,1,3/31/2011 16:28,5.79,,United Kingdom
548516,22744,MAKE YOUR OWN MONSOON CARD KIT,1,3/31/2011 16:28,5.79,,United Kingdom
548516,22759,SET OF 3 NOTEBOOKS IN PARCEL,1,3/31/2011 16:28,3.29,,United Kingdom
548516,22770,MIRROR CORNICE,1,3/31/2011 16:28,29.17,,United Kingdom
548516,22786,CUSHION COVER PINK UNION JACK,3,3/31/2011 16:28,5.95,,United Kingdom
