541507,22202,MILK PAN PINK POLKADOT,1,1/18/2011 16:05,7.46,,United Kingdom
541507,22352,LUNCH BOX WITH CUTLERY RETROSPOT ,1,1/18/2011 16:05,4.96,,United Kingdom
541507,22385,JUMBO BAG SPACEBOY DESIGN,2,1/18/2011 16:05,4.96,,United Kingdom
541507,22664,TOY TIDY DOLLY GIRL DESIGN,1,1/18/2011 16:05,4.13,,United Kingdom
541508,15056bl,EDWARDIAN PARASOL BLACK,1,1/18/2011 16:06,12.46,,United Kingdom
541508,20681,PINK POLKADOT CHILDRENS UMBRELLA,1,1/18/2011 16:06,6.63,,United Kingdom
541508,21035,SET/2 RED RETROSPOT TEA TOWELS ,1,1/18/2011 16:06,5.79,,United Kingdom
541508,21042,RED RETROSPOT APRON ,1,1/18/2011 16:06,12.46,,United Kingdom
541508,21169,YOU'RE CONFUSING ME METAL SIGN ,2,1/18/2011 16:06,4.13,,United Kingdom
541508,21181,PLEASE ONE PERSON METAL SIGN,1,1/18/2011 16:06,4.13,,United Kingdom
541508,21188,3D HEARTS  HONEYCOMB PAPER GARLAND,1,1/18/2011 16:06,5.79,,United Kingdom
541508,21194,PINK  HONEYCOMB PAPER FAN,1,1/18/2011 16:06,4.13,,United Kingdom
541508,21195,PINK  HONEYCOMB PAPER BALL ,1,1/18/2011 16:06,4.13,,United Kingdom
541508,21216,"SET 3 RETROSPOT TEA,COFFEE,SUGAR",2,1/18/2011 16:06,10.79,,United Kingdom
541508,21218,RED SPOTTY BISCUIT TIN,1,1/18/2011 16:06,8.29,,United Kingdom
541508,21411,GINGHAM HEART  DOORSTOP RED,1,1/18/2011 16:06,8.29,,United Kingdom
541508,21557,SET OF 6 FUNKY BEAKERS,1,1/18/2011 16:06,5.63,,United Kingdom
541508,21558,SKULL LUNCH BOX WITH CUTLERY ,1,1/18/2011 16:06,4.96,,United Kingdom
541508,21658,GLASS  BEURRE DISH,2,1/18/2011 16:06,8.29,,United Kingdom
541508,21786,POLKADOT RAIN HAT ,2,1/18/2011 16:06,0.79,,United Kingdom
541508,21802,CHRISTMAS TREE HEART DECORATION,1,1/18/2011 16:06,0.83,,United Kingdom
541508,21803,CHRISTMAS TREE STAR DECORATION,1,1/18/2011 16:06,0.83,,United Kingdom
541508,21811,CHRISTMAS HANGING HEART WITH BELL,1,1/18/2011 16:06,2.46,,United Kingdom
541508,21875,KINGS CHOICE MUG,1,1/18/2011 16:06,3.29,,United Kingdom
541508,21928,JUMBO BAG SCANDINAVIAN PAISLEY,2,1/18/2011 16:06,4.96,,United Kingdom
541508,22037,ROBOT BIRTHDAY CARD,1,1/18/2011 16:06,0.83,,United Kingdom
541508,22041,"RECORD FRAME 7"" SINGLE SIZE ",3,1/18/2011 16:06,4.96,,United Kingdom
541508,22097,SWALLOW SQUARE TISSUE BOX,1,1/18/2011 16:06,2.46,,United Kingdom
541508,22156,HEART DECORATION WITH PEARLS ,1,1/18/2011 16:06,1.63,,United Kingdom
541508,22161,HEART DECORATION RUSTIC HANGING ,1,1/18/2011 16:06,1.63,,United Kingdom
541508,22171,3 HOOK PHOTO SHELF ANTIQUE WHITE,1,1/18/2011 16:06,16.63,,United Kingdom
541508,22173,METAL 4 HOOK HANGER FRENCH CHATEAU,1,1/18/2011 16:06,5.79,,United Kingdom
541508,22318,FIVE HEART HANGING DECORATION,1,1/18/2011 16:06,5.79,,United Kingdom
541508,22358,KINGS CHOICE TEA CADDY ,1,1/18/2011 16:06,5.79,,United Kingdom
541508,22361,GLASS JAR DAISY FRESH COTTON WOOL,1,1/18/2011 16:06,5.79,,United Kingdom
541508,22364,GLASS JAR DIGESTIVE BISCUITS,1,1/18/2011 16:06,5.79,,United Kingdom
541508,22383,LUNCH BAG SUKI  DESIGN ,3,1/18/2011 16:06,4.96,,United Kingdom
541508,22385,JUMBO BAG SPACEBOY DESIGN,1,1/18/2011 16:06,4.96,,United Kingdom
541508,22386,JUMBO BAG PINK POLKADOT,2,1/18/2011 16:06,4.96,,United Kingdom
541508,22456,NATURAL SLATE CHALKBOARD LARGE ,1,1/18/2011 16:06,9.96,,United Kingdom
541508,22493,PAINT YOUR OWN CANVAS SET,1,1/18/2011 16:06,3.29,,United Kingdom
541508,22518,CHILDS GARDEN BRUSH BLUE,1,1/18/2011 16:06,4.13,,United Kingdom
541508,22659,LUNCH BOX I LOVE LONDON,4,1/18/2011 16:06,2.46,,United Kingdom
541508,22666,RECIPE BOX PANTRY YELLOW DESIGN,1,1/18/2011 16:06,5.79,,United Kingdom
541508,22766,PHOTO FRAME CORNICE,1,1/18/2011 16:06,5.79,,United Kingdom
541508,22838,3 TIER CAKE TIN RED AND CREAM,1,1/18/2011 16:06,29.17,,United Kingdom
541508,22839,3 TIER CAKE TIN GREEN AND CREAM,1,1/18/2011 16:06,29.17,,United Kingdom
541508,22960,JAM MAKING SET WITH JARS,1,1/18/2011 16:06,8.29,,United Kingdom
541508,47566,PARTY BUNTING,2,1/18/2011 16:06,10.79,,United Kingdom
541508,47566b,TEA TIME PARTY BUNTING,1,1/18/2011 16:06,8.29,,United Kingdom
541508,48111,DOORMAT 3 SMILEY CATS,1,1/18/2011 16:06,14.13,,United Kingdom
541508,48138,DOORMAT UNION FLAG,1,1/18/2011 16:06,16.63,,United Kingdom
541508,48185,DOORMAT FAIRY CAKE,1,1/18/2011 16:06,16.63,,United Kingdom
541508,48194,DOORMAT HEARTS,1,1/18/2011 16:06,14.13,,United Kingdom
541508,72351a,SET/6 TURQUOISE BUTTERFLY T-LIGHTS,1,1/18/2011 16:06,4.13,,United Kingdom
541508,82583,HOT BATHS METAL SIGN,3,1/18/2011 16:06,4.13,,United Kingdom
541508,85099B,JUMBO BAG RED RETROSPOT,1,1/18/2011 16:06,4.13,,United Kingdom
541508,DOT,DOTCOM POSTAGE,1,1/18/2011 16:06,152.92,,United Kingdom
541509,21181,PLEASE ONE PERSON METAL SIGN,2,1/18/2011 16:31,2.1,13263,United Kingdom
541509,21903,MAN FLU METAL SIGN,2,1/18/2011 16:31,2.1,13263,United Kingdom
541509,21166,COOK WITH WINE METAL SIGN ,2,1/18/2011 16:31,1.95,13263,United Kingdom
541509,21169,YOU'RE CONFUSING ME METAL SIGN ,1,1/18/2011 16:31,1.69,13263,United Kingdom
541509,21174,POTTERING IN THE SHED METAL SIGN,2,1/18/2011 16:31,1.95,13263,United Kingdom
541509,82582,AREA PATROLLED METAL SIGN,1,1/18/2011 16:31,2.1,13263,United Kingdom
541509,85152,HAND OVER THE CHOCOLATE   SIGN ,2,1/18/2011 16:31,2.1,13263,United Kingdom
541509,21868,POTTING SHED TEA MUG,6,1/18/2011 16:31,1.25,13263,United Kingdom
541509,72741,GRAND CHOCOLATECANDLE,3,1/18/2011 16:31,1.45,13263,United Kingdom
541509,85123A,WHITE HANGING HEART T-LIGHT HOLDER,1,1/18/2011 16:31,2.95,13263,United Kingdom
541509,22804,CANDLEHOLDER PINK HANGING HEART,1,1/18/2011 16:31,2.95,13263,United Kingdom
541509,84050,PINK HEART SHAPE EGG FRYING PAN,1,1/18/2011 16:31,1.65,13263,United Kingdom
541509,85038,6 CHOCOLATE LOVE HEART T-LIGHTS,1,1/18/2011 16:31,2.1,13263,United Kingdom
541509,85230B,CINNAMON SCENTED VOTIVE CANDLE,3,1/18/2011 16:31,0.29,13263,United Kingdom
541509,22893,MINI CAKE STAND T-LIGHT HOLDER,4,1/18/2011 16:31,0.42,13263,United Kingdom
541509,22639,SET OF 4 NAPKIN CHARMS HEARTS,2,1/18/2011 16:31,2.55,13263,United Kingdom
541509,22647,CERAMIC LOVE HEART MONEY BANK,36,1/18/2011 16:31,0.42,13263,United Kingdom
541509,22469,HEART OF WICKER SMALL,1,1/18/2011 16:31,1.65,13263,United Kingdom
541509,22694,WICKER STAR ,1,1/18/2011 16:31,2.1,13263,United Kingdom
541509,21755,LOVE BUILDING BLOCK WORD,1,1/18/2011 16:31,5.95,13263,United Kingdom
541509,22499,WOODEN UNION JACK BUNTING,1,1/18/2011 16:31,5.95,13263,United Kingdom
541509,20914,SET/5 RED RETROSPOT LID GLASS BOWLS,1,1/18/2011 16:31,2.95,13263,United Kingdom
541509,22961,JAM MAKING SET PRINTED,2,1/18/2011 16:31,1.45,13263,United Kingdom
541509,85184C,S/4 VALENTINE DECOUPAGE HEART BOX,1,1/18/2011 16:31,2.95,13263,United Kingdom
541509,85231B,CINAMMON SET OF 9 T-LIGHTS,3,1/18/2011 16:31,0.85,13263,United Kingdom
541509,22212,FOUR HOOK  WHITE LOVEBIRDS,1,1/18/2011 16:31,2.1,13263,United Kingdom
541509,22930,BAKING MOULD HEART MILK CHOCOLATE,1,1/18/2011 16:31,2.55,13263,United Kingdom
541509,22311,OFFICE MUG WARMER BLACK+SILVER ,1,1/18/2011 16:31,2.95,13263,United Kingdom
541509,22720,SET OF 3 CAKE TINS PANTRY DESIGN ,1,1/18/2011 16:31,4.95,13263,United Kingdom
541509,22722,SET OF 6 SPICE TINS PANTRY DESIGN,1,1/18/2011 16:31,3.95,13263,United Kingdom
541509,22723,SET OF 6 HERB TINS SKETCHBOOK,1,1/18/2011 16:31,3.95,13263,United Kingdom
541509,22666,RECIPE BOX PANTRY YELLOW DESIGN,1,1/18/2011 16:31,2.95,13263,United Kingdom
541509,22667,RECIPE BOX RETROSPOT ,1,1/18/2011 16:31,2.95,13263,United Kingdom
541509,85036B,CHOCOLATE 1 WICK MORRIS BOX CANDLE,12,1/18/2011 16:31,1.25,13263,United Kingdom
541509,85053,FRENCH ENAMEL CANDLEHOLDER,1,1/18/2011 16:31,2.1,13263,United Kingdom
541509,22558,CLOTHES PEGS RETROSPOT PACK 24 ,1,1/18/2011 16:31,1.49,13263,United Kingdom
541509,21520,BOOZE & WOMEN GREETING CARD ,1,1/18/2011 16:31,0.42,13263,United Kingdom
541509,21518,BANK ACCOUNT  GREETING  CARD ,1,1/18/2011 16:31,0.42,13263,United Kingdom
541509,21519,GIN & TONIC DIET GREETING CARD ,1,1/18/2011 16:31,0.42,13263,United Kingdom
541510,21696,SMALL SILVER TRELLIS CANDLEPOT,4,1/18/2011 16:39,2.95,14428,United Kingdom
541510,22507,MEMO BOARD RETROSPOT  DESIGN,2,1/18/2011 16:39,4.95,14428,United Kingdom
541510,21609,SET 12 LAVENDER  BOTANICAL T-LIGHTS,2,1/18/2011 16:39,2.95,14428,United Kingdom
541510,84658,WHITE STITCHED CUSHION COVER,4,1/18/2011 16:39,6.95,14428,United Kingdom
541510,22776,SWEETHEART CAKESTAND 3 TIER,1,1/18/2011 16:39,9.95,14428,United Kingdom
541510,22457,NATURAL SLATE HEART CHALKBOARD ,3,1/18/2011 16:39,2.95,14428,United Kingdom
541510,21034,REX CASH+CARRY JUMBO SHOPPER,2,1/18/2011 16:39,0.95,14428,United Kingdom
541510,85053,FRENCH ENAMEL CANDLEHOLDER,1,1/18/2011 16:39,2.1,14428,United Kingdom
541510,22423,REGENCY CAKESTAND 3 TIER,1,1/18/2011 16:39,12.75,14428,United Kingdom
541510,85123A,WHITE HANGING HEART T-LIGHT HOLDER,2,1/18/2011 16:39,2.95,14428,United Kingdom
541510,21651,HANGING GLASS ETCHED TEALIGHT,4,1/18/2011 16:39,1.65,14428,United Kingdom
541510,85141,JARDIN ETCHED GLASS FRUITBOWL,1,1/18/2011 16:39,10.75,14428,United Kingdom
541510,22588,CARD HOLDER GINGHAM HEART,2,1/18/2011 16:39,2.55,14428,United Kingdom
541510,21714,CITRONELLA CANDLE GARDEN POT,6,1/18/2011 16:39,1.25,14428,United Kingdom
541510,22429,ENAMEL MEASURING JUG CREAM,1,1/18/2011 16:39,4.25,14428,United Kingdom
541510,84947,ANTIQUE SILVER TEA GLASS ENGRAVED,6,1/18/2011 16:39,1.25,14428,United Kingdom
541510,85144,JARDIN ETCHED GLASS CHEESE DISH,1,1/18/2011 16:39,7.25,14428,United Kingdom
541510,84978,HANGING HEART JAR T-LIGHT HOLDER,6,1/18/2011 16:39,1.25,14428,United Kingdom
541510,22840,ROUND CAKE TIN VINTAGE RED,1,1/18/2011 16:39,7.95,14428,United Kingdom
541510,21257,VICTORIAN SEWING BOX MEDIUM,2,1/18/2011 16:39,7.95,14428,United Kingdom
541510,22778,GLASS CLOCHE SMALL,1,1/18/2011 16:39,3.95,14428,United Kingdom
541510,22426,ENAMEL WASH BOWL CREAM,1,1/18/2011 16:39,3.75,14428,United Kingdom
541510,85059,FRENCH ENAMEL WATER BASIN,1,1/18/2011 16:39,3.75,14428,United Kingdom
541510,22839,3 TIER CAKE TIN GREEN AND CREAM,1,1/18/2011 16:39,14.95,14428,United Kingdom
541511,22113,GREY HEART HOT WATER BOTTLE,1,1/18/2011 16:45,3.75,17576,United Kingdom
541511,22113,GREY HEART HOT WATER BOTTLE,1,1/18/2011 16:45,3.75,17576,United Kingdom
541511,22261,FELT EGG COSY WHITE RABBIT ,1,1/18/2011 16:45,0.85,17576,United Kingdom
541511,22269,EGG CUP NATURAL CHICKEN,4,1/18/2011 16:45,1.25,17576,United Kingdom
541511,22228,BUNNY WOODEN PAINTED WITH BIRD ,4,1/18/2011 16:45,0.85,17576,United Kingdom
541511,22256,FELT FARM ANIMAL CHICKEN,4,1/18/2011 16:45,1.25,17576,United Kingdom
541511,22285,HANGING HEN ON NEST DECORATION,4,1/18/2011 16:45,1.65,17576,United Kingdom
541511,22266,EASTER DECORATION HANGING BUNNY,4,1/18/2011 16:45,0.65,17576,United Kingdom
541511,22284,HEN HOUSE DECORATION,4,1/18/2011 16:45,1.65,17576,United Kingdom
541511,85036B,CHOCOLATE 1 WICK MORRIS BOX CANDLE,6,1/18/2011 16:45,4.25,17576,United Kingdom
541511,35095A,BLUE VICTORIAN FABRIC OVAL BOX,1,1/18/2011 16:45,0.42,17576,United Kingdom
541511,21181,PLEASE ONE PERSON METAL SIGN,4,1/18/2011 16:45,2.1,17576,United Kingdom
541511,47566,PARTY BUNTING,4,1/18/2011 16:45,4.65,17576,United Kingdom
541511,21621,VINTAGE UNION JACK BUNTING,1,1/18/2011 16:45,8.5,17576,United Kingdom
541511,22113,GREY HEART HOT WATER BOTTLE,2,1/18/2011 16:45,3.75,17576,United Kingdom
541511,22588,CARD HOLDER GINGHAM HEART,4,1/18/2011 16:45,2.55,17576,United Kingdom
541511,22077,6 RIBBONS RUSTIC CHARM,2,1/18/2011 16:45,1.65,17576,United Kingdom
541511,20914,SET/5 RED RETROSPOT LID GLASS BOWLS,1,1/18/2011 16:45,2.95,17576,United Kingdom
541511,22720,SET OF 3 CAKE TINS PANTRY DESIGN ,1,1/18/2011 16:45,4.95,17576,United Kingdom
541511,21034,REX CASH+CARRY JUMBO SHOPPER,1,1/18/2011 16:45,0.95,17576,United Kingdom
541513,85036B,CHOCOLATE 1 WICK MORRIS BOX CANDLE,12,1/18/2011 16:52,1.25,17576,United Kingdom
C541512,85036B,CHOCOLATE 1 WICK MORRIS BOX CANDLE,-6,1/18/2011 16:52,4.25,17576,United Kingdom
541516,21220,SET/4 BADGES DOGS,3,1/18/2011 17:34,0.83,,United Kingdom
541516,22318,FIVE HEART HANGING DECORATION,1,1/18/2011 17:34,5.79,,United Kingdom
541516,47585A,PINK FAIRY CAKE CUSHION COVER,2,1/18/2011 17:34,4.13,,United Kingdom
541516,22322,BIRD DECORATION GREEN POLKADOT,6,1/18/2011 17:34,0.79,,United Kingdom
541516,22325,MOBILE VINTAGE HEARTS ,1,1/18/2011 17:34,3.29,,United Kingdom
541516,22345,PARTY PIZZA DISH BLUE POLKADOT,1,1/18/2011 17:34,0.42,,United Kingdom
541516,22355,CHARLOTTE BAG SUKI DESIGN,1,1/18/2011 17:34,1.63,,United Kingdom
541516,22358,KINGS CHOICE TEA CADDY ,1,1/18/2011 17:34,5.79,,United Kingdom
541516,22365,DOORMAT RESPECTABLE HOUSE,1,1/18/2011 17:34,14.13,,United Kingdom
541516,22374,AIRLINE BAG VINTAGE JET SET RED,1,1/18/2011 17:34,4.13,,United Kingdom
541516,22377,BOTTLE BAG RETROSPOT ,1,1/18/2011 17:34,1.63,,United Kingdom
541516,22379,RECYCLING BAG RETROSPOT ,1,1/18/2011 17:34,4.13,,United Kingdom
541516,22381,TOY TIDY PINK POLKADOT,2,1/18/2011 17:34,4.13,,United Kingdom
541516,22383,LUNCH BAG SUKI  DESIGN ,3,1/18/2011 17:34,4.13,,United Kingdom
541516,22386,JUMBO BAG PINK POLKADOT,2,1/18/2011 17:34,4.13,,United Kingdom
541516,84520B,PACK 20 ENGLISH ROSE PAPER NAPKINS,1,1/18/2011 17:34,1.63,,United Kingdom
541516,85071B,RED CHARLIE+LOLA PERSONAL DOORSIGN,1,1/18/2011 17:34,0.83,,United Kingdom
541516,90115,SUMMER BUTTERFLIES BAG CHARM,1,1/18/2011 17:34,2.46,,United Kingdom
541516,21221,SET/4 BADGES CUTE CREATURES,3,1/18/2011 17:34,0.83,,United Kingdom
541516,21232,STRAWBERRY CERAMIC TRINKET BOX,1,1/18/2011 17:34,2.46,,United Kingdom
541516,21259,VICTORIAN SEWING BOX SMALL ,1,1/18/2011 17:34,12.46,,United Kingdom
541516,21270,ANTIQUE CREAM CUTLERY CUPBOARD,1,1/18/2011 17:34,8.29,,United Kingdom
541516,21314,SMALL GLASS HEART TRINKET POT,1,1/18/2011 17:34,4.13,,United Kingdom
541516,21381,MINI WOODEN HAPPY BIRTHDAY GARLAND,2,1/18/2011 17:34,3.29,,United Kingdom
541516,21417,COCKLE SHELL DISH,2,1/18/2011 17:34,4.13,,United Kingdom
541516,21418,STARFISH SOAP DISH,2,1/18/2011 17:34,4.96,,United Kingdom
541516,21494,ROTATING LEAVES T-LIGHT HOLDER,1,1/18/2011 17:34,1.63,,United Kingdom
541516,21508,VINTAGE KID DOLLY CARD ,1,1/18/2011 17:34,0.83,,United Kingdom
541516,21518,BANK ACCOUNT  GREETING  CARD ,1,1/18/2011 17:34,0.42,,United Kingdom
541516,21535,RED RETROSPOT SMALL MILK JUG,1,1/18/2011 17:34,4.96,,United Kingdom
541516,21555,CERAMIC STRAWBERRY TRINKET TRAY,1,1/18/2011 17:34,2.46,,United Kingdom
541516,21556,CERAMIC STRAWBERRY MONEY BOX,1,1/18/2011 17:34,2.46,,United Kingdom
541516,21557,SET OF 6 FUNKY BEAKERS,1,1/18/2011 17:34,2.46,,United Kingdom
541516,21615,4 LAVENDER BOTANICAL DINNER CANDLES,1,1/18/2011 17:34,2.46,,United Kingdom
541516,21618,4 WILDFLOWER BOTANICAL CANDLES,1,1/18/2011 17:34,2.46,,United Kingdom
541516,21620,SET OF 4 ROSE BOTANICAL CANDLES,1,1/18/2011 17:34,2.46,,United Kingdom
541516,21632,VINTAGE PINK DECORATIVE PARASOL,1,1/18/2011 17:34,8.29,,United Kingdom
541516,21668,RED STRIPE CERAMIC DRAWER KNOB,1,1/18/2011 17:34,2.46,,United Kingdom
541516,21669,BLUE STRIPE CERAMIC DRAWER KNOB,2,1/18/2011 17:34,2.46,,United Kingdom
541516,21670,BLUE SPOT CERAMIC DRAWER KNOB,2,1/18/2011 17:34,2.46,,United Kingdom
541516,22403,MAGNETS PACK OF 4 VINTAGE LABELS ,2,1/18/2011 17:34,0.83,,United Kingdom
541516,22426,ENAMEL WASH BOWL CREAM,1,1/18/2011 17:34,7.46,,United Kingdom
541516,22445,PENCIL CASE LIFE IS BEAUTIFUL,1,1/18/2011 17:34,2.46,,United Kingdom
541516,22446,PIN CUSHION BABUSHKA PINK,4,1/18/2011 17:34,2.46,,United Kingdom
541516,22452,MEASURING TAPE BABUSHKA PINK,5,1/18/2011 17:34,1.63,,United Kingdom
541516,22453,MEASURING TAPE BABUSHKA BLUE,1,1/18/2011 17:34,1.63,,United Kingdom
541516,21671,RED SPOT CERAMIC DRAWER KNOB,1,1/18/2011 17:34,2.46,,United Kingdom
541516,22456,NATURAL SLATE CHALKBOARD LARGE ,3,1/18/2011 17:34,9.96,,United Kingdom
541516,21673,WHITE SPOT BLUE CERAMIC DRAWER KNOB,2,1/18/2011 17:34,2.46,,United Kingdom
541516,21675,BUTTERFLIES STICKERS,1,1/18/2011 17:34,0.79,,United Kingdom
541516,21677,HEARTS  STICKERS,1,1/18/2011 17:34,0.79,,United Kingdom
541516,21706,FOLDING UMBRELLA RED/WHITE POLKADOT,5,1/18/2011 17:34,3.29,,United Kingdom
541516,21773,DECORATIVE ROSE BATHROOM BOTTLE,4,1/18/2011 17:34,1.25,,United Kingdom
541516,21774,DECORATIVE CATS BATHROOM BOTTLE,1,1/18/2011 17:34,1.25,,United Kingdom
541516,21775,DECORATIVE FLORE BATHROOM BOTTLE,1,1/18/2011 17:34,1.25,,United Kingdom
541516,21801,CHRISTMAS TREE DECORATION WITH BELL,1,1/18/2011 17:34,0.42,,United Kingdom
541516,21802,CHRISTMAS TREE HEART DECORATION,1,1/18/2011 17:34,0.42,,United Kingdom
541516,21803,CHRISTMAS TREE STAR DECORATION,1,1/18/2011 17:34,0.42,,United Kingdom
541516,21832,CHOCOLATE CALCULATOR,2,1/18/2011 17:34,3.29,,United Kingdom
541516,21846,PINK DIAMANTE PEN IN GIFT BOX,1,1/18/2011 17:34,1.63,,United Kingdom
541516,21851,LILAC DIAMANTE PEN IN GIFT BOX,1,1/18/2011 17:34,1.63,,United Kingdom
541516,21873,IF YOU CAN'T STAND THE HEAT MUG,3,1/18/2011 17:34,1.63,,United Kingdom
541516,21879,HEARTS GIFT TAPE,2,1/18/2011 17:34,0.42,,United Kingdom
541516,21881,CUTE CATS TAPE,3,1/18/2011 17:34,0.42,,United Kingdom
541516,21882,SKULLS TAPE,3,1/18/2011 17:34,0.42,,United Kingdom
541516,21883,STARS GIFT TAPE ,4,1/18/2011 17:34,0.42,,United Kingdom
541516,21884,CAKES AND BOWS GIFT  TAPE,1,1/18/2011 17:34,0.42,,United Kingdom
541516,21900,"KEY FOB , SHED",1,1/18/2011 17:34,1.63,,United Kingdom
541516,21908,CHOCOLATE THIS WAY METAL SIGN,1,1/18/2011 17:34,4.13,,United Kingdom
541516,21928,JUMBO BAG SCANDINAVIAN PAISLEY,2,1/18/2011 17:34,4.13,,United Kingdom
541516,21931,JUMBO STORAGE BAG SUKI,2,1/18/2011 17:34,4.13,,United Kingdom
541516,21934,SKULL SHOULDER BAG,3,1/18/2011 17:34,1.63,,United Kingdom
541516,21850,BLUE  DIAMANTE PEN IN GIFT BOX,1,1/18/2011 17:34,1.63,,United Kingdom
541516,21935,SUKI  SHOULDER BAG,9,1/18/2011 17:34,1.63,,United Kingdom
541516,21947,SET OF 6 HEART CHOPSTICKS,1,1/18/2011 17:34,1.25,,United Kingdom
541516,21948,SET OF 6 CAKE CHOPSTICKS,1,1/18/2011 17:34,1.25,,United Kingdom
541516,21949,SET OF 6 STRAWBERRY CHOPSTICKS,1,1/18/2011 17:34,1.25,,United Kingdom
541516,21975,PACK OF 60 DINOSAUR CAKE CASES,1,1/18/2011 17:34,1.25,,United Kingdom
541516,21977,PACK OF 60 PINK PAISLEY CAKE CASES,1,1/18/2011 17:34,1.25,,United Kingdom
541516,21990,MODERN FLORAL STATIONERY SET,2,1/18/2011 17:34,2.46,,United Kingdom
541516,21991,BOHEMIAN COLLAGE STATIONERY SET,1,1/18/2011 17:34,2.46,,United Kingdom
541516,21992,VINTAGE PAISLEY STATIONERY SET,3,1/18/2011 17:34,2.46,,United Kingdom
541516,22035,VINTAGE CARAVAN GREETING CARD ,1,1/18/2011 17:34,0.83,,United Kingdom
541516,22070,SMALL RED RETROSPOT MUG IN BOX ,1,1/18/2011 17:34,3.29,,United Kingdom
541516,22071,SMALL WHITE RETROSPOT MUG IN BOX ,1,1/18/2011 17:34,3.29,,United Kingdom
541516,10125,MINI FUNKY DESIGN TAPES,1,1/18/2011 17:34,0.79,,United Kingdom
541516,10133,COLOURING PENCILS BROWN TUBE,6,1/18/2011 17:34,0.79,,United Kingdom
541516,10135,COLOURING PENCILS BROWN TUBE,7,1/18/2011 17:34,1.25,,United Kingdom
541516,17084N,FAIRY DREAMS INCENSE ,10,1/18/2011 17:34,0.42,,United Kingdom
541516,17129F,BLUE GLASS GEMS IN BAG,7,1/18/2011 17:34,1.63,,United Kingdom
541516,20622,VIPPASSPORT COVER ,1,1/18/2011 17:34,1.63,,United Kingdom
541516,20655,QUEEN OF SKIES LUGGAGE TAG,1,1/18/2011 17:34,0.83,,United Kingdom
541516,20669,RED HEART LUGGAGE TAG,5,1/18/2011 17:34,2.46,,United Kingdom
541516,20685,DOORMAT RED RETROSPOT,1,1/18/2011 17:34,14.13,,United Kingdom
541516,20696,FLORAL SOFT CAR TOY,1,1/18/2011 17:34,3.29,,United Kingdom
541516,20699,MOUSEY LONG LEGS SOFT TOY,1,1/18/2011 17:34,2.46,,United Kingdom
541516,20712,JUMBO BAG WOODLAND ANIMALS,10,1/18/2011 17:34,4.13,,United Kingdom
541516,20717,STRAWBERRY SHOPPER BAG,4,1/18/2011 17:34,0.83,,United Kingdom
541516,20735,BLACK MINI TAPE MEASURE ,1,1/18/2011 17:34,0.83,,United Kingdom
541516,20866,BLUE ROSE FABRIC MIRROR,1,1/18/2011 17:34,0.83,,United Kingdom
541516,20969,RED FLORAL FELTCRAFT SHOULDER BAG,1,1/18/2011 17:34,3.29,,United Kingdom
541516,21026,SPACE OWL,5,1/18/2011 17:34,0.83,,United Kingdom
541516,21027,NINJA RABBIT PINK,1,1/18/2011 17:34,0.83,,United Kingdom
541516,21028,NINJA RABBIT BLACK,1,1/18/2011 17:34,0.83,,United Kingdom
541516,21030,SPACE CADET RED,1,1/18/2011 17:34,0.83,,United Kingdom
541516,21033,JUMBO BAG CHARLIE AND LOLA TOYS,6,1/18/2011 17:34,2.46,,United Kingdom
541516,21043,APRON MODERN VINTAGE COTTON,1,1/18/2011 17:34,4.13,,United Kingdom
541516,21051,RIBBONS PURSE ,2,1/18/2011 17:34,1.63,,United Kingdom
541516,21063,PARTY INVITES JAZZ HEARTS,1,1/18/2011 17:34,1.63,,United Kingdom
541516,21109,LARGE CAKE TOWEL CHOCOLATE SPOTS,1,1/18/2011 17:34,4.13,,United Kingdom
541516,21110,LARGE CAKE TOWEL PINK SPOTS,3,1/18/2011 17:34,4.13,,United Kingdom
541516,21111,"SWISS ROLL TOWEL, CHOCOLATE  SPOTS",1,1/18/2011 17:34,2.46,,United Kingdom
541516,21161,KEEP OUT BOYS DOOR HANGER ,2,1/18/2011 17:34,3.29,,United Kingdom
541516,21163,DO NOT TOUCH MY STUFF DOOR HANGER ,6,1/18/2011 17:34,3.29,,United Kingdom
541516,21169,YOU'RE CONFUSING ME METAL SIGN ,1,1/18/2011 17:34,4.13,,United Kingdom
541516,21194,PINK  HONEYCOMB PAPER FAN,10,1/18/2011 17:34,1.63,,United Kingdom
541516,21195,PINK  HONEYCOMB PAPER BALL ,12,1/18/2011 17:34,1.63,,United Kingdom
541516,21212,PACK OF 72 RETROSPOT CAKE CASES,1,1/18/2011 17:34,1.25,,United Kingdom
541516,21217,RED RETROSPOT ROUND CAKE TINS,1,1/18/2011 17:34,20.79,,United Kingdom
541516,21219,SET/4 BADGES BALLOON GIRL,2,1/18/2011 17:34,0.83,,United Kingdom
541516,47591B,SCOTTIES CHILDRENS APRON,1,1/18/2011 17:34,1.63,,United Kingdom
541516,47594A,CAROUSEL DESIGN WASHBAG,1,1/18/2011 17:34,1.63,,United Kingdom
541516,47594B,SCOTTIES DESIGN WASHBAG,1,1/18/2011 17:34,1.63,,United Kingdom
541516,82552,WASHROOM METAL SIGN,1,1/18/2011 17:34,2.46,,United Kingdom
541516,82580,BATHROOM METAL SIGN,1,1/18/2011 17:34,1.25,,United Kingdom
541516,82583,HOT BATHS METAL SIGN,1,1/18/2011 17:34,4.13,,United Kingdom
541516,82600,NO SINGING METAL SIGN,1,1/18/2011 17:34,4.13,,United Kingdom
541516,82613B,"METAL SIGN,CUPCAKE SINGLE HOOK",2,1/18/2011 17:34,0.83,,United Kingdom
541516,84563A,PINK & WHITE BREAKFAST TRAY,1,1/18/2011 17:34,4.13,,United Kingdom
541516,84563B,BLUE & WHITE BREAKFAST TRAY,1,1/18/2011 17:34,4.13,,United Kingdom
541516,84569A,PACK 3 IRON ON DOG PATCHES,1,1/18/2011 17:34,0.83,,United Kingdom
541516,84569B,PACK 3 FIRE ENGINE/CAR PATCHES,1,1/18/2011 17:34,2.46,,United Kingdom
541516,84596B,SMALL DOLLY MIX DESIGN ORANGE BOWL,6,1/18/2011 17:34,0.83,,United Kingdom
541516,84596E,SMALL LICORICE DES PINK BOWL,2,1/18/2011 17:34,0.83,,United Kingdom
541516,84596F,SMALL MARSHMALLOWS PINK BOWL,2,1/18/2011 17:34,0.83,,United Kingdom
541516,84596L,BISCUITS SMALL BOWL LIGHT BLUE,2,1/18/2011 17:34,0.83,,United Kingdom
541516,84598,BOYS ALPHABET IRON ON PATCHES,14,1/18/2011 17:34,0.42,,United Kingdom
541516,84659A,WHITE TRAVEL ALARM CLOCK,3,1/18/2011 17:34,2.46,,United Kingdom
541516,84707A,SILVER JEWELLED MIRROR TRINKET TRAY,1,1/18/2011 17:34,5.79,,United Kingdom
541516,84748,FOLK FELT HANGING MULTICOL GARLAND,8,1/18/2011 17:34,2.46,,United Kingdom
541516,84912B,GREEN ROSE WASHBAG,1,1/18/2011 17:34,3.29,,United Kingdom
541516,84913B,MINT GREEN ROSE TOWEL,1,1/18/2011 17:34,3.29,,United Kingdom
541516,84931A,PINK SCOTTIE DOG W FLOWER PATTERN,2,1/18/2011 17:34,1.63,,United Kingdom
541516,84951A,SET OF 4 PISTACHIO LOVEBIRD COASTER,2,1/18/2011 17:34,1.63,,United Kingdom
541516,84951B,SET OF 4 BLACK LOVEBIRD COASTERS,1,1/18/2011 17:34,1.63,,United Kingdom
541516,22457,NATURAL SLATE HEART CHALKBOARD ,1,1/18/2011 17:34,5.79,,United Kingdom
541516,22469,HEART OF WICKER SMALL,4,1/18/2011 17:34,3.29,,United Kingdom
541516,22472,TV DINNER TRAY DOLLY GIRL,1,1/18/2011 17:34,10.79,,United Kingdom
541516,22474,SPACEBOY TV DINNER TRAY,1,1/18/2011 17:34,10.79,,United Kingdom
541516,22488,NATURAL SLATE RECTANGLE CHALKBOARD,4,1/18/2011 17:34,3.29,,United Kingdom
541516,22492,MINI PAINT SET VINTAGE ,2,1/18/2011 17:34,1.63,,United Kingdom
541516,22567,20 DOLLY PEGS RETROSPOT,2,1/18/2011 17:34,2.46,,United Kingdom
541516,22620,4 TRADITIONAL SPINNING TOPS,1,1/18/2011 17:34,2.46,,United Kingdom
541516,22628,PICNIC BOXES SET OF 3 RETROSPOT ,1,1/18/2011 17:34,4.13,,United Kingdom
541516,22630,DOLLY GIRL LUNCH BOX,1,1/18/2011 17:34,4.13,,United Kingdom
541516,22638,SET OF 4 NAPKIN CHARMS CROWNS ,3,1/18/2011 17:34,1.63,,United Kingdom
541516,22640,SET OF 4 NAPKIN CHARMS 3 KEYS ,4,1/18/2011 17:34,1.63,,United Kingdom
541516,22643,SET OF 4 NAPKIN CHARMS LEAVES   ,1,1/18/2011 17:34,1.63,,United Kingdom
541516,22679,FRENCH BLUE METAL DOOR SIGN 4,1,1/18/2011 17:34,2.46,,United Kingdom
541516,22072,RED RETROSPOT TEA CUP AND SAUCER ,1,1/18/2011 17:34,7.46,,United Kingdom
541516,22074,6 RIBBONS SHIMMERING PINKS ,8,1/18/2011 17:34,0.83,,United Kingdom
541516,22076,6 RIBBONS EMPIRE  ,1,1/18/2011 17:34,3.29,,United Kingdom
541516,22077,6 RIBBONS RUSTIC CHARM,1,1/18/2011 17:34,3.29,,United Kingdom
541516,22079,RIBBON REEL HEARTS DESIGN ,1,1/18/2011 17:34,3.29,,United Kingdom
541516,22083,PAPER CHAIN KIT RETROSPOT,1,1/18/2011 17:34,5.79,,United Kingdom
541516,22110,BIRD HOUSE HOT WATER BOTTLE,1,1/18/2011 17:34,3.29,,United Kingdom
541516,22111,SCOTTIE DOG HOT WATER BOTTLE,1,1/18/2011 17:34,10.79,,United Kingdom
541516,22681,FRENCH BLUE METAL DOOR SIGN 6,1,1/18/2011 17:34,2.46,,United Kingdom
541516,82613C,"METAL SIGN,CUPCAKE SINGLE HOOK",4,1/18/2011 17:34,0.83,,United Kingdom
541516,84952B,BLACK LOVE BIRD T-LIGHT HOLDER,2,1/18/2011 17:34,1.63,,United Kingdom
541516,85071C,"CHARLIE+LOLA""EXTREMELY BUSY"" SIGN",2,1/18/2011 17:34,0.83,,United Kingdom
541516,85087,CANDY SPOT CUSHION COVER,6,1/18/2011 17:34,3.29,,United Kingdom
541516,85094,CANDY SPOT EGG WARMER RABBIT,3,1/18/2011 17:34,0.83,,United Kingdom
541516,85131D,BEADED CRYSTAL HEART PINK ON STICK,1,1/18/2011 17:34,0.83,,United Kingdom
541516,85163A,WHITE BAROQUE WALL CLOCK ,1,1/18/2011 17:34,8.29,,United Kingdom
541516,85168B,BLACK BAROQUE CARRIAGE CLOCK,2,1/18/2011 17:34,8.29,,United Kingdom
