569519,22594,CHRISTMAS GINGHAM TREE,12,10/4/2011 14:31,0.85,13792,United Kingdom
569519,22593,CHRISTMAS GINGHAM STAR,12,10/4/2011 14:31,0.85,13792,United Kingdom
569520,22187,GREEN CHRISTMAS TREE CARD HOLDER,12,10/4/2011 14:32,1.95,17667,United Kingdom
569520,22144,CHRISTMAS CRAFT LITTLE FRIENDS,6,10/4/2011 14:32,2.1,17667,United Kingdom
569520,22142,CHRISTMAS CRAFT WHITE FAIRY ,12,10/4/2011 14:32,1.45,17667,United Kingdom
569520,23493,VINTAGE DOILY TRAVEL SEWING KIT,10,10/4/2011 14:32,1.95,17667,United Kingdom
569520,23203,JUMBO BAG VINTAGE DOILY ,10,10/4/2011 14:32,2.08,17667,United Kingdom
569520,23202,JUMBO BAG VINTAGE LEAF,10,10/4/2011 14:32,2.08,17667,United Kingdom
569520,85099B,JUMBO BAG RED RETROSPOT,10,10/4/2011 14:32,2.08,17667,United Kingdom
569520,20724,RED RETROSPOT CHARLOTTE BAG,10,10/4/2011 14:32,0.85,17667,United Kingdom
569520,23205,CHARLOTTE BAG VINTAGE ALPHABET ,10,10/4/2011 14:32,0.85,17667,United Kingdom
569520,22456,NATURAL SLATE CHALKBOARD LARGE ,3,10/4/2011 14:32,4.95,17667,United Kingdom
569520,20972,PINK CREAM FELT CRAFT TRINKET BOX ,12,10/4/2011 14:32,1.25,17667,United Kingdom
569520,22925,BLUE GIANT GARDEN THERMOMETER,2,10/4/2011 14:32,5.95,17667,United Kingdom
569520,22189,CREAM HEART CARD HOLDER,4,10/4/2011 14:32,3.95,17667,United Kingdom
569520,22960,JAM MAKING SET WITH JARS,6,10/4/2011 14:32,4.25,17667,United Kingdom
569520,22424,ENAMEL BREAD BIN CREAM,2,10/4/2011 14:32,12.75,17667,United Kingdom
569520,23298,SPOTTY BUNTING,3,10/4/2011 14:32,4.95,17667,United Kingdom
569520,21155,RED RETROSPOT PEG BAG,6,10/4/2011 14:32,2.55,17667,United Kingdom
569520,22795,SWEETHEART RECIPE BOOK STAND,2,10/4/2011 14:32,6.75,17667,United Kingdom
569521,47590A,BLUE HAPPY BIRTHDAY BUNTING,1,10/4/2011 14:33,5.45,16474,United Kingdom
569521,47590B,PINK HAPPY BIRTHDAY BUNTING,1,10/4/2011 14:33,5.45,16474,United Kingdom
569521,82486,3 DRAWER ANTIQUE WHITE WOOD CABINET,1,10/4/2011 14:33,8.95,16474,United Kingdom
569521,21755,LOVE BUILDING BLOCK WORD,2,10/4/2011 14:33,6.25,16474,United Kingdom
569521,84706F,RED PEONY TABLE CLOCK,2,10/4/2011 14:33,2.95,16474,United Kingdom
569521,81952V,ROUND PURPLE CLOCK WITH SUCKER,1,10/4/2011 14:33,0.19,16474,United Kingdom
569521,84912B,GREEN ROSE WASHBAG,1,10/4/2011 14:33,3.75,16474,United Kingdom
569521,21030,SPACE CADET RED,1,10/4/2011 14:33,1.25,16474,United Kingdom
569521,21172,PARTY METAL SIGN ,8,10/4/2011 14:33,1.45,16474,United Kingdom
569521,82552,WASHROOM METAL SIGN,3,10/4/2011 14:33,1.45,16474,United Kingdom
569521,21165,BEWARE OF THE CAT METAL SIGN ,3,10/4/2011 14:33,1.69,16474,United Kingdom
569521,21181,PLEASE ONE PERSON METAL SIGN,1,10/4/2011 14:33,2.1,16474,United Kingdom
569521,23188,VINTAGE  2 METER FOLDING RULER,1,10/4/2011 14:33,1.65,16474,United Kingdom
569521,47591D,PINK FAIRY CAKE CHILDRENS APRON,3,10/4/2011 14:33,1.95,16474,United Kingdom
569521,23197,SKETCHBOOK MAGNETIC SHOPPING LIST,2,10/4/2011 14:33,1.45,16474,United Kingdom
569521,23198,PANTRY MAGNETIC  SHOPPING LIST,2,10/4/2011 14:33,1.45,16474,United Kingdom
569521,21028,NINJA RABBIT BLACK,1,10/4/2011 14:33,1.25,16474,United Kingdom
569521,20984,12 PENCILS TALL TUBE POSY,3,10/4/2011 14:33,0.29,16474,United Kingdom
569521,21915,RED  HARMONICA IN BOX ,1,10/4/2011 14:33,1.25,16474,United Kingdom
569521,23506,MINI PLAYING CARDS SPACEBOY ,1,10/4/2011 14:33,0.42,16474,United Kingdom
569521,20986,BLUE CALCULATOR RULER,2,10/4/2011 14:33,1.25,16474,United Kingdom
569521,21163,DO NOT TOUCH MY STUFF DOOR HANGER ,1,10/4/2011 14:33,0.39,16474,United Kingdom
569521,22432,WATERING CAN PINK BUNNY,1,10/4/2011 14:33,1.95,16474,United Kingdom
569521,22086,PAPER CHAIN KIT 50'S CHRISTMAS ,1,10/4/2011 14:33,2.95,16474,United Kingdom
569521,22910,PAPER CHAIN KIT VINTAGE CHRISTMAS,1,10/4/2011 14:33,2.95,16474,United Kingdom
569521,21163,DO NOT TOUCH MY STUFF DOOR HANGER ,1,10/4/2011 14:33,0.39,16474,United Kingdom
569521,81952V,ROUND PURPLE CLOCK WITH SUCKER,1,10/4/2011 14:33,0.19,16474,United Kingdom
569521,20977,36 PENCILS TUBE WOODLAND,1,10/4/2011 14:33,1.25,16474,United Kingdom
569521,22950,36 DOILIES VINTAGE CHRISTMAS,1,10/4/2011 14:33,1.45,16474,United Kingdom
569521,23162,REGENCY TEA STRAINER,1,10/4/2011 14:33,3.75,16474,United Kingdom
569521,23147,SINGLE ANTIQUE ROSE HOOK IVORY,4,10/4/2011 14:33,1.45,16474,United Kingdom
569521,22952,60 CAKE CASES VINTAGE CHRISTMAS,1,10/4/2011 14:33,0.55,16474,United Kingdom
569521,20984,12 PENCILS TALL TUBE POSY,2,10/4/2011 14:33,0.29,16474,United Kingdom
569521,21327,SKULLS WRITING SET ,2,10/4/2011 14:33,1.65,16474,United Kingdom
569521,20977,36 PENCILS TUBE WOODLAND,1,10/4/2011 14:33,1.25,16474,United Kingdom
569521,22909,SET OF 20 VINTAGE CHRISTMAS NAPKINS,1,10/4/2011 14:33,0.85,16474,United Kingdom
569521,22142,CHRISTMAS CRAFT WHITE FAIRY ,2,10/4/2011 14:33,1.45,16474,United Kingdom
569521,23328,SET 6 SCHOOL MILK BOTTLES IN CRATE,4,10/4/2011 14:33,3.75,16474,United Kingdom
569521,21990,MODERN FLORAL STATIONERY SET,2,10/4/2011 14:33,1.25,16474,United Kingdom
569521,23328,SET 6 SCHOOL MILK BOTTLES IN CRATE,1,10/4/2011 14:33,3.75,16474,United Kingdom
569521,85066,CREAM SWEETHEART MINI CHEST,2,10/4/2011 14:33,12.75,16474,United Kingdom
569521,23320,GIANT 50'S CHRISTMAS CRACKER,4,10/4/2011 14:33,2.89,16474,United Kingdom
569521,82494L,WOODEN FRAME ANTIQUE WHITE ,6,10/4/2011 14:33,2.95,16474,United Kingdom
569521,23506,MINI PLAYING CARDS SPACEBOY ,1,10/4/2011 14:33,0.42,16474,United Kingdom
569521,23390,DOLLY GIRL MINI BACKPACK,1,10/4/2011 14:33,4.15,16474,United Kingdom
569521,21249,WOODLAND  HEIGHT CHART STICKERS ,2,10/4/2011 14:33,2.95,16474,United Kingdom
569521,21026,SPACE OWL,1,10/4/2011 14:33,1.25,16474,United Kingdom
569521,22173,METAL 4 HOOK HANGER FRENCH CHATEAU,1,10/4/2011 14:33,3.29,16474,United Kingdom
569521,16225,RATTLE SNAKE EGGS,1,10/4/2011 14:33,1.25,16474,United Kingdom
569521,23419,HOME SWEET HOME BOTTLE ,2,10/4/2011 14:33,2.08,16474,United Kingdom
569521,22749,FELTCRAFT PRINCESS CHARLOTTE DOLL,1,10/4/2011 14:33,3.75,16474,United Kingdom
569521,22570,FELTCRAFT CUSHION RABBIT,1,10/4/2011 14:33,3.75,16474,United Kingdom
569521,20970,PINK FLORAL FELTCRAFT SHOULDER BAG,1,10/4/2011 14:33,3.75,16474,United Kingdom
569521,22457,NATURAL SLATE HEART CHALKBOARD ,12,10/4/2011 14:33,2.95,16474,United Kingdom
569521,22456,NATURAL SLATE CHALKBOARD LARGE ,6,10/4/2011 14:33,4.95,16474,United Kingdom
569521,23300,GARDENERS KNEELING PAD CUP OF TEA ,4,10/4/2011 14:33,1.65,16474,United Kingdom
569521,23302,KNEELING MAT HOUSEWORK  DESIGN,2,10/4/2011 14:33,1.65,16474,United Kingdom
569521,23301,GARDENERS KNEELING PAD KEEP CALM ,2,10/4/2011 14:33,1.65,16474,United Kingdom
569521,20712,JUMBO BAG WOODLAND ANIMALS,1,10/4/2011 14:33,2.08,16474,United Kingdom
569521,21930,JUMBO STORAGE BAG SKULLS,1,10/4/2011 14:33,2.08,16474,United Kingdom
569521,22569,FELTCRAFT CUSHION BUTTERFLY,1,10/4/2011 14:33,3.75,16474,United Kingdom
569521,85152,HAND OVER THE CHOCOLATE   SIGN ,2,10/4/2011 14:33,2.1,16474,United Kingdom
569521,22432,WATERING CAN PINK BUNNY,1,10/4/2011 14:33,1.95,16474,United Kingdom
569521,23096,PETIT TRAY CHIC,1,10/4/2011 14:33,1.65,16474,United Kingdom
569521,23188,VINTAGE  2 METER FOLDING RULER,1,10/4/2011 14:33,1.65,16474,United Kingdom
569521,21163,DO NOT TOUCH MY STUFF DOOR HANGER ,1,10/4/2011 14:33,0.39,16474,United Kingdom
569521,22553,PLASTERS IN TIN SKULLS,1,10/4/2011 14:33,1.65,16474,United Kingdom
569521,21181,PLEASE ONE PERSON METAL SIGN,1,10/4/2011 14:33,2.1,16474,United Kingdom
569521,21908,CHOCOLATE THIS WAY METAL SIGN,1,10/4/2011 14:33,2.1,16474,United Kingdom
569521,23426,METAL SIGN DROP YOUR PANTS,1,10/4/2011 14:33,2.89,16474,United Kingdom
569521,21163,DO NOT TOUCH MY STUFF DOOR HANGER ,1,10/4/2011 14:33,0.39,16474,United Kingdom
569521,22801,ANTIQUE GLASS PEDESTAL BOWL,1,10/4/2011 14:33,3.75,16474,United Kingdom
569521,22141,CHRISTMAS CRAFT TREE TOP ANGEL,2,10/4/2011 14:33,2.1,16474,United Kingdom
569521,85104,SILVER GLASS T-LIGHT SET,4,10/4/2011 14:33,2.95,16474,United Kingdom
569521,85099B,JUMBO BAG RED RETROSPOT,3,10/4/2011 14:33,2.08,16474,United Kingdom
569521,22386,JUMBO BAG PINK POLKADOT,3,10/4/2011 14:33,2.08,16474,United Kingdom
569521,20712,JUMBO BAG WOODLAND ANIMALS,2,10/4/2011 14:33,2.08,16474,United Kingdom
569521,21264,WHITE GOOSE FEATHER TREE 60CM ,4,10/4/2011 14:33,1.95,16474,United Kingdom
569521,16225,RATTLE SNAKE EGGS,1,10/4/2011 14:33,1.25,16474,United Kingdom
569521,23081,GREEN METAL BOX ARMY SUPPLIES,1,10/4/2011 14:33,8.25,16474,United Kingdom
569521,23080,RED METAL BOX TOP SECRET,1,10/4/2011 14:33,8.25,16474,United Kingdom
569521,22555,PLASTERS IN TIN STRONGMAN,1,10/4/2011 14:33,1.65,16474,United Kingdom
569521,21026,SPACE OWL,1,10/4/2011 14:33,1.25,16474,United Kingdom
569521,22633,HAND WARMER UNION JACK,4,10/4/2011 14:33,2.1,16474,United Kingdom
569521,21914,BLUE HARMONICA IN BOX ,1,10/4/2011 14:33,1.25,16474,United Kingdom
569521,21671,RED SPOT CERAMIC DRAWER KNOB,6,10/4/2011 14:33,1.45,16474,United Kingdom
569521,23034,DRAWER KNOB CERAMIC BLACK,6,10/4/2011 14:33,1.45,16474,United Kingdom
569521,23026,DRAWER KNOB VINTAGE GLASS STAR,6,10/4/2011 14:33,2.08,16474,United Kingdom
569521,23035,DRAWER KNOB CERAMIC IVORY,6,10/4/2011 14:33,1.45,16474,United Kingdom
569521,22433,WATERING CAN GREEN DINOSAUR,1,10/4/2011 14:33,1.95,16474,United Kingdom
569521,22457,NATURAL SLATE HEART CHALKBOARD ,12,10/4/2011 14:33,2.95,16474,United Kingdom
569521,22866,HAND WARMER SCOTTY DOG DESIGN,24,10/4/2011 14:33,2.1,16474,United Kingdom
569521,22867,HAND WARMER BIRD DESIGN,24,10/4/2011 14:33,2.1,16474,United Kingdom
569522,84997D,CHILDRENS CUTLERY POLKADOT PINK,72,10/4/2011 14:41,3.75,12664,Finland
569522,POST,POSTAGE,1,10/4/2011 14:41,40,12664,Finland
569523,22366,DOORMAT AIRMAIL ,1,10/4/2011 14:41,8.25,16033,United Kingdom
569523,48129,DOORMAT TOPIARY,1,10/4/2011 14:41,8.25,16033,United Kingdom
569523,48188,DOORMAT WELCOME PUPPIES,1,10/4/2011 14:41,8.25,16033,United Kingdom
569523,48111,DOORMAT 3 SMILEY CATS,1,10/4/2011 14:41,8.25,16033,United Kingdom
569523,23526,WALL ART DOG LICENCE ,2,10/4/2011 14:41,5.95,16033,United Kingdom
569523,23535,WALL ART BICYCLE SAFTEY ,1,10/4/2011 14:41,5.95,16033,United Kingdom
569523,23533,WALL ART GARDEN HAVEN ,1,10/4/2011 14:41,5.95,16033,United Kingdom
569523,23536,WALL ART VILLAGE SHOW ,1,10/4/2011 14:41,5.95,16033,United Kingdom
569523,23524,WALL ART HORSE & PONY ,1,10/4/2011 14:41,3.75,16033,United Kingdom
569523,23525,WALL ART BUFFALO BILL ,1,10/4/2011 14:41,3.75,16033,United Kingdom
569523,23527,WALL ART ANIMALS AND NATURE ,1,10/4/2011 14:41,3.75,16033,United Kingdom
569523,21340,CLASSIC METAL BIRDCAGE PLANT HOLDER,1,10/4/2011 14:41,12.75,16033,United Kingdom
569523,22637,PIGGY BANK RETROSPOT ,6,10/4/2011 14:41,2.55,16033,United Kingdom
569523,22645,CERAMIC HEART FAIRY CAKE MONEY BANK,4,10/4/2011 14:41,1.45,16033,United Kingdom
569523,22646,CERAMIC STRAWBERRY CAKE MONEY BANK,4,10/4/2011 14:41,1.45,16033,United Kingdom
569523,23296,SET OF 6 TEA TIME BAKING CASES,4,10/4/2011 14:41,1.25,16033,United Kingdom
569523,23295,SET OF 12 MINI LOAF BAKING CASES,8,10/4/2011 14:41,0.83,16033,United Kingdom
569523,23293,SET OF 12 FAIRY CAKE BAKING CASES,8,10/4/2011 14:41,0.83,16033,United Kingdom
569523,23152,IVORY SWEETHEART WIRE LETTER RACK ,2,10/4/2011 14:41,3.75,16033,United Kingdom
569523,22634,CHILDS BREAKFAST SET SPACEBOY ,1,10/4/2011 14:41,9.95,16033,United Kingdom
569523,84879,ASSORTED COLOUR BIRD ORNAMENT,8,10/4/2011 14:41,1.69,16033,United Kingdom
569523,23419,HOME SWEET HOME BOTTLE ,2,10/4/2011 14:41,2.08,16033,United Kingdom
569523,22112,CHOCOLATE HOT WATER BOTTLE,1,10/4/2011 14:41,4.95,16033,United Kingdom
569523,22835,HOT WATER BOTTLE I AM SO POORLY,1,10/4/2011 14:41,4.95,16033,United Kingdom
569523,21481,FAWN BLUE HOT WATER BOTTLE,1,10/4/2011 14:41,3.75,16033,United Kingdom
569523,22114,HOT WATER BOTTLE TEA AND SYMPATHY,2,10/4/2011 14:41,4.25,16033,United Kingdom
569523,23321,SMALL WHITE HEART OF WICKER,2,10/4/2011 14:41,1.65,16033,United Kingdom
569523,23517,EMBROIDERED RIBBON REEL REBECCA ,1,10/4/2011 14:41,2.89,16033,United Kingdom
569523,23511,EMBROIDERED RIBBON REEL EMILY ,1,10/4/2011 14:41,2.08,16033,United Kingdom
569523,23512,EMBROIDERED RIBBON REEL ROSIE,1,10/4/2011 14:41,2.08,16033,United Kingdom
569523,23513,EMBROIDERED RIBBON REEL SUSIE ,1,10/4/2011 14:41,2.08,16033,United Kingdom
569523,22078,RIBBON REEL LACE DESIGN ,1,10/4/2011 14:41,2.1,16033,United Kingdom
569523,21787,RAIN PONCHO RETROSPOT,2,10/4/2011 14:41,0.85,16033,United Kingdom
569523,21786,POLKADOT RAIN HAT ,4,10/4/2011 14:41,0.42,16033,United Kingdom
569523,22652,TRAVEL SEWING KIT,2,10/4/2011 14:41,1.65,16033,United Kingdom
569523,23263,SET OF 3 WOODEN HEART DECORATIONS,2,10/4/2011 14:41,1.25,16033,United Kingdom
569523,23096,PETIT TRAY CHIC,2,10/4/2011 14:41,1.65,16033,United Kingdom
569523,22670,FRENCH WC SIGN BLUE METAL,5,10/4/2011 14:41,1.25,16033,United Kingdom
569523,21899,GARAGE KEY FOB,2,10/4/2011 14:41,0.65,16033,United Kingdom
569523,21900,"KEY FOB , SHED",2,10/4/2011 14:41,0.65,16033,United Kingdom
569523,21902,"KEY FOB , FRONT  DOOR ",2,10/4/2011 14:41,0.65,16033,United Kingdom
569523,21901,"KEY FOB , BACK DOOR ",2,10/4/2011 14:41,0.65,16033,United Kingdom
569523,23138,SINGLE WIRE HOOK IVORY HEART,2,10/4/2011 14:41,1.45,16033,United Kingdom
569523,22720,SET OF 3 CAKE TINS PANTRY DESIGN ,2,10/4/2011 14:41,4.95,16033,United Kingdom
569523,23029,DRAWER KNOB CRACKLE GLAZE GREEN,5,10/4/2011 14:41,1.65,16033,United Kingdom
569523,21683,MEDIUM MEDINA STAMPED METAL BOWL ,2,10/4/2011 14:41,2.95,16033,United Kingdom
569523,22292,HANGING CHICK  YELLOW DECORATION,3,10/4/2011 14:41,1.45,16033,United Kingdom
569523,22293,HANGING CHICK GREEN DECORATION,3,10/4/2011 14:41,1.45,16033,United Kingdom
569523,21166,COOK WITH WINE METAL SIGN ,1,10/4/2011 14:41,2.08,16033,United Kingdom
569523,22722,SET OF 6 SPICE TINS PANTRY DESIGN,2,10/4/2011 14:41,3.95,16033,United Kingdom
569523,22361,GLASS JAR DAISY FRESH COTTON WOOL,2,10/4/2011 14:41,2.95,16033,United Kingdom
569523,84880,WHITE WIRE EGG HOLDER,1,10/4/2011 14:41,7.5,16033,United Kingdom
569523,21906,PHARMACIE FIRST AID TIN,1,10/4/2011 14:41,6.75,16033,United Kingdom
569523,22795,SWEETHEART RECIPE BOOK STAND,1,10/4/2011 14:41,6.75,16033,United Kingdom
569523,23065,LARGE DECO JEWELLERY STAND,1,10/4/2011 14:41,12.5,16033,United Kingdom
569523,21166,COOK WITH WINE METAL SIGN ,1,10/4/2011 14:41,2.08,16033,United Kingdom
569523,23066,SMALL DECO JEWELLERY STAND,1,10/4/2011 14:41,8.25,16033,United Kingdom
569523,21668,RED STRIPE CERAMIC DRAWER KNOB,4,10/4/2011 14:41,1.45,16033,United Kingdom
569523,21670,BLUE SPOT CERAMIC DRAWER KNOB,4,10/4/2011 14:41,1.45,16033,United Kingdom
569523,21671,RED SPOT CERAMIC DRAWER KNOB,4,10/4/2011 14:41,1.45,16033,United Kingdom
569523,21669,BLUE STRIPE CERAMIC DRAWER KNOB,4,10/4/2011 14:41,1.45,16033,United Kingdom
569523,22845,VINTAGE CREAM CAT FOOD CONTAINER,1,10/4/2011 14:41,6.35,16033,United Kingdom
569523,23012,GLASS APOTHECARY BOTTLE PERFUME,1,10/4/2011 14:41,3.95,16033,United Kingdom
569523,23013,GLASS APOTHECARY BOTTLE TONIC,2,10/4/2011 14:41,3.95,16033,United Kingdom
569523,23014,GLASS APOTHECARY BOTTLE ELIXIR,1,10/4/2011 14:41,3.95,16033,United Kingdom
569524,23493,VINTAGE DOILY TRAVEL SEWING KIT,4,10/4/2011 14:42,1.95,14506,United Kingdom
569524,48129,DOORMAT TOPIARY,2,10/4/2011 14:42,8.25,14506,United Kingdom
569524,48184,DOORMAT ENGLISH ROSE ,4,10/4/2011 14:42,8.25,14506,United Kingdom
569524,48111,DOORMAT 3 SMILEY CATS,2,10/4/2011 14:42,8.25,14506,United Kingdom
569524,48173C,DOORMAT BLACK FLOCK ,2,10/4/2011 14:42,8.25,14506,United Kingdom
569524,21524,DOORMAT SPOTTY HOME SWEET HOME,1,10/4/2011 14:42,8.25,14506,United Kingdom
569524,48116,DOORMAT MULTICOLOUR STRIPE,1,10/4/2011 14:42,8.25,14506,United Kingdom
569524,48138,DOORMAT UNION FLAG,3,10/4/2011 14:42,8.25,14506,United Kingdom
569524,23284,DOORMAT KEEP CALM AND COME IN,2,10/4/2011 14:42,8.25,14506,United Kingdom
569524,20685,DOORMAT RED RETROSPOT,2,10/4/2011 14:42,8.25,14506,United Kingdom
569524,48188,DOORMAT WELCOME PUPPIES,2,10/4/2011 14:42,8.25,14506,United Kingdom
569524,48187,DOORMAT NEW ENGLAND,2,10/4/2011 14:42,8.25,14506,United Kingdom
569524,22692,DOORMAT WELCOME TO OUR HOME,1,10/4/2011 14:42,8.25,14506,United Kingdom
569524,22653,BUTTON BOX ,4,10/4/2011 14:42,1.95,14506,United Kingdom
569524,23118,PARISIENNE JEWELLERY DRAWER ,1,10/4/2011 14:42,7.5,14506,United Kingdom
569524,20733,GOLD MINI TAPE MEASURE ,8,10/4/2011 14:42,0.85,14506,United Kingdom
569524,23494,VINTAGE DOILY DELUXE SEWING KIT ,4,10/4/2011 14:42,5.95,14506,United Kingdom
569524,22147,FELTCRAFT BUTTERFLY HEARTS,1,10/4/2011 14:42,1.45,14506,United Kingdom
569524,22169,FAMILY ALBUM WHITE PICTURE FRAME,1,10/4/2011 14:42,8.5,14506,United Kingdom
569524,22507,MEMO BOARD RETROSPOT  DESIGN,2,10/4/2011 14:42,4.95,14506,United Kingdom
569524,23203,JUMBO BAG VINTAGE DOILY ,2,10/4/2011 14:42,2.08,14506,United Kingdom
569524,22170,PICTURE FRAME WOOD TRIPLE PORTRAIT,2,10/4/2011 14:42,6.75,14506,United Kingdom
569524,22825,DECORATIVE PLANT POT WITH FRIEZE,2,10/4/2011 14:42,7.95,14506,United Kingdom
569524,22751,FELTCRAFT PRINCESS OLIVIA DOLL,1,10/4/2011 14:42,3.75,14506,United Kingdom
569524,85014A,BLACK/BLUE POLKADOT UMBRELLA,2,10/4/2011 14:42,5.95,14506,United Kingdom
569524,85014B,RED RETROSPOT UMBRELLA,2,10/4/2011 14:42,5.95,14506,United Kingdom
569524,85054,FRENCH ENAMEL POT W LID,1,10/4/2011 14:42,2.95,14506,United Kingdom
569524,20972,PINK CREAM FELT CRAFT TRINKET BOX ,1,10/4/2011 14:42,1.25,14506,United Kingdom
569524,22981,PANTRY APPLE CORER,1,10/4/2011 14:42,1.45,14506,United Kingdom
569524,23399,HOME SWEET HOME HANGING HEART,1,10/4/2011 14:42,0.85,14506,United Kingdom
569524,23427,STOOL HOME SWEET HOME ,1,10/4/2011 14:42,12.5,14506,United Kingdom
569524,22297,HEART IVORY TRELLIS SMALL,1,10/4/2011 14:42,1.25,14506,United Kingdom
569524,23398,HANGING HEART BONHEUR,1,10/4/2011 14:42,0.85,14506,United Kingdom
569524,23493,VINTAGE DOILY TRAVEL SEWING KIT,1,10/4/2011 14:42,1.95,14506,United Kingdom
569524,22297,HEART IVORY TRELLIS SMALL,1,10/4/2011 14:42,1.25,14506,United Kingdom
569524,22296,HEART IVORY TRELLIS LARGE,1,10/4/2011 14:42,1.65,14506,United Kingdom
569524,23409,PHOTO FRAME LINEN AND LACE LARGE,1,10/4/2011 14:42,3.75,14506,United Kingdom
569524,23408,PHOTO FRAME LINEN AND LACE SMALL,2,10/4/2011 14:42,2.08,14506,United Kingdom
569524,22077,6 RIBBONS RUSTIC CHARM,5,10/4/2011 14:42,1.95,14506,United Kingdom
569524,22082,RIBBON REEL STRIPES DESIGN ,3,10/4/2011 14:42,1.65,14506,United Kingdom
569524,22080,RIBBON REEL POLKADOTS ,3,10/4/2011 14:42,1.65,14506,United Kingdom
569524,85185B,PINK HORSE SOCK PUPPET KIT,2,10/4/2011 14:42,2.95,14506,United Kingdom
569524,21670,BLUE SPOT CERAMIC DRAWER KNOB,1,10/4/2011 14:42,1.45,14506,United Kingdom
569524,20972,PINK CREAM FELT CRAFT TRINKET BOX ,2,10/4/2011 14:42,1.25,14506,United Kingdom
569524,20969,RED FLORAL FELTCRAFT SHOULDER BAG,1,10/4/2011 14:42,3.75,14506,United Kingdom
569524,20970,PINK FLORAL FELTCRAFT SHOULDER BAG,1,10/4/2011 14:42,3.75,14506,United Kingdom
569524,22940,FELTCRAFT CHRISTMAS FAIRY,1,10/4/2011 14:42,4.25,14506,United Kingdom
569524,22149,FELTCRAFT 6 FLOWER FRIENDS,2,10/4/2011 14:42,2.1,14506,United Kingdom
569524,22750,FELTCRAFT PRINCESS LOLA DOLL,1,10/4/2011 14:42,3.75,14506,United Kingdom
569524,22749,FELTCRAFT PRINCESS CHARLOTTE DOLL,1,10/4/2011 14:42,3.75,14506,United Kingdom
569524,23127,FELTCRAFT GIRL NICOLE KIT,1,10/4/2011 14:42,4.95,14506,United Kingdom
569524,23126,FELTCRAFT GIRL AMELIE KIT,1,10/4/2011 14:42,4.95,14506,United Kingdom
569524,21669,BLUE STRIPE CERAMIC DRAWER KNOB,1,10/4/2011 14:42,1.45,14506,United Kingdom
569524,22150,3 STRIPEY MICE FELTCRAFT,2,10/4/2011 14:42,1.95,14506,United Kingdom
569524,22568,FELTCRAFT CUSHION OWL,1,10/4/2011 14:42,3.75,14506,United Kingdom
569524,22570,FELTCRAFT CUSHION RABBIT,1,10/4/2011 14:42,3.75,14506,United Kingdom
569524,22569,FELTCRAFT CUSHION BUTTERFLY,1,10/4/2011 14:42,3.75,14506,United Kingdom
569524,22800,ANTIQUE TALL SWIRLGLASS TRINKET POT,1,10/4/2011 14:42,3.75,14506,United Kingdom
569524,22722,SET OF 6 SPICE TINS PANTRY DESIGN,1,10/4/2011 14:42,3.95,14506,United Kingdom
569524,85184C,SET 4 VALENTINE DECOUPAGE HEART BOX,2,10/4/2011 14:42,2.95,14506,United Kingdom
569524,22798,ANTIQUE GLASS DRESSING TABLE POT,1,10/4/2011 14:42,2.95,14506,United Kingdom
569524,23209,LUNCH BAG VINTAGE DOILY ,1,10/4/2011 14:42,1.65,14506,United Kingdom
569524,20728,LUNCH BAG CARS BLUE,1,10/4/2011 14:42,1.65,14506,United Kingdom
569524,22801,ANTIQUE GLASS PEDESTAL BOWL,1,10/4/2011 14:42,3.75,14506,United Kingdom
569524,22078,RIBBON REEL LACE DESIGN ,2,10/4/2011 14:42,2.1,14506,United Kingdom
569524,22697,GREEN REGENCY TEACUP AND SAUCER,1,10/4/2011 14:42,2.95,14506,United Kingdom
569524,21673,WHITE SPOT BLUE CERAMIC DRAWER KNOB,1,10/4/2011 14:42,1.45,14506,United Kingdom
569524,21672,WHITE SPOT RED CERAMIC DRAWER KNOB,1,10/4/2011 14:42,1.45,14506,United Kingdom
569524,23236,STORAGE TIN VINTAGE DOILY ,2,10/4/2011 14:42,2.89,14506,United Kingdom
569524,22794,SWEETHEART WIRE MAGAZINE RACK,1,10/4/2011 14:42,7.95,14506,United Kingdom
569524,23431,NATURAL HANGING QUILTED HEARTS ,6,10/4/2011 14:42,0.83,14506,United Kingdom
569524,23240,SET OF 4 KNICK KNACK TINS DOILY ,2,10/4/2011 14:42,4.15,14506,United Kingdom
569524,22979,PANTRY WASHING UP BRUSH,1,10/4/2011 14:42,1.45,14506,United Kingdom
569524,22980,PANTRY SCRUBBING BRUSH,1,10/4/2011 14:42,1.65,14506,United Kingdom
569524,22722,SET OF 6 SPICE TINS PANTRY DESIGN,1,10/4/2011 14:42,3.95,14506,United Kingdom
569524,22796,PHOTO FRAME 3 CLASSIC HANGING,1,10/4/2011 14:42,9.95,14506,United Kingdom
569524,22766,PHOTO FRAME CORNICE,3,10/4/2011 14:42,2.95,14506,United Kingdom
569524,23211,RED ROCKING HORSE HAND PAINTED,1,10/4/2011 14:42,1.25,14506,United Kingdom
569524,23219,LAUREL STAR ANTIQUE SILVER ,1,10/4/2011 14:42,1.25,14506,United Kingdom
569524,23213,STAR WREATH DECORATION WITH BELL,1,10/4/2011 14:42,1.25,14506,United Kingdom
569524,23211,RED ROCKING HORSE HAND PAINTED,1,10/4/2011 14:42,1.25,14506,United Kingdom
569524,23210,WHITE ROCKING HORSE HAND PAINTED,2,10/4/2011 14:42,1.25,14506,United Kingdom
569524,21824,PAINTED METAL STAR WITH HOLLY BELLS,1,10/4/2011 14:42,0.39,14506,United Kingdom
569524,21823,PAINTED METAL HEART WITH HOLLY BELL,1,10/4/2011 14:42,0.39,14506,United Kingdom
569524,22770,MIRROR CORNICE,1,10/4/2011 14:42,14.95,14506,United Kingdom
569524,23171,REGENCY TEA PLATE GREEN ,2,10/4/2011 14:42,1.65,14506,United Kingdom
569524,23170,REGENCY TEA PLATE ROSES ,2,10/4/2011 14:42,1.65,14506,United Kingdom
569524,23172,REGENCY TEA PLATE PINK,2,10/4/2011 14:42,1.65,14506,United Kingdom
569524,23511,EMBROIDERED RIBBON REEL EMILY ,1,10/4/2011 14:42,2.08,14506,United Kingdom
569524,23091,ZINC HERB GARDEN CONTAINER,1,10/4/2011 14:42,6.25,14506,United Kingdom
569524,23165,LARGE CERAMIC TOP STORAGE JAR,2,10/4/2011 14:42,1.65,14506,United Kingdom
569524,23101,SILVER STARS TABLE DECORATION,1,10/4/2011 14:42,0.83,14506,United Kingdom
569524,22738,RIBBON REEL SNOWY VILLAGE,2,10/4/2011 14:42,1.65,14506,United Kingdom
569524,22739,RIBBON REEL CHRISTMAS SOCK BAUBLE,2,10/4/2011 14:42,1.65,14506,United Kingdom
569524,22737,RIBBON REEL CHRISTMAS PRESENT ,2,10/4/2011 14:42,1.65,14506,United Kingdom
569524,23101,SILVER STARS TABLE DECORATION,1,10/4/2011 14:42,0.83,14506,United Kingdom
569524,23515,EMBROIDERED RIBBON REEL DAISY ,1,10/4/2011 14:42,2.08,14506,United Kingdom
569524,23511,EMBROIDERED RIBBON REEL EMILY ,1,10/4/2011 14:42,2.08,14506,United Kingdom
569524,23512,EMBROIDERED RIBBON REEL ROSIE,1,10/4/2011 14:42,2.08,14506,United Kingdom
569524,23513,EMBROIDERED RIBBON REEL SUSIE ,1,10/4/2011 14:42,2.08,14506,United Kingdom
569524,23518,EMBROIDERED RIBBON REEL RACHEL ,1,10/4/2011 14:42,2.89,14506,United Kingdom
569524,23511,EMBROIDERED RIBBON REEL EMILY ,2,10/4/2011 14:42,2.08,14506,United Kingdom
569524,23101,SILVER STARS TABLE DECORATION,1,10/4/2011 14:42,0.83,14506,United Kingdom
569524,23100,SILVER BELLS TABLE DECORATION,2,10/4/2011 14:42,1.25,14506,United Kingdom
569524,23517,EMBROIDERED RIBBON REEL REBECCA ,1,10/4/2011 14:42,2.89,14506,United Kingdom
569524,22699,ROSES REGENCY TEACUP AND SAUCER ,1,10/4/2011 14:42,2.95,14506,United Kingdom
569524,21894,POTTING SHED SEED ENVELOPES,1,10/4/2011 14:42,1.25,14506,United Kingdom
569524,23393,HOME SWEET HOME CUSHION COVER ,1,10/4/2011 14:42,3.75,14506,United Kingdom
569524,23396,LE JARDIN BOTANIQUE CUSHION COVER,1,10/4/2011 14:42,3.75,14506,United Kingdom
569524,22944,CHRISTMAS METAL POSTCARD WITH BELLS,6,10/4/2011 14:42,0.39,14506,United Kingdom
569524,22283,6 EGG HOUSE PAINTED WOOD,1,10/4/2011 14:42,7.95,14506,United Kingdom
569524,85054,FRENCH ENAMEL POT W LID,1,10/4/2011 14:42,2.95,14506,United Kingdom
569524,22477,WATERING CAN GARDEN MARKER,1,10/4/2011 14:42,1.25,14506,United Kingdom
569524,22979,PANTRY WASHING UP BRUSH,1,10/4/2011 14:42,1.45,14506,United Kingdom
569524,23405,HOME SWEET HOME 2 DRAWER CABINET,1,10/4/2011 14:42,4.95,14506,United Kingdom
569524,22465,HANGING METAL STAR LANTERN,2,10/4/2011 14:42,1.65,14506,United Kingdom
569524,22867,HAND WARMER BIRD DESIGN,1,10/4/2011 14:42,2.1,14506,United Kingdom
569524,22602,RETROSPOT WOODEN HEART DECORATION,1,10/4/2011 14:42,0.85,14506,United Kingdom
569524,22577,WOODEN HEART CHRISTMAS SCANDINAVIAN,1,10/4/2011 14:42,0.29,14506,United Kingdom
569524,22284,HEN HOUSE DECORATION,1,10/4/2011 14:42,1.65,14506,United Kingdom
569524,23210,WHITE ROCKING HORSE HAND PAINTED,1,10/4/2011 14:42,1.25,14506,United Kingdom
569524,23211,RED ROCKING HORSE HAND PAINTED,1,10/4/2011 14:42,1.25,14506,United Kingdom
569524,23222,CHRISTMAS TREE HANGING GOLD,2,10/4/2011 14:42,0.83,14506,United Kingdom
569524,21824,PAINTED METAL STAR WITH HOLLY BELLS,1,10/4/2011 14:42,0.39,14506,United Kingdom
569524,22578,WOODEN STAR CHRISTMAS SCANDINAVIAN,1,10/4/2011 14:42,0.29,14506,United Kingdom
569524,22581,WOOD STOCKING CHRISTMAS SCANDISPOT,1,10/4/2011 14:42,0.85,14506,United Kingdom
