574297,23100,SILVER BELLS TABLE DECORATION,12,11/3/2011 15:54,1.25,16602,United Kingdom
574297,23274,STAR T-LIGHT HOLDER WILLIE WINKIE,12,11/3/2011 15:54,1.65,16602,United Kingdom
574297,84347,ROTATING SILVER ANGELS T-LIGHT HLDR,6,11/3/2011 15:54,2.55,16602,United Kingdom
574297,23048,SET OF 10 LANTERNS FAIRY LIGHT STAR,4,11/3/2011 15:54,4.15,16602,United Kingdom
574297,22456,NATURAL SLATE CHALKBOARD LARGE ,3,11/3/2011 15:54,4.95,16602,United Kingdom
574297,22185,SLATE TILE NATURAL HANGING,12,11/3/2011 15:54,1.65,16602,United Kingdom
574297,84945,MULTI COLOUR SILVER T-LIGHT HOLDER,12,11/3/2011 15:54,0.85,16602,United Kingdom
574297,84755,COLOUR GLASS T-LIGHT HOLDER HANGING,16,11/3/2011 15:54,0.65,16602,United Kingdom
574297,71459,HANGING JAM JAR T-LIGHT HOLDERS,12,11/3/2011 15:54,0.85,16602,United Kingdom
574297,23483,HANGING  BUTTERFLY T-LIGHT HOLDER,12,11/3/2011 15:54,1.25,16602,United Kingdom
574297,71477,COLOUR GLASS. STAR T-LIGHT HOLDER,24,11/3/2011 15:54,3.29,16602,United Kingdom
574297,85123A,WHITE HANGING HEART T-LIGHT HOLDER,6,11/3/2011 15:54,2.95,16602,United Kingdom
574297,23039,T-LIGHT HOLDER SILVER HEART HANDLE,6,11/3/2011 15:54,1.95,16602,United Kingdom
574297,22892,SET OF SALT AND PEPPER TOADSTOOLS,12,11/3/2011 15:54,1.25,16602,United Kingdom
574297,79321,CHILLI LIGHTS,4,11/3/2011 15:54,5.75,16602,United Kingdom
574297,22847,BREAD BIN DINER STYLE IVORY,1,11/3/2011 15:54,16.95,16602,United Kingdom
574297,23424,GINGHAM RECIPE BOOK BOX,4,11/3/2011 15:54,4.95,16602,United Kingdom
574297,22969,HOMEMADE JAM SCENTED CANDLES,12,11/3/2011 15:54,1.45,16602,United Kingdom
574297,23493,VINTAGE DOILY TRAVEL SEWING KIT,10,11/3/2011 15:54,1.95,16602,United Kingdom
574297,22621,TRADITIONAL KNITTING NANCY,12,11/3/2011 15:54,1.65,16602,United Kingdom
574297,21891,TRADITIONAL WOODEN SKIPPING ROPE,12,11/3/2011 15:54,1.45,16602,United Kingdom
574297,22620,4 TRADITIONAL SPINNING TOPS,12,11/3/2011 15:54,1.45,16602,United Kingdom
574297,21790,VINTAGE SNAP CARDS,12,11/3/2011 15:54,0.85,16602,United Kingdom
574297,84077,WORLD WAR 2 GLIDERS ASSTD DESIGNS,48,11/3/2011 15:54,0.29,16602,United Kingdom
574297,21914,BLUE HARMONICA IN BOX ,12,11/3/2011 15:54,1.25,16602,United Kingdom
574297,23497,CLASSIC CHROME BICYCLE BELL ,12,11/3/2011 15:54,1.45,16602,United Kingdom
574297,23188,VINTAGE  2 METRE FOLDING RULER,12,11/3/2011 15:54,1.65,16602,United Kingdom
574297,23301,GARDENERS KNEELING PAD KEEP CALM ,12,11/3/2011 15:54,1.65,16602,United Kingdom
574298,22356,CHARLOTTE BAG PINK POLKADOT,2,11/3/2011 15:56,1.63,,United Kingdom
574298,22358,KINGS CHOICE TEA CADDY ,1,11/3/2011 15:56,5.79,,United Kingdom
574298,22378,WALL TIDY RETROSPOT ,2,11/3/2011 15:56,4.13,,United Kingdom
574298,22379,RECYCLING BAG RETROSPOT ,4,11/3/2011 15:56,4.13,,United Kingdom
574298,22380,TOY TIDY SPACEBOY  ,2,11/3/2011 15:56,4.13,,United Kingdom
574298,22384,LUNCH BAG PINK POLKADOT,1,11/3/2011 15:56,4.13,,United Kingdom
574298,22385,JUMBO BAG SPACEBOY DESIGN,3,11/3/2011 15:56,4.13,,United Kingdom
574298,22411,JUMBO SHOPPER VINTAGE RED PAISLEY,2,11/3/2011 15:56,4.13,,United Kingdom
574298,22417,PACK OF 60 SPACEBOY CAKE CASES,1,11/3/2011 15:56,1.25,,United Kingdom
574298,22419,LIPSTICK PEN RED,3,11/3/2011 15:56,0.83,,United Kingdom
574298,22421,LIPSTICK PEN FUSCHIA,1,11/3/2011 15:56,0.83,,United Kingdom
574298,22422,TOOTHPASTE TUBE PEN,2,11/3/2011 15:56,1.25,,United Kingdom
574298,22429,ENAMEL MEASURING JUG CREAM,1,11/3/2011 15:56,8.29,,United Kingdom
574298,22438,BALLOON ART MAKE YOUR OWN FLOWERS,1,11/3/2011 15:56,4.13,,United Kingdom
574298,22446,PIN CUSHION BABUSHKA PINK,4,11/3/2011 15:56,2.46,,United Kingdom
574298,22464,HANGING METAL HEART LANTERN,1,11/3/2011 15:56,3.29,,United Kingdom
574298,22466,FAIRY TALE COTTAGE NIGHT LIGHT,1,11/3/2011 15:56,4.13,,United Kingdom
574298,22523,CHILDS GARDEN FORK PINK,1,11/3/2011 15:56,1.63,,United Kingdom
574298,22544,MINI JIGSAW SPACEBOY,1,11/3/2011 15:56,0.83,,United Kingdom
574298,22546,MINI JIGSAW PURDEY,1,11/3/2011 15:56,0.83,,United Kingdom
574298,22551,PLASTERS IN TIN SPACEBOY,1,11/3/2011 15:56,3.29,,United Kingdom
574298,22553,PLASTERS IN TIN SKULLS,2,11/3/2011 15:56,3.29,,United Kingdom
574298,22554,PLASTERS IN TIN WOODLAND ANIMALS,1,11/3/2011 15:56,3.29,,United Kingdom
574298,22555,PLASTERS IN TIN STRONGMAN,2,11/3/2011 15:56,3.29,,United Kingdom
574298,22557,PLASTERS IN TIN VINTAGE PAISLEY ,1,11/3/2011 15:56,3.29,,United Kingdom
574298,22572,ROCKING HORSE GREEN CHRISTMAS ,3,11/3/2011 15:56,1.63,,United Kingdom
574298,22573,STAR WOODEN CHRISTMAS DECORATION,3,11/3/2011 15:56,1.63,,United Kingdom
574298,22574,HEART WOODEN CHRISTMAS DECORATION,4,11/3/2011 15:56,1.63,,United Kingdom
574298,22576,SWALLOW WOODEN CHRISTMAS DECORATION,1,11/3/2011 15:56,1.63,,United Kingdom
574298,22577,WOODEN HEART CHRISTMAS SCANDINAVIAN,12,11/3/2011 15:56,0.83,,United Kingdom
574298,22578,WOODEN STAR CHRISTMAS SCANDINAVIAN,5,11/3/2011 15:56,0.83,,United Kingdom
574298,22579,WOODEN TREE CHRISTMAS SCANDINAVIAN,8,11/3/2011 15:56,0.83,,United Kingdom
574298,22580,ADVENT CALENDAR GINGHAM SACK,2,11/3/2011 15:56,4.13,,United Kingdom
574298,22581,WOOD STOCKING CHRISTMAS SCANDISPOT,6,11/3/2011 15:56,0.83,,United Kingdom
574298,22592,CARDHOLDER HOLLY WREATH METAL,3,11/3/2011 15:56,7.46,,United Kingdom
574298,22593,CHRISTMAS GINGHAM STAR,4,11/3/2011 15:56,1.63,,United Kingdom
574298,22594,CHRISTMAS GINGHAM TREE,3,11/3/2011 15:56,1.63,,United Kingdom
574298,22595,GINGHAM HEART DECORATION,1,11/3/2011 15:56,1.63,,United Kingdom
574298,22597,MUSICAL ZINC HEART DECORATION ,11,11/3/2011 15:56,0.83,,United Kingdom
574298,22598,CHRISTMAS MUSICAL ZINC TREE,5,11/3/2011 15:56,0.83,,United Kingdom
574298,22599,CHRISTMAS MUSICAL ZINC STAR,5,11/3/2011 15:56,0.83,,United Kingdom
574298,22601,CHRISTMAS RETROSPOT ANGEL WOOD,4,11/3/2011 15:56,1.63,,United Kingdom
574298,22608,PENS ASSORTED FUNKY JEWELED ,2,11/3/2011 15:56,0.42,,United Kingdom
574298,22614,PACK OF 12 SPACEBOY TISSUES,1,11/3/2011 15:56,0.83,,United Kingdom
574298,22616,PACK OF 12 LONDON TISSUES ,1,11/3/2011 15:56,0.83,,United Kingdom
574298,22620,4 TRADITIONAL SPINNING TOPS,1,11/3/2011 15:56,2.46,,United Kingdom
574298,22621,TRADITIONAL KNITTING NANCY,1,11/3/2011 15:56,3.29,,United Kingdom
574298,22629,SPACEBOY LUNCH BOX ,1,11/3/2011 15:56,4.13,,United Kingdom
574298,22630,DOLLY GIRL LUNCH BOX,1,11/3/2011 15:56,4.13,,United Kingdom
574298,22653,BUTTON BOX ,4,11/3/2011 15:56,1.63,,United Kingdom
574298,22659,LUNCH BOX I LOVE LONDON,2,11/3/2011 15:56,4.13,,United Kingdom
574298,22661,CHARLOTTE BAG DOLLY GIRL DESIGN,2,11/3/2011 15:56,1.63,,United Kingdom
574298,22663,JUMBO BAG DOLLY GIRL DESIGN,1,11/3/2011 15:56,4.13,,United Kingdom
574298,22664,TOY TIDY DOLLY GIRL DESIGN,1,11/3/2011 15:56,4.13,,United Kingdom
574298,22665,RECIPE BOX BLUE SKETCHBOOK DESIGN,1,11/3/2011 15:56,5.79,,United Kingdom
574298,22666,RECIPE BOX PANTRY YELLOW DESIGN,6,11/3/2011 15:56,5.79,,United Kingdom
574298,22692,DOORMAT WELCOME TO OUR HOME,1,11/3/2011 15:56,15.79,,United Kingdom
574298,22693,GROW A FLYTRAP OR SUNFLOWER IN TIN,1,11/3/2011 15:56,2.5,,United Kingdom
574298,22697,GREEN REGENCY TEACUP AND SAUCER,2,11/3/2011 15:56,5.79,,United Kingdom
574298,22698,PINK REGENCY TEACUP AND SAUCER,1,11/3/2011 15:56,5.79,,United Kingdom
574298,22714,CARD BIRTHDAY COWBOY,1,11/3/2011 15:56,0.83,,United Kingdom
574298,22716,CARD CIRCUS PARADE,1,11/3/2011 15:56,0.83,,United Kingdom
574298,22717,CARD DOG AND BALL ,1,11/3/2011 15:56,0.83,,United Kingdom
574298,22720,SET OF 3 CAKE TINS PANTRY DESIGN ,2,11/3/2011 15:56,10.79,,United Kingdom
574298,22726,ALARM CLOCK BAKELIKE GREEN,5,11/3/2011 15:56,7.46,,United Kingdom
574298,22727,ALARM CLOCK BAKELIKE RED ,2,11/3/2011 15:56,7.46,,United Kingdom
574298,22730,ALARM CLOCK BAKELIKE IVORY,2,11/3/2011 15:56,7.46,,United Kingdom
574298,22735,RIBBON REEL SOCKS AND MITTENS,1,11/3/2011 15:56,3.29,,United Kingdom
574298,22738,RIBBON REEL SNOWY VILLAGE,1,11/3/2011 15:56,3.29,,United Kingdom
574298,22739,RIBBON REEL CHRISTMAS SOCK BAUBLE,4,11/3/2011 15:56,3.29,,United Kingdom
574298,22741,FUNKY DIVA PEN,2,11/3/2011 15:56,1.63,,United Kingdom
574298,22745,POPPY'S PLAYHOUSE BEDROOM ,2,11/3/2011 15:56,4.13,,United Kingdom
574298,22746,POPPY'S PLAYHOUSE LIVINGROOM ,2,11/3/2011 15:56,4.13,,United Kingdom
574298,22747,POPPY'S PLAYHOUSE BATHROOM,1,11/3/2011 15:56,4.13,,United Kingdom
574298,22754,SMALL RED BABUSHKA NOTEBOOK ,1,11/3/2011 15:56,1.63,,United Kingdom
574298,22757,LARGE RED BABUSHKA NOTEBOOK ,1,11/3/2011 15:56,2.46,,United Kingdom
574298,22759,SET OF 3 NOTEBOOKS IN PARCEL,3,11/3/2011 15:56,3.29,,United Kingdom
574298,22771,CLEAR DRAWER KNOB ACRYLIC EDWARDIAN,3,11/3/2011 15:56,2.46,,United Kingdom
574298,22772,PINK DRAWER KNOB ACRYLIC EDWARDIAN,3,11/3/2011 15:56,2.46,,United Kingdom
574298,22773,GREEN DRAWER KNOB ACRYLIC EDWARDIAN,7,11/3/2011 15:56,2.46,,United Kingdom
574298,22774,RED DRAWER KNOB ACRYLIC EDWARDIAN,4,11/3/2011 15:56,2.46,,United Kingdom
574298,22775,PURPLE DRAWERKNOB ACRYLIC EDWARDIAN,3,11/3/2011 15:56,2.46,,United Kingdom
574298,22791,T-LIGHT GLASS FLUTED ANTIQUE,3,11/3/2011 15:56,2.46,,United Kingdom
574298,22795,SWEETHEART RECIPE BOOK STAND,1,11/3/2011 15:56,13.29,,United Kingdom
574298,22798,ANTIQUE GLASS DRESSING TABLE POT,2,11/3/2011 15:56,5.79,,United Kingdom
574298,22800,ANTIQUE TALL SWIRLGLASS TRINKET POT,1,11/3/2011 15:56,7.46,,United Kingdom
574298,22801,ANTIQUE GLASS PEDESTAL BOWL,1,11/3/2011 15:56,7.46,,United Kingdom
574298,22805,BLUE DRAWER KNOB ACRYLIC EDWARDIAN,3,11/3/2011 15:56,2.46,,United Kingdom
574298,22812,PACK 3 BOXES CHRISTMAS PANNETONE,3,11/3/2011 15:56,4.13,,United Kingdom
574298,22814,CARD PARTY GAMES ,3,11/3/2011 15:56,0.42,,United Kingdom
574298,22816,CARD MOTORBIKE SANTA,4,11/3/2011 15:56,0.42,,United Kingdom
574298,22817,CARD SUKI BIRTHDAY,3,11/3/2011 15:56,0.42,,United Kingdom
574298,22818,CARD CHRISTMAS VILLAGE,10,11/3/2011 15:56,0.42,,United Kingdom
574298,22819,"BIRTHDAY CARD, RETRO SPOT",2,11/3/2011 15:56,0.42,,United Kingdom
574298,22863,SOAP DISH BROCANTE,1,11/3/2011 15:56,5.79,,United Kingdom
574298,22865,HAND WARMER OWL DESIGN,1,11/3/2011 15:56,4.13,,United Kingdom
574298,22866,HAND WARMER SCOTTY DOG DESIGN,1,11/3/2011 15:56,4.13,,United Kingdom
574298,22904,CALENDAR PAPER CUT DESIGN,4,11/3/2011 15:56,5.79,,United Kingdom
574298,22905,CALENDAR IN SEASON DESIGN,3,11/3/2011 15:56,2.46,,United Kingdom
574298,22909,SET OF 20 VINTAGE CHRISTMAS NAPKINS,2,11/3/2011 15:56,1.63,,United Kingdom
574298,22910,PAPER CHAIN KIT VINTAGE CHRISTMAS,2,11/3/2011 15:56,5.79,,United Kingdom
574298,22942,CHRISTMAS LIGHTS 10 SANTAS ,1,11/3/2011 15:56,16.63,,United Kingdom
574298,22944,CHRISTMAS METAL POSTCARD WITH BELLS,18,11/3/2011 15:56,0.97,,United Kingdom
574298,22952,60 CAKE CASES VINTAGE CHRISTMAS,5,11/3/2011 15:56,1.25,,United Kingdom
574298,22955,36 FOIL STAR CAKE CASES ,1,11/3/2011 15:56,4.13,,United Kingdom
574298,22960,JAM MAKING SET WITH JARS,4,11/3/2011 15:56,8.29,,United Kingdom
574298,22961,JAM MAKING SET PRINTED,3,11/3/2011 15:56,3.29,,United Kingdom
574298,22966,GINGERBREAD MAN COOKIE CUTTER,1,11/3/2011 15:56,2.46,,United Kingdom
574298,22968,ROSE COTTAGE KEEPSAKE BOX ,1,11/3/2011 15:56,19.96,,United Kingdom
574298,22969,HOMEMADE JAM SCENTED CANDLES,1,11/3/2011 15:56,3.29,,United Kingdom
574298,22976,CIRCUS PARADE CHILDRENS EGG CUP ,1,11/3/2011 15:56,2.46,,United Kingdom
574298,22979,PANTRY WASHING UP BRUSH,1,11/3/2011 15:56,3.29,,United Kingdom
574298,22980,PANTRY SCRUBBING BRUSH,1,11/3/2011 15:56,3.29,,United Kingdom
574298,22983,CARD BILLBOARD FONT,1,11/3/2011 15:56,0.83,,United Kingdom
574298,22988,SOLDIERS EGG CUP ,3,11/3/2011 15:56,2.46,,United Kingdom
574298,22993,SET OF 4 PANTRY JELLY MOULDS,1,11/3/2011 15:56,2.46,,United Kingdom
574298,22995,TRAVEL CARD WALLET SUKI,1,11/3/2011 15:56,0.83,,United Kingdom
574298,23000,TRAVEL CARD WALLET TRANSPORT,1,11/3/2011 15:56,0.83,,United Kingdom
574298,23005,TRAVEL CARD WALLET I LOVE LONDON,1,11/3/2011 15:56,0.83,,United Kingdom
574298,23007, SPACEBOY BABY GIFT SET,1,11/3/2011 15:56,10.79,,United Kingdom
574298,23010,CIRCUS PARADE BABY GIFT SET,1,11/3/2011 15:56,10.79,,United Kingdom
574298,23077,DOUGHNUT LIP GLOSS ,1,11/3/2011 15:56,2.46,,United Kingdom
574298,23078,ICE CREAM PEN LIP GLOSS ,1,11/3/2011 15:56,2.46,,United Kingdom
574298,23080,RED METAL BOX TOP SECRET,1,11/3/2011 15:56,16.63,,United Kingdom
574298,23083,SET 6 PAPER TABLE LANTERN STARS ,1,11/3/2011 15:56,7.46,,United Kingdom
574298,23084,RABBIT NIGHT LIGHT,13,11/3/2011 15:56,4.13,,United Kingdom
574298,23086,ZINC  STAR T-LIGHT HOLDER ,2,11/3/2011 15:56,2.46,,United Kingdom
574298,23089,GLASS BON BON JAR,1,11/3/2011 15:56,3.29,,United Kingdom
574298,23100,SILVER BELLS TABLE DECORATION,2,11/3/2011 15:56,2.46,,United Kingdom
574298,23103,JINGLE BELL HEART DECORATION,1,11/3/2011 15:56,3.29,,United Kingdom
574298,23109,PACK OF SIX LED TEA LIGHTS,2,11/3/2011 15:56,5.79,,United Kingdom
574298,23120,PACK OF 6 SMALL FRUIT STRAWS,1,11/3/2011 15:56,0.79,,United Kingdom
574298,23124,18PC WOODEN CUTLERY SET DISPOSABLE,1,11/3/2011 15:56,2.46,,United Kingdom
574298,23125,6PC WOOD PLATE SET DISPOSABLE,1,11/3/2011 15:56,2.46,,United Kingdom
574298,23157,SET OF 6 NATIVITY MAGNETS ,5,11/3/2011 15:56,4.13,,United Kingdom
574298,23168,CLASSIC CAFE SUGAR DISPENSER,1,11/3/2011 15:56,2.46,,United Kingdom
574298,23177,TREASURE ISLAND BOOK BOX,1,11/3/2011 15:56,4.58,,United Kingdom
574298,23184,BULL DOG BOTTLE OPENER,1,11/3/2011 15:56,10.79,,United Kingdom
574298,23199,JUMBO BAG APPLES,1,11/3/2011 15:56,4.13,,United Kingdom
574298,23201,JUMBO BAG ALPHABET,3,11/3/2011 15:56,4.13,,United Kingdom
574298,23202,JUMBO BAG VINTAGE LEAF,2,11/3/2011 15:56,4.13,,United Kingdom
574298,23203,JUMBO BAG VINTAGE DOILY ,2,11/3/2011 15:56,4.13,,United Kingdom
574298,23205,CHARLOTTE BAG VINTAGE ALPHABET ,2,11/3/2011 15:56,1.63,,United Kingdom
574298,23208,LUNCH BAG VINTAGE LEAF DESIGN,1,11/3/2011 15:56,4.13,,United Kingdom
574298,23209,LUNCH BAG VINTAGE DOILY ,1,11/3/2011 15:56,4.13,,United Kingdom
574298,23210,WHITE ROCKING HORSE HAND PAINTED,1,11/3/2011 15:56,2.46,,United Kingdom
574298,23211,RED ROCKING HORSE HAND PAINTED,3,11/3/2011 15:56,2.46,,United Kingdom
574298,23213,STAR WREATH DECORATION WITH BELL,3,11/3/2011 15:56,2.46,,United Kingdom
574298,23218,LAUREL STAR ANTIQUE GOLD,1,11/3/2011 15:56,2.46,,United Kingdom
574298,23222,CHRISTMAS TREE HANGING GOLD,1,11/3/2011 15:56,1.63,,United Kingdom
574298,23226,FILIGREE HEART DAISY WHITE,1,11/3/2011 15:56,2.46,,United Kingdom
574298,23228,FILIGREE HEART BIRD WHITE ,3,11/3/2011 15:56,2.46,,United Kingdom
574298,23243,SET OF TEA COFFEE SUGAR TINS PANTRY,2,11/3/2011 15:56,10.79,,United Kingdom
574298,23245,SET OF 3 REGENCY CAKE TINS,4,11/3/2011 15:56,10.79,,United Kingdom
574298,23263,SET OF 3 WOODEN HEART DECORATIONS,2,11/3/2011 15:56,2.46,,United Kingdom
574298,23264,SET OF 3 WOODEN SLEIGH DECORATIONS,2,11/3/2011 15:56,2.46,,United Kingdom
574298,23266,SET OF 3 WOODEN STOCKING DECORATION,1,11/3/2011 15:56,2.46,,United Kingdom
574298,23286,BLUE VINTAGE SPOT BEAKER,1,11/3/2011 15:56,1.63,,United Kingdom
574298,23291,DOLLY GIRL CHILDRENS CUP,1,11/3/2011 15:56,2.46,,United Kingdom
574298,23292,SPACEBOY CHILDRENS CUP,2,11/3/2011 15:56,2.46,,United Kingdom
574298,23294,SET OF 6 SNACK LOAF BAKING CASES,1,11/3/2011 15:56,2.46,,United Kingdom
574298,23296,SET OF 6 TEA TIME BAKING CASES,1,11/3/2011 15:56,3.29,,United Kingdom
574298,23301,GARDENERS KNEELING PAD KEEP CALM ,3,11/3/2011 15:56,3.29,,United Kingdom
574298,23309,SET OF 60 I LOVE LONDON CAKE CASES ,2,11/3/2011 15:56,1.25,,United Kingdom
574298,23310,BUBBLEGUM RING ASSORTED,1,11/3/2011 15:56,0.83,,United Kingdom
574298,23322,LARGE WHITE HEART OF WICKER,13,11/3/2011 15:56,3.29,,United Kingdom
574298,23328,SET 6 SCHOOL MILK BOTTLES IN CRATE,1,11/3/2011 15:56,7.46,,United Kingdom
574298,23330,DECORATIVE WICKER HEART MEDIUM,1,11/3/2011 15:56,2.46,,United Kingdom
574298,23331,DECORATIVE WICKER HEART SMALL,1,11/3/2011 15:56,1.25,,United Kingdom
574298,23335,EGG FRYING PAN IVORY ,2,11/3/2011 15:56,4.13,,United Kingdom
574298,23343,JUMBO BAG VINTAGE CHRISTMAS ,4,11/3/2011 15:56,4.13,,United Kingdom
574298,23344,JUMBO BAG 50'S CHRISTMAS ,6,11/3/2011 15:56,4.13,,United Kingdom
574298,23345, DOLLY GIRL BEAKER,1,11/3/2011 15:56,2.46,,United Kingdom
574298,23346,SPACEBOY BEAKER,1,11/3/2011 15:56,2.46,,United Kingdom
574298,23353,6 GIFT TAGS VINTAGE CHRISTMAS ,2,11/3/2011 15:56,1.63,,United Kingdom
574298,23354,6 GIFT TAGS 50'S CHRISTMAS ,4,11/3/2011 15:56,1.63,,United Kingdom
574298,23365,SET 12 COLOUR PENCILS LOVE LONDON,1,11/3/2011 15:56,1.25,,United Kingdom
574298,23369,SET 36 COLOUR PENCILS LOVE LONDON,2,11/3/2011 15:56,2.46,,United Kingdom
574298,23370,SET 36 COLOURING PENCILS DOILY,2,11/3/2011 15:56,2.46,,United Kingdom
574298,23372,SET 36 COLOUR PENCILS DOLLY GIRL,1,11/3/2011 15:56,2.46,,United Kingdom
574298,23375,50'S CHRISTMAS PAPER GIFT BAG,2,11/3/2011 15:56,1.63,,United Kingdom
574298,23379,PACK OF 12 RED APPLE TISSUES,1,11/3/2011 15:56,0.83,,United Kingdom
574298,23381,PACK OF 12 VINTAGE LEAF TISSUES ,1,11/3/2011 15:56,0.83,,United Kingdom
574298,23399,HOME SWEET HOME HANGING HEART,2,11/3/2011 15:56,2.08,,United Kingdom
574298,23403,LETTER HOLDER HOME SWEET HOME,1,11/3/2011 15:56,7.46,,United Kingdom
574298,23404,HOME SWEET HOME BLACKBOARD,1,11/3/2011 15:56,10.79,,United Kingdom
574298,23434,3 RAFFIA RIBBONS 50'S CHRISTMAS ,4,11/3/2011 15:56,0.83,,United Kingdom
574298,23475,WOODLAND SMALL PINK FELT HEART,1,11/3/2011 15:56,1.63,,United Kingdom
574298,23476,WOODLAND LARGE RED FELT HEART,3,11/3/2011 15:56,2.46,,United Kingdom
574298,23489,VINTAGE BELLS GARLAND,1,11/3/2011 15:56,5.79,,United Kingdom
574298,23493,VINTAGE DOILY TRAVEL SEWING KIT,1,11/3/2011 15:56,3.29,,United Kingdom
574298,23504,PLAYING CARDS JUBILEE UNION JACK,1,11/3/2011 15:56,2.46,,United Kingdom
574298,23526,WALL ART DOG LICENCE ,1,11/3/2011 15:56,12.46,,United Kingdom
574298,23535,WALL ART BICYCLE SAFETY,1,11/3/2011 15:56,12.46,,United Kingdom
574298,23565,EGG CUP MILKMAID HELGA ,1,11/3/2011 15:56,2.46,,United Kingdom
574298,23570,TRADITIONAL PICK UP STICKS GAME ,2,11/3/2011 15:56,2.46,,United Kingdom
574298,23571,TRADITIONAL NAUGHTS & CROSSES,1,11/3/2011 15:56,3.29,,United Kingdom
574298,23581,JUMBO BAG PAISLEY PARK,6,11/3/2011 15:56,2.08,,United Kingdom
574298,23608,SET 10 CARDS RUDOLPHS NOSE 17097,2,11/3/2011 15:56,2.91,,United Kingdom
574298,23645,SET 10 CHRISTMAS CARDS HOHOHO 16956,4,11/3/2011 15:56,2.49,,United Kingdom
574298,23646,SET 10 CARDS JINGLE BELLS 16957,3,11/3/2011 15:56,2.49,,United Kingdom
574298,35095A,BLUE VICTORIAN FABRIC OVAL BOX,1,11/3/2011 15:56,0.83,,United Kingdom
574298,35471D,SET OF 3 BIRD LIGHT PINK FEATHER ,1,11/3/2011 15:56,1.25,,United Kingdom
574298,35646,VINTAGE BEAD PINK EVENING BAG,4,11/3/2011 15:56,2.46,,United Kingdom
574298,35648,VINTAGE BEAD PINK PURSE ,1,11/3/2011 15:56,1.63,,United Kingdom
574298,35964,FOLKART CLIP ON STARS,1,11/3/2011 15:56,0.83,,United Kingdom
574298,35967,FOLK ART METAL STAR T-LIGHT HOLDER,1,11/3/2011 15:56,0.83,,United Kingdom
574298,35970,ZINC FOLKART SLEIGH BELLS,2,11/3/2011 15:56,4.13,,United Kingdom
574298,46776C,WOVEN FROST CUSHION COVER,2,11/3/2011 15:56,4.13,,United Kingdom
574298,47310M,SMALL POP BOX FUNKY MONKEY,2,11/3/2011 15:56,1.63,,United Kingdom
574298,47593B,SCOTTIE DOGS BABY BIB,2,11/3/2011 15:56,0.83,,United Kingdom
574298,51014A,"FEATHER PEN,HOT PINK",2,11/3/2011 15:56,0.83,,United Kingdom
574298,71477,COLOUR GLASS. STAR T-LIGHT HOLDER,2,11/3/2011 15:56,6.63,,United Kingdom
574298,72349B,SET/6 PURPLE BUTTERFLY T-LIGHTS,1,11/3/2011 15:56,4.13,,United Kingdom
574298,72351B,SET/6 PINK  BUTTERFLY T-LIGHTS,1,11/3/2011 15:56,4.13,,United Kingdom
574298,72598,SET/12 TAPER CANDLES,1,11/3/2011 15:56,1.63,,United Kingdom
574298,72741,GRAND CHOCOLATECANDLE,3,11/3/2011 15:56,2.76,,United Kingdom
574298,72800E,4 IVORY DINNER CANDLES SILVER FLOCK,2,11/3/2011 15:56,3.29,,United Kingdom
574298,82484,WOOD BLACK BOARD ANT WHITE FINISH,1,11/3/2011 15:56,16.63,,United Kingdom
574298,82494L,WOODEN FRAME ANTIQUE WHITE ,3,11/3/2011 15:56,7.46,,United Kingdom
574298,82567,"AIRLINE LOUNGE,METAL SIGN",1,11/3/2011 15:56,1.63,,United Kingdom
574298,82616B,FRAPPUCINO SCARF KNITTING KIT,1,11/3/2011 15:56,2.46,,United Kingdom
574298,82616C,MIDNIGHT GLAMOUR SCARF KNITTING KIT,2,11/3/2011 15:56,2.46,,United Kingdom
574298,84032B,CHARLIE + LOLA RED HOT WATER BOTTLE,1,11/3/2011 15:56,3.29,,United Kingdom
574298,84378,SET OF 3 HEART COOKIE CUTTERS,2,11/3/2011 15:56,2.46,,United Kingdom
574298,84510A,SET OF 4 ENGLISH ROSE COASTERS,1,11/3/2011 15:56,2.46,,United Kingdom
574298,84535B,FAIRY CAKES NOTEBOOK A6 SIZE,1,11/3/2011 15:56,1.46,,United Kingdom
574298,84558A,3D DOG PICTURE PLAYING CARDS,1,11/3/2011 15:56,5.79,,United Kingdom
574298,84568,GIRLS ALPHABET IRON ON PATCHES ,7,11/3/2011 15:56,0.42,,United Kingdom
574298,84569D,PACK 6 HEART/ICE-CREAM PATCHES,2,11/3/2011 15:56,2.46,,United Kingdom
574298,84596B,SMALL DOLLY MIX DESIGN ORANGE BOWL,1,11/3/2011 15:56,0.83,,United Kingdom
574298,84596F,SMALL MARSHMALLOWS PINK BOWL,1,11/3/2011 15:56,0.83,,United Kingdom
574298,84596G,SMALL CHOCOLATES PINK BOWL,1,11/3/2011 15:56,0.83,,United Kingdom
574298,84598,BOYS ALPHABET IRON ON PATCHES,3,11/3/2011 15:56,0.42,,United Kingdom
574298,84692,BOX OF 24 COCKTAIL PARASOLS,3,11/3/2011 15:56,0.83,,United Kingdom
574298,84875B,GREEN SQUARE COMPACT MIRROR,2,11/3/2011 15:56,7.46,,United Kingdom
574298,84923,PINK BUTTERFLY HANDBAG W BOBBLES,3,11/3/2011 15:56,4.13,,United Kingdom
574298,84924A,WAKE UP COCKEREL CALENDAR SIGN ,1,11/3/2011 15:56,7.46,,United Kingdom
574298,84946,ANTIQUE SILVER T-LIGHT GLASS,2,11/3/2011 15:56,2.46,,United Kingdom
574298,84968A,SET OF 16 VINTAGE ROSE CUTLERY,1,11/3/2011 15:56,24.96,,United Kingdom
574298,84970L,SINGLE HEART ZINC T-LIGHT HOLDER,2,11/3/2011 15:56,2.08,,United Kingdom
574298,84988,SET OF 72 PINK HEART PAPER DOILIES,2,11/3/2011 15:56,2.92,,United Kingdom
574298,85049H,URBAN BLACK RIBBONS ,1,11/3/2011 15:56,0.83,,United Kingdom
574298,85066,CREAM SWEETHEART MINI CHEST,1,11/3/2011 15:56,24.96,,United Kingdom
574298,85093,CANDY SPOT EGG WARMER HARE,2,11/3/2011 15:56,0.83,,United Kingdom
574298,85099B,JUMBO BAG RED RETROSPOT,1,11/3/2011 15:56,4.13,,United Kingdom
574298,85123A,WHITE HANGING HEART T-LIGHT HOLDER,2,11/3/2011 15:56,5.79,,United Kingdom
574298,85131B,BEADED CRYSTAL HEART GREEN ON STICK,1,11/3/2011 15:56,0.83,,United Kingdom
574298,85131C,BEADED CRYSTAL HEART BLUE ON STICK,1,11/3/2011 15:56,0.83,,United Kingdom
574298,85131D,BEADED CRYSTAL HEART PINK ON STICK,1,11/3/2011 15:56,0.83,,United Kingdom
574298,85179A,GREEN BITTY LIGHT CHAIN,1,11/3/2011 15:56,2.46,,United Kingdom
574298,85179C,PINK BITTY LIGHT CHAIN,2,11/3/2011 15:56,2.46,,United Kingdom
574298,85199S,SMALL HANGING IVORY/RED WOOD BIRD,4,11/3/2011 15:56,0.83,,United Kingdom
574298,85227,SET OF 6 3D KIT CARDS FOR KIDS,1,11/3/2011 15:56,1.63,,United Kingdom
574298,90054,CRACKED GLAZE EARRINGS RED,1,11/3/2011 15:56,2.48,,United Kingdom
574298,90059A,DIAMANTE HAIR GRIP PACK/2 CRYSTAL,2,11/3/2011 15:56,1.65,,United Kingdom
574298,90059C,DIAMANTE HAIR GRIP PACK/2 MONTANA,1,11/3/2011 15:56,1.65,,United Kingdom
574298,90059D,DIAMANTE HAIR GRIP PACK/2 PERIDOT,1,11/3/2011 15:56,1.65,,United Kingdom
574298,90059E,DIAMANTE HAIR GRIP PACK/2 RUBY,1,11/3/2011 15:56,1.65,,United Kingdom
574298,90118,PINK DAISY BAG CHARM,1,11/3/2011 15:56,2.46,,United Kingdom
574298,90124C,GREEN MURANO TWIST NECKLACE,1,11/3/2011 15:56,9.98,,United Kingdom
574298,90138,WHITE/PINK MINI CRYSTALS NECKLACE,1,11/3/2011 15:56,5.4,,United Kingdom
574298,90158,ST TROPEZ NECKLACE,1,11/3/2011 15:56,4.98,,United Kingdom
574298,90169,DAISY HAIR COMB,1,11/3/2011 15:56,2.48,,United Kingdom
574298,90175A,WHITE GLASS CHUNKY CHARM BRACELET,1,11/3/2011 15:56,9.15,,United Kingdom
574298,90177D,DROP DIAMANTE EARRINGS PURPLE,1,11/3/2011 15:56,2.9,,United Kingdom
574298,90183C,BLACK DROP EARRINGS W LONG BEADS,1,11/3/2011 15:56,2.9,,United Kingdom
574298,90200E,GREEN SWEETHEART BRACELET,1,11/3/2011 15:56,4.15,,United Kingdom
574298,90201D,GREEN ENAMEL FLOWER RING,1,11/3/2011 15:56,2.9,,United Kingdom
574298,90206A,GOLD DIAMANTE STAR BROOCH,1,11/3/2011 15:56,4.98,,United Kingdom
574298,90208,PAIR OF PINK FLOWER CLUSTER SLIDE,1,11/3/2011 15:56,2.48,,United Kingdom
574298,DOT,DOTCOM POSTAGE,1,11/3/2011 15:56,286.88,,United Kingdom
574298,15034,PAPER POCKET TRAVELING FAN ,1,11/3/2011 15:56,0.83,,United Kingdom
574298,15036,ASSORTED COLOURS SILK FAN,3,11/3/2011 15:56,1.63,,United Kingdom
574298,16219,HOUSE SHAPE PENCIL SHARPENER,1,11/3/2011 15:56,0.83,,United Kingdom
574298,16235,RECYCLED PENCIL WITH RABBIT ERASER,1,11/3/2011 15:56,0.42,,United Kingdom
574298,16236,KITTY PENCIL ERASERS,1,11/3/2011 15:56,0.42,,United Kingdom
574298,16237,SLEEPING CAT ERASERS,4,11/3/2011 15:56,0.42,,United Kingdom
574298,16238,PARTY TIME PENCIL ERASERS,1,11/3/2011 15:56,0.42,,United Kingdom
574298,16258A,SWIRLY CIRCULAR RUBBERS IN BAG,1,11/3/2011 15:56,0.83,,United Kingdom
574298,17084N,FAIRY DREAMS INCENSE ,1,11/3/2011 15:56,0.42,,United Kingdom
574298,20711,JUMBO BAG TOYS ,1,11/3/2011 15:56,4.13,,United Kingdom
574298,20712,JUMBO BAG WOODLAND ANIMALS,1,11/3/2011 15:56,4.13,,United Kingdom
574298,20719,WOODLAND CHARLOTTE BAG,1,11/3/2011 15:56,1.63,,United Kingdom
574298,20723,STRAWBERRY CHARLOTTE BAG,1,11/3/2011 15:56,1.63,,United Kingdom
574298,20724,RED RETROSPOT CHARLOTTE BAG,2,11/3/2011 15:56,1.63,,United Kingdom
574298,20764,ABSTRACT CIRCLES SKETCHBOOK ,1,11/3/2011 15:56,7.46,,United Kingdom
574298,20766,GARDEN PATH SKETCHBOOK,2,11/3/2011 15:56,7.46,,United Kingdom
574298,20866,BLUE ROSE FABRIC MIRROR,2,11/3/2011 15:56,2.46,,United Kingdom
574298,20931,BLUE POT PLANT CANDLE ,1,11/3/2011 15:56,7.46,,United Kingdom
574298,20963,APPLE BATH SPONGE,1,11/3/2011 15:56,2.46,,United Kingdom
574298,20971,PINK BLUE FELT CRAFT TRINKET BOX,1,11/3/2011 15:56,2.46,,United Kingdom
