540418,84356,POMPOM CURTAIN,2,1/7/2011 11:04,5.91,,United Kingdom
540418,84378,SET OF 3 HEART COOKIE CUTTERS,1,1/7/2011 11:04,2.51,,United Kingdom
540418,84509A,SET OF 4 ENGLISH ROSE PLACEMATS,7,1/7/2011 11:04,3.36,,United Kingdom
540418,84509B,SET OF 4 FAIRY CAKE PLACEMATS,1,1/7/2011 11:04,3.36,,United Kingdom
540418,21219,SET/4 BADGES BALLOON GIRL,2,1/7/2011 11:04,0.85,,United Kingdom
540418,21220,SET/4 BADGES DOGS,3,1/7/2011 11:04,0.85,,United Kingdom
540418,21221,SET/4 BADGES CUTE CREATURES,1,1/7/2011 11:04,0.85,,United Kingdom
540418,21222,SET/4 BADGES BEETLES,2,1/7/2011 11:04,0.85,,United Kingdom
540418,21232,STRAWBERRY CERAMIC TRINKET BOX,1,1/7/2011 11:04,2.51,,United Kingdom
540418,21258,VICTORIAN SEWING BOX LARGE,1,1/7/2011 11:04,25.49,,United Kingdom
540418,21272,SALLE DE BAIN HOOK,1,1/7/2011 11:04,2.51,,United Kingdom
540418,21328,BALLOONS  WRITING SET ,1,1/7/2011 11:04,3.36,,United Kingdom
540418,21352,EUCALYPTUS & PINECONE  WREATH,1,1/7/2011 11:04,5.91,,United Kingdom
540418,21494,ROTATING LEAVES T-LIGHT HOLDER,8,1/7/2011 11:04,1.66,,United Kingdom
540418,21506,"FANCY FONT BIRTHDAY CARD, ",1,1/7/2011 11:04,0.85,,United Kingdom
540418,22117,METAL SIGN HER DINNER IS SERVED ,2,1/7/2011 11:04,1.66,,United Kingdom
540418,22124,SET OF 2 TEA TOWELS PING MICROWAVE,1,1/7/2011 11:04,2.51,,United Kingdom
540418,22134,MINI LADLE LOVE HEART RED ,5,1/7/2011 11:04,0.43,,United Kingdom
540418,22135,MINI LADLE LOVE HEART PINK,3,1/7/2011 11:04,0.43,,United Kingdom
540418,22136,LOVE HEART SOCK HANGER,2,1/7/2011 11:04,3.36,,United Kingdom
540418,22144,CHRISTMAS CRAFT LITTLE FRIENDS,1,1/7/2011 11:04,4.21,,United Kingdom
540418,22161,HEART DECORATION RUSTIC HANGING ,5,1/7/2011 11:04,0.81,,United Kingdom
540418,21518,BANK ACCOUNT  GREETING  CARD ,1,1/7/2011 11:04,0.43,,United Kingdom
540418,22163,HEART STRING MEMO HOLDER HANGING,3,1/7/2011 11:04,3.36,,United Kingdom
540418,21523,DOORMAT FANCY FONT HOME SWEET HOME,1,1/7/2011 11:04,14.43,,United Kingdom
540418,21555,CERAMIC STRAWBERRY TRINKET TRAY,2,1/7/2011 11:04,2.51,,United Kingdom
540418,21556,CERAMIC STRAWBERRY MONEY BOX,5,1/7/2011 11:04,2.51,,United Kingdom
540418,21557,SET OF 6 FUNKY BEAKERS,4,1/7/2011 11:04,2.51,,United Kingdom
540418,21615,4 LAVENDER BOTANICAL DINNER CANDLES,1,1/7/2011 11:04,2.51,,United Kingdom
540418,21616,4 PEAR BOTANICAL DINNER CANDLES,4,1/7/2011 11:04,2.51,,United Kingdom
540418,21617,4 LILY  BOTANICAL DINNER CANDLES,2,1/7/2011 11:04,2.51,,United Kingdom
540418,21618,4 WILDFLOWER BOTANICAL CANDLES,3,1/7/2011 11:04,2.51,,United Kingdom
540418,21619,4 VANILLA BOTANICAL CANDLES,1,1/7/2011 11:04,2.51,,United Kingdom
540418,21620,SET OF 4 ROSE BOTANICAL CANDLES,1,1/7/2011 11:04,2.51,,United Kingdom
540418,21623,VINTAGE UNION JACK MEMOBOARD,1,1/7/2011 11:04,20.38,,United Kingdom
540418,21625,VINTAGE UNION JACK APRON,1,1/7/2011 11:04,14.43,,United Kingdom
540418,21632,VINTAGE PINK DECORATIVE PARASOL,1,1/7/2011 11:04,8.47,,United Kingdom
540418,21633,SUNFLOWER DECORATIVE PARASOL,1,1/7/2011 11:04,8.47,,United Kingdom
540418,21641,ASSORTED TUTTI FRUTTI KEYRING BALL,1,1/7/2011 11:04,1.66,,United Kingdom
540418,21670,BLUE SPOT CERAMIC DRAWER KNOB,4,1/7/2011 11:04,2.51,,United Kingdom
540418,22165,"DIAMANTE HEART SHAPED WALL MIRROR, ",1,1/7/2011 11:04,11.02,,United Kingdom
540418,22184,CAKE STAND VICTORIAN FILIGREE LARGE,1,1/7/2011 11:04,8.47,,United Kingdom
540418,22196,SMALL HEART MEASURING SPOONS,1,1/7/2011 11:04,1.66,,United Kingdom
540418,22200,FRYING PAN PINK POLKADOT,1,1/7/2011 11:04,8.47,,United Kingdom
540418,22201,FRYING PAN BLUE POLKADOT,1,1/7/2011 11:04,3.36,,United Kingdom
540418,22204,MILK PAN BLUE POLKADOT,3,1/7/2011 11:04,3.36,,United Kingdom
540418,22208,WOOD STAMP SET THANK YOU,1,1/7/2011 11:04,1.66,,United Kingdom
540418,22209,WOOD STAMP SET HAPPY BIRTHDAY,1,1/7/2011 11:04,1.66,,United Kingdom
540418,22210,WOOD STAMP SET BEST WISHES,1,1/7/2011 11:04,1.66,,United Kingdom
540418,22211,WOOD STAMP SET FLOWERS,1,1/7/2011 11:04,1.66,,United Kingdom
540418,22214,CANDLE PLATE LACE WHITE,2,1/7/2011 11:04,1.66,,United Kingdom
540418,22216,T-LIGHT HOLDER WHITE LACE,3,1/7/2011 11:04,0.81,,United Kingdom
540418,22219,LOVEBIRD HANGING DECORATION WHITE ,1,1/7/2011 11:04,1.66,,United Kingdom
540418,22222,CAKE PLATE LOVEBIRD WHITE,7,1/7/2011 11:04,4.21,,United Kingdom
540418,21675,BUTTERFLIES STICKERS,3,1/7/2011 11:04,0.81,,United Kingdom
540418,22223,CAKE PLATE LOVEBIRD PINK,1,1/7/2011 11:04,4.21,,United Kingdom
540418,84251C,"GREETING CARD, TWO SISTERS.",3,1/7/2011 11:04,0.43,,United Kingdom
540418,84251G,"GREETING CARD, OVERCROWDED POOL.",4,1/7/2011 11:04,0.43,,United Kingdom
540418,84032A,CHARLIE+LOLA PINK HOT WATER BOTTLE,1,1/7/2011 11:04,3.36,,United Kingdom
540418,84086C,PINK/PURPLE RETRO RADIO,4,1/7/2011 11:04,2.51,,United Kingdom
540418,72818,CHRISTMAS DECOUPAGE CANDLE,1,1/7/2011 11:04,1.66,,United Kingdom
540418,82613B,"METAL SIGN,CUPCAKE SINGLE HOOK",3,1/7/2011 11:04,0.85,,United Kingdom
540418,82613C,"METAL SIGN,CUPCAKE SINGLE HOOK",4,1/7/2011 11:04,0.85,,United Kingdom
540418,82613D,METAL SIGN CUPCAKE SINGLE HOOK,7,1/7/2011 11:04,0.85,,United Kingdom
540418,84012,MAGIC SHEEP WOOL GROWING FROM PAPER,1,1/7/2011 11:04,1.66,,United Kingdom
540418,72816,SET/3 CHRISTMAS DECOUPAGE CANDLES,1,1/7/2011 11:04,2.51,,United Kingdom
540418,47593B,SCOTTIE DOGS BABY BIB,2,1/7/2011 11:04,0.85,,United Kingdom
540418,47594A,CAROUSEL DESIGN WASHBAG,3,1/7/2011 11:04,1.66,,United Kingdom
540418,47563A,RETRO LONGBOARD IRONING BOARD COVER,1,1/7/2011 11:04,3.36,,United Kingdom
540418,47580,TEA TIME DES TEA COSY,1,1/7/2011 11:04,5.06,,United Kingdom
540418,47585A,PINK FAIRY CAKE CUSHION COVER,10,1/7/2011 11:04,4.21,,United Kingdom
540418,21678,PAISLEY PATTERN  STICKERS,1,1/7/2011 11:04,0.81,,United Kingdom
540418,21706,FOLDING UMBRELLA RED/WHITE POLKADOT,2,1/7/2011 11:04,3.36,,United Kingdom
540418,21707,FOLDING UMBRELLA BLACKBLUE POLKADOT,1,1/7/2011 11:04,3.36,,United Kingdom
540418,21708,FOLDING UMBRELLA CREAM POLKADOT,2,1/7/2011 11:04,3.36,,United Kingdom
540418,21731,RED TOADSTOOL LED NIGHT LIGHT,1,1/7/2011 11:04,3.36,,United Kingdom
540418,21773,DECORATIVE ROSE BATHROOM BOTTLE,1,1/7/2011 11:04,1.28,,United Kingdom
540418,21774,DECORATIVE CATS BATHROOM BOTTLE,4,1/7/2011 11:04,1.28,,United Kingdom
540418,21775,DECORATIVE FLORE BATHROOM BOTTLE,1,1/7/2011 11:04,1.28,,United Kingdom
540418,21790,VINTAGE SNAP CARDS,2,1/7/2011 11:04,1.66,,United Kingdom
540418,21791,VINTAGE HEADS AND TAILS CARD GAME ,1,1/7/2011 11:04,2.51,,United Kingdom
540418,21801,CHRISTMAS TREE DECORATION WITH BELL,15,1/7/2011 11:04,0.43,,United Kingdom
540418,37482P,CUBIC MUG PINK POLKADOT,1,1/7/2011 11:04,5.91,,United Kingdom
540418,46118,FUNKY MONKEY CUSHION COVER,2,1/7/2011 11:04,3.36,,United Kingdom
540418,46775D,SUNSET COLOUR CHUNKY KNITTED THROW,1,1/7/2011 11:04,11.02,,United Kingdom
540418,47504H,ENGLISH ROSE SPIRIT LEVEL ,1,1/7/2011 11:04,3.36,,United Kingdom
540418,35648,VINTAGE BEAD PINK PURSE ,2,1/7/2011 11:04,1.66,,United Kingdom
540418,35651,VINTAGE BEAD PINK SCARF ,6,1/7/2011 11:04,3.36,,United Kingdom
540418,35957,SMALLFOLKART BAUBLE CHRISTMAS DEC,7,1/7/2011 11:04,1.66,,United Kingdom
540418,35971,ROSE FOLKART HEART DECORATIONS,1,1/7/2011 11:04,2.51,,United Kingdom
540418,22952,60 CAKE CASES VINTAGE CHRISTMAS,1,1/7/2011 11:04,1.28,,United Kingdom
540418,22961,JAM MAKING SET PRINTED,3,1/7/2011 11:04,3.36,,United Kingdom
540418,22964,3 PIECE SPACEBOY COOKIE CUTTER SET,1,1/7/2011 11:04,4.21,,United Kingdom
540418,22834,HAND WARMER BABUSHKA DESIGN,4,1/7/2011 11:04,1.66,,United Kingdom
540418,22835,HOT WATER BOTTLE I AM SO POORLY,1,1/7/2011 11:04,9.32,,United Kingdom
540418,22880,NUMBER TILE VINTAGE FONT 1,1,1/7/2011 11:04,4.21,,United Kingdom
540418,22881,NUMBER TILE VINTAGE FONT 2,1,1/7/2011 11:04,4.21,,United Kingdom
540418,22908,PACK OF 20 NAPKINS RED APPLES,2,1/7/2011 11:04,1.66,,United Kingdom
540418,22909,SET OF 20 VINTAGE CHRISTMAS NAPKINS,1,1/7/2011 11:04,1.66,,United Kingdom
540418,22817,CARD SUKI BIRTHDAY,17,1/7/2011 11:04,0.43,,United Kingdom
540418,22715,CARD WEDDING DAY,1,1/7/2011 11:04,0.85,,United Kingdom
540418,22481,BLACK TEA TOWEL CLASSIC DESIGN,2,1/7/2011 11:04,0.85,,United Kingdom
540418,22489,PACK OF 12 TRADITIONAL CRAYONS,6,1/7/2011 11:04,0.85,,United Kingdom
540418,22502,PICNIC BASKET WICKER SMALL,1,1/7/2011 11:04,8.47,,United Kingdom
540418,22504,CABIN BAG VINTAGE RETROSPOT,2,1/7/2011 11:04,25.49,,United Kingdom
540418,22533,MAGIC DRAWING SLATE BAKE A CAKE ,5,1/7/2011 11:04,0.85,,United Kingdom
540418,22534,MAGIC DRAWING SLATE SPACEBOY ,5,1/7/2011 11:04,0.85,,United Kingdom
540418,22548,HEADS AND TAILS SPORTING FUN,1,1/7/2011 11:04,2.51,,United Kingdom
540418,22558,CLOTHES PEGS RETROSPOT PACK 24 ,1,1/7/2011 11:04,2.51,,United Kingdom
540418,22581,WOOD STOCKING CHRISTMAS SCANDISPOT,2,1/7/2011 11:04,1.66,,United Kingdom
540418,22593,CHRISTMAS GINGHAM STAR,3,1/7/2011 11:04,1.66,,United Kingdom
540418,84596B,SMALL DOLLY MIX DESIGN ORANGE BOWL,10,1/7/2011 11:04,0.85,,United Kingdom
540418,84596E,SMALL LICORICE DES PINK BOWL,4,1/7/2011 11:04,0.85,,United Kingdom
540418,84596F,SMALL MARSHMALLOWS PINK BOWL,9,1/7/2011 11:04,0.85,,United Kingdom
540418,84596G,SMALL CHOCOLATES PINK BOWL,3,1/7/2011 11:04,0.85,,United Kingdom
540418,84596J,MIXED NUTS LIGHT GREEN BOWL,1,1/7/2011 11:04,0.85,,United Kingdom
540418,84596L,BISCUITS SMALL BOWL LIGHT BLUE,3,1/7/2011 11:04,0.85,,United Kingdom
540418,84748,FOLK FELT HANGING MULTICOL GARLAND,7,1/7/2011 11:04,2.51,,United Kingdom
540418,84870C,GREEN GEISHA GIRL ,2,1/7/2011 11:04,2.51,,United Kingdom
540418,84912B,GREEN ROSE WASHBAG,2,1/7/2011 11:04,3.36,,United Kingdom
540418,84913B,MINT GREEN ROSE TOWEL,1,1/7/2011 11:04,3.36,,United Kingdom
540418,85114B,IVORY ENCHANTED FOREST PLACEMAT,2,1/7/2011 11:04,3.36,,United Kingdom
540418,85116,BLACK CANDELABRA T-LIGHT HOLDER,8,1/7/2011 11:04,1.66,,United Kingdom
540418,85125,SMALL ROUND CUT GLASS CANDLESTICK,4,1/7/2011 11:04,3.36,,United Kingdom
540418,85127,SMALL SQUARE CUT GLASS CANDLESTICK,2,1/7/2011 11:04,3.36,,United Kingdom
540418,85131B,BEADED CRYSTAL HEART GREEN ON STICK,5,1/7/2011 11:04,0.85,,United Kingdom
540418,85131C,BEADED CRYSTAL HEART BLUE ON STICK,1,1/7/2011 11:04,0.85,,United Kingdom
540418,85131D,BEADED CRYSTAL HEART PINK ON STICK,4,1/7/2011 11:04,0.85,,United Kingdom
540418,85132A,CHARLIE + LOLA BISCUITS TINS,1,1/7/2011 11:04,8.47,,United Kingdom
540418,84916,HAND TOWEL PALE BLUE W FLOWERS,1,1/7/2011 11:04,4.21,,United Kingdom
540418,84923,PINK BUTTERFLY HANDBAG W BOBBLES,4,1/7/2011 11:04,4.21,,United Kingdom
540418,84927E,FLOWERS TILE HOOK,1,1/7/2011 11:04,4.21,,United Kingdom
540418,84931B,BLUE SCOTTIE DOG W FLOWER PATTERN,1,1/7/2011 11:04,1.66,,United Kingdom
540418,84946,ANTIQUE SILVER TEA GLASS ETCHED,7,1/7/2011 11:04,2.51,,United Kingdom
540418,84951A,SET OF 4 PISTACHIO LOVEBIRD COASTER,4,1/7/2011 11:04,1.66,,United Kingdom
540418,84951B,SET OF 4 BLACK LOVEBIRD COASTERS,5,1/7/2011 11:04,1.66,,United Kingdom
540418,84952A,CLEAR LOVE BIRD T-LIGHT HOLDER,1,1/7/2011 11:04,1.66,,United Kingdom
540418,84952B,BLACK LOVE BIRD T-LIGHT HOLDER,1,1/7/2011 11:04,1.66,,United Kingdom
540418,84968A,SET OF 16 VINTAGE ROSE CUTLERY,5,1/7/2011 11:04,8.47,,United Kingdom
540418,84968C,SET OF 16 VINTAGE PISTACHIO CUTLERY,4,1/7/2011 11:04,8.47,,United Kingdom
540418,84968D,SET OF 16 VINTAGE RED CUTLERY,4,1/7/2011 11:04,8.47,,United Kingdom
540418,84968E,SET OF 16 VINTAGE BLACK CUTLERY,1,1/7/2011 11:04,8.47,,United Kingdom
540418,84968F,SET OF 16 VINTAGE SKY BLUE CUTLERY,2,1/7/2011 11:04,8.47,,United Kingdom
540418,85017B,ENVELOPE 50 BLOSSOM IMAGES,1,1/7/2011 11:04,0.85,,United Kingdom
540418,85034B,3 WHITE CHOC MORRIS BOXED CANDLES,2,1/7/2011 11:04,3.36,,United Kingdom
540418,85034C,3 ROSE MORRIS BOXED CANDLES,2,1/7/2011 11:04,3.36,,United Kingdom
540418,85035B,CHOCOLATE 3 WICK MORRIS BOX CANDLE,7,1/7/2011 11:04,3.36,,United Kingdom
540418,85035C,ROSE 3 WICK MORRIS BOX CANDLE,1,1/7/2011 11:04,3.36,,United Kingdom
540418,85039B,S/4 IVORY MINI ROSE CANDLE IN BOWL,1,1/7/2011 11:04,1.66,,United Kingdom
540418,85039C,S/4 BLACK MINI ROSE CANDLE IN BOWL,1,1/7/2011 11:04,1.66,,United Kingdom
540418,85049E,SCANDINAVIAN REDS RIBBONS,1,1/7/2011 11:04,2.51,,United Kingdom
540418,85049H,URBAN BLACK RIBBONS ,7,1/7/2011 11:04,0.85,,United Kingdom
540418,85059,FRENCH ENAMEL WATER BASIN,1,1/7/2011 11:04,3.36,,United Kingdom
540418,85066,CREAM SWEETHEART MINI CHEST,1,1/7/2011 11:04,25.49,,United Kingdom
540418,85071C,"CHARLIE+LOLA""EXTREMELY BUSY"" SIGN",1,1/7/2011 11:04,0.85,,United Kingdom
540418,85071D,CHARLIE+LOLA MY ROOM DOOR SIGN,1,1/7/2011 11:04,0.85,,United Kingdom
540418,85087,CANDY SPOT CUSHION COVER,6,1/7/2011 11:04,3.36,,United Kingdom
540418,85088,CANDY SPOT HAND BAG,2,1/7/2011 11:04,1.66,,United Kingdom
540418,85094,CANDY SPOT EGG WARMER RABBIT,1,1/7/2011 11:04,0.85,,United Kingdom
540418,85095,THREE CANVAS LUGGAGE TAGS,8,1/7/2011 11:04,1.28,,United Kingdom
540418,85096,HILDA CANDY SPOT RABBIT,1,1/7/2011 11:04,7.62,,United Kingdom
540418,85103,SILVER T-LIGHT SETTING,1,1/7/2011 11:04,5.91,,United Kingdom
540418,85106,CUT GLASS HEXAGON T-LIGHT HOLDER,5,1/7/2011 11:04,1.66,,United Kingdom
540418,21802,CHRISTMAS TREE HEART DECORATION,14,1/7/2011 11:04,0.43,,United Kingdom
540418,21803,CHRISTMAS TREE STAR DECORATION,18,1/7/2011 11:04,0.43,,United Kingdom
540418,21846,PINK DIAMANTE PEN IN GIFT BOX,7,1/7/2011 11:04,1.66,,United Kingdom
540418,21847,GREEN  DIAMANTE PEN IN GIFT BOX,1,1/7/2011 11:04,1.66,,United Kingdom
540418,21849,SILVER DIAMANTE PEN IN GIFT BOX,1,1/7/2011 11:04,1.66,,United Kingdom
540418,21864,UNION JACK FLAG PASSPORT COVER ,1,1/7/2011 11:04,4.21,,United Kingdom
540418,21866,UNION JACK FLAG LUGGAGE TAG,1,1/7/2011 11:04,2.51,,United Kingdom
540418,21873,IF YOU CAN'T STAND THE HEAT MUG,2,1/7/2011 11:04,1.66,,United Kingdom
540418,21876,POTTERING MUG,1,1/7/2011 11:04,1.66,,United Kingdom
540418,21879,HEARTS GIFT TAPE,3,1/7/2011 11:04,0.43,,United Kingdom
540418,21880,RED RETROSPOT TAPE,2,1/7/2011 11:04,0.43,,United Kingdom
540418,21881,CUTE CATS TAPE,8,1/7/2011 11:04,0.43,,United Kingdom
540418,21883,STARS GIFT TAPE ,8,1/7/2011 11:04,0.43,,United Kingdom
540418,22241,GARLAND WOODEN HAPPY EASTER,2,1/7/2011 11:04,2.51,,United Kingdom
540418,22247,BUNNY DECORATION MAGIC GARDEN,5,1/7/2011 11:04,0.81,,United Kingdom
540418,22248,DECORATION  PINK CHICK MAGIC GARDEN,3,1/7/2011 11:04,0.81,,United Kingdom
540418,22249,DECORATION WHITE CHICK MAGIC GARDEN,10,1/7/2011 11:04,0.81,,United Kingdom
540418,22250,DECORATION  BUTTERFLY  MAGIC GARDEN,9,1/7/2011 11:04,0.81,,United Kingdom
540418,22256,FELT FARM ANIMAL CHICKEN,1,1/7/2011 11:04,2.51,,United Kingdom
540418,22257,FELT FARM ANIMAL SHEEP,9,1/7/2011 11:04,0.85,,United Kingdom
540418,22258,FELT FARM ANIMAL RABBIT,12,1/7/2011 11:04,0.85,,United Kingdom
540418,22259,FELT FARM ANIMAL HEN,4,1/7/2011 11:04,0.85,,United Kingdom
540418,22362,GLASS JAR PEACOCK BATH SALTS,1,1/7/2011 11:04,5.91,,United Kingdom
540418,22371,AIRLINE BAG VINTAGE TOKYO 78,5,1/7/2011 11:04,4.21,,United Kingdom
540418,22374,AIRLINE BAG VINTAGE JET SET RED,4,1/7/2011 11:04,4.21,,United Kingdom
540418,22375,AIRLINE BAG VINTAGE JET SET BROWN,4,1/7/2011 11:04,4.21,,United Kingdom
540418,22376,AIRLINE BAG VINTAGE JET SET WHITE,1,1/7/2011 11:04,4.21,,United Kingdom
540418,22377,BOTTLE BAG RETROSPOT ,8,1/7/2011 11:04,1.66,,United Kingdom
540418,22378,WALL TIDY RETROSPOT ,13,1/7/2011 11:04,1.66,,United Kingdom
540418,22379,RECYCLING BAG RETROSPOT ,1,1/7/2011 11:04,4.21,,United Kingdom
540418,22381,TOY TIDY PINK POLKADOT,1,1/7/2011 11:04,4.21,,United Kingdom
540418,22396,MAGNETS PACK OF 4 RETRO PHOTO,4,1/7/2011 11:04,0.85,,United Kingdom
540418,20717,STRAWBERRY SHOPPER BAG,18,1/7/2011 11:04,0.85,,United Kingdom
540418,21884,CAKES AND BOWS GIFT  TAPE,4,1/7/2011 11:04,0.43,,United Kingdom
540418,22263,FELT EGG COSY LADYBIRD ,1,1/7/2011 11:04,0.81,,United Kingdom
540418,22403,MAGNETS PACK OF 4 VINTAGE LABELS ,4,1/7/2011 11:04,0.85,,United Kingdom
540418,22594,CHRISTMAS GINGHAM TREE,3,1/7/2011 11:04,1.66,,United Kingdom
540418,22694,WICKER STAR ,2,1/7/2011 11:04,4.21,,United Kingdom
540418,22697,GREEN REGENCY TEACUP AND SAUCER,1,1/7/2011 11:04,5.91,,United Kingdom
540418,22699,ROSES REGENCY TEACUP AND SAUCER ,1,1/7/2011 11:04,5.91,,United Kingdom
540418,10002,INFLATABLE POLITICAL GLOBE ,1,1/7/2011 11:04,1.66,,United Kingdom
540418,10125,MINI FUNKY DESIGN TAPES,1,1/7/2011 11:04,0.81,,United Kingdom
540418,10133,COLOURING PENCILS BROWN TUBE,3,1/7/2011 11:04,0.81,,United Kingdom
540418,10135,COLOURING PENCILS BROWN TUBE,16,1/7/2011 11:04,1.28,,United Kingdom
540418,15036,ASSORTED COLOURS SILK FAN,3,1/7/2011 11:04,1.28,,United Kingdom
540418,16225,RATTLE SNAKE EGGS,3,1/7/2011 11:04,0.85,,United Kingdom
540418,17012B,ORIGAMI JASMINE INCENSE/CANDLE SET,1,1/7/2011 11:04,2.51,,United Kingdom
540418,17012C,ORIGAMI LAVENDER INCENSE/CANDL SET ,1,1/7/2011 11:04,2.51,,United Kingdom
540418,18094C,WHITE AND BLUE CERAMIC OIL BURNER,1,1/7/2011 11:04,2.51,,United Kingdom
540418,20616,CHERRY BLOSSOM PASSPORT COVER,1,1/7/2011 11:04,1.66,,United Kingdom
540418,20617,FIRST CLASS PASSPORT COVER ,1,1/7/2011 11:04,1.66,,United Kingdom
540418,20652,BLUE POLKADOT LUGGAGE TAG ,3,1/7/2011 11:04,0.85,,United Kingdom
540418,20653,CHERRY BLOSSOM LUGGAGE TAG,2,1/7/2011 11:04,0.85,,United Kingdom
540418,20655,QUEEN OF SKIES LUGGAGE TAG,1,1/7/2011 11:04,0.85,,United Kingdom
540418,20677,PINK POLKADOT BOWL,1,1/7/2011 11:04,2.51,,United Kingdom
540418,20699,MOUSEY LONG LEGS SOFT TOY,4,1/7/2011 11:04,2.51,,United Kingdom
540418,20700,GREEN CAT FLORAL CUSHION COVER ,1,1/7/2011 11:04,10.17,,United Kingdom
540418,20711,JUMBO BAG TOYS ,1,1/7/2011 11:04,4.21,,United Kingdom
540418,20713,JUMBO BAG OWLS,4,1/7/2011 11:04,4.21,,United Kingdom
540418,22595,CHRISTMAS GINGHAM HEART,3,1/7/2011 11:04,1.66,,United Kingdom
540418,22601,CHRISTMAS RETROSPOT ANGEL WOOD,2,1/7/2011 11:04,1.66,,United Kingdom
540418,22603,CHRISTMAS RETROSPOT TREE WOOD,2,1/7/2011 11:04,1.66,,United Kingdom
540418,22643,SET OF 4 NAPKIN CHARMS LEAVES   ,1,1/7/2011 11:04,1.66,,United Kingdom
540418,20719,WOODLAND CHARLOTTE BAG,1,1/7/2011 11:04,1.66,,United Kingdom
540418,20724,RED RETROSPOT CHARLOTTE BAG,1,1/7/2011 11:04,1.66,,United Kingdom
540418,20725,LUNCH BAG RED RETROSPOT,1,1/7/2011 11:04,4.21,,United Kingdom
540418,20733,GOLD MINI TAPE MEASURE ,2,1/7/2011 11:04,0.85,,United Kingdom
540418,20735,BLACK MINI TAPE MEASURE ,1,1/7/2011 11:04,0.85,,United Kingdom
540418,20832,RED FLOCK LOVE HEART PHOTO FRAME,1,1/7/2011 11:04,0.81,,United Kingdom
540418,20854,BLUE PATCH PURSE PINK HEART,3,1/7/2011 11:04,1.66,,United Kingdom
540418,20856,DENIM PATCH PURSE PINK BUTTERFLY,3,1/7/2011 11:04,1.66,,United Kingdom
540418,21892,TRADITIONAL WOODEN CATCH CUP GAME ,2,1/7/2011 11:04,2.51,,United Kingdom
540418,21918,SET 12 KIDS COLOUR  CHALK STICKS,1,1/7/2011 11:04,0.85,,United Kingdom
540418,21929,JUMBO BAG PINK VINTAGE PAISLEY,1,1/7/2011 11:04,4.21,,United Kingdom
540418,21934,SKULL SHOULDER BAG,6,1/7/2011 11:04,1.66,,United Kingdom
540418,21935,SUKI  SHOULDER BAG,8,1/7/2011 11:04,1.66,,United Kingdom
540418,21947,SET OF 6 HEART CHOPSTICKS,1,1/7/2011 11:04,1.28,,United Kingdom
540418,21948,SET OF 6 CAKE CHOPSTICKS,1,1/7/2011 11:04,1.28,,United Kingdom
540418,21967,PACK OF 12 SKULL TISSUES,1,1/7/2011 11:04,0.85,,United Kingdom
540418,21977,PACK OF 60 PINK PAISLEY CAKE CASES,2,1/7/2011 11:04,1.28,,United Kingdom
540418,22264,FELT FARM ANIMAL WHITE BUNNY ,2,1/7/2011 11:04,0.81,,United Kingdom
540418,22279,POCKET BAG BLUE PAISLEY RED SPOT,1,1/7/2011 11:04,0.85,,United Kingdom
540418,22280,POCKET BAG PINK PAISELY BROWN SPOT,3,1/7/2011 11:04,0.85,,United Kingdom
540418,22315,200 RED + WHITE BENDY STRAWS,1,1/7/2011 11:04,2.51,,United Kingdom
540418,22317,FIVE CATS HANGING DECORATION,8,1/7/2011 11:04,2.51,,United Kingdom
540418,22322,BIRD DECORATION GREEN POLKADOT,9,1/7/2011 11:04,0.81,,United Kingdom
540418,22324,BLUE POLKADOT KIDS BAG,1,1/7/2011 11:04,4.21,,United Kingdom
540418,22325,MOBILE VINTAGE HEARTS ,4,1/7/2011 11:04,3.36,,United Kingdom
540418,22329,ROUND CONTAINER SET OF 5 RETROSPOT,1,1/7/2011 11:04,3.36,,United Kingdom
540418,22411,JUMBO SHOPPER VINTAGE RED PAISLEY,1,1/7/2011 11:04,4.21,,United Kingdom
540418,22421,LIPSTICK PEN FUSCHIA,1,1/7/2011 11:04,0.85,,United Kingdom
540418,22438,BALLOON ART MAKE YOUR OWN FLOWERS,7,1/7/2011 11:04,1.66,,United Kingdom
540418,22446,PIN CUSHION BABUSHKA PINK,6,1/7/2011 11:04,2.51,,United Kingdom
540418,22447,PIN CUSHION BABUSHKA BLUE,6,1/7/2011 11:04,2.51,,United Kingdom
540418,22452,MEASURING TAPE BABUSHKA PINK,3,1/7/2011 11:04,1.66,,United Kingdom
540418,22453,MEASURING TAPE BABUSHKA BLUE,4,1/7/2011 11:04,1.66,,United Kingdom
540418,22466,FAIRY TALE COTTAGE NIGHTLIGHT,1,1/7/2011 11:04,4.21,,United Kingdom
540418,22471,TV DINNER TRAY AIR HOSTESS ,3,1/7/2011 11:04,4.21,,United Kingdom
540418,20866,BLUE ROSE FABRIC MIRROR,5,1/7/2011 11:04,0.85,,United Kingdom
540418,21990,MODERN FLORAL STATIONERY SET,3,1/7/2011 11:04,2.51,,United Kingdom
540418,22343,PARTY PIZZA DISH RED RETROSPOT,20,1/7/2011 11:04,0.43,,United Kingdom
540418,22344,PARTY PIZZA DISH PINK POLKADOT,6,1/7/2011 11:04,0.43,,United Kingdom
540418,22355,CHARLOTTE BAG SUKI DESIGN,1,1/7/2011 11:04,1.66,,United Kingdom
540418,85204,HANGING WOOD AND FELT FLOWER,1,1/7/2011 11:04,0.43,,United Kingdom
540418,85211,S/4 GROOVY CAT MAGNETS,1,1/7/2011 11:04,3.36,,United Kingdom
540418,90036F,"FLOWER GLASS GARLD NECKL36""TURQUOIS",1,1/7/2011 11:04,8.07,,United Kingdom
540418,90060F,FIRE POLISHED GLASS NECKL GREEN,1,1/7/2011 11:04,5.94,,United Kingdom
540418,90096,NECKLACE+BRACELET SET BLUE BLOSSOM,1,1/7/2011 11:04,2.51,,United Kingdom
540418,90115,SUMMER BUTTERFLIES BAG CHARM,1,1/7/2011 11:04,2.51,,United Kingdom
540418,90116,FRUIT SALAD BAG CHARM,1,1/7/2011 11:04,2.51,,United Kingdom
540418,90125D,PURPLE BERTIE GLASS BEAD BAG CHARM,2,1/7/2011 11:04,1.66,,United Kingdom
540418,90125E,AMBER BERTIE GLASS BEAD BAG CHARM,1,1/7/2011 11:04,1.66,,United Kingdom
540418,90130B,TURQ STONE/CRYSTAL EARRINGS,1,1/7/2011 11:04,2.96,,United Kingdom
540418,90200C,BLUE SWEETHEART BRACELET,1,1/7/2011 11:04,4.24,,United Kingdom
540418,90209B,GREEN ENAMEL+GLASS HAIR COMB,1,1/7/2011 11:04,2.11,,United Kingdom
540418,90214A,"LETTER ""A"" BLING KEY RING",2,1/7/2011 11:04,0.85,,United Kingdom
540418,90214C,"LETTER ""C"" BLING KEY RING",1,1/7/2011 11:04,0.85,,United Kingdom
540418,90214K,"LETTER ""K"" BLING KEY RING",1,1/7/2011 11:04,0.85,,United Kingdom
540418,90214R,"LETTER ""R"" BLING KEY RING",1,1/7/2011 11:04,0.85,,United Kingdom
540418,90214S,"LETTER ""S"" BLING KEY RING",2,1/7/2011 11:04,0.85,,United Kingdom
540418,DOT,DOTCOM POSTAGE,1,1/7/2011 11:04,369.95,,United Kingdom
540418,21991,BOHEMIAN COLLAGE STATIONERY SET,1,1/7/2011 11:04,2.51,,United Kingdom
540418,21992,VINTAGE PAISLEY STATIONERY SET,1,1/7/2011 11:04,2.51,,United Kingdom
540418,21993,FLORAL FOLK STATIONERY SET,1,1/7/2011 11:04,2.51,,United Kingdom
540418,22023,EMPIRE BIRTHDAY CARD,1,1/7/2011 11:04,0.85,,United Kingdom
540418,22032,BOTANICAL LILY GREETING CARD,1,1/7/2011 11:04,0.43,,United Kingdom
540418,22055,MINI CAKE STAND  HANGING STRAWBERY,1,1/7/2011 11:04,3.36,,United Kingdom
540418,22074,6 RIBBONS SHIMMERING PINKS ,8,1/7/2011 11:04,0.85,,United Kingdom
540418,22080,RIBBON REEL POLKADOTS ,1,1/7/2011 11:04,3.36,,United Kingdom
540418,22087,PAPER BUNTING WHITE LACE,10,1/7/2011 11:04,5.91,,United Kingdom
540418,22110,BIRD HOUSE HOT WATER BOTTLE,7,1/7/2011 11:04,3.36,,United Kingdom
540418,20867,PINK ROSE FABRIC MIRROR,2,1/7/2011 11:04,0.85,,United Kingdom
540418,20963,APPLE BATH SPONGE,1,1/7/2011 11:04,2.51,,United Kingdom
540418,20966,SANDWICH BATH SPONGE,1,1/7/2011 11:04,2.51,,United Kingdom
540418,20979,36 PENCILS TUBE RED RETROSPOT,3,1/7/2011 11:04,2.51,,United Kingdom
540418,20981,12 PENCILS TALL TUBE WOODLAND,3,1/7/2011 11:04,1.66,,United Kingdom
540418,21012,ANTIQUE ALL GLASS CANDLESTICK,4,1/7/2011 11:04,2.51,,United Kingdom
540418,21025,SPACE FROG,1,1/7/2011 11:04,0.85,,United Kingdom
540418,21026,SPACE OWL,5,1/7/2011 11:04,0.85,,United Kingdom
540418,21027,NINJA RABBIT PINK,1,1/7/2011 11:04,0.85,,United Kingdom
540418,21028,NINJA RABBIT BLACK,1,1/7/2011 11:04,0.85,,United Kingdom
540418,21032,SPACE CADET WHITE,3,1/7/2011 11:04,0.85,,United Kingdom
540418,21033,JUMBO BAG CHARLIE AND LOLA TOYS,9,1/7/2011 11:04,2.51,,United Kingdom
540420,84816,DANISH ROSE BEDSIDE CABINET,2,1/7/2011 11:13,39.95,12829,United Kingdom
540420,21430,SET/3 RED GINGHAM ROSE STORAGE BOX,4,1/7/2011 11:13,3.75,12829,United Kingdom
540420,22797,CHEST OF DRAWERS GINGHAM HEART ,3,1/7/2011 11:13,16.95,12829,United Kingdom
540420,84826,ASSTD DESIGN 3D PAPER STICKERS,120,1/7/2011 11:13,0.21,12829,United Kingdom
540420,84827,ASS DES PHONE SPONGE CRAFT STICKER,120,1/7/2011 11:13,0.19,12829,United Kingdom
540420,22795,SWEETHEART RECIPE BOOK STAND,2,1/7/2011 11:13,6.75,12829,United Kingdom
540452,21137,BLACK RECORD COVER FRAME,96,1/7/2011 11:49,3.39,13750,United Kingdom
540453,47559B,TEA TIME OVEN GLOVE,50,1/7/2011 11:54,1.06,13426,United Kingdom
540453,22405,MONEY BOX POCKET MONEY DESIGN,12,1/7/2011 11:54,1.25,13426,United Kingdom
540453,21870,I CAN ONLY PLEASE ONE PERSON MUG,12,1/7/2011 11:54,1.25,13426,United Kingdom
540453,21181,PLEASE ONE PERSON METAL SIGN,48,1/7/2011 11:54,1.85,13426,United Kingdom
540453,21508,VINTAGE KID DOLLY CARD ,12,1/7/2011 11:54,0.42,13426,United Kingdom
540453,22037,ROBOT BIRTHDAY CARD,12,1/7/2011 11:54,0.42,13426,United Kingdom
540453,22024,RAINY LADIES BIRTHDAY CARD,12,1/7/2011 11:54,0.42,13426,United Kingdom
540453,21519,GIN & TONIC DIET GREETING CARD ,12,1/7/2011 11:54,0.42,13426,United Kingdom
540453,22028,PENNY FARTHING BIRTHDAY CARD,12,1/7/2011 11:54,0.42,13426,United Kingdom
540453,22717,CARD DOG AND BALL ,12,1/7/2011 11:54,0.42,13426,United Kingdom
540453,22718,CARD CAT AND TREE ,12,1/7/2011 11:54,0.42,13426,United Kingdom
540453,22819,"BIRTHDAY CARD, RETRO SPOT",12,1/7/2011 11:54,0.42,13426,United Kingdom
