548612,20725,LUNCH BAG RED RETROSPOT,10,4/1/2011 11:34,1.65,13137,United Kingdom
548612,20726,LUNCH BAG WOODLAND,10,4/1/2011 11:34,1.65,13137,United Kingdom
548612,21937,STRAWBERRY   PICNIC BAG,2,4/1/2011 11:34,2.95,13137,United Kingdom
548612,22386,JUMBO BAG PINK POLKADOT,6,4/1/2011 11:34,2.08,13137,United Kingdom
548612,22385,JUMBO BAG SPACEBOY DESIGN,4,4/1/2011 11:34,2.08,13137,United Kingdom
548612,21930,JUMBO STORAGE BAG SKULLS,4,4/1/2011 11:34,2.08,13137,United Kingdom
548612,21931,JUMBO STORAGE BAG SUKI,5,4/1/2011 11:34,2.08,13137,United Kingdom
548612,22384,LUNCH BAG PINK POLKADOT,9,4/1/2011 11:34,1.65,13137,United Kingdom
548612,85099B,JUMBO BAG RED RETROSPOT,6,4/1/2011 11:34,2.08,13137,United Kingdom
548612,21936,RED RETROSPOT PICNIC BAG,2,4/1/2011 11:34,2.95,13137,United Kingdom
548612,22379,RECYCLING BAG RETROSPOT ,3,4/1/2011 11:34,2.1,13137,United Kingdom
548612,22380,TOY TIDY SPACEBOY  ,3,4/1/2011 11:34,2.1,13137,United Kingdom
548612,21928,JUMBO BAG SCANDINAVIAN BLUE PAISLEY,3,4/1/2011 11:34,2.08,13137,United Kingdom
548612,21929,JUMBO BAG PINK VINTAGE PAISLEY,3,4/1/2011 11:34,2.08,13137,United Kingdom
548612,21928,JUMBO BAG SCANDINAVIAN BLUE PAISLEY,2,4/1/2011 11:34,2.08,13137,United Kingdom
548612,22411,JUMBO SHOPPER VINTAGE RED PAISLEY,2,4/1/2011 11:34,2.08,13137,United Kingdom
548613,84596E,SMALL LICORICE DES PINK BOWL,84,4/1/2011 11:46,0.42,13694,United Kingdom
548614,21754,HOME BUILDING BLOCK WORD,1,4/1/2011 11:47,5.95,14419,United Kingdom
548614,22967,SET 3 SONG BIRD PAPER EGGS ASSORTED,2,4/1/2011 11:47,2.95,14419,United Kingdom
548614,22563,HAPPY STENCIL CRAFT,4,4/1/2011 11:47,1.25,14419,United Kingdom
548614,22957,SET 3 PAPER VINTAGE CHICK PAPER EGG,2,4/1/2011 11:47,2.95,14419,United Kingdom
548614,22894,TABLECLOTH RED APPLES DESIGN ,1,4/1/2011 11:47,9.95,14419,United Kingdom
548614,22896,PEG BAG APPLES DESIGN,1,4/1/2011 11:47,2.55,14419,United Kingdom
548614,23078,ICE CREAM PEN LIP GLOSS ,24,4/1/2011 11:47,1.25,14419,United Kingdom
548614,22831,WHITE BROCANTE SOAP DISH,4,4/1/2011 11:47,2.95,14419,United Kingdom
548614,85188A,GREEN METAL SWINGING BUNNY,6,4/1/2011 11:47,0.85,14419,United Kingdom
548614,22241,GARLAND WOODEN HAPPY EASTER,3,4/1/2011 11:47,1.25,14419,United Kingdom
548614,22999,TRAVEL CARD WALLET RETRO PETALS,1,4/1/2011 11:47,0.42,14419,United Kingdom
548614,22995,TRAVEL CARD WALLET SUKI,2,4/1/2011 11:47,0.42,14419,United Kingdom
548614,22999,TRAVEL CARD WALLET RETRO PETALS,1,4/1/2011 11:47,0.42,14419,United Kingdom
548614,22998,TRAVEL CARD WALLET KEEP CALM,1,4/1/2011 11:47,0.42,14419,United Kingdom
548614,47566,PARTY BUNTING,2,4/1/2011 11:47,4.95,14419,United Kingdom
548614,21238,RED RETROSPOT CUP,2,4/1/2011 11:47,0.85,14419,United Kingdom
548614,21240,BLUE POLKADOT CUP,2,4/1/2011 11:47,0.85,14419,United Kingdom
548614,21239,PINK  POLKADOT CUP,2,4/1/2011 11:47,0.85,14419,United Kingdom
548614,22353,LUNCH BOX WITH CUTLERY FAIRY CAKES ,1,4/1/2011 11:47,2.55,14419,United Kingdom
548614,22897,OVEN MITT APPLES DESIGN,2,4/1/2011 11:47,1.45,14419,United Kingdom
548614,84380,SET OF 3 BUTTERFLY COOKIE CUTTERS,2,4/1/2011 11:47,1.25,14419,United Kingdom
548614,21172,PARTY METAL SIGN ,1,4/1/2011 11:47,1.45,14419,United Kingdom
548614,22908,PACK OF 20 NAPKINS RED APPLES,2,4/1/2011 11:47,0.85,14419,United Kingdom
548614,84596F,SMALL MARSHMALLOWS PINK BOWL,8,4/1/2011 11:47,0.42,14419,United Kingdom
548614,85197,SET OF 12 MINI BUNNIES IN A BUCKET,2,4/1/2011 11:47,2.1,14419,United Kingdom
548614,10135,COLOURING PENCILS BROWN TUBE,4,4/1/2011 11:47,1.25,14419,United Kingdom
548614,20977,36 PENCILS TUBE WOODLAND,3,4/1/2011 11:47,1.25,14419,United Kingdom
548614,20980,36 PENCILS TUBE POSY,3,4/1/2011 11:47,1.25,14419,United Kingdom
548614,22554,PLASTERS IN TIN WOODLAND ANIMALS,3,4/1/2011 11:47,1.65,14419,United Kingdom
548614,22551,PLASTERS IN TIN SPACEBOY,2,4/1/2011 11:47,1.65,14419,United Kingdom
548614,22557,PLASTERS IN TIN VINTAGE PAISLEY ,3,4/1/2011 11:47,1.65,14419,United Kingdom
548614,22725,ALARM CLOCK BAKELIKE CHOCOLATE,2,4/1/2011 11:47,3.75,14419,United Kingdom
548614,22726,ALARM CLOCK BAKELIKE GREEN,1,4/1/2011 11:47,3.75,14419,United Kingdom
548614,22727,ALARM CLOCK BAKELIKE RED ,2,4/1/2011 11:47,3.75,14419,United Kingdom
548614,22728,ALARM CLOCK BAKELIKE PINK,2,4/1/2011 11:47,3.75,14419,United Kingdom
548614,20685,DOORMAT RED RETROSPOT,1,4/1/2011 11:47,7.95,14419,United Kingdom
548614,21034,REX CASH+CARRY JUMBO SHOPPER,2,4/1/2011 11:47,0.95,14419,United Kingdom
548615,16010,,-7,4/1/2011 11:47,0,,United Kingdom
548616,21790,VINTAGE SNAP CARDS,36,4/1/2011 11:48,0.85,18263,United Kingdom
548616,22621,TRADITIONAL KNITTING NANCY,24,4/1/2011 11:48,1.45,18263,United Kingdom
548616,22615,PACK OF 12 CIRCUS PARADE TISSUES ,24,4/1/2011 11:48,0.29,18263,United Kingdom
548616,21891,TRADITIONAL WOODEN SKIPPING ROPE,24,4/1/2011 11:48,1.25,18263,United Kingdom
548616,21791,VINTAGE HEADS AND TAILS CARD GAME ,24,4/1/2011 11:48,1.25,18263,United Kingdom
548616,22548,HEADS AND TAILS SPORTING FUN,12,4/1/2011 11:48,1.25,18263,United Kingdom
548616,22561,WOODEN SCHOOL COLOURING SET,12,4/1/2011 11:48,1.65,18263,United Kingdom
548616,22652,TRAVEL SEWING KIT,20,4/1/2011 11:48,1.65,18263,United Kingdom
548616,21982,PACK OF 12 SUKI TISSUES ,24,4/1/2011 11:48,0.29,18263,United Kingdom
548616,21985,PACK OF 12 HEARTS DESIGN TISSUES ,24,4/1/2011 11:48,0.29,18263,United Kingdom
548616,21980,PACK OF 12 RED RETROSPOT TISSUES ,24,4/1/2011 11:48,0.29,18263,United Kingdom
548616,21983,PACK OF 12 BLUE PAISLEY TISSUES ,24,4/1/2011 11:48,0.29,18263,United Kingdom
548616,23077,DOUGHNUT LIP GLOSS ,20,4/1/2011 11:48,1.25,18263,United Kingdom
548616,23179,CLOCK MAGNET MUM'S KITCHEN,12,4/1/2011 11:48,2.89,18263,United Kingdom
548616,23182,TOILET SIGN OCCUPIED OR VACANT,24,4/1/2011 11:48,0.83,18263,United Kingdom
548617,22488,NATURAL SLATE RECTANGLE CHALKBOARD,12,4/1/2011 11:50,1.65,16592,United Kingdom
548617,22457,NATURAL SLATE HEART CHALKBOARD ,6,4/1/2011 11:50,2.95,16592,United Kingdom
548617,20992,JAZZ HEARTS PURSE NOTEBOOK,12,4/1/2011 11:50,0.85,16592,United Kingdom
548617,22247,BUNNY DECORATION MAGIC GARDEN,16,4/1/2011 11:50,0.85,16592,United Kingdom
548617,21430,SET/3 RED GINGHAM ROSE STORAGE BOX,4,4/1/2011 11:50,3.75,16592,United Kingdom
548617,15036,ASSORTED COLOURS SILK FAN,12,4/1/2011 11:50,0.83,16592,United Kingdom
548617,21035,SET/2 RED RETROSPOT TEA TOWELS ,6,4/1/2011 11:50,3.25,16592,United Kingdom
548617,21080,SET/20 RED RETROSPOT PAPER NAPKINS ,12,4/1/2011 11:50,0.85,16592,United Kingdom
548617,22084,PAPER CHAIN KIT EMPIRE,6,4/1/2011 11:50,2.95,16592,United Kingdom
548617,21155,RED RETROSPOT PEG BAG,6,4/1/2011 11:50,2.55,16592,United Kingdom
548617,21042,RED RETROSPOT APRON ,3,4/1/2011 11:50,5.95,16592,United Kingdom
548617,20725,LUNCH BAG RED RETROSPOT,10,4/1/2011 11:50,1.65,16592,United Kingdom
548617,84992,72 SWEETHEART FAIRY CAKE CASES,48,4/1/2011 11:50,0.55,16592,United Kingdom
548617,84991,60 TEATIME FAIRY CAKE CASES,120,4/1/2011 11:50,0.42,16592,United Kingdom
548617,84987,SET OF 36 TEATIME PAPER DOILIES,12,4/1/2011 11:50,1.45,16592,United Kingdom
548617,22197,SMALL POPCORN HOLDER,24,4/1/2011 11:50,0.85,16592,United Kingdom
548617,22558,CLOTHES PEGS RETROSPOT PACK 24 ,12,4/1/2011 11:50,1.65,16592,United Kingdom
548617,22464,HANGING METAL HEART LANTERN,12,4/1/2011 11:50,1.65,16592,United Kingdom
548618,22900, SET 2 TEA TOWELS I LOVE LONDON ,12,4/1/2011 11:50,3.25,15197,United Kingdom
548618,22713,CARD I LOVE LONDON ,12,4/1/2011 11:50,0.42,15197,United Kingdom
548618,22902,TOTE BAG I LOVE LONDON,12,4/1/2011 11:50,2.1,15197,United Kingdom
548618,22616,PACK OF 12 LONDON TISSUES ,24,4/1/2011 11:50,0.29,15197,United Kingdom
548618,22710,WRAP I LOVE LONDON ,25,4/1/2011 11:50,0.42,15197,United Kingdom
548618,22659,LUNCH BOX I LOVE LONDON,12,4/1/2011 11:50,1.95,15197,United Kingdom
548618,22970,LONDON BUS COFFEE MUG,6,4/1/2011 11:50,2.55,15197,United Kingdom
548618,22971,QUEENS GUARD COFFEE MUG,6,4/1/2011 11:50,2.55,15197,United Kingdom
548618,22619,SET OF 6 SOLDIER SKITTLES,4,4/1/2011 11:50,3.75,15197,United Kingdom
548618,22499,WOODEN UNION JACK BUNTING,3,4/1/2011 11:50,5.95,15197,United Kingdom
548618,22084,PAPER CHAIN KIT EMPIRE,6,4/1/2011 11:50,2.95,15197,United Kingdom
548618,22423,REGENCY CAKESTAND 3 TIER,2,4/1/2011 11:50,12.75,15197,United Kingdom
548619,23155,KNICKERBOCKERGLORY MAGNET ASSORTED ,12,4/1/2011 11:51,0.83,16592,United Kingdom
548620,84313B,Damaged,-32,4/1/2011 11:53,0,,United Kingdom
548621,M,Manual,3,4/1/2011 11:54,0.65,16960,United Kingdom
548621,22899,CHILDREN'S APRON DOLLY GIRL ,2,4/1/2011 11:54,2.1,16960,United Kingdom
548621,85200,BUNNY EGG BOX,4,4/1/2011 11:54,1.25,16960,United Kingdom
548621,20961,STRAWBERRY BATH SPONGE ,2,4/1/2011 11:54,1.25,16960,United Kingdom
548621,22957,SET 3 PAPER VINTAGE CHICK PAPER EGG,1,4/1/2011 11:54,2.95,16960,United Kingdom
548621,22967,SET 3 SONG BIRD PAPER EGGS ASSORTED,2,4/1/2011 11:54,2.95,16960,United Kingdom
548621,22859,EASTER TIN BUNNY BOUQUET,4,4/1/2011 11:54,1.65,16960,United Kingdom
548621,47566,PARTY BUNTING,2,4/1/2011 11:54,4.95,16960,United Kingdom
548621,84596L,BISCUITS SMALL BOWL LIGHT BLUE,4,4/1/2011 11:54,0.42,16960,United Kingdom
548621,21889,WOODEN BOX OF DOMINOES,2,4/1/2011 11:54,1.25,16960,United Kingdom
548621,22831,WHITE BROCANTE SOAP DISH,6,4/1/2011 11:54,2.95,16960,United Kingdom
548621,22131,FOOD CONTAINER SET 3 LOVE HEART ,2,4/1/2011 11:54,1.95,16960,United Kingdom
548621,22723,SET OF 6 HERB TINS SKETCHBOOK,2,4/1/2011 11:54,3.95,16960,United Kingdom
548621,22964,3 PIECE SPACEBOY COOKIE CUTTER SET,2,4/1/2011 11:54,2.1,16960,United Kingdom
548621,85197,SET OF 12 MINI BUNNIES IN A BUCKET,1,4/1/2011 11:54,2.1,16960,United Kingdom
548621,84380,SET OF 3 BUTTERFLY COOKIE CUTTERS,2,4/1/2011 11:54,1.25,16960,United Kingdom
548621,21559,STRAWBERRY LUNCH BOX WITH CUTLERY,2,4/1/2011 11:54,2.55,16960,United Kingdom
548621,22982,PANTRY PASTRY BRUSH,2,4/1/2011 11:54,1.25,16960,United Kingdom
548621,22435,SET OF 9 HEART SHAPED BALLOONS,3,4/1/2011 11:54,1.25,16960,United Kingdom
548621,47594B,SCOTTIES DESIGN WASHBAG,2,4/1/2011 11:54,1.95,16960,United Kingdom
548621,22195,LARGE HEART MEASURING SPOONS,2,4/1/2011 11:54,1.65,16960,United Kingdom
548621,22979,PANTRY WASHING UP BRUSH,2,4/1/2011 11:54,1.45,16960,United Kingdom
548621,22139,RETROSPOT TEA SET CERAMIC 11 PC ,1,4/1/2011 11:54,4.95,16960,United Kingdom
548621,22518,CHILDS GARDEN BRUSH BLUE,1,4/1/2011 11:54,2.1,16960,United Kingdom
548621,22519,CHILDS GARDEN BRUSH PINK,1,4/1/2011 11:54,2.1,16960,United Kingdom
548621,22993,SET OF 4 PANTRY JELLY MOULDS,2,4/1/2011 11:54,1.25,16960,United Kingdom
548621,22961,JAM MAKING SET PRINTED,4,4/1/2011 11:54,1.45,16960,United Kingdom
548621,22992,REVOLVER WOODEN RULER ,2,4/1/2011 11:54,1.95,16960,United Kingdom
548621,84828,JUNGLE POPSICLES ICE LOLLY MOULDS,2,4/1/2011 11:54,1.25,16960,United Kingdom
548621,22980,PANTRY SCRUBBING BRUSH,2,4/1/2011 11:54,1.65,16960,United Kingdom
548621,79160,HEART SHAPE WIRELESS DOORBELL,2,4/1/2011 11:54,2.1,16960,United Kingdom
548621,22180,RETROSPOT LAMP,1,4/1/2011 11:54,9.95,16960,United Kingdom
548621,21789,KIDS RAIN MAC PINK,5,4/1/2011 11:54,0.85,16960,United Kingdom
548621,22466,FAIRY TALE COTTAGE NIGHTLIGHT,2,4/1/2011 11:54,1.95,16960,United Kingdom
548621,21788,KIDS RAIN MAC BLUE,3,4/1/2011 11:54,0.85,16960,United Kingdom
548621,22726,ALARM CLOCK BAKELIKE GREEN,2,4/1/2011 11:54,3.75,16960,United Kingdom
548621,22727,ALARM CLOCK BAKELIKE RED ,1,4/1/2011 11:54,3.75,16960,United Kingdom
548621,22728,ALARM CLOCK BAKELIKE PINK,1,4/1/2011 11:54,3.75,16960,United Kingdom
548621,22429,ENAMEL MEASURING JUG CREAM,1,4/1/2011 11:54,4.25,16960,United Kingdom
548621,22624,IVORY KITCHEN SCALES,1,4/1/2011 11:54,8.5,16960,United Kingdom
548621,22989,SET 2 PANTRY DESIGN TEA TOWELS,2,4/1/2011 11:54,3.25,16960,United Kingdom
548621,22749,FELTCRAFT PRINCESS CHARLOTTE DOLL,1,4/1/2011 11:54,3.75,16960,United Kingdom
548621,22751,FELTCRAFT PRINCESS OLIVIA DOLL,1,4/1/2011 11:54,3.75,16960,United Kingdom
548621,22273,FELTCRAFT DOLL MOLLY,1,4/1/2011 11:54,2.95,16960,United Kingdom
548621,21034,REX CASH+CARRY JUMBO SHOPPER,2,4/1/2011 11:54,0.95,16960,United Kingdom
548622,21755,LOVE BUILDING BLOCK WORD,3,4/1/2011 12:09,5.95,13636,United Kingdom
548622,20724,RED RETROSPOT CHARLOTTE BAG,10,4/1/2011 12:09,0.85,13636,United Kingdom
548622,21314,SMALL GLASS HEART TRINKET POT,8,4/1/2011 12:09,2.1,13636,United Kingdom
548622,85123A,WHITE HANGING HEART T-LIGHT HOLDER,6,4/1/2011 12:09,2.95,13636,United Kingdom
548622,22855,FINE WICKER HEART ,12,4/1/2011 12:09,1.25,13636,United Kingdom
548622,20727,LUNCH BAG  BLACK SKULL.,10,4/1/2011 12:09,1.65,13636,United Kingdom
548622,85131A,BEADED PEARL HEART WHITE ON STICK,12,4/1/2011 12:09,1.25,13636,United Kingdom
548622,22794,SWEETHEART WIRE MAGAZINE RACK,2,4/1/2011 12:09,7.95,13636,United Kingdom
548622,22378,WALL TIDY RETROSPOT ,5,4/1/2011 12:09,2.1,13636,United Kingdom
548622,22212,FOUR HOOK  WHITE LOVEBIRDS,6,4/1/2011 12:09,2.1,13636,United Kingdom
548622,84971S,SMALL HEART FLOWERS HOOK ,24,4/1/2011 12:09,0.85,13636,United Kingdom
548622,85061W,WHITE JEWELLED HEART DECORATION,24,4/1/2011 12:09,0.85,13636,United Kingdom
548622,22457,NATURAL SLATE HEART CHALKBOARD ,6,4/1/2011 12:09,2.95,13636,United Kingdom
548622,22650,CERAMIC PIRATE CHEST MONEY BANK,12,4/1/2011 12:09,1.45,13636,United Kingdom
548622,20718,RED RETROSPOT SHOPPER BAG,10,4/1/2011 12:09,1.25,13636,United Kingdom
548622,22139,RETROSPOT TEA SET CERAMIC 11 PC ,3,4/1/2011 12:09,4.95,13636,United Kingdom
548623,16016,LARGE CHINESE STYLE SCISSOR,100,4/1/2011 12:10,0.85,13841,United Kingdom
548624,22424,ENAMEL BREAD BIN CREAM,1,4/1/2011 12:12,12.75,,United Kingdom
548624,22986,GINGHAM ROSE WRAP,4,4/1/2011 12:12,0.42,,United Kingdom
C548625,21463,MIRRORED DISCO BALL ,-2,4/1/2011 12:14,5.95,13078,United Kingdom
C548626,22193,RED DINER WALL CLOCK,-1,4/1/2011 12:16,8.5,15622,United Kingdom
548627,21915,RED  HARMONICA IN BOX ,280,4/1/2011 12:19,1.06,16333,United Kingdom
548627,22620,4 TRADITIONAL SPINNING TOPS,160,4/1/2011 12:19,1.06,16333,United Kingdom
548627,22440,BALLOON WATER BOMB PACK OF 35,1200,4/1/2011 12:19,0.36,16333,United Kingdom
548627,21891,TRADITIONAL WOODEN SKIPPING ROPE,288,4/1/2011 12:19,1.06,16333,United Kingdom
548627,84077,WORLD WAR 2 GLIDERS ASSTD DESIGNS,1152,4/1/2011 12:19,0.21,16333,United Kingdom
C548628,21820,GLITTER HEART GARLAND WITH BELLS ,-6,4/1/2011 12:19,3.75,13184,United Kingdom
548629,21749,LARGE RED RETROSPOT WINDMILL,192,4/1/2011 12:21,1.85,16333,United Kingdom
548630,21749,LARGE RED RETROSPOT WINDMILL,192,4/1/2011 12:22,1.85,16333,United Kingdom
548631,22156,HEART DECORATION WITH PEARLS ,5,4/1/2011 12:24,0.85,13184,United Kingdom
548631,22158,3 HEARTS HANGING DECORATION RUSTIC,8,4/1/2011 12:24,2.95,13184,United Kingdom
548631,22227,HANGING HEART MIRROR DECORATION ,10,4/1/2011 12:24,0.65,13184,United Kingdom
548631,22577,WOODEN HEART CHRISTMAS SCANDINAVIAN,5,4/1/2011 12:24,0.85,13184,United Kingdom
548631,22602,RETROSPOT WOODEN HEART DECORATION,20,4/1/2011 12:24,0.85,13184,United Kingdom
548631,22294,HEART FILIGREE DOVE  SMALL,5,4/1/2011 12:24,1.25,13184,United Kingdom
548631,21114,LAVENDER SCENTED FABRIC HEART,5,4/1/2011 12:24,1.25,13184,United Kingdom
548631,22284,HEN HOUSE DECORATION,1,4/1/2011 12:24,1.65,13184,United Kingdom
548631,22318,FIVE HEART HANGING DECORATION,10,4/1/2011 12:24,2.95,13184,United Kingdom
548631,22700,BLACK AND WHITE DOG BOWL,1,4/1/2011 12:24,2.95,13184,United Kingdom
548631,22776,SWEETHEART CAKESTAND 3 TIER,1,4/1/2011 12:24,9.95,13184,United Kingdom
548631,22595,GINGHAM HEART DECORATION,5,4/1/2011 12:24,0.85,13184,United Kingdom
548631,M,Manual,1,4/1/2011 12:24,1,13184,United Kingdom
548632,22191,IVORY DINER WALL CLOCK,2,4/1/2011 12:25,8.5,17701,United Kingdom
548632,22192,BLUE DINER WALL CLOCK,2,4/1/2011 12:25,8.5,17701,United Kingdom
548632,22193,RED DINER WALL CLOCK,2,4/1/2011 12:25,8.5,17701,United Kingdom
548632,22726,ALARM CLOCK BAKELIKE GREEN,4,4/1/2011 12:25,3.75,17701,United Kingdom
548632,22728,ALARM CLOCK BAKELIKE PINK,4,4/1/2011 12:25,3.75,17701,United Kingdom
548632,22727,ALARM CLOCK BAKELIKE RED ,4,4/1/2011 12:25,3.75,17701,United Kingdom
548632,21733,RED HANGING HEART T-LIGHT HOLDER,6,4/1/2011 12:25,2.95,17701,United Kingdom
548632,85123A,WHITE HANGING HEART T-LIGHT HOLDER,6,4/1/2011 12:25,2.95,17701,United Kingdom
548632,22969,HOMEMADE JAM SCENTED CANDLES,12,4/1/2011 12:25,1.45,17701,United Kingdom
548632,22382,LUNCH BAG SPACEBOY DESIGN ,10,4/1/2011 12:25,1.65,17701,United Kingdom
548632,20727,LUNCH BAG  BLACK SKULL.,10,4/1/2011 12:25,1.65,17701,United Kingdom
548632,22383,LUNCH BAG SUKI  DESIGN ,10,4/1/2011 12:25,1.65,17701,United Kingdom
548632,22662,LUNCH BAG DOLLY GIRL DESIGN,10,4/1/2011 12:25,1.65,17701,United Kingdom
548632,22282,12 EGG HOUSE PAINTED WOOD,2,4/1/2011 12:25,12.75,17701,United Kingdom
548632,22283,6 EGG HOUSE PAINTED WOOD,4,4/1/2011 12:25,7.95,17701,United Kingdom
548632,23052,RECYCLED ACAPULCO MAT TURQUOISE,2,4/1/2011 12:25,8.25,17701,United Kingdom
548632,23049,RECYCLED ACAPULCO MAT RED,2,4/1/2011 12:25,8.25,17701,United Kingdom
548632,23051,RECYCLED ACAPULCO MAT BLUE,2,4/1/2011 12:25,8.25,17701,United Kingdom
548632,23053,RECYCLED ACAPULCO MAT PINK,2,4/1/2011 12:25,8.25,17701,United Kingdom
548632,23050,RECYCLED ACAPULCO MAT GREEN,2,4/1/2011 12:25,8.25,17701,United Kingdom
548632,23054,RECYCLED ACAPULCO MAT LAVENDER,2,4/1/2011 12:25,8.25,17701,United Kingdom
548632,71053,WHITE METAL LANTERN,4,4/1/2011 12:25,3.75,17701,United Kingdom
548632,22784,LANTERN CREAM GAZEBO ,3,4/1/2011 12:25,4.95,17701,United Kingdom
548632,22799,SWEETHEART WIRE FRUIT BOWL,2,4/1/2011 12:25,8.5,17701,United Kingdom
548633,22693,GROW A FLYTRAP OR SUNFLOWER IN TIN,864,4/1/2011 12:25,1.06,16333,United Kingdom
548634,15044D,RED PAPER PARASOL,6,4/1/2011 12:26,2.95,12877,United Kingdom
548634,15044A,PINK PAPER PARASOL ,6,4/1/2011 12:26,2.95,12877,United Kingdom
548634,15044B,BLUE PAPER PARASOL ,6,4/1/2011 12:26,2.95,12877,United Kingdom
548634,22502,PICNIC BASKET WICKER SMALL,4,4/1/2011 12:26,5.95,12877,United Kingdom
548634,22922,FRIDGE MAGNETS US DINER ASSORTED,12,4/1/2011 12:26,0.85,12877,United Kingdom
548635,84077,WORLD WAR 2 GLIDERS ASSTD DESIGNS,1152,4/1/2011 12:27,0.21,16333,United Kingdom
548635,21915,RED  HARMONICA IN BOX ,280,4/1/2011 12:27,1.06,16333,United Kingdom
548636,23156,SET OF 5 MINI GROCERY MAGNETS,12,4/1/2011 12:29,2.08,15601,United Kingdom
548636,23159,SET OF 5 PANCAKE DAY MAGNETS,12,4/1/2011 12:29,2.08,15601,United Kingdom
548636,21232,STRAWBERRY CERAMIC TRINKET BOX,12,4/1/2011 12:29,1.25,15601,United Kingdom
548636,21754,HOME BUILDING BLOCK WORD,3,4/1/2011 12:29,5.95,15601,United Kingdom
548636,22026,BANQUET BIRTHDAY  CARD  ,12,4/1/2011 12:29,0.42,15601,United Kingdom
548636,21506,"FANCY FONT BIRTHDAY CARD, ",12,4/1/2011 12:29,0.42,15601,United Kingdom
548636,21509,COWBOYS AND INDIANS BIRTHDAY CARD ,12,4/1/2011 12:29,0.42,15601,United Kingdom
548636,21507,"ELEPHANT, BIRTHDAY CARD, ",12,4/1/2011 12:29,0.42,15601,United Kingdom
548636,21519,GIN & TONIC DIET GREETING CARD ,12,4/1/2011 12:29,0.42,15601,United Kingdom
548636,22025,RING OF ROSES BIRTHDAY CARD,12,4/1/2011 12:29,0.42,15601,United Kingdom
548636,22027,TEA PARTY BIRTHDAY CARD,12,4/1/2011 12:29,0.42,15601,United Kingdom
548636,22035,VINTAGE CARAVAN GREETING CARD ,12,4/1/2011 12:29,0.42,15601,United Kingdom
548636,21508,VINTAGE KID DOLLY CARD ,12,4/1/2011 12:29,0.42,15601,United Kingdom
548636,22714,CARD BIRTHDAY COWBOY,12,4/1/2011 12:29,0.42,15601,United Kingdom
548636,22717,CARD DOG AND BALL ,12,4/1/2011 12:29,0.42,15601,United Kingdom
548636,22028,PENNY FARTHING BIRTHDAY CARD,12,4/1/2011 12:29,0.42,15601,United Kingdom
548636,22766,PHOTO FRAME CORNICE,8,4/1/2011 12:29,2.95,15601,United Kingdom
548636,22500,SET OF 2 TINS JARDIN DE PROVENCE,4,4/1/2011 12:29,4.95,15601,United Kingdom
548636,22497,SET OF 2 TINS VINTAGE BATHROOM ,4,4/1/2011 12:29,4.25,15601,United Kingdom
548636,85123A,WHITE HANGING HEART T-LIGHT HOLDER,12,4/1/2011 12:29,2.95,15601,United Kingdom
548636,82483,WOOD 2 DRAWER CABINET WHITE FINISH,4,4/1/2011 12:29,6.95,15601,United Kingdom
548637,84596E,,5,4/1/2011 12:32,0,,United Kingdom
548638,21258,,4,4/1/2011 12:34,0,,United Kingdom
548639,22627,,1,4/1/2011 12:34,0,,United Kingdom
548640,22283,6 EGG HOUSE PAINTED WOOD,6,4/1/2011 12:41,7.95,17580,United Kingdom
548641,21749,LARGE RED RETROSPOT WINDMILL,312,4/1/2011 12:56,1.85,16333,United Kingdom
548642,22776,SWEETHEART CAKESTAND 3 TIER,1,4/1/2011 13:00,9.95,17287,United Kingdom
548642,84879,ASSORTED COLOUR BIRD ORNAMENT,6,4/1/2011 13:00,1.69,17287,United Kingdom
548642,22294,HEART FILIGREE DOVE  SMALL,48,4/1/2011 13:00,1.25,17287,United Kingdom
548642,22326,ROUND SNACK BOXES SET OF4 WOODLAND ,1,4/1/2011 13:00,2.95,17287,United Kingdom
548642,21294,ETCHED GLASS COASTER,6,4/1/2011 13:00,0.39,17287,United Kingdom
548642,22616,PACK OF 12 LONDON TISSUES ,12,4/1/2011 13:00,0.29,17287,United Kingdom
548642,84406B,CREAM CUPID HEARTS COAT HANGER,2,4/1/2011 13:00,4.15,17287,United Kingdom
548642,22907,PACK OF 20 NAPKINS PANTRY DESIGN,6,4/1/2011 13:00,0.85,17287,United Kingdom
548642,22851,SET 20 NAPKINS FAIRY CAKES DESIGN ,6,4/1/2011 13:00,0.85,17287,United Kingdom
548642,22713,CARD I LOVE LONDON ,12,4/1/2011 13:00,0.42,17287,United Kingdom
548642,21507,"ELEPHANT, BIRTHDAY CARD, ",12,4/1/2011 13:00,0.42,17287,United Kingdom
548642,72800B, 4 PURPLE FLOCK DINNER CANDLES,3,4/1/2011 13:00,2.55,17287,United Kingdom
548642,72800D,4 BLUE DINNER CANDLES SILVER FLOCK,2,4/1/2011 13:00,2.55,17287,United Kingdom
548642,72800C,4 PINK DINNER CANDLE SILVER FLOCK,2,4/1/2011 13:00,2.55,17287,United Kingdom
548642,72760B,VINTAGE CREAM 3 BASKET CAKE STAND,1,4/1/2011 13:00,9.95,17287,United Kingdom
548643,22355,CHARLOTTE BAG SUKI DESIGN,100,4/1/2011 13:01,0.72,14680,United Kingdom
548644,22212,FOUR HOOK  WHITE LOVEBIRDS,144,4/1/2011 13:02,1.69,15291,United Kingdom
548644,22241,GARLAND WOODEN HAPPY EASTER,144,4/1/2011 13:02,1.06,15291,United Kingdom
548645,21609,SET 12 LAVENDER  BOTANICAL T-LIGHTS,96,4/1/2011 13:04,2.55,17457,United Kingdom
548645,85036A,GARDENIA 1 WICK MORRIS BOXED CANDLE,18,4/1/2011 13:04,3.81,17457,United Kingdom
548646,21472,,-140,4/1/2011 13:15,0,,United Kingdom
C548647,37449,CERAMIC CAKE STAND + HANGING CAKES,-3,4/1/2011 13:17,9.95,12888,United Kingdom
548648,21212,PACK OF 72 RETROSPOT CAKE CASES,24,4/1/2011 13:20,0.55,12949,United Kingdom
548648,20979,36 PENCILS TUBE RED RETROSPOT,16,4/1/2011 13:20,1.25,12949,United Kingdom
548648,20983,12 PENCILS TALL TUBE RED RETROSPOT,12,4/1/2011 13:20,0.85,12949,United Kingdom
548648,37370,RETRO COFFEE MUGS ASSORTED,24,4/1/2011 13:20,1.25,12949,United Kingdom
548648,22423,REGENCY CAKESTAND 3 TIER,3,4/1/2011 13:20,12.75,12949,United Kingdom
548648,22697,GREEN REGENCY TEACUP AND SAUCER,6,4/1/2011 13:20,2.95,12949,United Kingdom
548648,22699,ROSES REGENCY TEACUP AND SAUCER ,6,4/1/2011 13:20,2.95,12949,United Kingdom
548648,21068,VINTAGE BILLBOARD LOVE/HATE MUG,12,4/1/2011 13:20,1.25,12949,United Kingdom
548648,84050,PINK HEART SHAPE EGG FRYING PAN,12,4/1/2011 13:20,1.65,12949,United Kingdom
548648,85014B,RED RETROSPOT UMBRELLA,6,4/1/2011 13:20,5.95,12949,United Kingdom
548648,21980,PACK OF 12 RED RETROSPOT TISSUES ,24,4/1/2011 13:20,0.29,12949,United Kingdom
548648,84991,60 TEATIME FAIRY CAKE CASES,24,4/1/2011 13:20,0.55,12949,United Kingdom
548648,84987,SET OF 36 TEATIME PAPER DOILIES,12,4/1/2011 13:20,1.45,12949,United Kingdom
548648,79000,MOROCCAN TEA GLASS,24,4/1/2011 13:20,0.85,12949,United Kingdom
548648,22303,COFFEE MUG APPLES DESIGN,6,4/1/2011 13:20,2.55,12949,United Kingdom
548648,22914,BLUE COAT RACK PARIS FASHION,3,4/1/2011 13:20,4.95,12949,United Kingdom
548648,22773,GREEN DRAWER KNOB ACRYLIC EDWARDIAN,12,4/1/2011 13:20,1.25,12949,United Kingdom
548648,22805,BLUE DRAWER KNOB ACRYLIC EDWARDIAN,12,4/1/2011 13:20,1.25,12949,United Kingdom
548648,22771,CLEAR DRAWER KNOB ACRYLIC EDWARDIAN,12,4/1/2011 13:20,1.25,12949,United Kingdom
548648,21135,VICTORIAN  METAL POSTCARD SPRING,24,4/1/2011 13:20,1.69,12949,United Kingdom
548648,82583,HOT BATHS METAL SIGN,12,4/1/2011 13:20,2.1,12949,United Kingdom
548648,82551,LAUNDRY 15C METAL SIGN,12,4/1/2011 13:20,1.45,12949,United Kingdom
548648,82552,WASHROOM METAL SIGN,12,4/1/2011 13:20,1.45,12949,United Kingdom
548648,21174,POTTERING IN THE SHED METAL SIGN,12,4/1/2011 13:20,2.08,12949,United Kingdom
548648,82600,NO SINGING METAL SIGN,12,4/1/2011 13:20,2.1,12949,United Kingdom
548648,21172,PARTY METAL SIGN ,12,4/1/2011 13:20,1.45,12949,United Kingdom
548648,22792,FLUTED ANTIQUE CANDLE HOLDER,12,4/1/2011 13:20,0.85,12949,United Kingdom
548648,22178,VICTORIAN GLASS HANGING T-LIGHT,12,4/1/2011 13:20,1.25,12949,United Kingdom
548648,85123A,WHITE HANGING HEART T-LIGHT HOLDER,12,4/1/2011 13:20,2.95,12949,United Kingdom
548648,22478,BIRDHOUSE GARDEN MARKER ,10,4/1/2011 13:20,1.25,12949,United Kingdom
548648,84406B,CREAM CUPID HEARTS COAT HANGER,8,4/1/2011 13:20,4.15,12949,United Kingdom
548648,84792,ENCHANTED BIRD COATHANGER 5 HOOK,8,4/1/2011 13:20,4.65,12949,United Kingdom
548648,21136,PAINTED METAL PEARS ASSORTED,24,4/1/2011 13:20,1.69,12949,United Kingdom
548648,84879,ASSORTED COLOUR BIRD ORNAMENT,24,4/1/2011 13:20,1.69,12949,United Kingdom
548648,21430,SET/3 RED GINGHAM ROSE STORAGE BOX,4,4/1/2011 13:20,3.75,12949,United Kingdom
548648,84755,COLOUR GLASS T-LIGHT HOLDER HANGING,32,4/1/2011 13:20,0.65,12949,United Kingdom
548648,84970S,HANGING HEART ZINC T-LIGHT HOLDER,24,4/1/2011 13:20,0.85,12949,United Kingdom
548648,71459,HANGING JAM JAR T-LIGHT HOLDER,24,4/1/2011 13:20,0.85,12949,United Kingdom
548648,22460,EMBOSSED GLASS TEALIGHT HOLDER,12,4/1/2011 13:20,1.25,12949,United Kingdom
548648,84949,SILVER HANGING T-LIGHT HOLDER,12,4/1/2011 13:20,1.65,12949,United Kingdom
548648,84947,ANTIQUE SILVER TEA GLASS ENGRAVED,24,4/1/2011 13:20,1.25,12949,United Kingdom
548648,84946,ANTIQUE SILVER T-LIGHT GLASS,24,4/1/2011 13:20,1.25,12949,United Kingdom
