574069,23565,EGG CUP MILKMAID HELGA ,12,11/2/2011 14:52,1.25,17735,United Kingdom
574069,23566,EGG CUP MILKMAID HEIDI,12,11/2/2011 14:52,1.25,17735,United Kingdom
574069,23583,LUNCH BAG PAISLEY PARK  ,30,11/2/2011 14:52,1.65,17735,United Kingdom
574069,22596,CHRISTMAS STAR WISH LIST CHALKBOARD,12,11/2/2011 14:52,1.25,17735,United Kingdom
574069,23206,LUNCH BAG APPLE DESIGN,10,11/2/2011 14:52,1.65,17735,United Kingdom
574069,23424,GINGHAM RECIPE BOOK BOX,4,11/2/2011 14:52,4.95,17735,United Kingdom
574069,21210,SET OF 72 RETROSPOT PAPER  DOILIES,12,11/2/2011 14:52,1.45,17735,United Kingdom
574069,23295,SET OF 12 MINI LOAF BAKING CASES,8,11/2/2011 14:52,0.83,17735,United Kingdom
574069,23296,SET OF 6 TEA TIME BAKING CASES,8,11/2/2011 14:52,1.25,17735,United Kingdom
574069,23209,LUNCH BAG VINTAGE DOILY ,20,11/2/2011 14:52,1.65,17735,United Kingdom
574069,23208,LUNCH BAG VINTAGE LEAF DESIGN,10,11/2/2011 14:52,1.65,17735,United Kingdom
574069,20725,LUNCH BAG RED RETROSPOT,10,11/2/2011 14:52,1.65,17735,United Kingdom
574069,22383,LUNCH BAG SUKI DESIGN ,20,11/2/2011 14:52,1.65,17735,United Kingdom
574069,20726,LUNCH BAG WOODLAND,10,11/2/2011 14:52,1.65,17735,United Kingdom
574069,22112,CHOCOLATE HOT WATER BOTTLE,3,11/2/2011 14:52,4.95,17735,United Kingdom
574069,22114,HOT WATER BOTTLE TEA AND SYMPATHY,4,11/2/2011 14:52,4.25,17735,United Kingdom
574069,22867,HAND WARMER BIRD DESIGN,12,11/2/2011 14:52,2.1,17735,United Kingdom
574069,22865,HAND WARMER OWL DESIGN,12,11/2/2011 14:52,2.1,17735,United Kingdom
574069,23439,HAND WARMER RED LOVE HEART,12,11/2/2011 14:52,2.1,17735,United Kingdom
574070,23200,JUMBO BAG PEARS,10,11/2/2011 14:52,2.08,16748,United Kingdom
574070,23202,JUMBO BAG VINTAGE LEAF,10,11/2/2011 14:52,2.08,16748,United Kingdom
574070,85025B,EAU DE NILE HEART SHAPE PHOTO FRAME,12,11/2/2011 14:52,1.65,16748,United Kingdom
574070,85099B,JUMBO BAG RED RETROSPOT,10,11/2/2011 14:52,2.08,16748,United Kingdom
574070,85034C,3 ROSE MORRIS BOXED CANDLES,24,11/2/2011 14:52,1.25,16748,United Kingdom
574070,85034A,3 GARDENIA MORRIS BOXED CANDLES,24,11/2/2011 14:52,1.25,16748,United Kingdom
574070,85036C,ROSE 1 WICK MORRIS BOXED CANDLE,18,11/2/2011 14:52,1.25,16748,United Kingdom
574070,21931,JUMBO STORAGE BAG SUKI,10,11/2/2011 14:52,2.08,16748,United Kingdom
574070,21928,JUMBO BAG SCANDINAVIAN BLUE PAISLEY,10,11/2/2011 14:52,2.08,16748,United Kingdom
574070,22385,JUMBO BAG SPACEBOY DESIGN,10,11/2/2011 14:52,2.08,16748,United Kingdom
574070,22411,JUMBO SHOPPER VINTAGE RED PAISLEY,10,11/2/2011 14:52,2.08,16748,United Kingdom
574070,85099C,JUMBO  BAG BAROQUE BLACK WHITE,10,11/2/2011 14:52,2.08,16748,United Kingdom
574070,85099F,JUMBO BAG STRAWBERRY,10,11/2/2011 14:52,2.08,16748,United Kingdom
574070,20727,LUNCH BAG  BLACK SKULL.,10,11/2/2011 14:52,1.65,16748,United Kingdom
574070,22384,LUNCH BAG PINK POLKADOT,10,11/2/2011 14:52,1.65,16748,United Kingdom
574070,23206,LUNCH BAG APPLE DESIGN,10,11/2/2011 14:52,1.65,16748,United Kingdom
574071,23079,TOADSTOOL BEDSIDE LIGHT ,2,11/2/2011 14:57,8.95,12654,Germany
574071,23439,HAND WARMER RED LOVE HEART,12,11/2/2011 14:57,2.1,12654,Germany
574071,22867,HAND WARMER BIRD DESIGN,12,11/2/2011 14:57,2.1,12654,Germany
574071,22138,BAKING SET 9 PIECE RETROSPOT ,3,11/2/2011 14:57,4.95,12654,Germany
574071,22720,SET OF 3 CAKE TINS PANTRY DESIGN ,3,11/2/2011 14:57,4.95,12654,Germany
574071,22423,REGENCY CAKESTAND 3 TIER,1,11/2/2011 14:57,12.75,12654,Germany
574071,23031,DRAWER KNOB CRACKLE GLAZE PINK,6,11/2/2011 14:57,1.65,12654,Germany
574071,23032,DRAWER KNOB CRACKLE GLAZE IVORY,6,11/2/2011 14:57,1.65,12654,Germany
574071,84832,ZINC WILLIE WINKIE  CANDLE STICK,12,11/2/2011 14:57,0.85,12654,Germany
574071,POST,POSTAGE,1,11/2/2011 14:57,18,12654,Germany
574071,23084,RABBIT NIGHT LIGHT,6,11/2/2011 14:57,2.08,12654,Germany
574072,23080,RED METAL BOX TOP SECRET,2,11/2/2011 14:58,8.25,15414,United Kingdom
574072,22816,CARD MOTORBIKE SANTA,36,11/2/2011 14:58,0.42,15414,United Kingdom
574072,22910,PAPER CHAIN KIT VINTAGE CHRISTMAS,12,11/2/2011 14:58,2.95,15414,United Kingdom
574072,22086,PAPER CHAIN KIT 50'S CHRISTMAS ,6,11/2/2011 14:58,2.95,15414,United Kingdom
574072,22144,CHRISTMAS CRAFT LITTLE FRIENDS,12,11/2/2011 14:58,2.1,15414,United Kingdom
574072,21754,HOME BUILDING BLOCK WORD,3,11/2/2011 14:58,6.25,15414,United Kingdom
574072,21756,BATH BUILDING BLOCK WORD,3,11/2/2011 14:58,6.25,15414,United Kingdom
574072,22271,FELTCRAFT DOLL ROSIE,6,11/2/2011 14:58,2.95,15414,United Kingdom
574072,22274,FELTCRAFT DOLL EMILY,6,11/2/2011 14:58,2.95,15414,United Kingdom
574072,22621,TRADITIONAL KNITTING NANCY,12,11/2/2011 14:58,1.65,15414,United Kingdom
574072,22138,BAKING SET 9 PIECE RETROSPOT ,12,11/2/2011 14:58,4.95,15414,United Kingdom
574072,22617,BAKING SET SPACEBOY DESIGN,12,11/2/2011 14:58,4.95,15414,United Kingdom
574072,20992,JAZZ HEARTS PURSE NOTEBOOK,72,11/2/2011 14:58,0.39,15414,United Kingdom
574072,23367,SET 12 COLOUR PENCILS SPACEBOY ,16,11/2/2011 14:58,0.65,15414,United Kingdom
574072,23368,SET 12 COLOUR PENCILS DOLLY GIRL ,16,11/2/2011 14:58,0.65,15414,United Kingdom
574072,21791,VINTAGE HEADS AND TAILS CARD GAME ,12,11/2/2011 14:58,1.25,15414,United Kingdom
574073,23579,,3,11/2/2011 15:15,0,,United Kingdom
574074,21066,VINTAGE RED MUG,2,11/2/2011 15:33,2.46,,United Kingdom
574074,21068,VINTAGE BILLBOARD LOVE/HATE MUG,2,11/2/2011 15:33,2.46,,United Kingdom
574074,21116,OWL DOORSTOP,1,11/2/2011 15:33,8.29,,United Kingdom
574074,21147,JINGLE BELLS TREE DECORATION,2,11/2/2011 15:33,1.63,,United Kingdom
574074,21189,WHITE HONEYCOMB PAPER GARLAND ,25,11/2/2011 15:33,3.29,,United Kingdom
574074,21222,SET/4 BADGES BEETLES,1,11/2/2011 15:33,2.46,,United Kingdom
574074,21232,STRAWBERRY CERAMIC TRINKET POT,1,11/2/2011 15:33,2.46,,United Kingdom
574074,21239,PINK  POLKADOT CUP,1,11/2/2011 15:33,1.63,,United Kingdom
574074,21260,FIRST AID TIN,1,11/2/2011 15:33,6.63,,United Kingdom
574074,21313,GLASS HEART T-LIGHT HOLDER ,4,11/2/2011 15:33,1.63,,United Kingdom
574074,21314,SMALL GLASS HEART TRINKET POT,3,11/2/2011 15:33,4.13,,United Kingdom
574074,21327,SKULLS WRITING SET ,1,11/2/2011 15:33,3.29,,United Kingdom
574074,21329,DINOSAURS  WRITING SET ,1,11/2/2011 15:33,3.29,,United Kingdom
574074,21446,12 RED ROSE PEG PLACE SETTINGS,1,11/2/2011 15:33,2.46,,United Kingdom
574074,21479,WHITE SKULL HOT WATER BOTTLE ,1,11/2/2011 15:33,8.29,,United Kingdom
574074,21494,ROTATING LEAVES T-LIGHT HOLDER,1,11/2/2011 15:33,2.46,,United Kingdom
574074,21558,SKULL LUNCH BOX WITH CUTLERY ,1,11/2/2011 15:33,4.96,,United Kingdom
574074,21618,4 WILDFLOWER BOTANICAL CANDLES,4,11/2/2011 15:33,3.29,,United Kingdom
574074,21666,RIDGED GLASS T-LIGHT HOLDER,3,11/2/2011 15:33,1.63,,United Kingdom
574074,21680,WOODLAND  STICKERS,1,11/2/2011 15:33,1.63,,United Kingdom
574074,21716,BOYS VINTAGE TIN SEASIDE BUCKET,1,11/2/2011 15:33,4.96,,United Kingdom
574074,21744,SNOWFLAKE PORTABLE TABLE LIGHT ,1,11/2/2011 15:33,2.46,,United Kingdom
574074,21754,HOME BUILDING BLOCK WORD,1,11/2/2011 15:33,11.63,,United Kingdom
574074,21755,LOVE BUILDING BLOCK WORD,2,11/2/2011 15:33,12.46,,United Kingdom
574074,21773,DECORATIVE ROSE BATHROOM BOTTLE,2,11/2/2011 15:33,2.46,,United Kingdom
574074,21774,DECORATIVE CATS BATHROOM BOTTLE,1,11/2/2011 15:33,2.46,,United Kingdom
574074,21775,DECORATIVE FLORE BATHROOM BOTTLE,2,11/2/2011 15:33,2.46,,United Kingdom
574074,21786,POLKADOT RAIN HAT ,1,11/2/2011 15:33,0.83,,United Kingdom
574074,21790,VINTAGE SNAP CARDS,3,11/2/2011 15:33,1.63,,United Kingdom
574074,21810,CHRISTMAS HANGING STAR WITH BELL,1,11/2/2011 15:33,0.83,,United Kingdom
574074,21811,HANGING HEART WITH BELL,13,11/2/2011 15:33,0.83,,United Kingdom
574074,21812,GARLAND WITH HEARTS AND BELLS,5,11/2/2011 15:33,3.29,,United Kingdom
574074,21813,GARLAND WITH STARS AND BELLS,1,11/2/2011 15:33,3.29,,United Kingdom
574074,21824,PAINTED METAL STAR WITH HOLLY BELLS,14,11/2/2011 15:33,0.83,,United Kingdom
574074,21832,CHOCOLATE CALCULATOR,2,11/2/2011 15:33,3.29,,United Kingdom
574074,21888,BINGO SET,1,11/2/2011 15:33,7.46,,United Kingdom
574074,21892,TRADITIONAL WOODEN CATCH CUP GAME ,1,11/2/2011 15:33,2.46,,United Kingdom
574074,21908,CHOCOLATE THIS WAY METAL SIGN,1,11/2/2011 15:33,4.13,,United Kingdom
574074,21928,JUMBO BAG SCANDINAVIAN BLUE PAISLEY,1,11/2/2011 15:33,4.13,,United Kingdom
574074,21929,JUMBO BAG PINK VINTAGE PAISLEY,3,11/2/2011 15:33,4.13,,United Kingdom
574074,21931,JUMBO STORAGE BAG SUKI,2,11/2/2011 15:33,4.13,,United Kingdom
574074,21934,SKULL SHOULDER BAG,4,11/2/2011 15:33,1.63,,United Kingdom
574074,21935,SUKI  SHOULDER BAG,5,11/2/2011 15:33,1.63,,United Kingdom
574074,21976,PACK OF 60 MUSHROOM CAKE CASES,1,11/2/2011 15:33,1.25,,United Kingdom
574074,21977,PACK OF 60 PINK PAISLEY CAKE CASES,1,11/2/2011 15:33,1.25,,United Kingdom
574074,21981,PACK OF 12 WOODLAND TISSUES ,2,11/2/2011 15:33,0.83,,United Kingdom
574074,21982,PACK OF 12 SUKI TISSUES ,1,11/2/2011 15:33,0.83,,United Kingdom
574074,21984,PACK OF 12 PINK PAISLEY TISSUES ,1,11/2/2011 15:33,0.83,,United Kingdom
574074,21985,PACK OF 12 HEARTS DESIGN TISSUES ,1,11/2/2011 15:33,0.83,,United Kingdom
574074,21990,MODERN FLORAL STATIONERY SET,3,11/2/2011 15:33,2.46,,United Kingdom
574074,21992,VINTAGE PAISLEY STATIONERY SET,1,11/2/2011 15:33,2.46,,United Kingdom
574074,21993,FLORAL FOLK STATIONERY SET,2,11/2/2011 15:33,2.46,,United Kingdom
574074,22029,SPACEBOY BIRTHDAY CARD,1,11/2/2011 15:33,0.83,,United Kingdom
574074,22065,CHRISTMAS PUDDING TRINKET POT ,4,11/2/2011 15:33,1.63,,United Kingdom
574074,22075,6 RIBBONS ELEGANT CHRISTMAS ,1,11/2/2011 15:33,1.63,,United Kingdom
574074,22080,RIBBON REEL POLKADOTS ,1,11/2/2011 15:33,3.29,,United Kingdom
574074,22086,PAPER CHAIN KIT 50'S CHRISTMAS ,6,11/2/2011 15:33,5.79,,United Kingdom
574074,22091,EMPIRE TISSUE BOX,1,11/2/2011 15:33,2.46,,United Kingdom
574074,22104,MIRROR MOSAIC CANDLE PLATE,1,11/2/2011 15:33,1.63,,United Kingdom
574074,22107,PIZZA PLATE IN BOX,2,11/2/2011 15:33,3.29,,United Kingdom
574074,22110,BIRD HOUSE HOT WATER BOTTLE,1,11/2/2011 15:33,5.79,,United Kingdom
574074,22116,METAL SIGN HIS DINNER IS SERVED,2,11/2/2011 15:33,1.63,,United Kingdom
574074,22123,PING MICROWAVE APRON,1,11/2/2011 15:33,4.13,,United Kingdom
574074,22124,SET OF 2 TEA TOWELS PING MICROWAVE,1,11/2/2011 15:33,2.46,,United Kingdom
574074,22141,CHRISTMAS CRAFT TREE TOP ANGEL,1,11/2/2011 15:33,4.13,,United Kingdom
574074,22144,CHRISTMAS CRAFT LITTLE FRIENDS,1,11/2/2011 15:33,4.13,,United Kingdom
574074,22153,ANGEL DECORATION STARS ON DRESS,1,11/2/2011 15:33,0.83,,United Kingdom
574074,22154,ANGEL DECORATION 3 BUTTONS ,1,11/2/2011 15:33,0.83,,United Kingdom
574074,22155,STAR DECORATION RUSTIC,3,11/2/2011 15:33,0.83,,United Kingdom
574074,22161,HEART DECORATION RUSTIC HANGING ,8,11/2/2011 15:33,0.79,,United Kingdom
574074,22162,HEART GARLAND RUSTIC PADDED,2,11/2/2011 15:33,3.29,,United Kingdom
574074,22163,HEART STRING MEMO HOLDER HANGING,6,11/2/2011 15:33,1.63,,United Kingdom
574074,22166,WALL MIRROR RECTANGLE DIAMANTE PINK,1,11/2/2011 15:33,7.46,,United Kingdom
574074,22167, OVAL WALL MIRROR DIAMANTE ,1,11/2/2011 15:33,8.29,,United Kingdom
574074,22174,PHOTO CUBE,1,11/2/2011 15:33,3.29,,United Kingdom
574074,22192,BLUE DINER WALL CLOCK,1,11/2/2011 15:33,16.63,,United Kingdom
574074,22195,LARGE HEART MEASURING SPOONS,1,11/2/2011 15:33,3.29,,United Kingdom
574074,22197,POPCORN HOLDER,11,11/2/2011 15:33,1.63,,United Kingdom
574074,22219,LOVEBIRD HANGING DECORATION WHITE ,5,11/2/2011 15:33,1.63,,United Kingdom
574074,22227,HANGING HEART MIRROR DECORATION ,1,11/2/2011 15:33,1.25,,United Kingdom
574074,22230,JIGSAW TREE WITH WATERING CAN,1,11/2/2011 15:33,1.63,,United Kingdom
574074,22231,JIGSAW TREE WITH BIRDHOUSE,1,11/2/2011 15:33,3.29,,United Kingdom
574074,22273,FELTCRAFT DOLL MOLLY,1,11/2/2011 15:33,5.79,,United Kingdom
574074,22274,FELTCRAFT DOLL EMILY,1,11/2/2011 15:33,5.79,,United Kingdom
574074,22277,COSMETIC BAG VINTAGE ROSE PAISLEY,1,11/2/2011 15:33,4.13,,United Kingdom
574074,22294,HEART FILIGREE DOVE  SMALL,3,11/2/2011 15:33,2.46,,United Kingdom
574074,22329,ROUND CONTAINER SET OF 5 RETROSPOT,1,11/2/2011 15:33,3.29,,United Kingdom
574074,22337,ANGEL DECORATION PAINTED ZINC ,3,11/2/2011 15:33,0.63,,United Kingdom
574074,22339,CHRISTMAS TREE PAINTED ZINC ,3,11/2/2011 15:33,0.63,,United Kingdom
574074,22340,NOEL GARLAND PAINTED ZINC ,5,11/2/2011 15:33,0.83,,United Kingdom
574074,22354,RETROSPOT PADDED SEAT CUSHION,5,11/2/2011 15:33,7.46,,United Kingdom
574074,22355,CHARLOTTE BAG SUKI DESIGN,2,11/2/2011 15:33,1.63,,United Kingdom
574074,22356,CHARLOTTE BAG PINK POLKADOT,11,11/2/2011 15:33,1.63,,United Kingdom
574074,22359,GLASS JAR KINGS CHOICE,1,11/2/2011 15:33,5.79,,United Kingdom
574074,22361,GLASS JAR DAISY FRESH COTTON WOOL,1,11/2/2011 15:33,5.79,,United Kingdom
574074,22362,GLASS JAR PEACOCK BATH SALTS,1,11/2/2011 15:33,5.79,,United Kingdom
574074,22364,GLASS JAR DIGESTIVE BISCUITS,2,11/2/2011 15:33,5.79,,United Kingdom
574074,22365,DOORMAT RESPECTABLE HOUSE,1,11/2/2011 15:33,15.79,,United Kingdom
574074,22366,DOORMAT AIRMAIL ,1,11/2/2011 15:33,15.79,,United Kingdom
574074,22378,WALL TIDY RETROSPOT ,2,11/2/2011 15:33,4.13,,United Kingdom
574074,22379,RECYCLING BAG RETROSPOT ,1,11/2/2011 15:33,4.13,,United Kingdom
574074,22386,JUMBO BAG PINK POLKADOT,1,11/2/2011 15:33,4.13,,United Kingdom
574074,22418,10 COLOUR SPACEBOY PEN,3,11/2/2011 15:33,1.63,,United Kingdom
574074,22419,LIPSTICK PEN RED,3,11/2/2011 15:33,0.83,,United Kingdom
574074,22422,TOOTHPASTE TUBE PEN,4,11/2/2011 15:33,1.25,,United Kingdom
574074,22423,REGENCY CAKESTAND 3 TIER,2,11/2/2011 15:33,24.96,,United Kingdom
574074,22435,SET OF 9 HEART SHAPED BALLOONS,1,11/2/2011 15:33,2.46,,United Kingdom
574074,22441,GROW YOUR OWN BASIL IN ENAMEL MUG,1,11/2/2011 15:33,4.13,,United Kingdom
574074,22446,PIN CUSHION BABUSHKA PINK,1,11/2/2011 15:33,2.46,,United Kingdom
574074,22452,MEASURING TAPE BABUSHKA PINK,4,11/2/2011 15:33,1.63,,United Kingdom
574074,22471,TV DINNER TRAY AIR HOSTESS ,2,11/2/2011 15:33,10.79,,United Kingdom
574074,22553,PLASTERS IN TIN SKULLS,1,11/2/2011 15:33,3.29,,United Kingdom
574074,22554,PLASTERS IN TIN WOODLAND ANIMALS,1,11/2/2011 15:33,3.29,,United Kingdom
574074,22555,PLASTERS IN TIN STRONGMAN,1,11/2/2011 15:33,3.29,,United Kingdom
574074,22568,FELTCRAFT CUSHION OWL,2,11/2/2011 15:33,7.46,,United Kingdom
574074,22571,ROCKING HORSE RED CHRISTMAS ,5,11/2/2011 15:33,1.63,,United Kingdom
574074,22574,HEART WOODEN CHRISTMAS DECORATION,3,11/2/2011 15:33,1.63,,United Kingdom
574074,22575,METAL MERRY CHRISTMAS WREATH,2,11/2/2011 15:33,4.13,,United Kingdom
574074,22576,SWALLOW WOODEN CHRISTMAS DECORATION,3,11/2/2011 15:33,1.63,,United Kingdom
574074,22577,WOODEN HEART CHRISTMAS SCANDINAVIAN,3,11/2/2011 15:33,0.83,,United Kingdom
574074,22578,WOODEN STAR CHRISTMAS SCANDINAVIAN,3,11/2/2011 15:33,0.83,,United Kingdom
574074,22579,WOODEN TREE CHRISTMAS SCANDINAVIAN,3,11/2/2011 15:33,0.83,,United Kingdom
574074,22580,ADVENT CALENDAR GINGHAM SACK,7,11/2/2011 15:33,4.13,,United Kingdom
574074,22581,WOOD STOCKING CHRISTMAS SCANDISPOT,5,11/2/2011 15:33,0.83,,United Kingdom
574074,22586,FELTCRAFT HAIRBAND PINK AND BLUE,1,11/2/2011 15:33,1.63,,United Kingdom
574074,22587,FELTCRAFT HAIRBAND RED AND BLUE,2,11/2/2011 15:33,1.63,,United Kingdom
574074,22592,CARDHOLDER HOLLY WREATH METAL,2,11/2/2011 15:33,7.46,,United Kingdom
574074,22593,CHRISTMAS GINGHAM STAR,3,11/2/2011 15:33,1.63,,United Kingdom
574074,22594,CHRISTMAS GINGHAM TREE,1,11/2/2011 15:33,1.63,,United Kingdom
574074,22595,GINGHAM HEART DECORATION,2,11/2/2011 15:33,1.63,,United Kingdom
574074,22597,MUSICAL ZINC HEART DECORATION ,5,11/2/2011 15:33,0.83,,United Kingdom
574074,22598,CHRISTMAS MUSICAL ZINC TREE,2,11/2/2011 15:33,0.83,,United Kingdom
574074,22599,CHRISTMAS MUSICAL ZINC STAR,1,11/2/2011 15:33,0.83,,United Kingdom
574074,22600,CHRISTMAS RETROSPOT STAR WOOD,1,11/2/2011 15:33,1.63,,United Kingdom
574074,22602,RETROSPOT WOODEN HEART DECORATION,3,11/2/2011 15:33,1.63,,United Kingdom
574074,22607,WOODEN ROUNDERS GARDEN SET ,1,11/2/2011 15:33,16.63,,United Kingdom
574074,22614,PACK OF 12 SPACEBOY TISSUES,1,11/2/2011 15:33,0.83,,United Kingdom
574074,22619,SET OF 6 SOLDIER SKITTLES,1,11/2/2011 15:33,7.46,,United Kingdom
574074,22621,TRADITIONAL KNITTING NANCY,1,11/2/2011 15:33,3.29,,United Kingdom
574074,22644,CERAMIC CHERRY CAKE MONEY BANK,1,11/2/2011 15:33,3.29,,United Kingdom
574074,22646,CERAMIC STRAWBERRY CAKE MONEY BANK,1,11/2/2011 15:33,3.29,,United Kingdom
574074,22653,BUTTON BOX ,5,11/2/2011 15:33,1.63,,United Kingdom
574074,22661,CHARLOTTE BAG DOLLY GIRL DESIGN,1,11/2/2011 15:33,1.63,,United Kingdom
574074,22663,JUMBO BAG DOLLY GIRL DESIGN,1,11/2/2011 15:33,4.13,,United Kingdom
574074,22666,RECIPE BOX PANTRY YELLOW DESIGN,2,11/2/2011 15:33,5.79,,United Kingdom
574074,22671,FRENCH LAUNDRY SIGN BLUE METAL,1,11/2/2011 15:33,3.29,,United Kingdom
574074,22673,FRENCH GARDEN SIGN BLUE METAL,1,11/2/2011 15:33,2.46,,United Kingdom
574074,22677,FRENCH BLUE METAL DOOR SIGN 2,1,11/2/2011 15:33,2.46,,United Kingdom
574074,22689,DOORMAT MERRY CHRISTMAS RED ,1,11/2/2011 15:33,16.63,,United Kingdom
574074,22694,WICKER STAR ,3,11/2/2011 15:33,4.13,,United Kingdom
574074,22696,WICKER WREATH LARGE,1,11/2/2011 15:33,4.13,,United Kingdom
574074,22698,PINK REGENCY TEACUP AND SAUCER,3,11/2/2011 15:33,5.79,,United Kingdom
574074,22703,PINK CAT BOWL,4,11/2/2011 15:33,1.63,,United Kingdom
574074,22720,SET OF 3 CAKE TINS PANTRY DESIGN ,1,11/2/2011 15:33,10.79,,United Kingdom
574074,22725,ALARM CLOCK BAKELIKE CHOCOLATE,2,11/2/2011 15:33,7.46,,United Kingdom
574074,22726,ALARM CLOCK BAKELIKE GREEN,2,11/2/2011 15:33,7.46,,United Kingdom
574074,22727,ALARM CLOCK BAKELIKE RED ,1,11/2/2011 15:33,7.46,,United Kingdom
574074,22730,ALARM CLOCK BAKELIKE IVORY,1,11/2/2011 15:33,7.46,,United Kingdom
574074,22739,RIBBON REEL CHRISTMAS SOCK BAUBLE,1,11/2/2011 15:33,3.29,,United Kingdom
574074,22741,FUNKY DIVA PEN,4,11/2/2011 15:33,1.63,,United Kingdom
574074,22744,MAKE YOUR OWN MONSOON CARD KIT,1,11/2/2011 15:33,5.79,,United Kingdom
574074,22745,POPPY'S PLAYHOUSE BEDROOM ,1,11/2/2011 15:33,4.13,,United Kingdom
574074,22751,FELTCRAFT PRINCESS OLIVIA DOLL,1,11/2/2011 15:33,7.46,,United Kingdom
574074,22753,SMALL YELLOW BABUSHKA NOTEBOOK ,3,11/2/2011 15:33,1.63,,United Kingdom
574074,22758,LARGE PURPLE BABUSHKA NOTEBOOK  ,1,11/2/2011 15:33,2.46,,United Kingdom
574074,22768,FAMILY PHOTO FRAME CORNICE,1,11/2/2011 15:33,19.96,,United Kingdom
574074,22786,CUSHION COVER PINK UNION JACK,1,11/2/2011 15:33,15.79,,United Kingdom
574074,22791,T-LIGHT GLASS FLUTED ANTIQUE,5,11/2/2011 15:33,2.46,,United Kingdom
574074,22792,FLUTED ANTIQUE CANDLE HOLDER,4,11/2/2011 15:33,1.63,,United Kingdom
574074,22801,ANTIQUE GLASS PEDESTAL BOWL,1,11/2/2011 15:33,7.46,,United Kingdom
574074,22809,SET OF 6 T-LIGHTS SANTA,2,11/2/2011 15:33,5.79,,United Kingdom
574074,22816,CARD MOTORBIKE SANTA,4,11/2/2011 15:33,0.42,,United Kingdom
574074,22818,CARD CHRISTMAS VILLAGE,4,11/2/2011 15:33,0.42,,United Kingdom
574074,22819,"BIRTHDAY CARD, RETRO SPOT",3,11/2/2011 15:33,0.42,,United Kingdom
574074,22820,GIFT BAG BIRTHDAY,1,11/2/2011 15:33,0.83,,United Kingdom
574074,22835,HOT WATER BOTTLE I AM SO POORLY,1,11/2/2011 15:33,10.79,,United Kingdom
574074,22844,VINTAGE CREAM DOG FOOD CONTAINER,1,11/2/2011 15:33,16.63,,United Kingdom
574074,22845,VINTAGE CREAM CAT FOOD CONTAINER,1,11/2/2011 15:33,12.46,,United Kingdom
574074,22852,DOG BOWL VINTAGE CREAM,1,11/2/2011 15:33,8.29,,United Kingdom
574074,22903,CALENDAR FAMILY FAVOURITES,1,11/2/2011 15:33,2.46,,United Kingdom
574074,22904,CALENDAR PAPER CUT DESIGN,3,11/2/2011 15:33,5.79,,United Kingdom
574074,22906,12 MESSAGE CARDS WITH ENVELOPES,3,11/2/2011 15:33,3.29,,United Kingdom
574074,22909,SET OF 20 VINTAGE CHRISTMAS NAPKINS,4,11/2/2011 15:33,1.63,,United Kingdom
574074,22910,PAPER CHAIN KIT VINTAGE CHRISTMAS,3,11/2/2011 15:33,5.79,,United Kingdom
574074,22937,BAKING MOULD CHOCOLATE CUPCAKES,1,11/2/2011 15:33,4.96,,United Kingdom
574074,22941,CHRISTMAS LIGHTS 10 REINDEER,2,11/2/2011 15:33,16.63,,United Kingdom
574074,22942,CHRISTMAS LIGHTS 10 SANTAS ,1,11/2/2011 15:33,16.63,,United Kingdom
574074,22944,CHRISTMAS METAL POSTCARD WITH BELLS,24,11/2/2011 15:33,0.97,,United Kingdom
574074,22950,SET OF 36 VINTAGE CHRISTMAS DOILIES,5,11/2/2011 15:33,2.92,,United Kingdom
574074,22952,60 CAKE CASES VINTAGE CHRISTMAS,1,11/2/2011 15:33,1.25,,United Kingdom
574074,22961,JAM MAKING SET PRINTED,2,11/2/2011 15:33,3.29,,United Kingdom
574074,22962,JAM JAR WITH PINK LID,1,11/2/2011 15:33,1.63,,United Kingdom
574074,22964,3 PIECE SPACEBOY COOKIE CUTTER SET,1,11/2/2011 15:33,4.13,,United Kingdom
574074,22966,GINGERBREAD MAN COOKIE CUTTER,1,11/2/2011 15:33,2.46,,United Kingdom
574074,22969,HOMEMADE JAM SCENTED CANDLES,3,11/2/2011 15:33,3.29,,United Kingdom
574074,22970,LONDON BUS COFFEE MUG,1,11/2/2011 15:33,4.96,,United Kingdom
574074,22971,QUEENS GUARD COFFEE MUG,1,11/2/2011 15:33,4.96,,United Kingdom
574074,22975,SPACEBOY CHILDRENS EGG CUP,4,11/2/2011 15:33,2.46,,United Kingdom
574074,22978,PANTRY ROLLING PIN,1,11/2/2011 15:33,7.46,,United Kingdom
574074,22983,CARD BILLBOARD FONT,1,11/2/2011 15:33,0.83,,United Kingdom
574074,22988,SOLDIERS EGG CUP ,2,11/2/2011 15:33,2.46,,United Kingdom
574074,22990,COTTON APRON PANTRY DESIGN,1,11/2/2011 15:33,10.79,,United Kingdom
574074,22992,REVOLVER WOODEN RULER ,3,11/2/2011 15:33,4.13,,United Kingdom
574074,22993,SET OF 4 PANTRY JELLY MOULDS,1,11/2/2011 15:33,2.46,,United Kingdom
574074,23004,TRAVEL CARD WALLET PANTRY,1,11/2/2011 15:33,0.83,,United Kingdom
574074,23005,TRAVEL CARD WALLET I LOVE LONDON,1,11/2/2011 15:33,0.83,,United Kingdom
574074,23012,GLASS APOTHECARY BOTTLE PERFUME,2,11/2/2011 15:33,8.29,,United Kingdom
574074,23013,GLASS APOTHECARY BOTTLE TONIC,2,11/2/2011 15:33,8.29,,United Kingdom
574074,23014,GLASS APOTHECARY BOTTLE ELIXIR,3,11/2/2011 15:33,8.29,,United Kingdom
574074,23070,EDWARDIAN HEART PHOTO FRAME,1,11/2/2011 15:33,8.29,,United Kingdom
574074,23084,RABBIT NIGHT LIGHT,3,11/2/2011 15:33,4.13,,United Kingdom
574074,23090,VINTAGE GLASS T-LIGHT HOLDER,3,11/2/2011 15:33,1.63,,United Kingdom
574074,23093,SMALL PARISIENNE HEART PHOTO FRAME ,1,11/2/2011 15:33,4.96,,United Kingdom
574074,23099,FRENCH CARRIAGE LANTERN,2,11/2/2011 15:33,13.29,,United Kingdom
574074,23103,JINGLE BELL HEART DECORATION,2,11/2/2011 15:33,3.29,,United Kingdom
574074,23106,ZINC HEARTS PLANT POT HOLDER,1,11/2/2011 15:33,5.79,,United Kingdom
574074,23118,PARISIENNE JEWELLERY DRAWER ,2,11/2/2011 15:33,14.96,,United Kingdom
574074,23133,LARGE IVORY HEART WALL ORGANISER,1,11/2/2011 15:33,16.63,,United Kingdom
574074,23168,CLASSIC CAFE SUGAR DISPENSER,1,11/2/2011 15:33,2.46,,United Kingdom
574074,23169,CLASSIC GLASS COOKIE JAR,1,11/2/2011 15:33,8.29,,United Kingdom
574074,23170,REGENCY TEA PLATE ROSES ,2,11/2/2011 15:33,3.29,,United Kingdom
574074,23173,REGENCY TEAPOT ROSES ,1,11/2/2011 15:33,19.96,,United Kingdom
574074,23174,REGENCY SUGAR BOWL GREEN,1,11/2/2011 15:33,8.29,,United Kingdom
574074,23175,REGENCY MILK JUG PINK ,1,11/2/2011 15:33,7.46,,United Kingdom
574074,23176,ABC TREASURE BOOK BOX ,1,11/2/2011 15:33,4.58,,United Kingdom
574074,23182,TOILET SIGN OCCUPIED OR VACANT,4,11/2/2011 15:33,2.46,,United Kingdom
574074,23183,MOTHER'S KITCHEN SPOON REST ,1,11/2/2011 15:33,7.46,,United Kingdom
574074,23189,SET OF 12 FORK CANDLES,1,11/2/2011 15:33,5.79,,United Kingdom
574074,23194,GYMKHANA TREASURE BOOK BOX,1,11/2/2011 15:33,4.58,,United Kingdom
574074,23196,VINTAGE LEAF MAGNETIC NOTEPAD,1,11/2/2011 15:33,3.29,,United Kingdom
574074,23198,PANTRY MAGNETIC  SHOPPING LIST,2,11/2/2011 15:33,3.29,,United Kingdom
574074,23199,JUMBO BAG APPLES,2,11/2/2011 15:33,4.13,,United Kingdom
574074,23200,JUMBO BAG PEARS,1,11/2/2011 15:33,4.13,,United Kingdom
574074,23201,JUMBO BAG ALPHABET,2,11/2/2011 15:33,4.13,,United Kingdom
574074,23202,JUMBO BAG VINTAGE LEAF,1,11/2/2011 15:33,4.13,,United Kingdom
574074,23203,JUMBO BAG VINTAGE DOILY ,5,11/2/2011 15:33,4.13,,United Kingdom
574074,23204,CHARLOTTE BAG APPLES DESIGN,1,11/2/2011 15:33,1.63,,United Kingdom
574074,23215,JINGLE BELL HEART ANTIQUE SILVER,1,11/2/2011 15:33,4.13,,United Kingdom
574074,23219,LAUREL STAR ANTIQUE SILVER ,6,11/2/2011 15:33,2.46,,United Kingdom
574074,23234,BISCUIT TIN VINTAGE CHRISTMAS,4,11/2/2011 15:33,5.79,,United Kingdom
574074,23238,SET OF 4 KNICK KNACK TINS LONDON ,1,11/2/2011 15:33,8.29,,United Kingdom
574074,23245,SET OF 3 REGENCY CAKE TINS,2,11/2/2011 15:33,10.79,,United Kingdom
574074,23247,BISCUIT TIN 50'S CHRISTMAS,1,11/2/2011 15:33,5.79,,United Kingdom
574074,23256,CHILDRENS CUTLERY SPACEBOY ,1,11/2/2011 15:33,8.29,,United Kingdom
574074,23263,SET OF 3 WOODEN HEART DECORATIONS,2,11/2/2011 15:33,2.46,,United Kingdom
574074,23265,SET OF 3 WOODEN TREE DECORATIONS,2,11/2/2011 15:33,2.46,,United Kingdom
574074,23280,FOLDING BUTTERFLY MIRROR HOT PINK ,2,11/2/2011 15:33,2.46,,United Kingdom
574074,23284,DOORMAT KEEP CALM AND COME IN,1,11/2/2011 15:33,15.79,,United Kingdom
574074,23292,SPACEBOY CHILDRENS CUP,2,11/2/2011 15:33,2.46,,United Kingdom
574074,23301,GARDENERS KNEELING PAD KEEP CALM ,4,11/2/2011 15:33,3.29,,United Kingdom
574074,23306,SET OF 36 PANTRY PAPER DOILIES,1,11/2/2011 15:33,2.92,,United Kingdom
574074,23307,SET OF 60 PANTRY DESIGN CAKE CASES ,2,11/2/2011 15:33,1.25,,United Kingdom
574074,23309,SET OF 60 I LOVE LONDON CAKE CASES ,1,11/2/2011 15:33,1.25,,United Kingdom
574074,23311,VINTAGE CHRISTMAS STOCKING ,1,11/2/2011 15:33,4.96,,United Kingdom
574074,23318,BOX OF 6 MINI VINTAGE CRACKERS,3,11/2/2011 15:33,4.96,,United Kingdom
574074,23322,LARGE WHITE HEART OF WICKER,5,11/2/2011 15:33,3.29,,United Kingdom
574074,23323,WHITE WICKER STAR ,2,11/2/2011 15:33,4.13,,United Kingdom
574074,23328,SET 6 SCHOOL MILK BOTTLES IN CRATE,1,11/2/2011 15:33,7.46,,United Kingdom
574074,23334,IVORY WICKER HEART SMALL,3,11/2/2011 15:33,1.25,,United Kingdom
574074,23341,PINK DINER WALL CLOCK,1,11/2/2011 15:33,16.63,,United Kingdom
