541424,85203,HANGING WOOD AND FELT BUTTERFLY ,2,1/17/2011 17:57,0.42,,United Kingdom
541424,85213,MINI  ZINC GARDEN DECORATIONS ,1,1/17/2011 17:57,1.63,,United Kingdom
541424,85184C,S/4 VALENTINE DECOUPAGE HEART BOX,4,1/17/2011 17:57,3.29,,United Kingdom
541424,85199S,SMALL HANGING IVORY/RED WOOD BIRD,1,1/17/2011 17:57,0.83,,United Kingdom
541424,85170B,SET/6 BLACK BIRD T-LIGHT CANDLES,2,1/17/2011 17:57,2.46,,United Kingdom
541424,85170D,SET/6 PINK BIRD T-LIGHT CANDLES,1,1/17/2011 17:57,2.46,,United Kingdom
541424,85179A,GREEN BITTY LIGHT CHAIN,1,1/17/2011 17:57,2.46,,United Kingdom
541424,85180A,RED HEARTS LIGHT CHAIN ,5,1/17/2011 17:57,2.46,,United Kingdom
541424,85131D,BEADED CRYSTAL HEART PINK ON STICK,4,1/17/2011 17:57,0.83,,United Kingdom
541424,85163A,WHITE BAROQUE WALL CLOCK ,3,1/17/2011 17:57,8.29,,United Kingdom
541424,85163B,BLACK BAROQUE WALL CLOCK ,9,1/17/2011 17:57,8.29,,United Kingdom
541424,85168B,BLACK BAROQUE CARRIAGE CLOCK,2,1/17/2011 17:57,8.29,,United Kingdom
541424,85169A,IVORY LOVE BIRD CANDLE,4,1/17/2011 17:57,0.83,,United Kingdom
541424,85169B,BLACK LOVE BIRD CANDLE,7,1/17/2011 17:57,0.83,,United Kingdom
541424,21676,FLOWERS  STICKERS,1,1/17/2011 17:57,0.79,,United Kingdom
541424,21706,FOLDING UMBRELLA RED/WHITE POLKADOT,1,1/17/2011 17:57,3.29,,United Kingdom
541424,21755,LOVE BUILDING BLOCK WORD,1,1/17/2011 17:57,11.63,,United Kingdom
541424,21773,DECORATIVE ROSE BATHROOM BOTTLE,4,1/17/2011 17:57,1.25,,United Kingdom
541424,21774,DECORATIVE CATS BATHROOM BOTTLE,4,1/17/2011 17:57,1.25,,United Kingdom
541424,21775,DECORATIVE FLORE BATHROOM BOTTLE,6,1/17/2011 17:57,1.25,,United Kingdom
541424,21801,CHRISTMAS TREE DECORATION WITH BELL,8,1/17/2011 17:57,0.42,,United Kingdom
541424,21802,CHRISTMAS TREE HEART DECORATION,1,1/17/2011 17:57,0.42,,United Kingdom
541424,21803,CHRISTMAS TREE STAR DECORATION,1,1/17/2011 17:57,0.42,,United Kingdom
541424,21846,PINK DIAMANTE PEN IN GIFT BOX,10,1/17/2011 17:57,1.63,,United Kingdom
541424,21849,SILVER DIAMANTE PEN IN GIFT BOX,4,1/17/2011 17:57,1.63,,United Kingdom
541424,21851,LILAC DIAMANTE PEN IN GIFT BOX,3,1/17/2011 17:57,1.63,,United Kingdom
541424,21876,POTTERING MUG,1,1/17/2011 17:57,1.63,,United Kingdom
541424,21879,HEARTS GIFT TAPE,5,1/17/2011 17:57,0.42,,United Kingdom
541424,21880,RED RETROSPOT TAPE,3,1/17/2011 17:57,0.42,,United Kingdom
541424,21881,CUTE CATS TAPE,7,1/17/2011 17:57,0.42,,United Kingdom
541424,85118,HEART T-LIGHT HOLDER,1,1/17/2011 17:57,1.25,,United Kingdom
541424,85123A,WHITE HANGING HEART T-LIGHT HOLDER,22,1/17/2011 17:57,2.95,,United Kingdom
541424,85131A,BEADED PEARL HEART WHITE ON STICK,10,1/17/2011 17:57,0.83,,United Kingdom
541424,85094,CANDY SPOT EGG WARMER RABBIT,2,1/17/2011 17:57,0.83,,United Kingdom
541424,85095,THREE CANVAS LUGGAGE TAGS,2,1/17/2011 17:57,1.25,,United Kingdom
541424,85099B,JUMBO BAG RED RETROSPOT,4,1/17/2011 17:57,4.13,,United Kingdom
541424,85099F,JUMBO BAG STRAWBERRY,1,1/17/2011 17:57,4.13,,United Kingdom
541424,85103,SILVER T-LIGHT SETTING,1,1/17/2011 17:57,5.79,,United Kingdom
541424,85017B,ENVELOPE 50 BLOSSOM IMAGES,1,1/17/2011 17:57,0.83,,United Kingdom
541424,85035B,CHOCOLATE 3 WICK MORRIS BOX CANDLE,1,1/17/2011 17:57,3.29,,United Kingdom
541424,85039A,SET/4 RED MINI ROSE CANDLE IN BOWL,2,1/17/2011 17:57,1.63,,United Kingdom
541424,85039B,S/4 IVORY MINI ROSE CANDLE IN BOWL,1,1/17/2011 17:57,1.63,,United Kingdom
541424,85039C,S/4 BLACK MINI ROSE CANDLE IN BOWL,2,1/17/2011 17:57,1.63,,United Kingdom
541424,85049H,URBAN BLACK RIBBONS ,3,1/17/2011 17:57,0.83,,United Kingdom
541424,85053,FRENCH ENAMEL CANDLEHOLDER,1,1/17/2011 17:57,4.13,,United Kingdom
541424,85054,FRENCH ENAMEL POT W LID,1,1/17/2011 17:57,5.79,,United Kingdom
541424,85059,FRENCH ENAMEL WATER BASIN,4,1/17/2011 17:57,3.29,,United Kingdom
541424,85071A,BLUE CHARLIE+LOLA PERSONAL DOORSIGN,1,1/17/2011 17:57,0.83,,United Kingdom
541424,85071C,"CHARLIE+LOLA""EXTREMELY BUSY"" SIGN",4,1/17/2011 17:57,0.83,,United Kingdom
541424,85071D,CHARLIE+LOLA MY ROOM DOOR SIGN,1,1/17/2011 17:57,0.83,,United Kingdom
541424,85087,CANDY SPOT CUSHION COVER,1,1/17/2011 17:57,3.29,,United Kingdom
541424,84968E,SET OF 16 VINTAGE BLACK CUTLERY,2,1/17/2011 17:57,8.29,,United Kingdom
541424,84968F,SET OF 16 VINTAGE SKY BLUE CUTLERY,2,1/17/2011 17:57,8.29,,United Kingdom
541424,84969,BOX OF 6 ASSORTED COLOUR TEASPOONS,1,1/17/2011 17:57,3.29,,United Kingdom
541424,84970S,HANGING HEART ZINC T-LIGHT HOLDER,1,1/17/2011 17:57,2.08,,United Kingdom
541424,84971S,SMALL HEART FLOWERS HOOK ,3,1/17/2011 17:57,1.63,,United Kingdom
541424,84978,HANGING HEART JAR T-LIGHT HOLDER,2,1/17/2011 17:57,2.46,,United Kingdom
541424,84992,72 SWEETHEART FAIRY CAKE CASES,1,1/17/2011 17:57,1.25,,United Kingdom
541424,84660A,WHITE STITCHED WALL CLOCK,1,1/17/2011 17:57,3.29,,United Kingdom
541424,84707A,SILVER JEWELLED MIRROR TRINKET TRAY,1,1/17/2011 17:57,5.79,,United Kingdom
541424,84748,FOLK FELT HANGING MULTICOL GARLAND,3,1/17/2011 17:57,2.46,,United Kingdom
541424,84836,ZINC METAL HEART DECORATION,3,1/17/2011 17:57,2.46,,United Kingdom
541424,84879,ASSORTED COLOUR BIRD ORNAMENT,8,1/17/2011 17:57,3.12,,United Kingdom
541424,84913B,MINT GREEN ROSE TOWEL,2,1/17/2011 17:57,3.29,,United Kingdom
541424,84931A,PINK SCOTTIE DOG W FLOWER PATTERN,1,1/17/2011 17:57,1.63,,United Kingdom
541424,84946,ANTIQUE SILVER TEA GLASS ETCHED,13,1/17/2011 17:57,2.46,,United Kingdom
541424,84951A,SET OF 4 PISTACHIO LOVEBIRD COASTER,1,1/17/2011 17:57,1.63,,United Kingdom
541424,84951B,SET OF 4 BLACK LOVEBIRD COASTERS,2,1/17/2011 17:57,1.63,,United Kingdom
541424,84952B,BLACK LOVE BIRD T-LIGHT HOLDER,4,1/17/2011 17:57,1.63,,United Kingdom
541424,84968A,SET OF 16 VINTAGE ROSE CUTLERY,1,1/17/2011 17:57,8.29,,United Kingdom
541424,84459B,YELLOW METAL CHICKEN HEART ,1,1/17/2011 17:57,3.29,,United Kingdom
541424,84509A,SET OF 4 ENGLISH ROSE PLACEMATS,5,1/17/2011 17:57,3.29,,United Kingdom
541424,84509C,SET OF 4 POLKADOT PLACEMATS ,2,1/17/2011 17:57,3.29,,United Kingdom
541424,84509G,SET OF 4 FAIRY CAKE PLACEMATS ,2,1/17/2011 17:57,3.29,,United Kingdom
541424,84510A,SET OF 4 ENGLISH ROSE COASTERS,2,1/17/2011 17:57,2.46,,United Kingdom
541424,84510C,SET OF 4 POLKADOT COASTERS,2,1/17/2011 17:57,2.46,,United Kingdom
541424,84520B,PACK 20 ENGLISH ROSE PAPER NAPKINS,9,1/17/2011 17:57,1.63,,United Kingdom
541424,84535B,FAIRY CAKES NOTEBOOK A6 SIZE,1,1/17/2011 17:57,1.46,,United Kingdom
541424,84563A,PINK & WHITE BREAKFAST TRAY,1,1/17/2011 17:57,4.13,,United Kingdom
541424,84569A,PACK 3 IRON ON DOG PATCHES,5,1/17/2011 17:57,0.83,,United Kingdom
541424,84569D,PACK 6 HEART/ICE-CREAM PATCHES,4,1/17/2011 17:57,0.83,,United Kingdom
541424,84596B,SMALL DOLLY MIX DESIGN ORANGE BOWL,4,1/17/2011 17:57,0.83,,United Kingdom
541424,84596E,SMALL LICORICE DES PINK BOWL,2,1/17/2011 17:57,0.83,,United Kingdom
541424,84596F,SMALL MARSHMALLOWS PINK BOWL,2,1/17/2011 17:57,0.83,,United Kingdom
541424,84596J,MIXED NUTS LIGHT GREEN BOWL,4,1/17/2011 17:57,0.83,,United Kingdom
541424,84596L,BISCUITS SMALL BOWL LIGHT BLUE,1,1/17/2011 17:57,0.83,,United Kingdom
541424,84251B,"GREETING CARD, STICKY GORDON",3,1/17/2011 17:57,0.42,,United Kingdom
541424,84251C,"GREETING CARD, TWO SISTERS.",2,1/17/2011 17:57,0.42,,United Kingdom
541424,84251G,"GREETING CARD, OVERCROWDED POOL.",1,1/17/2011 17:57,0.42,,United Kingdom
541424,84313B,BLUE TV TRAY TABLE ,3,1/17/2011 17:57,5.79,,United Kingdom
541424,84313C,ORANGE TV TRAY TABLE ,3,1/17/2011 17:57,5.79,,United Kingdom
541424,84356,POMPOM CURTAIN,1,1/17/2011 17:57,5.79,,United Kingdom
541424,84375,SET OF 20 KIDS COOKIE CUTTERS,1,1/17/2011 17:57,4.13,,United Kingdom
541424,84378,SET OF 3 HEART COOKIE CUTTERS,1,1/17/2011 17:57,2.46,,United Kingdom
541424,47591B,SCOTTIES CHILDRENS APRON,1,1/17/2011 17:57,1.63,,United Kingdom
541424,47594A,CAROUSEL DESIGN WASHBAG,2,1/17/2011 17:57,1.63,,United Kingdom
541424,72122,COFFEE SCENT PILLAR CANDLE,1,1/17/2011 17:57,1.88,,United Kingdom
541424,72817,SET OF 2 CHRISTMAS DECOUPAGE CANDLE,1,1/17/2011 17:57,1.63,,United Kingdom
541424,79321,CHILLI LIGHTS,2,1/17/2011 17:57,9.96,,United Kingdom
541424,82552,WASHROOM METAL SIGN,2,1/17/2011 17:57,2.46,,United Kingdom
541424,82578,KITCHEN METAL SIGN,1,1/17/2011 17:57,1.25,,United Kingdom
541424,82582,AREA PATROLLED METAL SIGN,1,1/17/2011 17:57,4.13,,United Kingdom
541424,82600,NO SINGING METAL SIGN,1,1/17/2011 17:57,4.13,,United Kingdom
541424,82613B,"METAL SIGN,CUPCAKE SINGLE HOOK",3,1/17/2011 17:57,0.83,,United Kingdom
541424,82613C,"METAL SIGN,CUPCAKE SINGLE HOOK",6,1/17/2011 17:57,0.83,,United Kingdom
541424,82613D,METAL SIGN CUPCAKE SINGLE HOOK,5,1/17/2011 17:57,0.83,,United Kingdom
541424,84012,MAGIC SHEEP WOOL GROWING FROM PAPER,2,1/17/2011 17:57,1.63,,United Kingdom
541424,84032A,CHARLIE+LOLA PINK HOT WATER BOTTLE,1,1/17/2011 17:57,3.29,,United Kingdom
541424,35648,VINTAGE BEAD PINK PURSE ,1,1/17/2011 17:57,1.63,,United Kingdom
541424,35651,VINTAGE BEAD PINK SCARF ,3,1/17/2011 17:57,3.29,,United Kingdom
541424,35810B,ENAMEL BLUE RIM COFFEE CONTAINER,1,1/17/2011 17:57,4.13,,United Kingdom
541424,35961,FOLKART ZINC HEART CHRISTMAS DEC,2,1/17/2011 17:57,1.63,,United Kingdom
541424,37327,ASSTD MULTICOLOUR CIRCLES MUG,1,1/17/2011 17:57,5.79,,United Kingdom
541424,37342,POLKADOT COFFEE CUP & SAUCER PINK,4,1/17/2011 17:57,2.46,,United Kingdom
541424,37444A,YELLOW BREAKFAST CUP AND SAUCER,2,1/17/2011 17:57,5.79,,United Kingdom
541424,47504K,ENGLISH ROSE GARDEN SECATEURS,1,1/17/2011 17:57,3.29,,United Kingdom
541424,47563A,RETRO LONGBOARD IRONING BOARD COVER,2,1/17/2011 17:57,3.29,,United Kingdom
541424,47566,PARTY BUNTING,1,1/17/2011 17:57,8.29,,United Kingdom
541424,22844,VINTAGE CREAM DOG FOOD CONTAINER,1,1/17/2011 17:57,16.63,,United Kingdom
541424,22845,VINTAGE CREAM CAT FOOD CONTAINER,1,1/17/2011 17:57,12.46,,United Kingdom
541424,22846,BREAD BIN DINER STYLE RED ,1,1/17/2011 17:57,33.29,,United Kingdom
541424,22855,FINE WICKER HEART ,2,1/17/2011 17:57,2.46,,United Kingdom
541424,22862,LOVE HEART NAPKIN BOX ,1,1/17/2011 17:57,8.29,,United Kingdom
541424,22867,HAND WARMER BIRD DESIGN,2,1/17/2011 17:57,4.13,,United Kingdom
541424,22908,PACK OF 20 NAPKINS RED APPLES,2,1/17/2011 17:57,1.63,,United Kingdom
541424,22926,IVORY GIANT GARDEN THERMOMETER,1,1/17/2011 17:57,11.63,,United Kingdom
541424,22930,BAKING MOULD HEART MILK CHOCOLATE,1,1/17/2011 17:57,4.96,,United Kingdom
541424,22937,BAKING MOULD CHOCOLATE CUPCAKES,1,1/17/2011 17:57,4.96,,United Kingdom
541424,22946,WOODEN ADVENT CALENDAR CREAM,1,1/17/2011 17:57,33.29,,United Kingdom
541424,22960,JAM MAKING SET WITH JARS,1,1/17/2011 17:57,8.29,,United Kingdom
541424,22962,JAM JAR WITH PINK LID,1,1/17/2011 17:57,1.63,,United Kingdom
541424,22988,SOLDIERS EGG CUP ,2,1/17/2011 17:57,2.46,,United Kingdom
541424,35241,ENAMEL BLUE RIM BISCUIT BIN,1,1/17/2011 17:57,9.96,,United Kingdom
541424,35471D,SET OF 3 BIRD LIGHT PINK FEATHER ,1,1/17/2011 17:57,2.46,,United Kingdom
541424,22665,RECIPE BOX BLUE SKETCHBOOK DESIGN,1,1/17/2011 17:57,5.79,,United Kingdom
541424,22669,RED BABY BUNTING ,1,1/17/2011 17:57,5.79,,United Kingdom
541424,22694,WICKER STAR ,1,1/17/2011 17:57,4.13,,United Kingdom
541424,22696,WICKER WREATH LARGE,1,1/17/2011 17:57,4.13,,United Kingdom
541424,22699,ROSES REGENCY TEACUP AND SAUCER ,1,1/17/2011 17:57,5.79,,United Kingdom
541424,22716,CARD CIRCUS PARADE,1,1/17/2011 17:57,0.83,,United Kingdom
541424,22719,GUMBALL MONOCHROME COAT RACK,1,1/17/2011 17:57,2.46,,United Kingdom
541424,22726,ALARM CLOCK BAKELIKE GREEN,1,1/17/2011 17:57,7.46,,United Kingdom
541424,22757,LARGE RED BABUSHKA NOTEBOOK ,1,1/17/2011 17:57,2.46,,United Kingdom
541424,22788,BROCANTE COAT RACK,2,1/17/2011 17:57,19.96,,United Kingdom
541424,22802,FAUX FUR CHOCOLATE THROW,1,1/17/2011 17:57,16.63,,United Kingdom
541424,22804,CANDLEHOLDER PINK HANGING HEART,2,1/17/2011 17:57,2.46,,United Kingdom
541424,22817,CARD SUKI BIRTHDAY,5,1/17/2011 17:57,0.42,,United Kingdom
541424,22819,"BIRTHDAY CARD, RETRO SPOT",7,1/17/2011 17:57,0.42,,United Kingdom
541424,22831,WHITE BROCANTE SOAP DISH,1,1/17/2011 17:57,5.79,,United Kingdom
541424,22588,CARD HOLDER GINGHAM HEART,1,1/17/2011 17:57,4.96,,United Kingdom
541424,22621,TRADITIONAL KNITTING NANCY,1,1/17/2011 17:57,3.29,,United Kingdom
541424,22628,PICNIC BOXES SET OF 3 RETROSPOT ,2,1/17/2011 17:57,4.13,,United Kingdom
541424,22629,SPACEBOY LUNCH BOX ,1,1/17/2011 17:57,4.13,,United Kingdom
541424,22631,CIRCUS PARADE LUNCH BOX ,1,1/17/2011 17:57,4.13,,United Kingdom
541424,22640,SET OF 4 NAPKIN CHARMS 3 KEYS ,4,1/17/2011 17:57,1.63,,United Kingdom
541424,22641,SET OF 4 NAPKIN CHARMS INSTRUMENT,5,1/17/2011 17:57,1.63,,United Kingdom
541424,22649,STRAWBERRY FAIRY CAKE TEAPOT,1,1/17/2011 17:57,10.79,,United Kingdom
541424,22452,MEASURING TAPE BABUSHKA PINK,2,1/17/2011 17:57,1.63,,United Kingdom
541424,22457,NATURAL SLATE HEART CHALKBOARD ,3,1/17/2011 17:57,5.79,,United Kingdom
541424,22469,HEART OF WICKER SMALL,4,1/17/2011 17:57,3.29,,United Kingdom
541424,22470,HEART OF WICKER LARGE,1,1/17/2011 17:57,5.79,,United Kingdom
541424,22471,TV DINNER TRAY AIR HOSTESS ,3,1/17/2011 17:57,4.13,,United Kingdom
541424,22473,TV DINNER TRAY VINTAGE PAISLEY,2,1/17/2011 17:57,4.13,,United Kingdom
541424,22485,SET OF 2 WOODEN MARKET CRATES,1,1/17/2011 17:57,24.96,,United Kingdom
541424,22489,PACK OF 12 TRADITIONAL CRAYONS,2,1/17/2011 17:57,0.83,,United Kingdom
541424,22494,EMERGENCY FIRST AID TIN ,1,1/17/2011 17:57,2.46,,United Kingdom
541424,22502,PICNIC BASKET WICKER SMALL,1,1/17/2011 17:57,8.29,,United Kingdom
541424,22558,CLOTHES PEGS RETROSPOT PACK 24 ,1,1/17/2011 17:57,2.46,,United Kingdom
541424,22560,TRADITIONAL MODELLING CLAY,1,1/17/2011 17:57,2.46,,United Kingdom
541424,22565,FELTCRAFT HAIRBANDS PINK AND WHITE ,3,1/17/2011 17:57,1.63,,United Kingdom
541424,22568,FELTCRAFT CUSHION OWL,2,1/17/2011 17:57,7.46,,United Kingdom
541424,22569,FELTCRAFT CUSHION BUTTERFLY,1,1/17/2011 17:57,7.46,,United Kingdom
541424,22570,FELTCRAFT CUSHION RABBIT,1,1/17/2011 17:57,7.46,,United Kingdom
541424,22375,AIRLINE BAG VINTAGE JET SET BROWN,1,1/17/2011 17:57,4.13,,United Kingdom
541424,22376,AIRLINE BAG VINTAGE JET SET WHITE,1,1/17/2011 17:57,4.13,,United Kingdom
541424,22377,BOTTLE BAG RETROSPOT ,6,1/17/2011 17:57,1.63,,United Kingdom
541424,22378,WALL TIDY RETROSPOT ,11,1/17/2011 17:57,1.63,,United Kingdom
541424,22381,TOY TIDY PINK POLKADOT,2,1/17/2011 17:57,4.13,,United Kingdom
541424,22382,LUNCH BAG SPACEBOY DESIGN ,1,1/17/2011 17:57,4.13,,United Kingdom
541424,22383,LUNCH BAG SUKI  DESIGN ,1,1/17/2011 17:57,4.13,,United Kingdom
541424,22385,JUMBO BAG SPACEBOY DESIGN,1,1/17/2011 17:57,4.13,,United Kingdom
541424,22396,MAGNETS PACK OF 4 RETRO PHOTO,4,1/17/2011 17:57,0.83,,United Kingdom
541424,22342,HOME GARLAND PAINTED ZINC ,2,1/17/2011 17:57,1.63,,United Kingdom
541424,22343,PARTY PIZZA DISH RED RETROSPOT,15,1/17/2011 17:57,0.42,,United Kingdom
541424,22344,PARTY PIZZA DISH PINK POLKADOT,4,1/17/2011 17:57,0.42,,United Kingdom
541424,22345,PARTY PIZZA DISH BLUE POLKADOT,2,1/17/2011 17:57,0.42,,United Kingdom
541424,22346,PARTY PIZZA DISH GREEN POLKADOT,2,1/17/2011 17:57,0.42,,United Kingdom
541424,22355,CHARLOTTE BAG SUKI DESIGN,1,1/17/2011 17:57,1.63,,United Kingdom
541424,22365,DOORMAT RESPECTABLE HOUSE,3,1/17/2011 17:57,14.13,,United Kingdom
541424,22366,DOORMAT AIRMAIL ,2,1/17/2011 17:57,14.13,,United Kingdom
541424,22371,AIRLINE BAG VINTAGE TOKYO 78,2,1/17/2011 17:57,4.13,,United Kingdom
541424,22372,AIRLINE BAG VINTAGE WORLD CHAMPION ,1,1/17/2011 17:57,4.13,,United Kingdom
541424,22249,DECORATION WHITE CHICK MAGIC GARDEN,8,1/17/2011 17:57,0.79,,United Kingdom
541424,22250,DECORATION  BUTTERFLY  MAGIC GARDEN,5,1/17/2011 17:57,0.79,,United Kingdom
541424,22257,FELT FARM ANIMAL SHEEP,2,1/17/2011 17:57,0.83,,United Kingdom
541424,22258,FELT FARM ANIMAL RABBIT,1,1/17/2011 17:57,0.83,,United Kingdom
541424,22259,FELT FARM ANIMAL HEN,2,1/17/2011 17:57,0.83,,United Kingdom
541424,22264,FELT FARM ANIMAL WHITE BUNNY ,3,1/17/2011 17:57,0.79,,United Kingdom
541424,22279,POCKET BAG BLUE PAISLEY RED SPOT,7,1/17/2011 17:57,0.83,,United Kingdom
541424,22280,POCKET BAG PINK PAISELY BROWN SPOT,6,1/17/2011 17:57,0.83,,United Kingdom
541424,22284,HEN HOUSE DECORATION,1,1/17/2011 17:57,3.29,,United Kingdom
541424,22285,HANGING HEN ON NEST DECORATION,1,1/17/2011 17:57,3.29,,United Kingdom
541424,22309,TEA COSY RED  STRIPE,1,1/17/2011 17:57,4.96,,United Kingdom
541424,22317,FIVE CATS HANGING DECORATION,1,1/17/2011 17:57,2.46,,United Kingdom
541424,22318,FIVE HEART HANGING DECORATION,1,1/17/2011 17:57,5.79,,United Kingdom
541424,22322,BIRD DECORATION GREEN POLKADOT,2,1/17/2011 17:57,0.79,,United Kingdom
541424,22325,MOBILE VINTAGE HEARTS ,1,1/17/2011 17:57,3.29,,United Kingdom
541424,22208,WOOD STAMP SET THANK YOU,2,1/17/2011 17:57,1.63,,United Kingdom
541424,22210,WOOD STAMP SET BEST WISHES,2,1/17/2011 17:57,1.63,,United Kingdom
541424,22211,WOOD STAMP SET FLOWERS,1,1/17/2011 17:57,1.63,,United Kingdom
541424,22212,FOUR HOOK  WHITE LOVEBIRDS,1,1/17/2011 17:57,4.13,,United Kingdom
541424,22214,CANDLE PLATE LACE WHITE,1,1/17/2011 17:57,1.63,,United Kingdom
541424,22216,T-LIGHT HOLDER WHITE LACE,1,1/17/2011 17:57,0.79,,United Kingdom
541424,22219,LOVEBIRD HANGING DECORATION WHITE ,3,1/17/2011 17:57,1.63,,United Kingdom
541424,22222,CAKE PLATE LOVEBIRD WHITE,2,1/17/2011 17:57,4.13,,United Kingdom
541424,22223,CAKE PLATE LOVEBIRD PINK,2,1/17/2011 17:57,4.13,,United Kingdom
541424,22227,HANGING HEART MIRROR DECORATION ,2,1/17/2011 17:57,1.25,,United Kingdom
541424,21882,SKULLS TAPE,1,1/17/2011 17:57,0.42,,United Kingdom
541424,21883,STARS GIFT TAPE ,6,1/17/2011 17:57,0.42,,United Kingdom
541424,21884,CAKES AND BOWS GIFT  TAPE,6,1/17/2011 17:57,0.42,,United Kingdom
541424,21889,WOODEN BOX OF DOMINOES,2,1/17/2011 17:57,2.46,,United Kingdom
541424,21892,TRADITIONAL WOODEN CATCH CUP GAME ,2,1/17/2011 17:57,2.46,,United Kingdom
541424,21903,MAN FLU METAL SIGN,1,1/17/2011 17:57,4.13,,United Kingdom
541424,21913,VINTAGE SEASIDE JIGSAW PUZZLES,1,1/17/2011 17:57,3.29,,United Kingdom
541424,21931,JUMBO STORAGE BAG SUKI,1,1/17/2011 17:57,4.13,,United Kingdom
541424,21934,SKULL SHOULDER BAG,6,1/17/2011 17:57,1.63,,United Kingdom
541424,21935,SUKI  SHOULDER BAG,12,1/17/2011 17:57,1.63,,United Kingdom
541424,21947,SET OF 6 HEART CHOPSTICKS,6,1/17/2011 17:57,1.25,,United Kingdom
541424,21990,MODERN FLORAL STATIONERY SET,1,1/17/2011 17:57,2.46,,United Kingdom
541424,22027,TEA PARTY BIRTHDAY CARD,1,1/17/2011 17:57,0.83,,United Kingdom
541424,22247,BUNNY DECORATION MAGIC GARDEN,5,1/17/2011 17:57,0.79,,United Kingdom
541424,22035,VINTAGE CARAVAN GREETING CARD ,1,1/17/2011 17:57,0.83,,United Kingdom
541424,22072,RED RETROSPOT TEA CUP AND SAUCER ,1,1/17/2011 17:57,7.46,,United Kingdom
541424,22074,6 RIBBONS SHIMMERING PINKS ,3,1/17/2011 17:57,0.83,,United Kingdom
541424,22077,6 RIBBONS RUSTIC CHARM,1,1/17/2011 17:57,3.29,,United Kingdom
541424,22083,PAPER CHAIN KIT RETROSPOT,1,1/17/2011 17:57,5.79,,United Kingdom
541424,22087,PAPER BUNTING WHITE LACE,4,1/17/2011 17:57,5.79,,United Kingdom
541424,22099,CARAVAN SQUARE TISSUE BOX,1,1/17/2011 17:57,2.46,,United Kingdom
541424,22111,SCOTTIE DOG HOT WATER BOTTLE,1,1/17/2011 17:57,10.79,,United Kingdom
541424,22147,FELTCRAFT BUTTERFLY HEARTS,1,1/17/2011 17:57,3.29,,United Kingdom
541424,22154,ANGEL DECORATION 3 BUTTONS ,6,1/17/2011 17:57,0.83,,United Kingdom
541424,22156,HEART DECORATION WITH PEARLS ,2,1/17/2011 17:57,1.63,,United Kingdom
541424,10125,MINI FUNKY DESIGN TAPES,2,1/17/2011 17:57,0.79,,United Kingdom
541424,10135,COLOURING PENCILS BROWN TUBE,8,1/17/2011 17:57,1.25,,United Kingdom
541424,15036,ASSORTED COLOURS SILK FAN,15,1/17/2011 17:57,1.25,,United Kingdom
541424,15044D,RED PAPER PARASOL,1,1/17/2011 17:57,5.79,,United Kingdom
541424,17012A,ORIGAMI VANILLA INCENSE/CANDLE SET ,1,1/17/2011 17:57,2.46,,United Kingdom
541424,20615,BLUE POLKADOT PASSPORT COVER,2,1/17/2011 17:57,1.63,,United Kingdom
541424,20652,BLUE POLKADOT LUGGAGE TAG ,4,1/17/2011 17:57,0.83,,United Kingdom
541424,20675,BLUE POLKADOT BOWL,2,1/17/2011 17:57,2.46,,United Kingdom
541424,20677,PINK POLKADOT BOWL,2,1/17/2011 17:57,2.46,,United Kingdom
541424,20699,MOUSEY LONG LEGS SOFT TOY,1,1/17/2011 17:57,2.46,,United Kingdom
541424,20707,CRAZY DAISY HEART DECORATION,1,1/17/2011 17:57,2.46,,United Kingdom
541424,20712,JUMBO BAG WOODLAND ANIMALS,2,1/17/2011 17:57,4.13,,United Kingdom
541424,20717,STRAWBERRY SHOPPER BAG,17,1/17/2011 17:57,0.83,,United Kingdom
541424,20725,LUNCH BAG RED RETROSPOT,1,1/17/2011 17:57,4.13,,United Kingdom
541424,20727,LUNCH BAG  BLACK SKULL.,2,1/17/2011 17:57,4.13,,United Kingdom
541424,20733,GOLD MINI TAPE MEASURE ,2,1/17/2011 17:57,0.83,,United Kingdom
541424,20764,ABSTRACT CIRCLES SKETCHBOOK ,1,1/17/2011 17:57,7.46,,United Kingdom
541424,22163,HEART STRING MEMO HOLDER HANGING,1,1/17/2011 17:57,3.29,,United Kingdom
541425,84755,COLOUR GLASS T-LIGHT HOLDER HANGING,144,1/18/2011 8:43,0.55,15513,United Kingdom
541426,22823,CHEST NATURAL WOOD 20 DRAWERS,4,1/18/2011 8:44,110,18233,United Kingdom
541427,48187,DOORMAT NEW ENGLAND,10,1/18/2011 8:46,6.75,17018,United Kingdom
541427,22690,DOORMAT HOME SWEET HOME BLUE ,10,1/18/2011 8:46,6.75,17018,United Kingdom
541427,21523,DOORMAT FANCY FONT HOME SWEET HOME,10,1/18/2011 8:46,6.75,17018,United Kingdom
541427,22692,DOORMAT WELCOME TO OUR HOME,10,1/18/2011 8:46,6.75,17018,United Kingdom
541427,20685,DOORMAT RED RETROSPOT,10,1/18/2011 8:46,6.75,17018,United Kingdom
541427,48129,DOORMAT TOPIARY,10,1/18/2011 8:46,6.75,17018,United Kingdom
541428,22855,FINE WICKER HEART ,12,1/18/2011 8:53,1.25,14242,United Kingdom
541428,22669,RED BABY BUNTING ,5,1/18/2011 8:53,2.95,14242,United Kingdom
541428,22469,HEART OF WICKER SMALL,12,1/18/2011 8:53,1.65,14242,United Kingdom
541428,85099B,JUMBO BAG RED RETROSPOT,10,1/18/2011 8:53,1.95,14242,United Kingdom
541428,22487,WHITE WOOD GARDEN PLANT LADDER,2,1/18/2011 8:53,9.95,14242,United Kingdom
541428,22189,CREAM HEART CARD HOLDER,4,1/18/2011 8:53,3.95,14242,United Kingdom
541428,85123A,WHITE HANGING HEART T-LIGHT HOLDER,6,1/18/2011 8:53,2.95,14242,United Kingdom
541428,48187,DOORMAT NEW ENGLAND,2,1/18/2011 8:53,7.95,14242,United Kingdom
541429,22343,PARTY PIZZA DISH RED RETROSPOT,24,1/18/2011 9:44,0.21,14688,United Kingdom
541429,22345,PARTY PIZZA DISH BLUE POLKADOT,24,1/18/2011 9:44,0.21,14688,United Kingdom
541429,22344,PARTY PIZZA DISH PINK POLKADOT,24,1/18/2011 9:44,0.21,14688,United Kingdom
541429,84519A,TOMATO CHARLIE+LOLA COASTER SET,24,1/18/2011 9:44,1.25,14688,United Kingdom
541429,48188,DOORMAT WELCOME PUPPIES,2,1/18/2011 9:44,7.95,14688,United Kingdom
541429,22379,RECYCLING BAG RETROSPOT ,10,1/18/2011 9:44,2.1,14688,United Kingdom
541429,22381,TOY TIDY PINK POLKADOT,10,1/18/2011 9:44,2.1,14688,United Kingdom
541429,85099B,JUMBO BAG RED RETROSPOT,10,1/18/2011 9:44,1.95,14688,United Kingdom
541429,21080,SET/20 RED RETROSPOT PAPER NAPKINS ,12,1/18/2011 9:44,0.85,14688,United Kingdom
541429,21086,SET/6 RED SPOTTY PAPER CUPS,12,1/18/2011 9:44,0.65,14688,United Kingdom
541429,21975,PACK OF 60 DINOSAUR CAKE CASES,24,1/18/2011 9:44,0.55,14688,United Kingdom
541429,84992,72 SWEETHEART FAIRY CAKE CASES,24,1/18/2011 9:44,0.55,14688,United Kingdom
541429,21210,SET OF 72 RETROSPOT PAPER  DOILIES,12,1/18/2011 9:44,1.45,14688,United Kingdom
541429,21974,SET OF 36 PAISLEY FLOWER DOILIES,12,1/18/2011 9:44,1.45,14688,United Kingdom
541429,22667,RECIPE BOX RETROSPOT ,6,1/18/2011 9:44,2.95,14688,United Kingdom
541429,84519B,CARROT CHARLIE+LOLA COASTER SET,24,1/18/2011 9:44,1.25,14688,United Kingdom
541429,21216,"SET 3 RETROSPOT TEA,COFFEE,SUGAR",4,1/18/2011 9:44,4.95,14688,United Kingdom
541429,21935,SUKI  SHOULDER BAG,10,1/18/2011 9:44,1.65,14688,United Kingdom
541429,21934,SKULL SHOULDER BAG,10,1/18/2011 9:44,1.65,14688,United Kingdom
541430,22138,BAKING SET 9 PIECE RETROSPOT ,24,1/18/2011 9:50,4.25,12356,Portugal
541430,21198,WHITE HEART CONFETTI IN TUBE,48,1/18/2011 9:50,0.42,12356,Portugal
541430,21114,LAVENDER SCENTED FABRIC HEART,40,1/18/2011 9:50,1.25,12356,Portugal
541430,21199,PINK  HEART CONFETTI IN TUBE,48,1/18/2011 9:50,0.42,12356,Portugal
541430,21231,SWEETHEART CERAMIC TRINKET BOX,72,1/18/2011 9:50,1.06,12356,Portugal
541430,22060,LARGE CAKE STAND HANGING HEARTS,12,1/18/2011 9:50,8.5,12356,Portugal
541430,22062,CERAMIC BOWL WITH LOVE HEART DESIGN,24,1/18/2011 9:50,2.95,12356,Portugal
541430,22066,LOVE HEART TRINKET POT,24,1/18/2011 9:50,1.45,12356,Portugal
541430,22132,RED LOVE HEART SHAPE CUP,48,1/18/2011 9:50,0.85,12356,Portugal
541430,22131,FOOD CONTAINER SET 3 LOVE HEART ,24,1/18/2011 9:50,1.95,12356,Portugal
541430,22195,LARGE HEART MEASURING SPOONS,12,1/18/2011 9:50,1.65,12356,Portugal
541430,22435,SET OF 9 HEART SHAPED BALLOONS,60,1/18/2011 9:50,1.25,12356,Portugal
541430,22937,BAKING MOULD CHOCOLATE CUPCAKES,24,1/18/2011 9:50,2.55,12356,Portugal
541430,84378,SET OF 3 HEART COOKIE CUTTERS,48,1/18/2011 9:50,1.25,12356,Portugal
541430,84569D,PACK 6 HEART/ICE-CREAM PATCHES,24,1/18/2011 9:50,1.25,12356,Portugal
541430,84992,72 SWEETHEART FAIRY CAKE CASES,120,1/18/2011 9:50,0.42,12356,Portugal
541430,85184C,S/4 VALENTINE DECOUPAGE HEART BOX,24,1/18/2011 9:50,1.25,12356,Portugal
541430,22055,MINI CAKE STAND  HANGING STRAWBERY,32,1/18/2011 9:50,1.45,12356,Portugal
541430,22059,CERAMIC STRAWBERRY DESIGN MUG,48,1/18/2011 9:50,1.25,12356,Portugal
541430,22649,STRAWBERRY FAIRY CAKE TEAPOT,24,1/18/2011 9:50,4.25,12356,Portugal
541430,22646,CERAMIC STRAWBERRY CAKE MONEY BANK,12,1/18/2011 9:50,1.45,12356,Portugal
541430,37448,CERAMIC CAKE DESIGN SPOTTED MUG,48,1/18/2011 9:50,1.25,12356,Portugal
541430,37450,CERAMIC CAKE BOWL + HANGING CAKES,18,1/18/2011 9:50,2.55,12356,Portugal
541430,37500,TEA TIME TEAPOT IN GIFT BOX,12,1/18/2011 9:50,8.49,12356,Portugal
541430,37501,TEA TIME TEA SET IN GIFT BOX,12,1/18/2011 9:50,6.95,12356,Portugal
541430,84991,60 TEATIME FAIRY CAKE CASES,120,1/18/2011 9:50,0.42,12356,Portugal
541430,84987,SET OF 36 TEATIME PAPER DOILIES,24,1/18/2011 9:50,1.45,12356,Portugal
