542252,84378,SET OF 3 HEART COOKIE CUTTERS,2,1/26/2011 16:01,3.29,,United Kingdom
542252,84559a,3D SHEET OF DOG STICKERS,1,1/26/2011 16:01,1.66,,United Kingdom
542252,84559b,3D SHEET OF CAT STICKERS,1,1/26/2011 16:01,1.66,,United Kingdom
542252,84992,72 SWEETHEART FAIRY CAKE CASES,1,1/26/2011 16:01,2.08,,United Kingdom
542252,84997a,GREEN 3 PIECE POLKADOT CUTLERY SET,1,1/26/2011 16:01,8.29,,United Kingdom
542252,85039a,SET/4 RED MINI ROSE CANDLE IN BOWL,1,1/26/2011 16:01,3.29,,United Kingdom
542252,85099B,JUMBO BAG RED RETROSPOT,1,1/26/2011 16:01,4.13,,United Kingdom
542252,21928,JUMBO BAG SCANDINAVIAN PAISLEY,1,1/26/2011 16:01,4.13,,United Kingdom
542252,22630,DOLLY GIRL LUNCH BOX,1,1/26/2011 16:01,2.46,,United Kingdom
542252,22645,CERAMIC HEART FAIRY CAKE MONEY BANK,1,1/26/2011 16:01,4.13,,United Kingdom
542252,22659,LUNCH BOX I LOVE LONDON,1,1/26/2011 16:01,2.46,,United Kingdom
542252,22665,RECIPE BOX BLUE SKETCHBOOK DESIGN,1,1/26/2011 16:01,5.79,,United Kingdom
542252,22666,RECIPE BOX PANTRY YELLOW DESIGN,3,1/26/2011 16:01,5.79,,United Kingdom
542252,22677,FRENCH BLUE METAL DOOR SIGN 2,1,1/26/2011 16:01,2.46,,United Kingdom
542252,22683,FRENCH BLUE METAL DOOR SIGN 8,1,1/26/2011 16:01,2.46,,United Kingdom
542252,22757,LARGE RED BABUSHKA NOTEBOOK ,1,1/26/2011 16:01,2.46,,United Kingdom
542252,22758,LARGE PURPLE BABUSHKA NOTEBOOK  ,1,1/26/2011 16:01,2.46,,United Kingdom
542252,22778,GLASS CLOCHE SMALL,1,1/26/2011 16:01,8.29,,United Kingdom
542252,37333,"RETRO ""TEA FOR ONE"" ",1,1/26/2011 16:01,10.79,,United Kingdom
542252,85099C,JUMBO  BAG BAROQUE BLACK WHITE,1,1/26/2011 16:01,4.13,,United Kingdom
542252,DOT,DOTCOM POSTAGE,1,1/26/2011 16:01,200.38,,United Kingdom
542253,21034,REX CASH+CARRY JUMBO SHOPPER,3,1/26/2011 16:36,0.95,,United Kingdom
542254,84836,ZINC METAL HEART DECORATION,36,1/26/2011 16:41,1.25,14733,United Kingdom
542254,22625,RED KITCHEN SCALES,2,1/26/2011 16:41,8.5,14733,United Kingdom
542254,21843,RED RETROSPOT CAKE STAND,3,1/26/2011 16:41,10.95,14733,United Kingdom
542254,48138,DOORMAT UNION FLAG,10,1/26/2011 16:41,6.75,14733,United Kingdom
542254,22722,SET OF 6 SPICE TINS PANTRY DESIGN,24,1/26/2011 16:41,3.45,14733,United Kingdom
542254,22854,CREAM SWEETHEART EGG HOLDER,24,1/26/2011 16:41,4.25,14733,United Kingdom
542254,22173,METAL 4 HOOK HANGER FRENCH CHATEAU,8,1/26/2011 16:41,2.95,14733,United Kingdom
542254,85066,CREAM SWEETHEART MINI CHEST,4,1/26/2011 16:41,12.75,14733,United Kingdom
542254,22073,RED RETROSPOT STORAGE JAR,16,1/26/2011 16:41,3.39,14733,United Kingdom
542254,22499,WOODEN UNION JACK BUNTING,6,1/26/2011 16:41,5.95,14733,United Kingdom
542255,21802,CHRISTMAS TREE HEART DECORATION,6,1/26/2011 16:43,0.42,,United Kingdom
542255,21803,CHRISTMAS TREE STAR DECORATION,6,1/26/2011 16:43,0.42,,United Kingdom
542255,21832,CHOCOLATE CALCULATOR,1,1/26/2011 16:43,3.29,,United Kingdom
542255,22934,BAKING MOULD EASTER EGG WHITE CHOC,1,1/26/2011 16:43,5.79,,United Kingdom
542255,22963,JAM JAR WITH GREEN LID,1,1/26/2011 16:43,1.63,,United Kingdom
542255,35965,FOLKART HEART NAPKIN RINGS,4,1/26/2011 16:43,3.29,,United Kingdom
542255,79144C,PAINTED LIGHTBULB RAINBOW DESIGN,4,1/26/2011 16:43,0.83,,United Kingdom
542255,82613B,"METAL SIGN,CUPCAKE SINGLE HOOK",1,1/26/2011 16:43,2.46,,United Kingdom
542255,84520B,PACK 20 ENGLISH ROSE PAPER NAPKINS,7,1/26/2011 16:43,1.63,,United Kingdom
542255,84836,ZINC METAL HEART DECORATION,2,1/26/2011 16:43,2.46,,United Kingdom
542255,84968C,SET OF 16 VINTAGE PISTACHIO CUTLERY,1,1/26/2011 16:43,24.96,,United Kingdom
542255,84970S,HANGING HEART ZINC T-LIGHT HOLDER,4,1/26/2011 16:43,2.08,,United Kingdom
542255,85173,SET/6 FROG PRINCE T-LIGHT CANDLES,1,1/26/2011 16:43,4.96,,United Kingdom
542255,85232D,SET/3 DECOUPAGE STACKING TINS,1,1/26/2011 16:43,9.96,,United Kingdom
542255,90214H,"LETTER ""H"" BLING KEY RING",1,1/26/2011 16:43,0.83,,United Kingdom
542255,90214M,"LETTER ""M"" BLING KEY RING",2,1/26/2011 16:43,0.83,,United Kingdom
542255,21844,RED RETROSPOT MUG,2,1/26/2011 16:43,5.79,,United Kingdom
542255,21868,POTTING SHED TEA MUG,1,1/26/2011 16:43,3.29,,United Kingdom
542255,21880,RED RETROSPOT TAPE,6,1/26/2011 16:43,0.42,,United Kingdom
542255,21908,CHOCOLATE THIS WAY METAL SIGN,2,1/26/2011 16:43,4.13,,United Kingdom
542255,21928,JUMBO BAG SCANDINAVIAN PAISLEY,2,1/26/2011 16:43,4.13,,United Kingdom
542255,21929,JUMBO BAG PINK VINTAGE PAISLEY,3,1/26/2011 16:43,4.13,,United Kingdom
542255,21931,JUMBO STORAGE BAG SUKI,2,1/26/2011 16:43,4.13,,United Kingdom
542255,21942,SKULLS DESIGN FLANNEL,2,1/26/2011 16:43,1.63,,United Kingdom
542255,21943,CAKES AND RABBITS DESIGN FLANNEL ,1,1/26/2011 16:43,1.63,,United Kingdom
542255,21944,KITTENS DESIGN FLANNEL,2,1/26/2011 16:43,1.63,,United Kingdom
542255,21945,STRAWBERRIES  DESIGN FLANNEL ,2,1/26/2011 16:43,1.63,,United Kingdom
542255,21946,PARTY TIME DESIGN FLANNEL,1,1/26/2011 16:43,1.63,,United Kingdom
542255,21947,SET OF 6 HEART CHOPSTICKS,1,1/26/2011 16:43,2.46,,United Kingdom
542255,22055,MINI CAKE STAND  HANGING STRAWBERY,1,1/26/2011 16:43,3.29,,United Kingdom
542255,22077,6 RIBBONS RUSTIC CHARM,2,1/26/2011 16:43,3.29,,United Kingdom
542255,22078,RIBBON REEL LACE DESIGN ,2,1/26/2011 16:43,4.13,,United Kingdom
542255,22081,RIBBON REEL FLORA + FAUNA ,2,1/26/2011 16:43,3.29,,United Kingdom
542255,22087,PAPER BUNTING WHITE LACE,3,1/26/2011 16:43,5.79,,United Kingdom
542255,DOT,DOTCOM POSTAGE,1,1/26/2011 16:43,246.37,,United Kingdom
542255,22111,SCOTTIE DOG HOT WATER BOTTLE,1,1/26/2011 16:43,10.79,,United Kingdom
542255,22132,RED LOVE HEART SHAPE CUP,1,1/26/2011 16:43,1.63,,United Kingdom
542255,22141,CHRISTMAS CRAFT TREE TOP ANGEL,1,1/26/2011 16:43,4.13,,United Kingdom
542255,22151,PLACE SETTING WHITE HEART,6,1/26/2011 16:43,1.63,,United Kingdom
542255,22161,HEART DECORATION RUSTIC HANGING ,21,1/26/2011 16:43,0.79,,United Kingdom
542255,22162,HEART GARLAND RUSTIC PADDED,1,1/26/2011 16:43,3.29,,United Kingdom
542255,22166,WALL MIRROR RECTANGLE DIAMANTE PINK,1,1/26/2011 16:43,7.46,,United Kingdom
542255,22189,CREAM HEART CARD HOLDER,1,1/26/2011 16:43,8.29,,United Kingdom
542255,22196,SMALL HEART MEASURING SPOONS,1,1/26/2011 16:43,1.63,,United Kingdom
542255,22219,LOVEBIRD HANGING DECORATION WHITE ,6,1/26/2011 16:43,1.63,,United Kingdom
542255,90214R,"LETTER ""R"" BLING KEY RING",4,1/26/2011 16:43,0.83,,United Kingdom
542255,90214S,"LETTER ""S"" BLING KEY RING",3,1/26/2011 16:43,0.83,,United Kingdom
542255,22227,HANGING HEART MIRROR DECORATION ,1,1/26/2011 16:43,1.25,,United Kingdom
542255,22228,BUNNY WOODEN PAINTED WITH BIRD ,1,1/26/2011 16:43,1.63,,United Kingdom
542255,22245,"HOOK, 1 HANGER ,MAGIC GARDEN",1,1/26/2011 16:43,1.63,,United Kingdom
542255,22268,EASTER DECORATION SITTING BUNNY,2,1/26/2011 16:43,1.63,,United Kingdom
542255,22285,HANGING HEN ON NEST DECORATION,1,1/26/2011 16:43,3.29,,United Kingdom
542255,22299,PIG KEYRING WITH LIGHT & SOUND ,1,1/26/2011 16:43,2.46,,United Kingdom
542255,22311,OFFICE MUG WARMER BLACK+SILVER ,1,1/26/2011 16:43,5.79,,United Kingdom
542255,22321,BIRD DECORATION RED RETROSPOT,1,1/26/2011 16:43,1.63,,United Kingdom
542255,22322,BIRD DECORATION GREEN POLKADOT,1,1/26/2011 16:43,1.63,,United Kingdom
542255,22329,ROUND CONTAINER SET OF 5 RETROSPOT,1,1/26/2011 16:43,3.29,,United Kingdom
542255,22331,WOODLAND PARTY BAG + STICKER SET,4,1/26/2011 16:43,3.29,,United Kingdom
542255,22335,HEART DECORATION PAINTED ZINC ,1,1/26/2011 16:43,1.25,,United Kingdom
542255,22342,HOME GARLAND PAINTED ZINC ,1,1/26/2011 16:43,3.29,,United Kingdom
542255,22356,CHARLOTTE BAG PINK POLKADOT,1,1/26/2011 16:43,1.63,,United Kingdom
542255,22375,AIRLINE BAG VINTAGE JET SET BROWN,1,1/26/2011 16:43,8.29,,United Kingdom
542255,22377,BOTTLE BAG RETROSPOT ,1,1/26/2011 16:43,4.13,,United Kingdom
542255,90214I,"LETTER ""I"" BLING KEY RING",1,1/26/2011 16:43,0.83,,United Kingdom
542255,90214J,"LETTER ""J"" BLING KEY RING",4,1/26/2011 16:43,0.83,,United Kingdom
542255,90214E,"LETTER ""E"" BLING KEY RING",1,1/26/2011 16:43,0.83,,United Kingdom
542255,90214L,"LETTER ""L"" BLING KEY RING",1,1/26/2011 16:43,0.83,,United Kingdom
542255,90214V,"LETTER ""V"" BLING KEY RING",1,1/26/2011 16:43,0.83,,United Kingdom
542255,22411,JUMBO SHOPPER VINTAGE RED PAISLEY,1,1/26/2011 16:43,4.13,,United Kingdom
542255,22419,LIPSTICK PEN RED,2,1/26/2011 16:43,0.83,,United Kingdom
542255,22424,ENAMEL BREAD BIN CREAM,1,1/26/2011 16:43,24.96,,United Kingdom
542255,22426,ENAMEL WASH BOWL CREAM,1,1/26/2011 16:43,7.46,,United Kingdom
542255,22427,ENAMEL FLOWER JUG CREAM,1,1/26/2011 16:43,11.63,,United Kingdom
542255,22431,WATERING CAN BLUE ELEPHANT,1,1/26/2011 16:43,4.13,,United Kingdom
542255,22432,WATERING CAN PINK BUNNY,1,1/26/2011 16:43,4.13,,United Kingdom
542255,22437,SET OF 9 BLACK SKULL BALLOONS,2,1/26/2011 16:43,1.63,,United Kingdom
542255,22457,NATURAL SLATE HEART CHALKBOARD ,1,1/26/2011 16:43,5.79,,United Kingdom
542255,22469,HEART OF WICKER SMALL,4,1/26/2011 16:43,3.29,,United Kingdom
542255,22470,HEART OF WICKER LARGE,1,1/26/2011 16:43,5.79,,United Kingdom
542255,22471,TV DINNER TRAY AIR HOSTESS ,1,1/26/2011 16:43,10.79,,United Kingdom
542255,22476,EMPIRE UNION JACK TV DINNER TRAY,1,1/26/2011 16:43,10.79,,United Kingdom
542255,22489,PACK OF 12 TRADITIONAL CRAYONS,1,1/26/2011 16:43,0.83,,United Kingdom
542255,22492,MINI PAINT SET VINTAGE ,1,1/26/2011 16:43,1.63,,United Kingdom
542255,22496,SET OF 2 ROUND TINS DUTCH CHEESE,1,1/26/2011 16:43,5.79,,United Kingdom
542255,85188A,GREEN METAL SWINGING BUNNY,1,1/26/2011 16:43,1.63,,United Kingdom
542255,85188B,PINK METAL SWINGING BUNNY,1,1/26/2011 16:43,1.63,,United Kingdom
542255,85202,HANGING WOOD AND FELT HEART,1,1/26/2011 16:43,0.79,,United Kingdom
542255,85203,HANGING WOOD AND FELT BUTTERFLY ,1,1/26/2011 16:43,0.79,,United Kingdom
542255,90104,PURPLE FRANGIPANI HAIRCLIP,10,1/26/2011 16:43,0.82,,United Kingdom
542255,90124B,BLUE MURANO TWIST NECKLACE,1,1/26/2011 16:43,9.96,,United Kingdom
542255,90214A,"LETTER ""A"" BLING KEY RING",2,1/26/2011 16:43,0.83,,United Kingdom
542255,90214C,"LETTER ""C"" BLING KEY RING",1,1/26/2011 16:43,0.83,,United Kingdom
542255,84978,HANGING HEART JAR T-LIGHT HOLDER,14,1/26/2011 16:43,2.46,,United Kingdom
542255,84988,SET OF 72 PINK HEART PAPER DOILIES,3,1/26/2011 16:43,2.92,,United Kingdom
542255,85099F,JUMBO BAG STRAWBERRY,1,1/26/2011 16:43,4.13,,United Kingdom
542255,85123A,WHITE HANGING HEART T-LIGHT HOLDER,6,1/26/2011 16:43,5.79,,United Kingdom
542255,85129D,BEADED CRYSTAL HEART PINK SMALL,1,1/26/2011 16:43,2.46,,United Kingdom
542255,84970L,SINGLE HEART ZINC T-LIGHT HOLDER,4,1/26/2011 16:43,2.08,,United Kingdom
542255,85150,LADIES & GENTLEMEN METAL SIGN,1,1/26/2011 16:43,4.96,,United Kingdom
542255,84969,BOX OF 6 ASSORTED COLOUR TEASPOONS,7,1/26/2011 16:43,3.29,,United Kingdom
542255,22558,CLOTHES PEGS RETROSPOT PACK 24 ,1,1/26/2011 16:43,2.46,,United Kingdom
542255,22595,GINGHAM HEART DECORATION,3,1/26/2011 16:43,1.63,,United Kingdom
542255,22624,IVORY KITCHEN SCALES,2,1/26/2011 16:43,16.63,,United Kingdom
542255,22625,RED KITCHEN SCALES,1,1/26/2011 16:43,16.63,,United Kingdom
542255,22637,PIGGY BANK RETROSPOT ,1,1/26/2011 16:43,4.96,,United Kingdom
542255,22653,BUTTON BOX ,1,1/26/2011 16:43,4.13,,United Kingdom
542255,22666,RECIPE BOX PANTRY YELLOW DESIGN,1,1/26/2011 16:43,5.79,,United Kingdom
542255,22694,WICKER STAR ,1,1/26/2011 16:43,4.13,,United Kingdom
542255,22697,GREEN REGENCY TEACUP AND SAUCER,6,1/26/2011 16:43,5.79,,United Kingdom
542255,22699,ROSES REGENCY TEACUP AND SAUCER ,4,1/26/2011 16:43,5.79,,United Kingdom
542255,22720,SET OF 3 CAKE TINS PANTRY DESIGN ,1,1/26/2011 16:43,10.79,,United Kingdom
542255,22722,SET OF 6 SPICE TINS PANTRY DESIGN,1,1/26/2011 16:43,8.29,,United Kingdom
542255,84849B,FAIRY SOAP SOAP HOLDER,1,1/26/2011 16:43,3.29,,United Kingdom
542255,84913A,SOFT PINK ROSE TOWEL ,3,1/26/2011 16:43,3.29,,United Kingdom
542255,84913B,MINT GREEN ROSE TOWEL,2,1/26/2011 16:43,3.29,,United Kingdom
542255,84945,MULTI COLOUR SILVER T-LIGHT HOLDER,6,1/26/2011 16:43,1.8,,United Kingdom
542255,22727,ALARM CLOCK BAKELIKE RED ,1,1/26/2011 16:43,7.46,,United Kingdom
542255,22740,POLKADOT PEN,9,1/26/2011 16:43,1.63,,United Kingdom
542255,22760,"TRAY, BREAKFAST IN BED",1,1/26/2011 16:43,24.96,,United Kingdom
542255,22762,CUPBOARD 3 DRAWER MA CAMPAGNE,1,1/26/2011 16:43,29.17,,United Kingdom
542255,22770,MIRROR CORNICE,1,1/26/2011 16:43,29.17,,United Kingdom
542255,22781,GUMBALL MAGAZINE RACK,1,1/26/2011 16:43,14.96,,United Kingdom
542255,22798,ANTIQUE GLASS DRESSING TABLE POT,1,1/26/2011 16:43,5.79,,United Kingdom
542255,22800,ANTIQUE TALL SWIRLGLASS TRINKET POT,1,1/26/2011 16:43,7.46,,United Kingdom
542255,22807,SET OF 6 T-LIGHTS TOADSTOOLS,1,1/26/2011 16:43,5.79,,United Kingdom
542255,22833,HALL CABINET WITH 3 DRAWERS,1,1/26/2011 16:43,100,,United Kingdom
542255,22834,HAND WARMER BABUSHKA DESIGN,1,1/26/2011 16:43,4.13,,United Kingdom
542255,22869,NUMBER TILE COTTAGE GARDEN 1,1,1/26/2011 16:43,4.13,,United Kingdom
542255,21352,EUCALYPTUS & PINECONE  WREATH,1,1/26/2011 16:43,5.79,,United Kingdom
542255,22873,NUMBER TILE COTTAGE GARDEN 5,1,1/26/2011 16:43,4.13,,United Kingdom
542255,84692,BOX OF 24 COCKTAIL PARASOLS,4,1/26/2011 16:43,0.83,,United Kingdom
542255,84510C,SET OF 4 POLKADOT COASTERS,1,1/26/2011 16:43,2.46,,United Kingdom
542255,84832,ZINC WILLIE WINKIE  CANDLE STICK,2,1/26/2011 16:43,1.63,,United Kingdom
542255,84950,ASSORTED COLOUR T-LIGHT HOLDER,6,1/26/2011 16:43,1.38,,United Kingdom
542255,22930,BAKING MOULD HEART MILK CHOCOLATE,2,1/26/2011 16:43,4.96,,United Kingdom
542255,82583,HOT BATHS METAL SIGN,1,1/26/2011 16:43,4.13,,United Kingdom
542255,84032A,CHARLIE+LOLA PINK HOT WATER BOTTLE,1,1/26/2011 16:43,3.29,,United Kingdom
542255,84459A,PINK METAL CHICKEN HEART ,1,1/26/2011 16:43,3.29,,United Kingdom
542255,84459B,YELLOW METAL CHICKEN HEART ,1,1/26/2011 16:43,3.29,,United Kingdom
542255,84510A,SET OF 4 ENGLISH ROSE COASTERS,3,1/26/2011 16:43,2.46,,United Kingdom
542255,79321,CHILLI LIGHTS,1,1/26/2011 16:43,9.96,,United Kingdom
542255,82581,TOILET METAL SIGN,2,1/26/2011 16:43,1.25,,United Kingdom
542255,37370,RETRO COFFEE MUGS ASSORTED,1,1/26/2011 16:43,15.79,,United Kingdom
542255,37446,MINI CAKE STAND WITH HANGING CAKES,1,1/26/2011 16:43,3.29,,United Kingdom
542255,37448,CERAMIC CAKE DESIGN SPOTTED MUG,1,1/26/2011 16:43,3.29,,United Kingdom
542255,48194,DOORMAT HEARTS,1,1/26/2011 16:43,14.13,,United Kingdom
542255,51014C,"FEATHER PEN,COAL BLACK",1,1/26/2011 16:43,1.63,,United Kingdom
542255,22966,GINGERBREAD MAN COOKIE CUTTER,1,1/26/2011 16:43,2.46,,United Kingdom
542255,22974,CHILDRENS DOLLY GIRL MUG,2,1/26/2011 16:43,3.29,,United Kingdom
542255,35923,CANDY HEART HANGING DECORATION,1,1/26/2011 16:43,2.46,,United Kingdom
542255,35961,FOLKART ZINC HEART CHRISTMAS DEC,1,1/26/2011 16:43,1.63,,United Kingdom
542255,62094B,TURQ ICE CREAM BUM BAG ,1,1/26/2011 16:43,4.96,,United Kingdom
542255,22962,JAM JAR WITH PINK LID,1,1/26/2011 16:43,1.63,,United Kingdom
542255,22935,BAKING MOULD ROSE MILK CHOCOLATE,1,1/26/2011 16:43,6.63,,United Kingdom
542255,22960,JAM MAKING SET WITH JARS,1,1/26/2011 16:43,8.29,,United Kingdom
542255,15056BL,EDWARDIAN PARASOL BLACK,1,1/26/2011 16:43,12.46,,United Kingdom
542255,15056N,EDWARDIAN PARASOL NATURAL,1,1/26/2011 16:43,12.46,,United Kingdom
542255,20676,RED RETROSPOT BOWL,2,1/26/2011 16:43,2.46,,United Kingdom
542255,20685,DOORMAT RED RETROSPOT,1,1/26/2011 16:43,7.46,,United Kingdom
542255,20713,JUMBO BAG OWLS,1,1/26/2011 16:43,4.13,,United Kingdom
542255,20725,LUNCH BAG RED RETROSPOT,1,1/26/2011 16:43,4.13,,United Kingdom
542255,20727,LUNCH BAG  BLACK SKULL.,1,1/26/2011 16:43,4.13,,United Kingdom
542255,20754,RETROSPOT RED WASHING UP GLOVES,1,1/26/2011 16:43,4.13,,United Kingdom
542255,20914,SET/5 RED RETROSPOT LID GLASS BOWLS,2,1/26/2011 16:43,5.79,,United Kingdom
542255,20961,STRAWBERRY BATH SPONGE ,6,1/26/2011 16:43,2.46,,United Kingdom
542255,20963,APPLE BATH SPONGE,7,1/26/2011 16:43,2.46,,United Kingdom
542255,20974,12 PENCILS SMALL TUBE SKULL,2,1/26/2011 16:43,1.25,,United Kingdom
542255,21002,ROSE DU SUD DRAWSTRING BAG,3,1/26/2011 16:43,3.29,,United Kingdom
542255,21035,SET/2 RED RETROSPOT TEA TOWELS ,1,1/26/2011 16:43,5.79,,United Kingdom
542255,21041,RED RETROSPOT OVEN GLOVE DOUBLE,1,1/26/2011 16:43,5.79,,United Kingdom
542255,21068,VINTAGE BILLBOARD LOVE/HATE MUG,1,1/26/2011 16:43,2.46,,United Kingdom
542255,21071,VINTAGE BILLBOARD DRINK ME MUG,2,1/26/2011 16:43,2.46,,United Kingdom
542255,21116,OWL DOORSTOP,1,1/26/2011 16:43,8.29,,United Kingdom
542255,21154,RED RETROSPOT OVEN GLOVE ,1,1/26/2011 16:43,2.46,,United Kingdom
542255,21207,SKULL AND CROSSBONES  GARLAND ,2,1/26/2011 16:43,1.63,,United Kingdom
542255,21212,PACK OF 72 RETROSPOT CAKE CASES,1,1/26/2011 16:43,1.25,,United Kingdom
542255,21213,PACK OF 72 SKULL CAKE CASES,1,1/26/2011 16:43,1.25,,United Kingdom
542255,21216,"SET 3 RETROSPOT TEA,COFFEE,SUGAR",1,1/26/2011 16:43,10.79,,United Kingdom
542255,21222,SET/4 BADGES BEETLES,2,1/26/2011 16:43,2.46,,United Kingdom
542255,21224,SET/4 SKULL BADGES,5,1/26/2011 16:43,0.83,,United Kingdom
542255,21344,MOROCCAN BEATEN METAL DISH,1,1/26/2011 16:43,20.79,,United Kingdom
542255,21385,IVORY HANGING DECORATION  HEART,3,1/26/2011 16:43,1.63,,United Kingdom
542255,21413,PERIWINKLE T-LIGHT HOLDER,2,1/26/2011 16:43,2.46,,United Kingdom
542255,21446,12 RED ROSE PEG PLACE SETTINGS,1,1/26/2011 16:43,2.46,,United Kingdom
542255,21447,12 IVORY ROSE PEG PLACE SETTINGS,1,1/26/2011 16:43,2.46,,United Kingdom
542255,21470,FLOWER VINE RAFFIA FOOD COVER,1,1/26/2011 16:43,7.46,,United Kingdom
542255,21472,LADYBIRD + BEE RAFFIA FOOD COVER,1,1/26/2011 16:43,7.46,,United Kingdom
542255,21485,RETROSPOT HEART HOT WATER BOTTLE,1,1/26/2011 16:43,10.79,,United Kingdom
542255,21533,RETROSPOT LARGE MILK JUG,1,1/26/2011 16:43,9.96,,United Kingdom
542255,22875,NUMBER TILE COTTAGE GARDEN 7,1,1/26/2011 16:43,4.13,,United Kingdom
542255,21535,RED RETROSPOT SMALL MILK JUG,1,1/26/2011 16:43,4.96,,United Kingdom
542255,21557,SET OF 6 FUNKY BEAKERS,1,1/26/2011 16:43,5.79,,United Kingdom
542255,21558,SKULL LUNCH BOX WITH CUTLERY ,1,1/26/2011 16:43,4.96,,United Kingdom
542255,21559,STRAWBERRY LUNCH BOX WITH CUTLERY,1,1/26/2011 16:43,4.96,,United Kingdom
542255,21561,DINOSAUR LUNCH BOX WITH CUTLERY,1,1/26/2011 16:43,4.96,,United Kingdom
542255,21640,ASSORTED TUTTI FRUTTI  FOB NOTEBOOK,3,1/26/2011 16:43,1.63,,United Kingdom
542255,21786,POLKADOT RAIN HAT ,5,1/26/2011 16:43,0.83,,United Kingdom
542255,21801,CHRISTMAS TREE DECORATION WITH BELL,6,1/26/2011 16:43,0.42,,United Kingdom
C542256,22116,METAL SIGN HIS DINNER IS SERVED,-12,1/26/2011 17:04,0.85,17722,United Kingdom
C542256,21883,STARS GIFT TAPE ,-1,1/26/2011 17:04,0.19,17722,United Kingdom
C542256,22471,TV DINNER TRAY AIR HOSTESS ,-1,1/26/2011 17:04,1.95,17722,United Kingdom
C542256,22095,LADS ONLY TISSUE BOX,-1,1/26/2011 17:04,1.06,17722,United Kingdom
C542257,22841,ROUND CAKE TIN VINTAGE GREEN,-2,1/26/2011 17:06,7.95,14341,United Kingdom
542258,22804,CANDLEHOLDER PINK HANGING HEART,8,1/26/2011 17:08,2.95,17372,United Kingdom
542258,85123A,WHITE HANGING HEART T-LIGHT HOLDER,12,1/26/2011 17:08,2.95,17372,United Kingdom
542258,22219,LOVEBIRD HANGING DECORATION WHITE ,2,1/26/2011 17:08,0.85,17372,United Kingdom
542258,22296,HEART IVORY TRELLIS LARGE,4,1/26/2011 17:08,1.65,17372,United Kingdom
542258,84597C,RETRO PINK BALL ASHTRAY ,1,1/26/2011 17:08,1.25,17372,United Kingdom
542258,21733,RED HANGING HEART T-LIGHT HOLDER,4,1/26/2011 17:08,2.95,17372,United Kingdom
542258,47590A,BLUE HAPPY BIRTHDAY BUNTING,2,1/26/2011 17:08,5.45,17372,United Kingdom
542258,47590B,PINK HAPPY BIRTHDAY BUNTING,2,1/26/2011 17:08,5.45,17372,United Kingdom
542258,84580,MOUSE TOY WITH PINK T-SHIRT,2,1/26/2011 17:08,3.75,17372,United Kingdom
542258,22400,MAGNETS PACK OF 4 HOME SWEET HOME,1,1/26/2011 17:08,1.25,17372,United Kingdom
542258,22399,MAGNETS PACK OF 4 CHILDHOOD MEMORY,1,1/26/2011 17:08,1.25,17372,United Kingdom
542258,22398,MAGNETS PACK OF 4 SWALLOWS,1,1/26/2011 17:08,1.25,17372,United Kingdom
542258,21122,SET/10 PINK POLKADOT PARTY CANDLES,2,1/26/2011 17:08,1.25,17372,United Kingdom
542258,21124,SET/10 BLUE POLKADOT PARTY CANDLES,2,1/26/2011 17:08,1.25,17372,United Kingdom
542258,21121,SET/10 RED POLKADOT PARTY CANDLES,3,1/26/2011 17:08,1.25,17372,United Kingdom
542258,22165,"DIAMANTE HEART SHAPED WALL MIRROR, ",1,1/26/2011 17:08,12.75,17372,United Kingdom
542258,22766,PHOTO FRAME CORNICE,4,1/26/2011 17:08,2.95,17372,United Kingdom
542258,21563,RED HEART SHAPE LOVE BUCKET ,1,1/26/2011 17:08,2.95,17372,United Kingdom
542258,22720,SET OF 3 CAKE TINS PANTRY DESIGN ,2,1/26/2011 17:08,4.95,17372,United Kingdom
542258,21034,REX CASH+CARRY JUMBO SHOPPER,3,1/26/2011 17:08,0.95,17372,United Kingdom
C542259,22625,RED KITCHEN SCALES,-1,1/26/2011 17:09,8.5,16656,United Kingdom
C542260,85150,LADIES & GENTLEMEN METAL SIGN,-2,1/26/2011 17:11,2.55,13890,United Kingdom
C542261,22971,QUEENS GUARD COFFEE MUG,-2,1/26/2011 17:13,2.1,17306,United Kingdom
C542261,22970,LONDON BUS COFFEE MUG,-6,1/26/2011 17:13,2.1,17306,United Kingdom
C542262,21843,RED RETROSPOT CAKE STAND,-1,1/26/2011 17:15,10.95,17591,United Kingdom
C542263,22699,ROSES REGENCY TEACUP AND SAUCER ,-1,1/26/2011 17:16,2.95,14849,United Kingdom
C542264,22423,REGENCY CAKESTAND 3 TIER,-2,1/26/2011 17:25,10.95,15215,United Kingdom
C542264,48138,DOORMAT UNION FLAG,-1,1/26/2011 17:25,7.95,15215,United Kingdom
542265,22365,DOORMAT RESPECTABLE HOUSE,1,1/26/2011 17:27,7.95,15867,United Kingdom
542265,20685,DOORMAT RED RETROSPOT,2,1/26/2011 17:27,7.95,15867,United Kingdom
542265,48138,DOORMAT UNION FLAG,2,1/26/2011 17:27,7.95,15867,United Kingdom
542265,21955,DOORMAT UNION JACK GUNS AND ROSES,2,1/26/2011 17:27,7.95,15867,United Kingdom
542265,84974,S/2 ZINC HEART DESIGN PLANTERS,1,1/26/2011 17:27,9.95,15867,United Kingdom
542265,22109,FULL ENGLISH BREAKFAST PLATE,2,1/26/2011 17:27,3.75,15867,United Kingdom
542265,22551,PLASTERS IN TIN SPACEBOY,2,1/26/2011 17:27,1.65,15867,United Kingdom
542265,22556,PLASTERS IN TIN CIRCUS PARADE ,2,1/26/2011 17:27,1.65,15867,United Kingdom
542265,22555,PLASTERS IN TIN STRONGMAN,2,1/26/2011 17:27,1.65,15867,United Kingdom
542265,21673,WHITE SPOT BLUE CERAMIC DRAWER KNOB,6,1/26/2011 17:27,1.25,15867,United Kingdom
542265,22964,3 PIECE SPACEBOY COOKIE CUTTER SET,2,1/26/2011 17:27,2.1,15867,United Kingdom
542265,22966,GINGERBREAD MAN COOKIE CUTTER,2,1/26/2011 17:27,1.25,15867,United Kingdom
542265,22957,SET 3 PAPER VINTAGE CHICK PAPER EGG,1,1/26/2011 17:27,2.95,15867,United Kingdom
542265,84380,SET OF 3 BUTTERFLY COOKIE CUTTERS,2,1/26/2011 17:27,1.25,15867,United Kingdom
542265,84378,SET OF 3 HEART COOKIE CUTTERS,2,1/26/2011 17:27,1.25,15867,United Kingdom
542265,22190,LOCAL CAFE MUG,1,1/26/2011 17:27,2.1,15867,United Kingdom
542265,22577,WOODEN HEART CHRISTMAS SCANDINAVIAN,7,1/26/2011 17:27,0.85,15867,United Kingdom
542265,21122,SET/10 PINK POLKADOT PARTY CANDLES,2,1/26/2011 17:27,1.25,15867,United Kingdom
542265,21121,SET/10 RED POLKADOT PARTY CANDLES,2,1/26/2011 17:27,1.25,15867,United Kingdom
542265,21124,SET/10 BLUE POLKADOT PARTY CANDLES,2,1/26/2011 17:27,1.25,15867,United Kingdom
542265,21917,SET 12 KIDS  WHITE CHALK STICKS,3,1/26/2011 17:27,0.42,15867,United Kingdom
542265,18098C,PORCELAIN BUTTERFLY OIL BURNER,2,1/26/2011 17:27,2.95,15867,United Kingdom
542265,22425,ENAMEL COLANDER CREAM,3,1/26/2011 17:27,4.95,15867,United Kingdom
542266,72351A,SET/6 TURQUOISE BUTTERFLY T-LIGHTS,4,1/26/2011 17:37,2.1,16918,United Kingdom
542266,72351B,SET/6 PINK  BUTTERFLY T-LIGHTS,8,1/26/2011 17:37,2.1,16918,United Kingdom
542266,22706,WRAP COWBOYS  ,25,1/26/2011 17:37,0.42,16918,United Kingdom
542266,85123A,WHITE HANGING HEART T-LIGHT HOLDER,9,1/26/2011 17:37,2.95,16918,United Kingdom
542266,21733,RED HANGING HEART T-LIGHT HOLDER,4,1/26/2011 17:37,2.95,16918,United Kingdom
542266,22804,CANDLEHOLDER PINK HANGING HEART,3,1/26/2011 17:37,2.95,16918,United Kingdom
542266,21985,PACK OF 12 HEARTS DESIGN TISSUES ,12,1/26/2011 17:37,0.29,16918,United Kingdom
542266,22588,CARD HOLDER GINGHAM HEART,3,1/26/2011 17:37,2.55,16918,United Kingdom
542266,22457,NATURAL SLATE HEART CHALKBOARD ,2,1/26/2011 17:37,2.95,16918,United Kingdom
542266,22384,LUNCH BAG PINK POLKADOT,10,1/26/2011 17:37,1.65,16918,United Kingdom
542266,22815,CARD PSYCHEDELIC APPLES,12,1/26/2011 17:37,0.42,16918,United Kingdom
542266,22821,GIFT BAG PSYCHEDELIC APPLES,12,1/26/2011 17:37,0.65,16918,United Kingdom
542266,22892,SET OF SALT AND PEPPER TOADSTOOLS,6,1/26/2011 17:37,1.25,16918,United Kingdom
542266,22634,CHILDS BREAKFAST SET SPACEBOY ,1,1/26/2011 17:37,9.95,16918,United Kingdom
542266,22714,CARD BIRTHDAY COWBOY,12,1/26/2011 17:37,0.42,16918,United Kingdom
542266,22968,ROSE COTTAGE KEEPSAKE BOX ,2,1/26/2011 17:37,9.95,16918,United Kingdom
542266,20974,12 PENCILS SMALL TUBE SKULL,10,1/26/2011 17:37,0.65,16918,United Kingdom
542266,20973,12 PENCIL SMALL TUBE WOODLAND,10,1/26/2011 17:37,0.65,16918,United Kingdom
542266,22419,LIPSTICK PEN RED,2,1/26/2011 17:37,0.42,16918,United Kingdom
542266,22420,LIPSTICK PEN BABY PINK,2,1/26/2011 17:37,0.42,16918,United Kingdom
542266,22421,LIPSTICK PEN FUSCHIA,2,1/26/2011 17:37,0.42,16918,United Kingdom
542266,22755,SMALL PURPLE BABUSHKA NOTEBOOK ,3,1/26/2011 17:37,0.85,16918,United Kingdom
542266,22754,SMALL RED BABUSHKA NOTEBOOK ,2,1/26/2011 17:37,0.85,16918,United Kingdom
542266,22753,SMALL YELLOW BABUSHKA NOTEBOOK ,2,1/26/2011 17:37,0.85,16918,United Kingdom
542266,22913,RED COAT RACK PARIS FASHION,1,1/26/2011 17:37,4.95,16918,United Kingdom
542266,22912,YELLOW COAT RACK PARIS FASHION,2,1/26/2011 17:37,4.95,16918,United Kingdom
542266,22165,"DIAMANTE HEART SHAPED WALL MIRROR, ",2,1/26/2011 17:37,12.75,16918,United Kingdom
542266,22167, OVAL WALL MIRROR DIAMANTE ,1,1/26/2011 17:37,9.95,16918,United Kingdom
542266,22652,TRAVEL SEWING KIT,4,1/26/2011 17:37,1.65,16918,United Kingdom
542266,22654,DELUXE SEWING KIT ,3,1/26/2011 17:37,5.95,16918,United Kingdom
