540247,21756,BATH BUILDING BLOCK WORD,1,1/5/2011 15:56,5.95,15464,United Kingdom
540247,21754,HOME BUILDING BLOCK WORD,3,1/5/2011 15:56,5.95,15464,United Kingdom
540247,21421,PORCELAIN ROSE LARGE ,3,1/5/2011 15:56,1.25,15464,United Kingdom
540247,22782,SET 3 WICKER STORAGE BASKETS ,1,1/5/2011 15:56,24.95,15464,United Kingdom
540247,22467,GUMBALL COAT RACK,1,1/5/2011 15:56,2.55,15464,United Kingdom
540247,22173,METAL 4 HOOK HANGER FRENCH CHATEAU,1,1/5/2011 15:56,2.95,15464,United Kingdom
540247,22098,BOUDOIR SQUARE TISSUE BOX,1,1/5/2011 15:56,1.25,15464,United Kingdom
540247,21763,VINTAGE WOODEN BAR STOOL,2,1/5/2011 15:56,29.95,15464,United Kingdom
540247,84375,SET OF 20 KIDS COOKIE CUTTERS,1,1/5/2011 15:56,2.1,15464,United Kingdom
540247,22723,SET OF 6 HERB TINS SKETCHBOOK,2,1/5/2011 15:56,3.95,15464,United Kingdom
540247,22094,RED RETROSPOT TISSUE BOX,1,1/5/2011 15:56,1.25,15464,United Kingdom
540247,84970S,HANGING HEART ZINC T-LIGHT HOLDER,6,1/5/2011 15:56,0.85,15464,United Kingdom
540247,85054,FRENCH ENAMEL POT W LID,1,1/5/2011 15:56,2.95,15464,United Kingdom
540247,21714,CITRONELLA CANDLE GARDEN POT,6,1/5/2011 15:56,1.25,15464,United Kingdom
540247,20933,YELLOW POT PLANT CANDLE,2,1/5/2011 15:56,3.75,15464,United Kingdom
540247,84375,SET OF 20 KIDS COOKIE CUTTERS,1,1/5/2011 15:56,2.1,15464,United Kingdom
540247,85055,FRENCH ENAMEL UTENSIL HOLDER,1,1/5/2011 15:56,3.75,15464,United Kingdom
540247,22666,RECIPE BOX PANTRY YELLOW DESIGN,2,1/5/2011 15:56,2.95,15464,United Kingdom
540247,85174,S/4 CACTI CANDLES,2,1/5/2011 15:56,4.95,15464,United Kingdom
540247,22961,JAM MAKING SET PRINTED,1,1/5/2011 15:56,1.45,15464,United Kingdom
540247,22963,JAM JAR WITH GREEN LID,6,1/5/2011 15:56,0.85,15464,United Kingdom
540247,22969,HOMEMADE JAM SCENTED CANDLES,12,1/5/2011 15:56,1.45,15464,United Kingdom
540247,22720,SET OF 3 CAKE TINS PANTRY DESIGN ,1,1/5/2011 15:56,4.95,15464,United Kingdom
540247,22457,NATURAL SLATE HEART CHALKBOARD ,12,1/5/2011 15:56,2.95,15464,United Kingdom
540247,22348,TEA BAG PLATE RED RETROSPOT,1,1/5/2011 15:56,0.85,15464,United Kingdom
540247,72800B, 4 PURPLE FLOCK DINNER CANDLES,1,1/5/2011 15:56,2.55,15464,United Kingdom
540247,22895,SET OF 2 TEA TOWELS APPLE AND PEARS,2,1/5/2011 15:56,2.95,15464,United Kingdom
540247,22191,IVORY DINER WALL CLOCK,1,1/5/2011 15:56,8.5,15464,United Kingdom
540247,72351A,SET/6 TURQUOISE BUTTERFLY T-LIGHTS,1,1/5/2011 15:56,2.1,15464,United Kingdom
540247,84380,SET OF 3 BUTTERFLY COOKIE CUTTERS,1,1/5/2011 15:56,1.25,15464,United Kingdom
540247,84378,SET OF 3 HEART COOKIE CUTTERS,3,1/5/2011 15:56,1.25,15464,United Kingdom
540247,22965,3 TRADITIONAl BISCUIT CUTTERS  SET,1,1/5/2011 15:56,2.1,15464,United Kingdom
540247,21272,SALLE DE BAIN HOOK,2,1/5/2011 15:56,1.25,15464,United Kingdom
540247,21471,STRAWBERRY RAFFIA FOOD COVER,1,1/5/2011 15:56,3.75,15464,United Kingdom
540247,21472,LADYBIRD + BEE RAFFIA FOOD COVER,1,1/5/2011 15:56,3.75,15464,United Kingdom
540247,22310,IVORY KNITTED MUG COSY ,1,1/5/2011 15:56,1.65,15464,United Kingdom
540247,22842,BISCUIT TIN VINTAGE RED,1,1/5/2011 15:56,6.75,15464,United Kingdom
540247,22139,RETROSPOT TEA SET CERAMIC 11 PC ,1,1/5/2011 15:56,4.95,15464,United Kingdom
540247,21531,RED RETROSPOT SUGAR JAM BOWL,2,1/5/2011 15:56,2.55,15464,United Kingdom
540247,72802B,OCEAN SCENT CANDLE IN JEWELLED BOX,1,1/5/2011 15:56,4.25,15464,United Kingdom
540247,72127,COLUMBIAN CANDLE ROUND ,1,1/5/2011 15:56,1.25,15464,United Kingdom
540247,72130,COLUMBIAN CANDLE ROUND,1,1/5/2011 15:56,0.65,15464,United Kingdom
540247,72128,COLUMBIAN CANDLE ROUND,1,1/5/2011 15:56,0.85,15464,United Kingdom
540247,22839,3 TIER CAKE TIN GREEN AND CREAM,1,1/5/2011 15:56,14.95,15464,United Kingdom
540247,22838,3 TIER CAKE TIN RED AND CREAM,1,1/5/2011 15:56,14.95,15464,United Kingdom
540247,22843,BISCUIT TIN VINTAGE GREEN,1,1/5/2011 15:56,6.75,15464,United Kingdom
540247,22939,APRON APPLE DELIGHT,1,1/5/2011 15:56,4.95,15464,United Kingdom
540247,22078,RIBBON REEL LACE DESIGN ,1,1/5/2011 15:56,2.1,15464,United Kingdom
540247,22079,RIBBON REEL HEARTS DESIGN ,1,1/5/2011 15:56,1.65,15464,United Kingdom
540247,22081,RIBBON REEL FLORA + FAUNA ,1,1/5/2011 15:56,1.65,15464,United Kingdom
540247,22082,RIBBON REEL STRIPES DESIGN ,1,1/5/2011 15:56,1.65,15464,United Kingdom
540247,21108,FAIRY CAKE FLANNEL ASSORTED COLOUR,9,1/5/2011 15:56,2.55,15464,United Kingdom
540247,22667,RECIPE BOX RETROSPOT ,1,1/5/2011 15:56,2.95,15464,United Kingdom
540247,22427,ENAMEL FLOWER JUG CREAM,1,1/5/2011 15:56,5.95,15464,United Kingdom
540247,21559,STRAWBERRY LUNCH BOX WITH CUTLERY,2,1/5/2011 15:56,2.55,15464,United Kingdom
540247,22956,36 FOIL HEART CAKE CASES,1,1/5/2011 15:56,2.1,15464,United Kingdom
540247,72349B,SET/6 PURPLE BUTTERFLY T-LIGHTS,1,1/5/2011 15:56,2.1,15464,United Kingdom
540247,22567,20 DOLLY PEGS RETROSPOT,1,1/5/2011 15:56,1.25,15464,United Kingdom
540247,22558,CLOTHES PEGS RETROSPOT PACK 24 ,1,1/5/2011 15:56,1.49,15464,United Kingdom
540247,35972,DAISY FOLKART HEART DECORATION,1,1/5/2011 15:56,1.25,15464,United Kingdom
540247,22799,SWEETHEART WIRE FRUIT BOWL,1,1/5/2011 15:56,8.5,15464,United Kingdom
540247,21326,AGED GLASS SILVER T-LIGHT HOLDER,3,1/5/2011 15:56,0.65,15464,United Kingdom
540247,84459B,YELLOW METAL CHICKEN HEART ,3,1/5/2011 15:56,1.49,15464,United Kingdom
540247,22424,ENAMEL BREAD BIN CREAM,1,1/5/2011 15:56,12.75,15464,United Kingdom
540247,21539,RED RETROSPOT BUTTER DISH,1,1/5/2011 15:56,4.95,15464,United Kingdom
540247,21455,PAINTED YELLOW WOODEN DAISY,4,1/5/2011 15:56,0.85,15464,United Kingdom
540247,21537,RED RETROSPOT PUDDING BOWL,1,1/5/2011 15:56,4.25,15464,United Kingdom
540247,20751,FUNKY WASHING UP GLOVES ASSORTED,4,1/5/2011 15:56,2.1,15464,United Kingdom
540247,20754,RETROSPOT RED WASHING UP GLOVES,1,1/5/2011 15:56,2.1,15464,United Kingdom
540247,20752,BLUE POLKADOT WASHING UP GLOVES,2,1/5/2011 15:56,2.1,15464,United Kingdom
540247,21389,IVORY HANGING DECORATION  BIRD,4,1/5/2011 15:56,0.85,15464,United Kingdom
540247,21584,RETROSPOT SMALL TUBE MATCHES,3,1/5/2011 15:56,1.65,15464,United Kingdom
540247,22624,IVORY KITCHEN SCALES,1,1/5/2011 15:56,8.5,15464,United Kingdom
540247,21845,DAIRY MAID STRIPE MUG,6,1/5/2011 15:56,2.95,15464,United Kingdom
540247,22956,36 FOIL HEART CAKE CASES,1,1/5/2011 15:56,2.1,15464,United Kingdom
540247,22862,LOVE HEART NAPKIN BOX ,1,1/5/2011 15:56,4.25,15464,United Kingdom
540247,22907,PACK OF 20 NAPKINS PANTRY DESIGN,3,1/5/2011 15:56,0.85,15464,United Kingdom
540247,22328,ROUND SNACK BOXES SET OF 4 FRUITS ,2,1/5/2011 15:56,2.95,15464,United Kingdom
540247,22197,SMALL POPCORN HOLDER,3,1/5/2011 15:56,0.85,15464,United Kingdom
540247,21527,RED RETROSPOT TRADITIONAL TEAPOT ,1,1/5/2011 15:56,7.95,15464,United Kingdom
540247,21216,"SET 3 RETROSPOT TEA,COFFEE,SUGAR",1,1/5/2011 15:56,4.95,15464,United Kingdom
540247,22908,PACK OF 20 NAPKINS RED APPLES,3,1/5/2011 15:56,0.85,15464,United Kingdom
540247,22629,SPACEBOY LUNCH BOX ,2,1/5/2011 15:56,1.95,15464,United Kingdom
540248,22457,NATURAL SLATE HEART CHALKBOARD ,6,1/5/2011 15:57,2.95,15034,United Kingdom
540248,22766,PHOTO FRAME CORNICE,4,1/5/2011 15:57,2.95,15034,United Kingdom
540248,22625,RED KITCHEN SCALES,1,1/5/2011 15:57,8.5,15034,United Kingdom
540248,22624,IVORY KITCHEN SCALES,1,1/5/2011 15:57,8.5,15034,United Kingdom
540248,22626,BLACK KITCHEN SCALES,1,1/5/2011 15:57,8.5,15034,United Kingdom
540248,21843,RED RETROSPOT CAKE STAND,3,1/5/2011 15:57,10.95,15034,United Kingdom
540248,22567,20 DOLLY PEGS RETROSPOT,6,1/5/2011 15:57,1.25,15034,United Kingdom
540248,82580,BATHROOM METAL SIGN,6,1/5/2011 15:57,0.55,15034,United Kingdom
540248,22670,FRENCH WC SIGN BLUE METAL,4,1/5/2011 15:57,1.25,15034,United Kingdom
540248,82551,LAUNDRY 15C METAL SIGN,6,1/5/2011 15:57,1.45,15034,United Kingdom
540248,22768,FAMILY PHOTO FRAME CORNICE,2,1/5/2011 15:57,9.95,15034,United Kingdom
540248,22804,CANDLEHOLDER PINK HANGING HEART,6,1/5/2011 15:57,2.95,15034,United Kingdom
540248,22500,SET OF 2 TINS JARDIN DE PROVENCE,4,1/5/2011 15:57,4.95,15034,United Kingdom
540248,21906,PHARMACIE FIRST AID TIN,6,1/5/2011 15:57,6.75,15034,United Kingdom
540248,21558,SKULL LUNCH BOX WITH CUTLERY ,6,1/5/2011 15:57,2.55,15034,United Kingdom
540248,22558,CLOTHES PEGS RETROSPOT PACK 24 ,6,1/5/2011 15:57,1.49,15034,United Kingdom
540248,22352,LUNCH BOX WITH CUTLERY RETROSPOT ,6,1/5/2011 15:57,2.55,15034,United Kingdom
540248,22956,36 FOIL HEART CAKE CASES,4,1/5/2011 15:57,2.1,15034,United Kingdom
540248,22425,ENAMEL COLANDER CREAM,32,1/5/2011 15:57,4.25,15034,United Kingdom
540248,22495,SET OF 2 ROUND TINS CAMEMBERT ,2,1/5/2011 15:57,2.95,15034,United Kingdom
540248,22496,SET OF 2 ROUND TINS DUTCH CHEESE,4,1/5/2011 15:57,2.95,15034,United Kingdom
540248,21918,SET 12 KIDS COLOUR  CHALK STICKS,8,1/5/2011 15:57,0.42,15034,United Kingdom
540248,21625,VINTAGE UNION JACK APRON,4,1/5/2011 15:57,6.95,15034,United Kingdom
540248,21888,BINGO SET,2,1/5/2011 15:57,3.75,15034,United Kingdom
540248,21791,VINTAGE HEADS AND TAILS CARD GAME ,2,1/5/2011 15:57,1.25,15034,United Kingdom
540248,22561,WOODEN SCHOOL COLOURING SET,4,1/5/2011 15:57,1.65,15034,United Kingdom
540248,22622,BOX OF VINTAGE ALPHABET BLOCKS,1,1/5/2011 15:57,9.95,15034,United Kingdom
540248,22623,BOX OF VINTAGE JIGSAW BLOCKS ,1,1/5/2011 15:57,4.95,15034,United Kingdom
540248,21914,BLUE HARMONICA IN BOX ,6,1/5/2011 15:57,1.25,15034,United Kingdom
540248,21915,RED  HARMONICA IN BOX ,6,1/5/2011 15:57,1.25,15034,United Kingdom
540248,22554,PLASTERS IN TIN WOODLAND ANIMALS,1,1/5/2011 15:57,1.65,15034,United Kingdom
540248,21559,STRAWBERRY LUNCH BOX WITH CUTLERY,3,1/5/2011 15:57,2.55,15034,United Kingdom
540248,21206,STRAWBERRY HONEYCOMB  GARLAND ,2,1/5/2011 15:57,1.65,15034,United Kingdom
540248,21204,DAISIES  HONEYCOMB GARLAND ,3,1/5/2011 15:57,1.65,15034,United Kingdom
540248,21205,MULTICOLOUR 3D BALLS GARLAND,2,1/5/2011 15:57,2.55,15034,United Kingdom
540248,22934,BAKING MOULD EASTER EGG WHITE CHOC,1,1/5/2011 15:57,2.95,15034,United Kingdom
540248,22935,BAKING MOULD ROSE MILK CHOCOLATE,2,1/5/2011 15:57,3.25,15034,United Kingdom
540248,22932,BAKING MOULD TOFFEE CUP CHOCOLATE,2,1/5/2011 15:57,2.55,15034,United Kingdom
540248,22937,BAKING MOULD CHOCOLATE CUPCAKES,8,1/5/2011 15:57,2.55,15034,United Kingdom
540248,22931,BAKING MOULD HEART WHITE CHOCOLATE,2,1/5/2011 15:57,2.55,15034,United Kingdom
540248,22930,BAKING MOULD HEART MILK CHOCOLATE,6,1/5/2011 15:57,2.55,15034,United Kingdom
540248,48138,DOORMAT UNION FLAG,1,1/5/2011 15:57,7.95,15034,United Kingdom
540248,48184,DOORMAT ENGLISH ROSE ,1,1/5/2011 15:57,7.95,15034,United Kingdom
540249,22966,GINGERBREAD MAN COOKIE CUTTER,12,1/5/2011 16:00,1.25,15298,United Kingdom
540249,16161P,WRAP ENGLISH ROSE ,25,1/5/2011 16:00,0.42,15298,United Kingdom
540249,21495,SKULLS AND CROSSBONES WRAP,50,1/5/2011 16:00,0.42,15298,United Kingdom
540249,21498,RED RETROSPOT WRAP ,25,1/5/2011 16:00,0.42,15298,United Kingdom
540249,22045,SPACEBOY GIFT WRAP,25,1/5/2011 16:00,0.42,15298,United Kingdom
540249,22046,TEA PARTY  WRAPPING PAPER ,25,1/5/2011 16:00,0.42,15298,United Kingdom
540249,17096,ASSORTED LAQUERED INCENSE HOLDERS,48,1/5/2011 16:00,0.21,15298,United Kingdom
540249,17038,PORCELAIN BUDAH INCENSE HOLDER,100,1/5/2011 16:00,0.1,15298,United Kingdom
540249,79321,CHILLI LIGHTS,8,1/5/2011 16:00,4.95,15298,United Kingdom
540249,22179,SET 10 LIGHTS NIGHT OWL,6,1/5/2011 16:00,6.75,15298,United Kingdom
540249,22468,BABUSHKA LIGHTS STRING OF 10,4,1/5/2011 16:00,6.75,15298,United Kingdom
540249,21731,RED TOADSTOOL LED NIGHT LIGHT,12,1/5/2011 16:00,1.65,15298,United Kingdom
540249,22892,SET OF SALT AND PEPPER TOADSTOOLS,36,1/5/2011 16:00,1.25,15298,United Kingdom
540249,22059,CERAMIC STRAWBERRY DESIGN MUG,12,1/5/2011 16:00,1.49,15298,United Kingdom
540249,37448,CERAMIC CAKE DESIGN SPOTTED MUG,12,1/5/2011 16:00,1.49,15298,United Kingdom
C540250,79321,CHILLI LIGHTS,-1,1/5/2011 16:02,4.25,17511,United Kingdom
C540250,22617,BAKING SET SPACEBOY DESIGN,-2,1/5/2011 16:02,4.25,17511,United Kingdom
C540250,22411,JUMBO SHOPPER VINTAGE RED PAISLEY,-1,1/5/2011 16:02,1.65,17511,United Kingdom
C540250,21928,JUMBO BAG SCANDINAVIAN PAISLEY,-1,1/5/2011 16:02,1.65,17511,United Kingdom
C540250,22942,CHRISTMAS LIGHTS 10 SANTAS ,-1,1/5/2011 16:02,8.5,17511,United Kingdom
C540250,22198,LARGE POPCORN HOLDER ,-2,1/5/2011 16:02,1.45,17511,United Kingdom
C540250,85099F,JUMBO BAG STRAWBERRY,-1,1/5/2011 16:02,1.65,17511,United Kingdom
C540250,22941,CHRISTMAS LIGHTS 10 REINDEER,-1,1/5/2011 16:02,8.5,17511,United Kingdom
540251,84968E,SET OF 16 VINTAGE BLACK CUTLERY,1,1/5/2011 16:06,12.75,12748,United Kingdom
540252,22198,,-100,1/5/2011 16:25,0,,United Kingdom
540253,21524,DOORMAT SPOTTY HOME SWEET HOME,30,1/5/2011 16:28,6.75,13225,United Kingdom
540253,48185,DOORMAT FAIRY CAKE,30,1/5/2011 16:28,6.75,13225,United Kingdom
540253,48187,DOORMAT NEW ENGLAND,40,1/5/2011 16:28,6.75,13225,United Kingdom
540253,21929,JUMBO BAG PINK VINTAGE PAISLEY,100,1/5/2011 16:28,1.65,13225,United Kingdom
540253,21166,COOK WITH WINE METAL SIGN ,48,1/5/2011 16:28,1.69,13225,United Kingdom
540253,21175,GIN + TONIC DIET METAL SIGN,48,1/5/2011 16:28,1.85,13225,United Kingdom
540253,21181,PLEASE ONE PERSON METAL SIGN,48,1/5/2011 16:28,1.85,13225,United Kingdom
540253,22386,JUMBO BAG PINK POLKADOT,100,1/5/2011 16:28,1.65,13225,United Kingdom
540255,21774,DECORATIVE CATS BATHROOM BOTTLE,2,1/5/2011 16:50,1.28,,United Kingdom
540255,85039A,SET/4 RED MINI ROSE CANDLE IN BOWL,1,1/5/2011 16:50,1.66,,United Kingdom
540255,85049H,URBAN BLACK RIBBONS ,6,1/5/2011 16:50,0.85,,United Kingdom
540255,85053,FRENCH ENAMEL CANDLEHOLDER,1,1/5/2011 16:50,4.21,,United Kingdom
540255,85059,FRENCH ENAMEL WATER BASIN,3,1/5/2011 16:50,3.36,,United Kingdom
540255,85071A,BLUE CHARLIE+LOLA PERSONAL DOORSIGN,1,1/5/2011 16:50,0.85,,United Kingdom
540255,85071C,"CHARLIE+LOLA""EXTREMELY BUSY"" SIGN",4,1/5/2011 16:50,0.85,,United Kingdom
540255,85071D,CHARLIE+LOLA MY ROOM DOOR SIGN,2,1/5/2011 16:50,0.85,,United Kingdom
540255,85087,CANDY SPOT CUSHION COVER,4,1/5/2011 16:50,3.36,,United Kingdom
540255,85093,CANDY SPOT EGG WARMER HARE,1,1/5/2011 16:50,2.51,,United Kingdom
540255,85095,THREE CANVAS LUGGAGE TAGS,2,1/5/2011 16:50,1.28,,United Kingdom
540255,85099C,JUMBO  BAG BAROQUE BLACK WHITE,1,1/5/2011 16:50,4.21,,United Kingdom
540255,85131B,BEADED CRYSTAL HEART GREEN ON STICK,2,1/5/2011 16:50,0.85,,United Kingdom
540255,85131D,BEADED CRYSTAL HEART PINK ON STICK,1,1/5/2011 16:50,0.85,,United Kingdom
540255,85132C,CHARLIE AND LOLA FIGURES TINS,1,1/5/2011 16:50,8.47,,United Kingdom
540255,85161,ACRYLIC GEOMETRIC LAMP,1,1/5/2011 16:50,12.72,,United Kingdom
540255,85163B,BLACK BAROQUE WALL CLOCK ,2,1/5/2011 16:50,8.47,,United Kingdom
540255,85169B,BLACK LOVE BIRD CANDLE,6,1/5/2011 16:50,0.85,,United Kingdom
540255,85170C,SET/6 EAU DE NIL BIRD T-LIGHTS,1,1/5/2011 16:50,2.51,,United Kingdom
540255,85174,S/4 CACTI CANDLES,3,1/5/2011 16:50,4.21,,United Kingdom
540255,85180A,RED HEARTS LIGHT CHAIN ,1,1/5/2011 16:50,2.51,,United Kingdom
540255,85183B,CHARLIE & LOLA WASTEPAPER BIN FLORA,1,1/5/2011 16:50,7.62,,United Kingdom
540255,85184C,S/4 VALENTINE DECOUPAGE HEART BOX,2,1/5/2011 16:50,3.36,,United Kingdom
540255,85199S,SMALL HANGING IVORY/RED WOOD BIRD,1,1/5/2011 16:50,0.85,,United Kingdom
540255,85202,HANGING WOOD AND FELT HEART,3,1/5/2011 16:50,0.43,,United Kingdom
540255,85203,HANGING WOOD AND FELT BUTTERFLY ,4,1/5/2011 16:50,0.43,,United Kingdom
540255,90013A,MIDNIGHT BLUE VINTAGE EARRINGS,1,1/5/2011 16:50,3.81,,United Kingdom
540255,90071,RUBY GLASS CLUSTER EARRINGS,1,1/5/2011 16:50,1.26,,United Kingdom
540255,90114,SUMMER DAISIES BAG CHARM,1,1/5/2011 16:50,2.51,,United Kingdom
540255,90120C,GREEN MURANO TWIST BRACELET,1,1/5/2011 16:50,4.24,,United Kingdom
540255,90155,RESIN NECKLACE W PASTEL BEADS,1,1/5/2011 16:50,7.64,,United Kingdom
540255,90165A,PINK ROSEBUD PEARL EARRINGS,1,1/5/2011 16:50,2.54,,United Kingdom
540255,90175A,WHITE GLASS CHUNKY CHARM BRACELET,1,1/5/2011 16:50,9.34,,United Kingdom
540255,90206C,CRYSTAL DIAMANTE STAR BROOCH,1,1/5/2011 16:50,5.09,,United Kingdom
540255,DOT,DOTCOM POSTAGE,1,1/5/2011 16:50,219.24,,United Kingdom
540255,20854,BLUE PATCH PURSE PINK HEART,3,1/5/2011 16:50,1.66,,United Kingdom
540255,21518,BANK ACCOUNT  GREETING  CARD ,3,1/5/2011 16:50,0.43,,United Kingdom
540255,21557,SET OF 6 FUNKY BEAKERS,5,1/5/2011 16:50,2.51,,United Kingdom
540255,21633,SUNFLOWER DECORATIVE PARASOL,1,1/5/2011 16:50,8.47,,United Kingdom
540255,21706,FOLDING UMBRELLA RED/WHITE POLKADOT,2,1/5/2011 16:50,3.36,,United Kingdom
540255,21802,CHRISTMAS TREE HEART DECORATION,2,1/5/2011 16:50,0.43,,United Kingdom
540255,21881,CUTE CATS TAPE,1,1/5/2011 16:50,0.43,,United Kingdom
540255,21912,VINTAGE SNAKES & LADDERS,1,1/5/2011 16:50,7.62,,United Kingdom
540255,21974,SET OF 36 PAISLEY FLOWER DOILIES,3,1/5/2011 16:50,2.98,,United Kingdom
540255,21977,PACK OF 60 PINK PAISLEY CAKE CASES,1,1/5/2011 16:50,1.28,,United Kingdom
540255,21992,VINTAGE PAISLEY STATIONERY SET,2,1/5/2011 16:50,2.51,,United Kingdom
540255,22074,6 RIBBONS SHIMMERING PINKS ,5,1/5/2011 16:50,0.85,,United Kingdom
540255,22110,BIRD HOUSE HOT WATER BOTTLE,9,1/5/2011 16:50,3.36,,United Kingdom
540255,22161,HEART DECORATION RUSTIC HANGING ,1,1/5/2011 16:50,0.81,,United Kingdom
540255,22208,WOOD STAMP SET THANK YOU,2,1/5/2011 16:50,1.66,,United Kingdom
540255,22209,WOOD STAMP SET HAPPY BIRTHDAY,2,1/5/2011 16:50,1.66,,United Kingdom
540255,22116,METAL SIGN HIS DINNER IS SERVED,1,1/5/2011 16:50,1.66,,United Kingdom
540255,22134,MINI LADLE LOVE HEART RED ,1,1/5/2011 16:50,0.43,,United Kingdom
540255,22135,MINI LADLE LOVE HEART PINK,2,1/5/2011 16:50,0.43,,United Kingdom
540255,22094,RED RETROSPOT TISSUE BOX,3,1/5/2011 16:50,2.51,,United Kingdom
540255,20856,DENIM PATCH PURSE PINK BUTTERFLY,1,1/5/2011 16:50,1.66,,United Kingdom
540255,20866,BLUE ROSE FABRIC MIRROR,2,1/5/2011 16:50,0.85,,United Kingdom
540255,20867,PINK ROSE FABRIC MIRROR,2,1/5/2011 16:50,0.85,,United Kingdom
540255,20868,SILVER FABRIC MIRROR,1,1/5/2011 16:50,0.85,,United Kingdom
540255,20966,SANDWICH BATH SPONGE,1,1/5/2011 16:50,2.51,,United Kingdom
540255,21014,SWISS CHALET TREE DECORATION ,1,1/5/2011 16:50,1.28,,United Kingdom
540255,21015,DARK BIRD HOUSE TREE DECORATION,1,1/5/2011 16:50,1.28,,United Kingdom
540255,22182,CAKE STAND VICTORIAN FILIGREE SMALL,1,1/5/2011 16:50,4.21,,United Kingdom
540255,22188,BLACK HEART CARD HOLDER,1,1/5/2011 16:50,8.47,,United Kingdom
540255,22189,CREAM HEART CARD HOLDER,1,1/5/2011 16:50,8.47,,United Kingdom
540255,22201,FRYING PAN BLUE POLKADOT,3,1/5/2011 16:50,3.36,,United Kingdom
540255,22204,MILK PAN BLUE POLKADOT,1,1/5/2011 16:50,3.36,,United Kingdom
540255,21980,PACK OF 12 RED RETROSPOT TISSUES ,1,1/5/2011 16:50,0.85,,United Kingdom
540255,21991,BOHEMIAN COLLAGE STATIONERY SET,1,1/5/2011 16:50,2.51,,United Kingdom
540255,22371,AIRLINE BAG VINTAGE TOKYO 78,1,1/5/2011 16:50,4.21,,United Kingdom
540255,22374,AIRLINE BAG VINTAGE JET SET RED,1,1/5/2011 16:50,4.21,,United Kingdom
540255,22377,BOTTLE BAG RETROSPOT ,4,1/5/2011 16:50,1.66,,United Kingdom
540255,22378,WALL TIDY RETROSPOT ,8,1/5/2011 16:50,1.66,,United Kingdom
540255,22381,TOY TIDY PINK POLKADOT,1,1/5/2011 16:50,4.21,,United Kingdom
540255,22411,JUMBO SHOPPER VINTAGE RED PAISLEY,1,1/5/2011 16:50,4.21,,United Kingdom
540255,22417,PACK OF 60 SPACEBOY CAKE CASES,3,1/5/2011 16:50,1.28,,United Kingdom
540255,22438,BALLOON ART MAKE YOUR OWN FLOWERS,3,1/5/2011 16:50,1.66,,United Kingdom
540255,22446,PIN CUSHION BABUSHKA PINK,1,1/5/2011 16:50,2.51,,United Kingdom
540255,22023,EMPIRE BIRTHDAY CARD,1,1/5/2011 16:50,0.85,,United Kingdom
540255,22031,BOTANICAL LAVENDER BIRTHDAY CARD,1,1/5/2011 16:50,0.43,,United Kingdom
540255,21976,PACK OF 60 MUSHROOM CAKE CASES,3,1/5/2011 16:50,1.28,,United Kingdom
540255,21916,SET 12 RETRO WHITE CHALK STICKS,1,1/5/2011 16:50,0.85,,United Kingdom
540255,21934,SKULL SHOULDER BAG,3,1/5/2011 16:50,1.66,,United Kingdom
540255,21935,SUKI  SHOULDER BAG,5,1/5/2011 16:50,1.66,,United Kingdom
540255,21949,SET OF 6 STRAWBERRY CHOPSTICKS,1,1/5/2011 16:50,1.28,,United Kingdom
540255,21883,STARS GIFT TAPE ,5,1/5/2011 16:50,0.43,,United Kingdom
540255,21884,CAKES AND BOWS GIFT  TAPE,1,1/5/2011 16:50,0.43,,United Kingdom
540255,21803,CHRISTMAS TREE STAR DECORATION,3,1/5/2011 16:50,0.43,,United Kingdom
540255,21820,GLITTER HEART GARLAND WITH BELLS ,1,1/5/2011 16:50,7.62,,United Kingdom
540255,21846,PINK DIAMANTE PEN IN GIFT BOX,5,1/5/2011 16:50,1.66,,United Kingdom
540255,21849,SILVER DIAMANTE PEN IN GIFT BOX,1,1/5/2011 16:50,1.66,,United Kingdom
540255,21879,HEARTS GIFT TAPE,2,1/5/2011 16:50,0.43,,United Kingdom
540255,21880,RED RETROSPOT TAPE,10,1/5/2011 16:50,0.43,,United Kingdom
540255,21775,DECORATIVE FLORE BATHROOM BOTTLE,4,1/5/2011 16:50,1.28,,United Kingdom
540255,21801,CHRISTMAS TREE DECORATION WITH BELL,3,1/5/2011 16:50,0.43,,United Kingdom
540255,21025,SPACE FROG,1,1/5/2011 16:50,0.85,,United Kingdom
540255,21028,NINJA RABBIT BLACK,1,1/5/2011 16:50,0.85,,United Kingdom
540255,21033,JUMBO BAG CHARLIE AND LOLA TOYS,4,1/5/2011 16:50,2.51,,United Kingdom
540255,21043,APRON MODERN VINTAGE COTTON,1,1/5/2011 16:50,4.21,,United Kingdom
540255,21051,RIBBONS PURSE ,3,1/5/2011 16:50,1.66,,United Kingdom
540255,21107,CREAM SLICE FLANNEL PINK SPOT ,1,1/5/2011 16:50,5.91,,United Kingdom
540255,21108,FAIRY CAKE FLANNEL ASSORTED COLOUR,2,1/5/2011 16:50,5.06,,United Kingdom
540255,21109,LARGE CAKE TOWEL CHOCOLATE SPOTS,1,1/5/2011 16:50,4.21,,United Kingdom
540255,21110,LARGE CAKE TOWEL PINK SPOTS,8,1/5/2011 16:50,4.21,,United Kingdom
540255,21111,"SWISS ROLL TOWEL, CHOCOLATE  SPOTS",1,1/5/2011 16:50,2.51,,United Kingdom
540255,21112,"SWISS ROLL TOWEL, PINK  SPOTS",2,1/5/2011 16:50,2.51,,United Kingdom
540255,21114,LAVENDER SCENTED FABRIC HEART,1,1/5/2011 16:50,11.02,,United Kingdom
540255,22250,DECORATION  BUTTERFLY  MAGIC GARDEN,2,1/5/2011 16:50,0.81,,United Kingdom
540255,22255,FELT TOADSTOOL  SMALL,1,1/5/2011 16:50,1.66,,United Kingdom
540255,22258,FELT FARM ANIMAL RABBIT,2,1/5/2011 16:50,0.85,,United Kingdom
540255,22259,FELT FARM ANIMAL HEN,2,1/5/2011 16:50,0.85,,United Kingdom
540255,22263,FELT EGG COSY LADYBIRD ,1,1/5/2011 16:50,0.81,,United Kingdom
540255,22279,POCKET BAG BLUE PAISLEY RED SPOT,4,1/5/2011 16:50,0.85,,United Kingdom
540255,22280,POCKET BAG PINK PAISELY BROWN SPOT,3,1/5/2011 16:50,0.85,,United Kingdom
540255,22294,HEART FILIGREE DOVE  SMALL,1,1/5/2011 16:50,2.51,,United Kingdom
540255,22315,200 RED + WHITE BENDY STRAWS,2,1/5/2011 16:50,2.51,,United Kingdom
540255,22322,BIRD DECORATION GREEN POLKADOT,8,1/5/2011 16:50,0.81,,United Kingdom
540255,22325,MOBILE VINTAGE HEARTS ,2,1/5/2011 16:50,3.36,,United Kingdom
540255,22342,HOME GARLAND PAINTED ZINC ,1,1/5/2011 16:50,1.66,,United Kingdom
540255,84596F,SMALL MARSHMALLOWS PINK BOWL,3,1/5/2011 16:50,0.85,,United Kingdom
540255,84596G,SMALL CHOCOLATES PINK BOWL,6,1/5/2011 16:50,0.85,,United Kingdom
540255,84596J,MIXED NUTS LIGHT GREEN BOWL,1,1/5/2011 16:50,0.85,,United Kingdom
540255,84596L,BISCUITS SMALL BOWL LIGHT BLUE,2,1/5/2011 16:50,0.85,,United Kingdom
540255,84692,BOX OF 24 COCKTAIL PARASOLS,8,1/5/2011 16:50,0.85,,United Kingdom
540255,84707A,SILVER JEWELLED MIRROR TRINKET TRAY,4,1/5/2011 16:50,5.91,,United Kingdom
540255,84748,FOLK FELT HANGING MULTICOL GARLAND,2,1/5/2011 16:50,2.51,,United Kingdom
540255,84836,ZINC METAL HEART DECORATION,1,1/5/2011 16:50,2.51,,United Kingdom
540255,84846A,SCENTED CANDLE IN DIGITALIS TIN,1,1/5/2011 16:50,4.21,,United Kingdom
540255,84870B,BLUE GEISHA GIRL ,1,1/5/2011 16:50,2.51,,United Kingdom
540255,84870C,GREEN GEISHA GIRL ,1,1/5/2011 16:50,2.51,,United Kingdom
540255,84913B,MINT GREEN ROSE TOWEL,2,1/5/2011 16:50,3.36,,United Kingdom
540255,84931A,PINK SCOTTIE DOG W FLOWER PATTERN,3,1/5/2011 16:50,1.66,,United Kingdom
540255,84951A,SET OF 4 PISTACHIO LOVEBIRD COASTER,1,1/5/2011 16:50,1.66,,United Kingdom
540255,84951B,SET OF 4 BLACK LOVEBIRD COASTERS,2,1/5/2011 16:50,1.66,,United Kingdom
540255,84968A,SET OF 16 VINTAGE ROSE CUTLERY,2,1/5/2011 16:50,8.47,,United Kingdom
540255,84968C,SET OF 16 VINTAGE PISTACHIO CUTLERY,6,1/5/2011 16:50,8.47,,United Kingdom
540255,84968F,SET OF 16 VINTAGE SKY BLUE CUTLERY,2,1/5/2011 16:50,8.47,,United Kingdom
540255,84969,BOX OF 6 ASSORTED COLOUR TEASPOONS,1,1/5/2011 16:50,3.36,,United Kingdom
540255,84987,SET OF 36 TEATIME PAPER DOILIES,3,1/5/2011 16:50,2.98,,United Kingdom
540255,84991,60 TEATIME FAIRY CAKE CASES,3,1/5/2011 16:50,1.28,,United Kingdom
540255,84992,72 SWEETHEART FAIRY CAKE CASES,2,1/5/2011 16:50,1.28,,United Kingdom
540255,85032D,YULETIDE IMAGES GIFT WRAP SET,1,1/5/2011 16:50,1.66,,United Kingdom
540255,85034B,3 WHITE CHOC MORRIS BOXED CANDLES,1,1/5/2011 16:50,3.36,,United Kingdom
540255,22713,CARD I LOVE LONDON ,1,1/5/2011 16:50,0.85,,United Kingdom
540255,22718,CARD CAT AND TREE ,2,1/5/2011 16:50,0.85,,United Kingdom
540255,22722,SET OF 6 SPICE TINS PANTRY DESIGN,1,1/5/2011 16:50,8.47,,United Kingdom
540255,22814,CARD PARTY GAMES ,1,1/5/2011 16:50,0.85,,United Kingdom
540255,22817,CARD SUKI BIRTHDAY,5,1/5/2011 16:50,0.43,,United Kingdom
540255,22819,"BIRTHDAY CARD, RETRO SPOT",6,1/5/2011 16:50,0.43,,United Kingdom
540255,22834,HAND WARMER BABUSHKA DESIGN,2,1/5/2011 16:50,1.66,,United Kingdom
540255,22909,SET OF 20 VINTAGE CHRISTMAS NAPKINS,6,1/5/2011 16:50,1.66,,United Kingdom
540255,22910,PAPER CHAIN KIT VINTAGE CHRISTMAS,2,1/5/2011 16:50,5.91,,United Kingdom
540255,22949,36 DOILIES DOLLY GIRL,3,1/5/2011 16:50,2.98,,United Kingdom
540255,22951,60 CAKE CASES DOLLY GIRL DESIGN,3,1/5/2011 16:50,1.28,,United Kingdom
540255,22952,60 CAKE CASES VINTAGE CHRISTMAS,4,1/5/2011 16:50,1.28,,United Kingdom
540255,22962,JAM JAR WITH PINK LID,1,1/5/2011 16:50,1.66,,United Kingdom
540255,22970,LONDON BUS COFFEE MUG,1,1/5/2011 16:50,5.06,,United Kingdom
540255,35646,VINTAGE BEAD PINK EVENING BAG,1,1/5/2011 16:50,2.51,,United Kingdom
540255,35648,VINTAGE BEAD PINK PURSE ,2,1/5/2011 16:50,1.66,,United Kingdom
