569122,POST,POSTAGE,3,9/30/2011 13:06,18,12694,France
569123,21882,SKULLS TAPE,2,9/30/2011 13:09,0.65,12748,United Kingdom
569123,22584,PACK OF 6 PANNETONE GIFT BOXES,1,9/30/2011 13:09,2.55,12748,United Kingdom
569123,21693,SMALL HAMMERED SILVER CANDLEPOT ,6,9/30/2011 13:09,2.95,12748,United Kingdom
569123,21642,ASSORTED TUTTI FRUTTI PEN,48,9/30/2011 13:09,0.29,12748,United Kingdom
569123,22296,HEART IVORY TRELLIS LARGE,24,9/30/2011 13:09,1.65,12748,United Kingdom
569123,22297,HEART IVORY TRELLIS SMALL,24,9/30/2011 13:09,1.25,12748,United Kingdom
569123,21688,SILVER PLATE CANDLE BOWL SMALL,12,9/30/2011 13:09,2.95,12748,United Kingdom
569123,21638,ASSORTED TUTTI FRUTTI NOTEBOOK,48,9/30/2011 13:09,2.1,12748,United Kingdom
569123,85135C,RED DRAGONFLY HELICOPTER,2,9/30/2011 13:09,7.95,12748,United Kingdom
569123,22316,200 BENDY SKULL STRAWS,1,9/30/2011 13:09,1.25,12748,United Kingdom
569123,23168,CLASSIC CAFE SUGAR DISPENSER,1,9/30/2011 13:09,1.25,12748,United Kingdom
569123,23351,ROLL WRAP 50'S CHRISTMAS,8,9/30/2011 13:09,1.25,12748,United Kingdom
569123,22197,POPCORN HOLDER,3,9/30/2011 13:09,0.85,12748,United Kingdom
569123,21479,WHITE SKULL HOT WATER BOTTLE ,5,9/30/2011 13:09,4.25,12748,United Kingdom
569123,84029G,KNITTED UNION FLAG HOT WATER BOTTLE,2,9/30/2011 13:09,4.25,12748,United Kingdom
569123,23356,LOVE HOT WATER BOTTLE,2,9/30/2011 13:09,5.95,12748,United Kingdom
569123,23301,GARDENERS KNEELING PAD KEEP CALM ,2,9/30/2011 13:09,1.65,12748,United Kingdom
569123,22940,FELTCRAFT CHRISTMAS FAIRY,4,9/30/2011 13:09,4.25,12748,United Kingdom
569123,22138,BAKING SET 9 PIECE RETROSPOT ,2,9/30/2011 13:09,4.95,12748,United Kingdom
569123,23390,DOLLY GIRL MINI BACKPACK,1,9/30/2011 13:09,4.15,12748,United Kingdom
569123,23388,WOODLAND MINI BACKPACK,1,9/30/2011 13:09,4.15,12748,United Kingdom
569123,23389,SPACEBOY MINI BACKPACK,1,9/30/2011 13:09,4.15,12748,United Kingdom
569123,23391, I LOVE LONDON MINI BACKPACK,1,9/30/2011 13:09,4.15,12748,United Kingdom
569123,20761,BLUE PAISLEY SKETCHBOOK,3,9/30/2011 13:09,3.75,12748,United Kingdom
569123,21647,ASSORTED TUTTI FRUTTI LARGE PURSE,2,9/30/2011 13:09,2.1,12748,United Kingdom
569123,84859A,SILVER DISCO HANDBAG,3,9/30/2011 13:09,1.95,12748,United Kingdom
569123,84859B,BLUE DISCO HANDBAG,4,9/30/2011 13:09,1.95,12748,United Kingdom
569123,71403,"PINK/WHITE ""KEEP CLEAN"" BULLET BIN",2,9/30/2011 13:09,2.95,12748,United Kingdom
569123,22636,CHILDS BREAKFAST SET CIRCUS PARADE,1,9/30/2011 13:09,8.5,12748,United Kingdom
569123,22654,DELUXE SEWING KIT ,6,9/30/2011 13:09,5.95,12748,United Kingdom
569123,90149,SILVER FLOWR PINK SHELL NECKLACE,48,9/30/2011 13:09,6.36,12748,United Kingdom
569123,90154,LAZER CUT NECKLACE W PASTEL BEADS,52,9/30/2011 13:09,7.25,12748,United Kingdom
569123,23344,JUMBO BAG 50'S CHRISTMAS ,5,9/30/2011 13:09,2.08,12748,United Kingdom
569124,22726,ALARM CLOCK BAKELIKE GREEN,4,9/30/2011 13:15,3.75,15172,United Kingdom
569124,22725,ALARM CLOCK BAKELIKE CHOCOLATE,4,9/30/2011 13:15,3.75,15172,United Kingdom
569124,22728,ALARM CLOCK BAKELIKE PINK,4,9/30/2011 13:15,3.75,15172,United Kingdom
569124,21809,CHRISTMAS HANGING TREE WITH BELL,48,9/30/2011 13:15,0.39,15172,United Kingdom
569124,21810,CHRISTMAS HANGING STAR WITH BELL,48,9/30/2011 13:15,0.39,15172,United Kingdom
569124,35954,SMALL FOLKART STAR CHRISTMAS DEC,48,9/30/2011 13:15,0.19,15172,United Kingdom
569124,21811,HANGING HEART WITH BELL,48,9/30/2011 13:15,0.39,15172,United Kingdom
569124,23268,SET OF 2 CERAMIC CHRISTMAS REINDEER,12,9/30/2011 13:15,1.45,15172,United Kingdom
569124,21812,GARLAND WITH HEARTS AND BELLS,6,9/30/2011 13:15,4.95,15172,United Kingdom
569124,22478,BIRDHOUSE GARDEN MARKER ,10,9/30/2011 13:15,1.25,15172,United Kingdom
569124,22487,WHITE WOOD GARDEN PLANT LADDER,1,9/30/2011 13:15,9.95,15172,United Kingdom
569124,84660A,WHITE STITCHED WALL CLOCK,20,9/30/2011 13:15,0.79,15172,United Kingdom
569124,85212,MINI PAINTED GARDEN DECORATION ,24,9/30/2011 13:15,0.29,15172,United Kingdom
569124,22583,PACK OF 6 HANDBAG GIFT BOXES,6,9/30/2011 13:15,2.55,15172,United Kingdom
569124,22029,SPACEBOY BIRTHDAY CARD,12,9/30/2011 13:15,0.42,15172,United Kingdom
569124,85015,SET OF 12  VINTAGE POSTCARD SET,24,9/30/2011 13:15,0.65,15172,United Kingdom
569124,47504K,ENGLISH ROSE GARDEN SECATEURS,12,9/30/2011 13:15,0.79,15172,United Kingdom
569124,21894,POTTING SHED SEED ENVELOPES,12,9/30/2011 13:15,1.25,15172,United Kingdom
569124,22386,JUMBO BAG PINK POLKADOT,10,9/30/2011 13:15,2.08,15172,United Kingdom
569124,22385,JUMBO BAG SPACEBOY DESIGN,10,9/30/2011 13:15,2.08,15172,United Kingdom
569124,23203,JUMBO BAG VINTAGE DOILY ,10,9/30/2011 13:15,2.08,15172,United Kingdom
569124,85099C,JUMBO  BAG BAROQUE BLACK WHITE,10,9/30/2011 13:15,2.08,15172,United Kingdom
569124,22727,ALARM CLOCK BAKELIKE RED ,4,9/30/2011 13:15,3.75,15172,United Kingdom
569125,22942,CHRISTMAS LIGHTS 10 SANTAS ,4,9/30/2011 13:21,8.5,15611,United Kingdom
569125,22941,CHRISTMAS LIGHTS 10 REINDEER,4,9/30/2011 13:21,8.5,15611,United Kingdom
569125,21116,OWL DOORSTOP,6,9/30/2011 13:21,4.95,15611,United Kingdom
569125,23082,SET 6 PAPER TABLE LANTERN HEARTS ,6,9/30/2011 13:21,3.75,15611,United Kingdom
569125,23083,SET 6 PAPER TABLE LANTERN STARS ,6,9/30/2011 13:21,3.75,15611,United Kingdom
569126,23170,REGENCY TEA PLATE ROSES ,24,9/30/2011 13:28,1.65,13347,United Kingdom
569126,23250,VINTAGE RED TRIM ENAMEL BOWL ,24,9/30/2011 13:28,1.25,13347,United Kingdom
569126,23171,REGENCY TEA PLATE GREEN ,24,9/30/2011 13:28,1.65,13347,United Kingdom
569126,23172,REGENCY TEA PLATE PINK,24,9/30/2011 13:28,1.65,13347,United Kingdom
569126,23249,VINTAGE RED ENAMEL TRIM PLATE,36,9/30/2011 13:28,1.65,13347,United Kingdom
569126,23251,VINTAGE RED ENAMEL TRIM MUG ,36,9/30/2011 13:28,1.25,13347,United Kingdom
569126,21071,VINTAGE BILLBOARD DRINK ME MUG,36,9/30/2011 13:28,1.06,13347,United Kingdom
569126,C2,CARRIAGE,1,9/30/2011 13:28,50,13347,United Kingdom
569127,22867,HAND WARMER BIRD DESIGN,96,9/30/2011 13:31,1.85,15903,United Kingdom
569127,22633,HAND WARMER UNION JACK,96,9/30/2011 13:31,1.85,15903,United Kingdom
569127,22632,HAND WARMER RED RETROSPOT,96,9/30/2011 13:31,1.85,15903,United Kingdom
569127,21485,RETROSPOT HEART HOT WATER BOTTLE,24,9/30/2011 13:31,4.25,15903,United Kingdom
569127,84029G,KNITTED UNION FLAG HOT WATER BOTTLE,24,9/30/2011 13:31,3.75,15903,United Kingdom
569127,84029E,RED WOOLLY HOTTIE WHITE HEART.,24,9/30/2011 13:31,3.75,15903,United Kingdom
569127,22111,SCOTTIE DOG HOT WATER BOTTLE,24,9/30/2011 13:31,4.25,15903,United Kingdom
569127,22114,HOT WATER BOTTLE TEA AND SYMPATHY,24,9/30/2011 13:31,3.75,15903,United Kingdom
569127,22112,CHOCOLATE HOT WATER BOTTLE,24,9/30/2011 13:31,4.25,15903,United Kingdom
569127,22835,HOT WATER BOTTLE I AM SO POORLY,24,9/30/2011 13:31,4.25,15903,United Kingdom
569127,22866,HAND WARMER SCOTTY DOG DESIGN,96,9/30/2011 13:31,1.85,15903,United Kingdom
569127,84030E,ENGLISH ROSE HOT WATER BOTTLE,48,9/30/2011 13:31,3.75,15903,United Kingdom
C569128,21733,RED HANGING HEART T-LIGHT HOLDER,-1,9/30/2011 13:34,2.95,15034,United Kingdom
C569128,22729,ALARM CLOCK BAKELIKE ORANGE,-1,9/30/2011 13:34,3.75,15034,United Kingdom
C569128,22727,ALARM CLOCK BAKELIKE RED ,-1,9/30/2011 13:34,3.75,15034,United Kingdom
C569128,22726,ALARM CLOCK BAKELIKE GREEN,-2,9/30/2011 13:34,3.75,15034,United Kingdom
569129,22507,MEMO BOARD RETROSPOT  DESIGN,1,9/30/2011 13:40,4.95,15034,United Kingdom
569129,23343,JUMBO BAG VINTAGE CHRISTMAS ,2,9/30/2011 13:40,2.08,15034,United Kingdom
569129,23344,JUMBO BAG 50'S CHRISTMAS ,2,9/30/2011 13:40,2.08,15034,United Kingdom
569129,23234,BISCUIT TIN VINTAGE CHRISTMAS,2,9/30/2011 13:40,2.89,15034,United Kingdom
569129,23247,BISCUIT TIN 50'S CHRISTMAS,2,9/30/2011 13:40,2.89,15034,United Kingdom
569129,22694,WICKER STAR ,2,9/30/2011 13:40,2.1,15034,United Kingdom
569129,23322,LARGE WHITE HEART OF WICKER,6,9/30/2011 13:40,2.95,15034,United Kingdom
569129,23340,VINTAGE CHRISTMAS CAKE FRILL,4,9/30/2011 13:40,1.65,15034,United Kingdom
569129,21327,SKULLS WRITING SET ,2,9/30/2011 13:40,1.65,15034,United Kingdom
569129,21328,BALLOONS  WRITING SET ,2,9/30/2011 13:40,1.65,15034,United Kingdom
569129,22952,60 CAKE CASES VINTAGE CHRISTMAS,6,9/30/2011 13:40,0.55,15034,United Kingdom
569129,23321,SMALL WHITE HEART OF WICKER,6,9/30/2011 13:40,1.65,15034,United Kingdom
569129,22470,HEART OF WICKER LARGE,2,9/30/2011 13:40,2.95,15034,United Kingdom
569129,22469,HEART OF WICKER SMALL,3,9/30/2011 13:40,1.65,15034,United Kingdom
569129,21682,LARGE MEDINA STAMPED METAL BOWL ,1,9/30/2011 13:40,4.95,15034,United Kingdom
569129,23379,PACK OF 12 RED APPLE TISSUES,12,9/30/2011 13:40,0.39,15034,United Kingdom
569129,22729,ALARM CLOCK BAKELIKE ORANGE,1,9/30/2011 13:40,3.75,15034,United Kingdom
569129,22736,RIBBON REEL MAKING SNOWMEN ,1,9/30/2011 13:40,1.65,15034,United Kingdom
569129,22738,RIBBON REEL SNOWY VILLAGE,1,9/30/2011 13:40,1.65,15034,United Kingdom
569129,22737,RIBBON REEL CHRISTMAS PRESENT ,1,9/30/2011 13:40,1.65,15034,United Kingdom
569129,22735,RIBBON REEL SOCKS AND MITTENS,1,9/30/2011 13:40,1.65,15034,United Kingdom
569129,22739,RIBBON REEL CHRISTMAS SOCK BAUBLE,2,9/30/2011 13:40,1.65,15034,United Kingdom
569129,23323,WHITE WICKER STAR ,4,9/30/2011 13:40,2.1,15034,United Kingdom
569129,22909,SET OF 20 VINTAGE CHRISTMAS NAPKINS,3,9/30/2011 13:40,0.85,15034,United Kingdom
569129,23103,JINGLE BELL HEART DECORATION,4,9/30/2011 13:40,1.65,15034,United Kingdom
569129,23329,DECORATIVE WICKER HEART LARGE,3,9/30/2011 13:40,1.65,15034,United Kingdom
569129,23333,IVORY WICKER HEART MEDIUM,3,9/30/2011 13:40,1.25,15034,United Kingdom
569129,23332,IVORY WICKER HEART LARGE,3,9/30/2011 13:40,1.65,15034,United Kingdom
569129,23330,DECORATIVE WICKER HEART MEDIUM,3,9/30/2011 13:40,1.25,15034,United Kingdom
569129,23077,DOUGHNUT LIP GLOSS ,20,9/30/2011 13:40,1.25,15034,United Kingdom
569129,22138,BAKING SET 9 PIECE RETROSPOT ,1,9/30/2011 13:40,4.95,15034,United Kingdom
569129,22804,CANDLEHOLDER PINK HANGING HEART,3,9/30/2011 13:40,2.95,15034,United Kingdom
569129,21733,RED HANGING HEART T-LIGHT HOLDER,4,9/30/2011 13:40,2.95,15034,United Kingdom
569129,21754,HOME BUILDING BLOCK WORD,1,9/30/2011 13:40,6.25,15034,United Kingdom
569129,22371,AIRLINE BAG VINTAGE TOKYO 78,1,9/30/2011 13:40,4.25,15034,United Kingdom
569129,22372,AIRLINE BAG VINTAGE WORLD CHAMPION ,1,9/30/2011 13:40,4.25,15034,United Kingdom
569129,23266,SET OF 3 WOODEN STOCKING DECORATION,3,9/30/2011 13:40,1.25,15034,United Kingdom
569129,23265,SET OF 3 WOODEN TREE DECORATIONS,3,9/30/2011 13:40,1.25,15034,United Kingdom
569129,21967,PACK OF 12 SKULL TISSUES,4,9/30/2011 13:40,0.39,15034,United Kingdom
569129,23263,SET OF 3 WOODEN HEART DECORATIONS,3,9/30/2011 13:40,1.25,15034,United Kingdom
569129,85123A,WHITE HANGING HEART T-LIGHT HOLDER,4,9/30/2011 13:40,2.95,15034,United Kingdom
569129,22086,PAPER CHAIN KIT 50'S CHRISTMAS ,3,9/30/2011 13:40,2.95,15034,United Kingdom
569129,22910,PAPER CHAIN KIT VINTAGE CHRISTMAS,3,9/30/2011 13:40,2.95,15034,United Kingdom
569129,21715,GIRLS VINTAGE TIN SEASIDE BUCKET,1,9/30/2011 13:40,2.55,15034,United Kingdom
569129,23328,SET 6 SCHOOL MILK BOTTLES IN CRATE,2,9/30/2011 13:40,3.75,15034,United Kingdom
569129,23296,SET OF 6 TEA TIME BAKING CASES,3,9/30/2011 13:40,1.25,15034,United Kingdom
569129,23294,SET OF 6 SNACK LOAF BAKING CASES,3,9/30/2011 13:40,0.83,15034,United Kingdom
569129,23360,SET 8 CANDLES VINTAGE DOILY,3,9/30/2011 13:40,1.95,15034,United Kingdom
569129,23418,LAVENDER TOILETTE BOTTLE,2,9/30/2011 13:40,2.08,15034,United Kingdom
569129,23295,SET OF 12 MINI LOAF BAKING CASES,4,9/30/2011 13:40,0.83,15034,United Kingdom
569129,21975,PACK OF 60 DINOSAUR CAKE CASES,1,9/30/2011 13:40,0.55,15034,United Kingdom
569129,23270,SET OF 2 CERAMIC PAINTED HEARTS ,6,9/30/2011 13:40,1.45,15034,United Kingdom
569129,20982,12 PENCILS TALL TUBE SKULLS,1,9/30/2011 13:40,0.85,15034,United Kingdom
569129,85227,SET OF 6 3D KIT CARDS FOR KIDS,1,9/30/2011 13:40,0.85,15034,United Kingdom
569129,21754,HOME BUILDING BLOCK WORD,1,9/30/2011 13:40,6.25,15034,United Kingdom
569129,21213,PACK OF 72 SKULL CAKE CASES,4,9/30/2011 13:40,0.55,15034,United Kingdom
569129,21975,PACK OF 60 DINOSAUR CAKE CASES,3,9/30/2011 13:40,0.55,15034,United Kingdom
569129,23308,SET OF 60 VINTAGE LEAF CAKE CASES ,4,9/30/2011 13:40,0.55,15034,United Kingdom
569129,22326,ROUND SNACK BOXES SET OF4 WOODLAND ,2,9/30/2011 13:40,2.95,15034,United Kingdom
569129,22429,ENAMEL MEASURING JUG CREAM,3,9/30/2011 13:40,4.25,15034,United Kingdom
569129,22197,POPCORN HOLDER,25,9/30/2011 13:40,0.85,15034,United Kingdom
569129,21935,SUKI  SHOULDER BAG,2,9/30/2011 13:40,1.65,15034,United Kingdom
569129,21934,SKULL SHOULDER BAG,2,9/30/2011 13:40,1.65,15034,United Kingdom
569129,22925,BLUE GIANT GARDEN THERMOMETER,1,9/30/2011 13:40,5.95,15034,United Kingdom
569129,23252,VINTAGE RED ENAMEL TRIM JUG ,2,9/30/2011 13:40,3.75,15034,United Kingdom
569129,23288,GREEN VINTAGE SPOT BEAKER,4,9/30/2011 13:40,0.85,15034,United Kingdom
569129,23346,SPACEBOY BEAKER,3,9/30/2011 13:40,1.25,15034,United Kingdom
569129,23345, DOLLY GIRL BEAKER,3,9/30/2011 13:40,1.25,15034,United Kingdom
569129,22630,DOLLY GIRL LUNCH BOX,2,9/30/2011 13:40,1.95,15034,United Kingdom
569129,22629,SPACEBOY LUNCH BOX ,2,9/30/2011 13:40,1.95,15034,United Kingdom
569129,22327,ROUND SNACK BOXES SET OF 4 SKULLS,2,9/30/2011 13:40,2.95,15034,United Kingdom
569129,22729,ALARM CLOCK BAKELIKE ORANGE,1,9/30/2011 13:40,3.75,15034,United Kingdom
569129,22727,ALARM CLOCK BAKELIKE RED ,1,9/30/2011 13:40,3.75,15034,United Kingdom
569129,22441,GROW YOUR OWN BASIL IN ENAMEL MUG,5,9/30/2011 13:40,2.1,15034,United Kingdom
569129,22328,ROUND SNACK BOXES SET OF 4 FRUITS ,2,9/30/2011 13:40,2.95,15034,United Kingdom
569129,22728,ALARM CLOCK BAKELIKE PINK,3,9/30/2011 13:40,3.75,15034,United Kingdom
569129,22726,ALARM CLOCK BAKELIKE GREEN,4,9/30/2011 13:40,3.75,15034,United Kingdom
569129,22845,VINTAGE CREAM CAT FOOD CONTAINER,1,9/30/2011 13:40,6.35,15034,United Kingdom
569129,22844,VINTAGE CREAM DOG FOOD CONTAINER,1,9/30/2011 13:40,8.5,15034,United Kingdom
569129,21260,FIRST AID TIN,3,9/30/2011 13:40,3.25,15034,United Kingdom
569129,84950,ASSORTED COLOUR T-LIGHT HOLDER,12,9/30/2011 13:40,0.65,15034,United Kingdom
569129,23310,BUBBLEGUM RING ASSORTED,36,9/30/2011 13:40,0.42,15034,United Kingdom
569129,22556,PLASTERS IN TIN CIRCUS PARADE ,1,9/30/2011 13:40,1.65,15034,United Kingdom
569129,23198,PANTRY MAGNETIC  SHOPPING LIST,2,9/30/2011 13:40,1.45,15034,United Kingdom
569129,23196,VINTAGE LEAF MAGNETIC NOTEPAD,2,9/30/2011 13:40,1.45,15034,United Kingdom
569129,23197,SKETCHBOOK MAGNETIC SHOPPING LIST,2,9/30/2011 13:40,1.45,15034,United Kingdom
569129,22549,PICTURE DOMINOES,3,9/30/2011 13:40,1.45,15034,United Kingdom
569129,22847,BREAD BIN DINER STYLE IVORY,2,9/30/2011 13:40,16.95,15034,United Kingdom
569129,20749,ASSORTED COLOUR MINI CASES,1,9/30/2011 13:40,7.95,15034,United Kingdom
569129,23188,VINTAGE  2 METER FOLDING RULER,3,9/30/2011 13:40,1.65,15034,United Kingdom
569129,22561,WOODEN SCHOOL COLOURING SET,2,9/30/2011 13:40,1.65,15034,United Kingdom
569129,23242,TREASURE TIN BUFFALO BILL ,2,9/30/2011 13:40,2.08,15034,United Kingdom
569129,23241,TREASURE TIN GYMKHANA DESIGN,2,9/30/2011 13:40,2.08,15034,United Kingdom
569129,22846,BREAD BIN DINER STYLE RED ,2,9/30/2011 13:40,16.95,15034,United Kingdom
569129,21428,SET3 BOOK BOX GREEN GINGHAM FLOWER ,1,9/30/2011 13:40,4.25,15034,United Kingdom
569129,20727,LUNCH BAG  BLACK SKULL.,4,9/30/2011 13:40,1.65,15034,United Kingdom
569129,48129,DOORMAT TOPIARY,1,9/30/2011 13:40,8.25,15034,United Kingdom
569129,48184,DOORMAT ENGLISH ROSE ,1,9/30/2011 13:40,8.25,15034,United Kingdom
569129,22379,RECYCLING BAG RETROSPOT ,2,9/30/2011 13:40,2.1,15034,United Kingdom
569129,22664,TOY TIDY DOLLY GIRL DESIGN,2,9/30/2011 13:40,2.1,15034,United Kingdom
569129,22381,TOY TIDY PINK POLKADOT,3,9/30/2011 13:40,2.1,15034,United Kingdom
569130,22372,AIRLINE BAG VINTAGE WORLD CHAMPION ,4,9/30/2011 13:46,4.25,14911,EIRE
569130,22376,AIRLINE BAG VINTAGE JET SET WHITE,8,9/30/2011 13:46,4.25,14911,EIRE
569130,84661A,WHITE SQUARE TABLE CLOCK,6,9/30/2011 13:46,2.55,14911,EIRE
569130,C2,CARRIAGE,1,9/30/2011 13:46,50,14911,EIRE
569131,22927,damaged,-5,9/30/2011 13:49,0,,United Kingdom
569132,16169E,WRAP 50'S  CHRISTMAS,25,9/30/2011 13:54,0.42,17757,United Kingdom
569132,23320,GIANT 50'S CHRISTMAS CRACKER,4,9/30/2011 13:54,2.89,17757,United Kingdom
569132,23389,SPACEBOY MINI BACKPACK,1,9/30/2011 13:54,4.15,17757,United Kingdom
569132,22457,NATURAL SLATE HEART CHALKBOARD ,1,9/30/2011 13:54,2.95,17757,United Kingdom
569132,22592,CARDHOLDER HOLLY WREATH METAL,2,9/30/2011 13:54,3.75,17757,United Kingdom
569132,22589,CARDHOLDER GINGHAM STAR,4,9/30/2011 13:54,2.89,17757,United Kingdom
569132,22488,NATURAL SLATE RECTANGLE CHALKBOARD,2,9/30/2011 13:54,1.65,17757,United Kingdom
569132,23114,VINTAGE LEAF CHOPPING BOARD  ,1,9/30/2011 13:54,4.95,17757,United Kingdom
569132,23117,POPPY FIELDS CHOPPING BOARD,1,9/30/2011 13:54,4.95,17757,United Kingdom
569132,23115,RED APPLES CHOPPING BOARD   ,1,9/30/2011 13:54,4.95,17757,United Kingdom
569132,23300,GARDENERS KNEELING PAD CUP OF TEA ,1,9/30/2011 13:54,1.65,17757,United Kingdom
569132,22581,WOOD STOCKING CHRISTMAS SCANDISPOT,3,9/30/2011 13:54,0.85,17757,United Kingdom
569132,22197,POPCORN HOLDER,4,9/30/2011 13:54,0.85,17757,United Kingdom
569132,22683,FRENCH BLUE METAL DOOR SIGN 8,2,9/30/2011 13:54,1.25,17757,United Kingdom
569132,22083,PAPER CHAIN KIT RETROSPOT,1,9/30/2011 13:54,2.95,17757,United Kingdom
569132,21494,ROTATING LEAVES T-LIGHT HOLDER,1,9/30/2011 13:54,1.25,17757,United Kingdom
569132,22910,PAPER CHAIN KIT VINTAGE CHRISTMAS,2,9/30/2011 13:54,2.95,17757,United Kingdom
569132,21094,SET/6 RED SPOTTY PAPER PLATES,3,9/30/2011 13:54,0.85,17757,United Kingdom
569132,47590B,PINK HAPPY BIRTHDAY BUNTING,1,9/30/2011 13:54,5.45,17757,United Kingdom
569132,47566,PARTY BUNTING,4,9/30/2011 13:54,4.95,17757,United Kingdom
569132,21080,SET/20 RED RETROSPOT PAPER NAPKINS ,6,9/30/2011 13:54,0.85,17757,United Kingdom
569132,21215,IVORY PAPER CUP CAKE CASES ,3,9/30/2011 13:54,0.55,17757,United Kingdom
569132,23207,LUNCH BAG ALPHABET DESIGN,2,9/30/2011 13:54,1.65,17757,United Kingdom
569132,22632,HAND WARMER RED RETROSPOT,4,9/30/2011 13:54,2.1,17757,United Kingdom
569132,22867,HAND WARMER BIRD DESIGN,3,9/30/2011 13:54,2.1,17757,United Kingdom
569132,22581,WOOD STOCKING CHRISTMAS SCANDISPOT,1,9/30/2011 13:54,0.85,17757,United Kingdom
569132,22571,ROCKING HORSE RED CHRISTMAS ,4,9/30/2011 13:54,0.85,17757,United Kingdom
569132,22576,SWALLOW WOODEN CHRISTMAS DECORATION,4,9/30/2011 13:54,0.85,17757,United Kingdom
569132,22574,HEART WOODEN CHRISTMAS DECORATION,4,9/30/2011 13:54,0.85,17757,United Kingdom
569132,22573,STAR WOODEN CHRISTMAS DECORATION,4,9/30/2011 13:54,0.85,17757,United Kingdom
569132,23196,VINTAGE LEAF MAGNETIC NOTEPAD,4,9/30/2011 13:54,1.45,17757,United Kingdom
569132,23197,SKETCHBOOK MAGNETIC SHOPPING LIST,4,9/30/2011 13:54,1.45,17757,United Kingdom
569132,22546,MINI JIGSAW PURDEY,1,9/30/2011 13:54,0.42,17757,United Kingdom
569132,22580,ADVENT CALENDAR GINGHAM SACK,2,9/30/2011 13:54,5.95,17757,United Kingdom
569132,21918,SET 12 KIDS COLOUR  CHALK STICKS,8,9/30/2011 13:54,0.42,17757,United Kingdom
569132,22681,FRENCH BLUE METAL DOOR SIGN 6,3,9/30/2011 13:54,1.25,17757,United Kingdom
569132,23329,DECORATIVE WICKER HEART LARGE,3,9/30/2011 13:54,1.65,17757,United Kingdom
569132,23332,IVORY WICKER HEART LARGE,3,9/30/2011 13:54,1.65,17757,United Kingdom
569132,21916,SET 12 RETRO WHITE CHALK STICKS,4,9/30/2011 13:54,0.42,17757,United Kingdom
569132,21790,VINTAGE SNAP CARDS,6,9/30/2011 13:54,0.85,17757,United Kingdom
569132,22684,FRENCH BLUE METAL DOOR SIGN 9,1,9/30/2011 13:54,1.25,17757,United Kingdom
569132,21086,SET/6 RED SPOTTY PAPER CUPS,2,9/30/2011 13:54,0.65,17757,United Kingdom
569132,23109,PACK OF SIX LED TEA LIGHTS,2,9/30/2011 13:54,2.89,17757,United Kingdom
569132,22620,4 TRADITIONAL SPINNING TOPS,4,9/30/2011 13:54,1.45,17757,United Kingdom
569132,21891,TRADITIONAL WOODEN SKIPPING ROPE,4,9/30/2011 13:54,1.45,17757,United Kingdom
569132,21892,TRADITIONAL WOODEN CATCH CUP GAME ,3,9/30/2011 13:54,1.25,17757,United Kingdom
569132,21889,WOODEN BOX OF DOMINOES,6,9/30/2011 13:54,1.25,17757,United Kingdom
569132,22723,SET OF 6 HERB TINS SKETCHBOOK,2,9/30/2011 13:54,3.95,17757,United Kingdom
569132,23331,DECORATIVE WICKER HEART SMALL,8,9/30/2011 13:54,0.63,17757,United Kingdom
569132,22531,MAGIC DRAWING SLATE CIRCUS PARADE  ,2,9/30/2011 13:54,0.42,17757,United Kingdom
569132,22686,FRENCH BLUE METAL DOOR SIGN No,2,9/30/2011 13:54,1.25,17757,United Kingdom
569132,23334,IVORY WICKER HEART SMALL,8,9/30/2011 13:54,0.63,17757,United Kingdom
569133,20973,12 PENCIL SMALL TUBE WOODLAND,24,9/30/2011 14:06,0.65,15185,United Kingdom
569133,20974,12 PENCILS SMALL TUBE SKULL,24,9/30/2011 14:06,0.65,15185,United Kingdom
569133,84078A,SET/4 WHITE RETRO STORAGE CUBES ,2,9/30/2011 14:06,39.95,15185,United Kingdom
569133,72818,CHRISTMAS DECOUPAGE CANDLE,36,9/30/2011 14:06,0.39,15185,United Kingdom
569133,72817,SET OF 2 CHRISTMAS DECOUPAGE CANDLE,24,9/30/2011 14:06,0.79,15185,United Kingdom
569133,35954,SMALL FOLKART STAR CHRISTMAS DEC,96,9/30/2011 14:06,0.19,15185,United Kingdom
569133,35933,PINK STOCKING CHRISTMAS DECORATION,40,9/30/2011 14:06,0.38,15185,United Kingdom
569133,22339,CHRISTMAS TREE PAINTED ZINC ,96,9/30/2011 14:06,0.19,15185,United Kingdom
569133,22338,STAR DECORATION PAINTED ZINC ,96,9/30/2011 14:06,0.19,15185,United Kingdom
569133,35598D,PINK/WHITE CHRISTMAS TREE 60CM,24,9/30/2011 14:06,0.65,15185,United Kingdom
569133,22402,MAGNETS PACK OF 4 VINTAGE COLLAGE,12,9/30/2011 14:06,0.39,15185,United Kingdom
569133,22609,PENS ASSORTED SPACEBALL,36,9/30/2011 14:06,0.19,15185,United Kingdom
569133,22403,MAGNETS PACK OF 4 VINTAGE LABELS ,12,9/30/2011 14:06,0.39,15185,United Kingdom
569133,22400,MAGNETS PACK OF 4 HOME SWEET HOME,12,9/30/2011 14:06,0.39,15185,United Kingdom
569133,35471D,SET OF 3 BIRD LIGHT PINK FEATHER ,24,9/30/2011 14:06,0.39,15185,United Kingdom
569133,47504K,ENGLISH ROSE GARDEN SECATEURS,12,9/30/2011 14:06,0.79,15185,United Kingdom
569133,47503A,ASS FLORAL PRINT MULTI SCREWDRIVER,24,9/30/2011 14:06,0.42,15185,United Kingdom
569133,47504H,ENGLISH ROSE SPIRIT LEVEL ,12,9/30/2011 14:06,0.79,15185,United Kingdom
569133,84926F,PSYCHEDELIC TILE COASTER,24,9/30/2011 14:06,0.29,15185,United Kingdom
569133,84927F,PSYCHEDELIC TILE HOOK,12,9/30/2011 14:06,0.39,15185,United Kingdom
569133,21916,SET 12 RETRO WHITE CHALK STICKS,24,9/30/2011 14:06,0.42,15185,United Kingdom
569134,23399,HOME SWEET HOME HANGING HEART,12,9/30/2011 14:07,0.85,15411,United Kingdom
569134,23407,SET OF 2 TRAYS HOME SWEET HOME,2,9/30/2011 14:07,9.95,15411,United Kingdom
569134,23431,NATURAL HANGING QUILTED HEARTS ,12,9/30/2011 14:07,0.83,15411,United Kingdom
569134,23433,HANGING QUILTED PATCHWORK APPLES,12,9/30/2011 14:07,0.83,15411,United Kingdom
569134,23301,GARDENERS KNEELING PAD KEEP CALM ,12,9/30/2011 14:07,1.65,15411,United Kingdom
569134,23300,GARDENERS KNEELING PAD CUP OF TEA ,12,9/30/2011 14:07,1.65,15411,United Kingdom
569134,22508,DOORSTOP RETROSPOT HEART,4,9/30/2011 14:07,3.75,15411,United Kingdom
569134,85123A,WHITE HANGING HEART T-LIGHT HOLDER,6,9/30/2011 14:07,2.95,15411,United Kingdom
569134,46000M,POLYESTER FILLER PAD 45x45cm,12,9/30/2011 14:07,1.55,15411,United Kingdom
569134,23108,SET OF 10 LED DOLLY LIGHTS,4,9/30/2011 14:07,6.25,15411,United Kingdom
569134,23284,DOORMAT KEEP CALM AND COME IN,2,9/30/2011 14:07,8.25,15411,United Kingdom
569134,21411,GINGHAM HEART  DOORSTOP RED,3,9/30/2011 14:07,4.25,15411,United Kingdom
569134,21932,SCANDINAVIAN PAISLEY PICNIC BAG,10,9/30/2011 14:07,1.65,15411,United Kingdom
569134,23052,RECYCLED ACAPULCO MAT TURQUOISE,2,9/30/2011 14:07,8.25,15411,United Kingdom
569134,23054,RECYCLED ACAPULCO MAT LAVENDER,2,9/30/2011 14:07,8.25,15411,United Kingdom
569134,22910,PAPER CHAIN KIT VINTAGE CHRISTMAS,6,9/30/2011 14:07,2.95,15411,United Kingdom
569134,23343,JUMBO BAG VINTAGE CHRISTMAS ,10,9/30/2011 14:07,2.08,15411,United Kingdom
569134,85159B,"WHITE TEA,COFFEE,SUGAR JARS",12,9/30/2011 14:07,1.95,15411,United Kingdom
569134,23311,VINTAGE CHRISTMAS STOCKING ,12,9/30/2011 14:07,2.55,15411,United Kingdom
569134,23312,VINTAGE CHRISTMAS GIFT SACK,8,9/30/2011 14:07,4.15,15411,United Kingdom
569134,23313,VINTAGE CHRISTMAS BUNTING,10,9/30/2011 14:07,4.95,15411,United Kingdom
569134,23393,HOME SWEET HOME CUSHION COVER ,4,9/30/2011 14:07,3.75,15411,United Kingdom
569134,23395,BELLE JARDINIERE CUSHION COVER,4,9/30/2011 14:07,3.75,15411,United Kingdom
569134,23396,LE JARDIN BOTANIQUE CUSHION COVER,4,9/30/2011 14:07,3.75,15411,United Kingdom
569134,22696,WICKER WREATH LARGE,6,9/30/2011 14:07,1.95,15411,United Kingdom
569134,35970,ZINC FOLKART SLEIGH BELLS,12,9/30/2011 14:07,1.69,15411,United Kingdom
569134,23263,SET OF 3 WOODEN HEART DECORATIONS,12,9/30/2011 14:07,1.25,15411,United Kingdom
569134,23266,SET OF 3 WOODEN STOCKING DECORATION,12,9/30/2011 14:07,1.25,15411,United Kingdom
569134,23265,SET OF 3 WOODEN TREE DECORATIONS,12,9/30/2011 14:07,1.25,15411,United Kingdom
569134,23264,SET OF 3 WOODEN SLEIGH DECORATIONS,12,9/30/2011 14:07,1.25,15411,United Kingdom
569134,22430,ENAMEL WATERING CAN CREAM,4,9/30/2011 14:07,4.95,15411,United Kingdom
569134,23400,SHELF WITH 4 HOOKS HOME SWEET HOME,2,9/30/2011 14:07,6.25,15411,United Kingdom
569134,23397,FOOT STOOL HOME SWEET HOME ,2,9/30/2011 14:07,9.95,15411,United Kingdom
569135,21349,,5,9/30/2011 14:20,0,,United Kingdom
569136,79302M,"ART LIGHTS,FUNK MONKEY",1,9/30/2011 14:41,2.95,15834,United Kingdom
569136,21068,VINTAGE BILLBOARD LOVE/HATE MUG,6,9/30/2011 14:41,1.25,15834,United Kingdom
569136,82580,BATHROOM METAL SIGN,4,9/30/2011 14:41,0.55,15834,United Kingdom
569136,21172,PARTY METAL SIGN ,4,9/30/2011 14:41,1.45,15834,United Kingdom
569136,22564,ALPHABET STENCIL CRAFT,2,9/30/2011 14:41,1.25,15834,United Kingdom
