569243,23236,STORAGE TIN VINTAGE DOILY ,6,10/3/2011 9:44,2.89,13344,United Kingdom
569243,23380,PACK OF 12 VINTAGE DOILY TISSUES,24,10/3/2011 9:44,0.39,13344,United Kingdom
569243,23424,GINGHAM RECIPE BOOK BOX,4,10/3/2011 9:44,4.95,13344,United Kingdom
569243,22950,36 DOILIES VINTAGE CHRISTMAS,12,10/3/2011 9:44,1.45,13344,United Kingdom
569243,21974,SET OF 36 PAISLEY FLOWER DOILIES,12,10/3/2011 9:44,1.45,13344,United Kingdom
569243,84988,SET OF 72 PINK HEART PAPER DOILIES,12,10/3/2011 9:44,1.45,13344,United Kingdom
569243,22083,PAPER CHAIN KIT RETROSPOT,6,10/3/2011 9:44,2.95,13344,United Kingdom
569243,22969,HOMEMADE JAM SCENTED CANDLES,12,10/3/2011 9:44,1.45,13344,United Kingdom
569243,22147,FELTCRAFT BUTTERFLY HEARTS,12,10/3/2011 9:44,1.45,13344,United Kingdom
569243,22149,FELTCRAFT 6 FLOWER FRIENDS,6,10/3/2011 9:44,2.1,13344,United Kingdom
569243,22150,3 STRIPEY MICE FELTCRAFT,6,10/3/2011 9:44,1.95,13344,United Kingdom
569243,84030E,ENGLISH ROSE HOT WATER BOTTLE,4,10/3/2011 9:44,4.25,13344,United Kingdom
569243,84029E,RED WOOLLY HOTTIE WHITE HEART.,4,10/3/2011 9:44,4.25,13344,United Kingdom
569243,22113,GREY HEART HOT WATER BOTTLE,4,10/3/2011 9:44,4.25,13344,United Kingdom
569243,22835,HOT WATER BOTTLE I AM SO POORLY,4,10/3/2011 9:44,4.95,13344,United Kingdom
569243,48187,DOORMAT NEW ENGLAND,2,10/3/2011 9:44,8.25,13344,United Kingdom
569243,82583,HOT BATHS METAL SIGN,12,10/3/2011 9:44,2.1,13344,United Kingdom
569243,23426,METAL SIGN DROP YOUR PANTS,6,10/3/2011 9:44,2.89,13344,United Kingdom
569243,21908,CHOCOLATE THIS WAY METAL SIGN,12,10/3/2011 9:44,2.1,13344,United Kingdom
569243,21524,DOORMAT SPOTTY HOME SWEET HOME,2,10/3/2011 9:44,8.25,13344,United Kingdom
569243,23111,PARISIENNE SEWING BOX,1,10/3/2011 9:44,12.5,13344,United Kingdom
569243,21754,HOME BUILDING BLOCK WORD,3,10/3/2011 9:44,6.25,13344,United Kingdom
569243,21754,HOME BUILDING BLOCK WORD,3,10/3/2011 9:44,6.25,13344,United Kingdom
569243,23092,LARGE ANTIQUE WHITE PHOTO FRAME,2,10/3/2011 9:44,7.9,13344,United Kingdom
569243,22654,DELUXE SEWING KIT ,3,10/3/2011 9:44,5.95,13344,United Kingdom
569243,23393,HOME SWEET HOME CUSHION COVER ,4,10/3/2011 9:44,3.75,13344,United Kingdom
569243,22938,CUPCAKE LACE PAPER SET 6,12,10/3/2011 9:44,1.95,13344,United Kingdom
569243,23273,HEART T-LIGHT HOLDER WILLIE WINKIE,12,10/3/2011 9:44,1.65,13344,United Kingdom
569243,23350,ROLL WRAP VINTAGE SPOT ,12,10/3/2011 9:44,1.25,13344,United Kingdom
569243,22086,PAPER CHAIN KIT 50'S CHRISTMAS ,6,10/3/2011 9:44,2.95,13344,United Kingdom
569243,23247,BISCUIT TIN 50'S CHRISTMAS,6,10/3/2011 9:44,2.89,13344,United Kingdom
569244,23307,SET OF 60 PANTRY DESIGN CAKE CASES ,24,10/3/2011 9:45,0.55,13344,United Kingdom
569244,23055,IVORY CHANDELIER T-LIGHT HOLDER,3,10/3/2011 9:45,6.25,13344,United Kingdom
569244,23073,GEORGIAN TRINKET BOX,2,10/3/2011 9:45,12.5,13344,United Kingdom
569244,23060,HEART BEADED TRELLIS DECORATION,6,10/3/2011 9:45,2.08,13344,United Kingdom
569244,23298,SPOTTY BUNTING,4,10/3/2011 9:45,4.95,13344,United Kingdom
569244,23142,IVORY WIRE KITCHEN ORGANISER,4,10/3/2011 9:45,10.4,13344,United Kingdom
569244,23132,SMALL IVORY HEART WALL ORGANISER,3,10/3/2011 9:45,5.75,13344,United Kingdom
569244,23012,GLASS APOTHECARY BOTTLE PERFUME,4,10/3/2011 9:45,3.95,13344,United Kingdom
569244,23111,PARISIENNE SEWING BOX,2,10/3/2011 9:45,12.5,13344,United Kingdom
569244,23118,PARISIENNE JEWELLERY DRAWER ,2,10/3/2011 9:45,7.5,13344,United Kingdom
569244,23171,REGENCY TEA PLATE GREEN ,12,10/3/2011 9:45,1.65,13344,United Kingdom
569244,23170,REGENCY TEA PLATE ROSES ,12,10/3/2011 9:45,1.65,13344,United Kingdom
569244,23172,REGENCY TEA PLATE PINK,12,10/3/2011 9:45,1.65,13344,United Kingdom
569244,23245,SET OF 3 REGENCY CAKE TINS,4,10/3/2011 9:45,4.95,13344,United Kingdom
569244,23199,JUMBO BAG APPLES,10,10/3/2011 9:45,1.95,13344,United Kingdom
569244,23202,JUMBO BAG VINTAGE LEAF,10,10/3/2011 9:45,1.95,13344,United Kingdom
569246,20996,JAZZ HEARTS ADDRESS BOOK,1,10/3/2011 9:57,0.83,14096,United Kingdom
569246,21031,SPACE CADET BLACK,1,10/3/2011 9:57,2.46,14096,United Kingdom
569246,21035,SET/2 RED RETROSPOT TEA TOWELS ,2,10/3/2011 9:57,6.63,14096,United Kingdom
569246,21055,TOOL BOX SOFT TOY ,1,10/3/2011 9:57,16.63,14096,United Kingdom
569246,21058,PARTY INVITES WOODLAND,1,10/3/2011 9:57,1.63,14096,United Kingdom
569246,21070,VINTAGE BILLBOARD MUG ,1,10/3/2011 9:57,2.46,14096,United Kingdom
569246,21071,VINTAGE BILLBOARD DRINK ME MUG,1,10/3/2011 9:57,2.46,14096,United Kingdom
569246,21080,SET/20 RED RETROSPOT PAPER NAPKINS ,7,10/3/2011 9:57,0.83,14096,United Kingdom
569246,21084,SET/6 COLLAGE PAPER CUPS,7,10/3/2011 9:57,0.83,14096,United Kingdom
569246,21086,SET/6 RED SPOTTY PAPER CUPS,5,10/3/2011 9:57,1.63,14096,United Kingdom
569246,21090,SET/6 COLLAGE PAPER PLATES,7,10/3/2011 9:57,0.83,14096,United Kingdom
569246,21094,SET/6 RED SPOTTY PAPER PLATES,15,10/3/2011 9:57,0.83,14096,United Kingdom
569246,21098,CHRISTMAS TOILET ROLL,3,10/3/2011 9:57,2.46,14096,United Kingdom
569246,21147,JINGLE BELLS TREE DECORATION,1,10/3/2011 9:57,2.46,14096,United Kingdom
569246,21154,RED RETROSPOT OVEN GLOVE ,3,10/3/2011 9:57,2.46,14096,United Kingdom
569246,21156,RETROSPOT CHILDRENS APRON,1,10/3/2011 9:57,4.13,14096,United Kingdom
569246,21219,SET/4 BADGES BALLOON GIRL,1,10/3/2011 9:57,2.46,14096,United Kingdom
569246,21231,SWEETHEART CERAMIC TRINKET BOX,7,10/3/2011 9:57,2.46,14096,United Kingdom
569246,21232,STRAWBERRY CERAMIC TRINKET BOX,3,10/3/2011 9:57,2.46,14096,United Kingdom
569246,21314,SMALL GLASS HEART TRINKET POT,1,10/3/2011 9:57,4.13,14096,United Kingdom
569246,21356,TOAST ITS - FAIRY FLOWER,1,10/3/2011 9:57,0.83,14096,United Kingdom
569246,21411,GINGHAM HEART  DOORSTOP RED,1,10/3/2011 9:57,8.29,14096,United Kingdom
569246,21465,PINK FLOWER CROCHET FOOD COVER,1,10/3/2011 9:57,7.46,14096,United Kingdom
569246,21494,ROTATING LEAVES T-LIGHT HOLDER,1,10/3/2011 9:57,2.46,14096,United Kingdom
569246,21524,DOORMAT SPOTTY HOME SWEET HOME,1,10/3/2011 9:57,16.63,14096,United Kingdom
569246,21557,SET OF 6 FUNKY BEAKERS,1,10/3/2011 9:57,5.79,14096,United Kingdom
569246,21559,STRAWBERRY LUNCH BOX WITH CUTLERY,2,10/3/2011 9:57,4.96,14096,United Kingdom
569246,21561,DINOSAUR LUNCH BOX WITH CUTLERY,1,10/3/2011 9:57,4.96,14096,United Kingdom
569246,21668,RED STRIPE CERAMIC DRAWER KNOB,6,10/3/2011 9:57,3.29,14096,United Kingdom
569246,21669,BLUE STRIPE CERAMIC DRAWER KNOB,4,10/3/2011 9:57,3.29,14096,United Kingdom
569246,21675,BUTTERFLIES STICKERS,1,10/3/2011 9:57,1.63,14096,United Kingdom
569246,21676,FLOWERS  STICKERS,1,10/3/2011 9:57,1.63,14096,United Kingdom
569246,21677,HEARTS  STICKERS,1,10/3/2011 9:57,1.63,14096,United Kingdom
569246,21733,RED HANGING HEART T-LIGHT HOLDER,1,10/3/2011 9:57,5.79,14096,United Kingdom
569246,21744,SNOWFLAKE PORTABLE TABLE LIGHT ,1,10/3/2011 9:57,5.79,14096,United Kingdom
569246,21746,SMALL RED RETROSPOT WINDMILL,1,10/3/2011 9:57,2.46,14096,United Kingdom
569246,21787,RAIN PONCHO RETROSPOT,2,10/3/2011 9:57,1.63,14096,United Kingdom
569246,21790,VINTAGE SNAP CARDS,1,10/3/2011 9:57,1.63,14096,United Kingdom
569246,21794,CLASSIC FRENCH STYLE BASKET NATURAL,1,10/3/2011 9:57,7.46,14096,United Kingdom
569246,21810,CHRISTMAS HANGING STAR WITH BELL,1,10/3/2011 9:57,2.46,14096,United Kingdom
569246,21832,CHOCOLATE CALCULATOR,1,10/3/2011 9:57,3.29,14096,United Kingdom
569246,21871,SAVE THE PLANET MUG,1,10/3/2011 9:57,3.29,14096,United Kingdom
569246,21873,IF YOU CAN'T STAND THE HEAT MUG,1,10/3/2011 9:57,3.29,14096,United Kingdom
569246,21875,KINGS CHOICE MUG,1,10/3/2011 9:57,3.29,14096,United Kingdom
569246,21877,HOME SWEET HOME MUG,1,10/3/2011 9:57,3.29,14096,United Kingdom
569246,21880,RED RETROSPOT TAPE,1,10/3/2011 9:57,0.42,14096,United Kingdom
569246,21881,CUTE CATS TAPE,1,10/3/2011 9:57,1.63,14096,United Kingdom
569246,21889,WOODEN BOX OF DOMINOES,4,10/3/2011 9:57,2.46,14096,United Kingdom
569246,21890,S/6 WOODEN SKITTLES IN COTTON BAG,2,10/3/2011 9:57,5.79,14096,United Kingdom
569246,21892,TRADITIONAL WOODEN CATCH CUP GAME ,4,10/3/2011 9:57,2.46,14096,United Kingdom
569246,21900,"KEY FOB , SHED",3,10/3/2011 9:57,1.63,14096,United Kingdom
569246,21903,MAN FLU METAL SIGN,5,10/3/2011 9:57,4.13,14096,United Kingdom
569246,21905,MORE BUTTER METAL SIGN ,1,10/3/2011 9:57,1.63,14096,United Kingdom
569246,21912,VINTAGE SNAKES & LADDERS,1,10/3/2011 9:57,7.46,14096,United Kingdom
569246,21914,BLUE HARMONICA IN BOX ,2,10/3/2011 9:57,2.46,14096,United Kingdom
569246,21915,RED  HARMONICA IN BOX ,1,10/3/2011 9:57,2.46,14096,United Kingdom
569246,21916,SET 12 RETRO WHITE CHALK STICKS,1,10/3/2011 9:57,0.83,14096,United Kingdom
569246,21928,JUMBO BAG SCANDINAVIAN BLUE PAISLEY,1,10/3/2011 9:57,4.13,14096,United Kingdom
569246,21929,JUMBO BAG PINK VINTAGE PAISLEY,1,10/3/2011 9:57,4.13,14096,United Kingdom
569246,21931,JUMBO STORAGE BAG SUKI,1,10/3/2011 9:57,4.13,14096,United Kingdom
569246,21932,SCANDINAVIAN PAISLEY PICNIC BAG,1,10/3/2011 9:57,2.46,14096,United Kingdom
569246,21933,PINK VINTAGE PAISLEY PICNIC BAG,3,10/3/2011 9:57,2.46,14096,United Kingdom
569246,21935,SUKI  SHOULDER BAG,1,10/3/2011 9:57,1.63,14096,United Kingdom
569246,21948,SET OF 6 CAKE CHOPSTICKS,1,10/3/2011 9:57,2.46,14096,United Kingdom
569246,21974,SET OF 36 PAISLEY FLOWER DOILIES,1,10/3/2011 9:57,2.92,14096,United Kingdom
569246,21975,PACK OF 60 DINOSAUR CAKE CASES,1,10/3/2011 9:57,1.25,14096,United Kingdom
569246,21976,PACK OF 60 MUSHROOM CAKE CASES,2,10/3/2011 9:57,1.25,14096,United Kingdom
569246,21977,PACK OF 60 PINK PAISLEY CAKE CASES,2,10/3/2011 9:57,1.25,14096,United Kingdom
569246,21981,PACK OF 12 WOODLAND TISSUES ,1,10/3/2011 9:57,0.83,14096,United Kingdom
569246,21982,PACK OF 12 SUKI TISSUES ,1,10/3/2011 9:57,0.83,14096,United Kingdom
569246,21983,PACK OF 12 BLUE PAISLEY TISSUES ,2,10/3/2011 9:57,0.83,14096,United Kingdom
569246,21984,PACK OF 12 PINK PAISLEY TISSUES ,1,10/3/2011 9:57,0.83,14096,United Kingdom
569246,21985,PACK OF 12 HEARTS DESIGN TISSUES ,2,10/3/2011 9:57,0.83,14096,United Kingdom
569246,21986,PACK OF 12 PINK POLKADOT TISSUES,2,10/3/2011 9:57,0.83,14096,United Kingdom
569246,21990,MODERN FLORAL STATIONERY SET,2,10/3/2011 9:57,2.46,14096,United Kingdom
569246,21991,BOHEMIAN COLLAGE STATIONERY SET,1,10/3/2011 9:57,2.46,14096,United Kingdom
569246,21992,VINTAGE PAISLEY STATIONERY SET,6,10/3/2011 9:57,2.46,14096,United Kingdom
569246,21993,FLORAL FOLK STATIONERY SET,5,10/3/2011 9:57,2.46,14096,United Kingdom
569246,22041,"RECORD FRAME 7"" SINGLE SIZE ",2,10/3/2011 9:57,4.96,14096,United Kingdom
569246,22064,PINK DOUGHNUT TRINKET POT ,1,10/3/2011 9:57,3.29,14096,United Kingdom
569246,22074,6 RIBBONS SHIMMERING PINKS ,1,10/3/2011 9:57,1.25,14096,United Kingdom
569246,22075,6 RIBBONS ELEGANT CHRISTMAS ,1,10/3/2011 9:57,3.29,14096,United Kingdom
569246,22076,6 RIBBONS EMPIRE  ,5,10/3/2011 9:57,1.25,14096,United Kingdom
569246,22077,6 RIBBONS RUSTIC CHARM,4,10/3/2011 9:57,3.29,14096,United Kingdom
569246,22082,RIBBON REEL STRIPES DESIGN ,2,10/3/2011 9:57,3.29,14096,United Kingdom
569246,22086,PAPER CHAIN KIT 50'S CHRISTMAS ,3,10/3/2011 9:57,5.79,14096,United Kingdom
569246,22096,PINK PAISLEY SQUARE TISSUE BOX ,2,10/3/2011 9:57,2.46,14096,United Kingdom
569246,22098,BOUDOIR SQUARE TISSUE BOX,2,10/3/2011 9:57,2.46,14096,United Kingdom
569246,22107,PIZZA PLATE IN BOX,3,10/3/2011 9:57,3.29,14096,United Kingdom
569246,22107,PIZZA PLATE IN BOX,1,10/3/2011 9:57,7.46,14096,United Kingdom
569246,22108,PING! MICROWAVE PLATE,1,10/3/2011 9:57,3.29,14096,United Kingdom
569246,22113,GREY HEART HOT WATER BOTTLE,1,10/3/2011 9:57,7.46,14096,United Kingdom
569246,22114,HOT WATER BOTTLE TEA AND SYMPATHY,1,10/3/2011 9:57,8.29,14096,United Kingdom
569246,22124,SET OF 2 TEA TOWELS PING MICROWAVE,1,10/3/2011 9:57,2.46,14096,United Kingdom
569246,22129,PARTY CONES CANDY DECORATION,5,10/3/2011 9:57,2.46,14096,United Kingdom
569246,22131,FOOD CONTAINER SET 3 LOVE HEART ,2,10/3/2011 9:57,4.13,14096,United Kingdom
569246,22138,BAKING SET 9 PIECE RETROSPOT ,2,10/3/2011 9:57,10.79,14096,United Kingdom
569246,22139,RETROSPOT TEA SET CERAMIC 11 PC ,5,10/3/2011 9:57,10.79,14096,United Kingdom
569246,22141,CHRISTMAS CRAFT TREE TOP ANGEL,2,10/3/2011 9:57,4.13,14096,United Kingdom
569246,22142,CHRISTMAS CRAFT WHITE FAIRY ,3,10/3/2011 9:57,3.29,14096,United Kingdom
569246,22144,CHRISTMAS CRAFT LITTLE FRIENDS,4,10/3/2011 9:57,4.13,14096,United Kingdom
569246,22149,FELTCRAFT 6 FLOWER FRIENDS,3,10/3/2011 9:57,4.13,14096,United Kingdom
569246,22173,METAL 4 HOOK HANGER FRENCH CHATEAU,2,10/3/2011 9:57,5.79,14096,United Kingdom
569246,22178,VICTORIAN GLASS HANGING T-LIGHT,14,10/3/2011 9:57,2.46,14096,United Kingdom
569246,22195,LARGE HEART MEASURING SPOONS,2,10/3/2011 9:57,3.29,14096,United Kingdom
569246,22197,POPCORN HOLDER,6,10/3/2011 9:57,1.63,14096,United Kingdom
569246,22203,MILK PAN RED RETROSPOT,1,10/3/2011 9:57,7.46,14096,United Kingdom
569246,22207,FRYING PAN UNION FLAG,2,10/3/2011 9:57,8.29,14096,United Kingdom
569246,22269,EGG CUP NATURAL CHICKEN,1,10/3/2011 9:57,2.46,14096,United Kingdom
569246,22277,COSMETIC BAG VINTAGE ROSE PAISLEY,1,10/3/2011 9:57,4.13,14096,United Kingdom
569246,22295,HEART FILIGREE DOVE LARGE,1,10/3/2011 9:57,3.29,14096,United Kingdom
569246,22296,HEART IVORY TRELLIS LARGE,1,10/3/2011 9:57,3.29,14096,United Kingdom
569246,22297,HEART IVORY TRELLIS SMALL,3,10/3/2011 9:57,2.46,14096,United Kingdom
569246,22324,BLUE POLKADOT KIDS BAG,1,10/3/2011 9:57,4.13,14096,United Kingdom
569246,22331,WOODLAND PARTY BAG + STICKER SET,2,10/3/2011 9:57,3.29,14096,United Kingdom
569246,22341,LOVE GARLAND PAINTED ZINC ,1,10/3/2011 9:57,3.29,14096,United Kingdom
569246,22356,CHARLOTTE BAG PINK POLKADOT,1,10/3/2011 9:57,1.63,14096,United Kingdom
569246,22357,KINGS CHOICE BISCUIT TIN,1,10/3/2011 9:57,4.13,14096,United Kingdom
569246,22367,CHILDRENS APRON SPACEBOY DESIGN,1,10/3/2011 9:57,4.13,14096,United Kingdom
569246,22379,RECYCLING BAG RETROSPOT ,1,10/3/2011 9:57,4.13,14096,United Kingdom
569246,22384,LUNCH BAG PINK POLKADOT,1,10/3/2011 9:57,4.13,14096,United Kingdom
569246,22385,JUMBO BAG SPACEBOY DESIGN,1,10/3/2011 9:57,4.13,14096,United Kingdom
569246,22406,MONEY BOX KINGS CHOICE DESIGN,2,10/3/2011 9:57,2.46,14096,United Kingdom
569246,22418,10 COLOUR SPACEBOY PEN,3,10/3/2011 9:57,1.63,14096,United Kingdom
569246,22419,LIPSTICK PEN RED,12,10/3/2011 9:57,0.83,14096,United Kingdom
569246,22421,LIPSTICK PEN FUSCHIA,3,10/3/2011 9:57,0.83,14096,United Kingdom
569246,22422,TOOTHPASTE TUBE PEN,2,10/3/2011 9:57,1.25,14096,United Kingdom
569246,22423,REGENCY CAKESTAND 3 TIER,1,10/3/2011 9:57,24.96,14096,United Kingdom
569246,22427,ENAMEL FLOWER JUG CREAM,1,10/3/2011 9:57,11.63,14096,United Kingdom
569246,22446,PIN CUSHION BABUSHKA PINK,2,10/3/2011 9:57,6.63,14096,United Kingdom
569246,22452,MEASURING TAPE BABUSHKA PINK,1,10/3/2011 9:57,1.63,14096,United Kingdom
569246,22457,NATURAL SLATE HEART CHALKBOARD ,7,10/3/2011 9:57,5.79,14096,United Kingdom
569246,22460,EMBOSSED GLASS TEALIGHT HOLDER,1,10/3/2011 9:57,2.46,14096,United Kingdom
569246,22473,TV DINNER TRAY VINTAGE PAISLEY,2,10/3/2011 9:57,10.79,14096,United Kingdom
569246,22476,EMPIRE UNION JACK TV DINNER TRAY,2,10/3/2011 9:57,10.79,14096,United Kingdom
569246,22489,PACK OF 12 TRADITIONAL CRAYONS,2,10/3/2011 9:57,0.83,14096,United Kingdom
569246,22494,EMERGENCY FIRST AID TIN ,4,10/3/2011 9:57,2.46,14096,United Kingdom
569246,22556,PLASTERS IN TIN CIRCUS PARADE ,1,10/3/2011 9:57,3.29,14096,United Kingdom
569246,22557,PLASTERS IN TIN VINTAGE PAISLEY ,2,10/3/2011 9:57,3.29,14096,United Kingdom
569246,22558,CLOTHES PEGS RETROSPOT PACK 24 ,1,10/3/2011 9:57,3.29,14096,United Kingdom
569246,22560,TRADITIONAL MODELLING CLAY,1,10/3/2011 9:57,2.46,14096,United Kingdom
569246,22573,STAR WOODEN CHRISTMAS DECORATION,2,10/3/2011 9:57,1.63,14096,United Kingdom
569246,22576,SWALLOW WOODEN CHRISTMAS DECORATION,1,10/3/2011 9:57,1.63,14096,United Kingdom
569246,22584,PACK OF 6 PANNETONE GIFT BOXES,42,10/3/2011 9:57,4.96,14096,United Kingdom
569246,22585,PACK OF 6 BIRDY GIFT TAGS,3,10/3/2011 9:57,2.46,14096,United Kingdom
569246,22589,CARDHOLDER GINGHAM STAR,1,10/3/2011 9:57,4.96,14096,United Kingdom
569246,22596,CHRISTMAS STAR WISH LIST CHALKBOARD,2,10/3/2011 9:57,2.46,14096,United Kingdom
569246,22600,CHRISTMAS RETROSPOT STAR WOOD,1,10/3/2011 9:57,1.63,14096,United Kingdom
569246,22609,PENS ASSORTED SPACEBALL,5,10/3/2011 9:57,1.63,14096,United Kingdom
569246,22619,SET OF 6 SOLDIER SKITTLES,4,10/3/2011 9:57,7.46,14096,United Kingdom
569246,22620,4 TRADITIONAL SPINNING TOPS,1,10/3/2011 9:57,2.46,14096,United Kingdom
569246,22621,TRADITIONAL KNITTING NANCY,4,10/3/2011 9:57,3.29,14096,United Kingdom
569246,22624,IVORY KITCHEN SCALES,3,10/3/2011 9:57,16.63,14096,United Kingdom
569246,22645,CERAMIC HEART FAIRY CAKE MONEY BANK,1,10/3/2011 9:57,3.29,14096,United Kingdom
569246,22654,DELUXE SEWING KIT ,2,10/3/2011 9:57,11.63,14096,United Kingdom
569246,22664,TOY TIDY DOLLY GIRL DESIGN,1,10/3/2011 9:57,4.13,14096,United Kingdom
569246,22665,RECIPE BOX BLUE SKETCHBOOK DESIGN,1,10/3/2011 9:57,5.79,14096,United Kingdom
569246,22666,RECIPE BOX PANTRY YELLOW DESIGN,4,10/3/2011 9:57,5.79,14096,United Kingdom
569246,22673,FRENCH GARDEN SIGN BLUE METAL,1,10/3/2011 9:57,2.46,14096,United Kingdom
569246,22689,DOORMAT MERRY CHRISTMAS RED ,1,10/3/2011 9:57,16.63,14096,United Kingdom
569246,22697,GREEN REGENCY TEACUP AND SAUCER,1,10/3/2011 9:57,5.79,14096,United Kingdom
569246,22698,PINK REGENCY TEACUP AND SAUCER,1,10/3/2011 9:57,5.79,14096,United Kingdom
569246,22699,ROSES REGENCY TEACUP AND SAUCER ,2,10/3/2011 9:57,5.79,14096,United Kingdom
569246,22712,CARD DOLLY GIRL ,1,10/3/2011 9:57,0.83,14096,United Kingdom
569246,22731,3D CHRISTMAS STAMPS STICKERS ,3,10/3/2011 9:57,2.46,14096,United Kingdom
569246,22739,RIBBON REEL CHRISTMAS SOCK BAUBLE,3,10/3/2011 9:57,3.29,14096,United Kingdom
569246,22759,SET OF 3 NOTEBOOKS IN PARCEL,5,10/3/2011 9:57,3.29,14096,United Kingdom
569246,22791,T-LIGHT GLASS FLUTED ANTIQUE,7,10/3/2011 9:57,2.46,14096,United Kingdom
569246,22800,ANTIQUE TALL SWIRLGLASS TRINKET POT,1,10/3/2011 9:57,7.46,14096,United Kingdom
569246,22809,SET OF 6 T-LIGHTS SANTA,2,10/3/2011 9:57,5.79,14096,United Kingdom
569246,22810,SET OF 6 T-LIGHTS SNOWMEN,1,10/3/2011 9:57,5.79,14096,United Kingdom
569246,22812,PACK 3 BOXES CHRISTMAS PANNETONE,2,10/3/2011 9:57,4.13,14096,United Kingdom
569246,22835,HOT WATER BOTTLE I AM SO POORLY,1,10/3/2011 9:57,9.13,14096,United Kingdom
569246,22851,SET 20 NAPKINS FAIRY CAKES DESIGN ,1,10/3/2011 9:57,1.63,14096,United Kingdom
569246,22897,OVEN MITT APPLES DESIGN,1,10/3/2011 9:57,3.29,14096,United Kingdom
569246,22905,CALENDAR IN SEASON DESIGN,1,10/3/2011 9:57,2.46,14096,United Kingdom
569246,22910,PAPER CHAIN KIT VINTAGE CHRISTMAS,1,10/3/2011 9:57,5.79,14096,United Kingdom
569246,22940,FELTCRAFT CHRISTMAS FAIRY,1,10/3/2011 9:57,8.29,14096,United Kingdom
569246,22945,CHRISTMAS METAL TAGS ASSORTED ,18,10/3/2011 9:57,1.8,14096,United Kingdom
569246,22946,WOODEN ADVENT CALENDAR CREAM,2,10/3/2011 9:57,16.63,14096,United Kingdom
569246,22947,WOODEN ADVENT CALENDAR RED,2,10/3/2011 9:57,16.63,14096,United Kingdom
569246,22948,METAL DECORATION NAUGHTY CHILDREN ,4,10/3/2011 9:57,1.66,14096,United Kingdom
569246,22951,60 CAKE CASES DOLLY GIRL DESIGN,1,10/3/2011 9:57,1.25,14096,United Kingdom
569246,22961,JAM MAKING SET PRINTED,4,10/3/2011 9:57,3.29,14096,United Kingdom
569246,22982,PANTRY PASTRY BRUSH,1,10/3/2011 9:57,2.46,14096,United Kingdom
569246,22991,GIRAFFE WOODEN RULER,2,10/3/2011 9:57,4.13,14096,United Kingdom
569246,22993,SET OF 4 PANTRY JELLY MOULDS,1,10/3/2011 9:57,2.46,14096,United Kingdom
569246,22998,TRAVEL CARD WALLET KEEP CALM,1,10/3/2011 9:57,0.83,14096,United Kingdom
569246,23056,FLOWERS CHANDELIER T-LIGHT HOLDER,2,10/3/2011 9:57,12.46,14096,United Kingdom
569246,23080,RED METAL BOX TOP SECRET,1,10/3/2011 9:57,16.63,14096,United Kingdom
569246,23081,GREEN METAL BOX ARMY SUPPLIES,2,10/3/2011 9:57,16.63,14096,United Kingdom
569246,23084,RABBIT NIGHT LIGHT,3,10/3/2011 9:57,4.13,14096,United Kingdom
569246,23157,SET OF 6 NATIVITY MAGNETS ,1,10/3/2011 9:57,4.13,14096,United Kingdom
569246,23167,SMALL CERAMIC TOP STORAGE JAR ,1,10/3/2011 9:57,1.63,14096,United Kingdom
569246,23170,REGENCY TEA PLATE ROSES ,1,10/3/2011 9:57,3.29,14096,United Kingdom
569246,23171,REGENCY TEA PLATE GREEN ,1,10/3/2011 9:57,3.29,14096,United Kingdom
569246,23172,REGENCY TEA PLATE PINK,1,10/3/2011 9:57,3.29,14096,United Kingdom
569246,23188,VINTAGE  2 METER FOLDING RULER,1,10/3/2011 9:57,3.29,14096,United Kingdom
569246,23191,BUNDLE OF 3 RETRO NOTE BOOKS,1,10/3/2011 9:57,3.29,14096,United Kingdom
569246,23197,SKETCHBOOK MAGNETIC SHOPPING LIST,3,10/3/2011 9:57,3.29,14096,United Kingdom
569246,23198,PANTRY MAGNETIC  SHOPPING LIST,2,10/3/2011 9:57,3.29,14096,United Kingdom
569246,23202,JUMBO BAG VINTAGE LEAF,1,10/3/2011 9:57,4.13,14096,United Kingdom
569246,23221,REINDEER HEART DECORATION SILVER,1,10/3/2011 9:57,1.63,14096,United Kingdom
569246,23223,CHRISTMAS TREE HANGING SILVER ,1,10/3/2011 9:57,1.63,14096,United Kingdom
569246,23225,CHERUB HEART DECORATION SILVER ,1,10/3/2011 9:57,1.63,14096,United Kingdom
569246,23229,VINTAGE DONKEY TAIL GAME ,1,10/3/2011 9:57,7.46,14096,United Kingdom
569246,23247,BISCUIT TIN 50'S CHRISTMAS,1,10/3/2011 9:57,5.79,14096,United Kingdom
569246,23263,SET OF 3 WOODEN HEART DECORATIONS,2,10/3/2011 9:57,2.46,14096,United Kingdom
569246,23263,SET OF 3 WOODEN HEART DECORATIONS,1,10/3/2011 9:57,2.5,14096,United Kingdom
569246,23264,SET OF 3 WOODEN SLEIGH DECORATIONS,3,10/3/2011 9:57,2.46,14096,United Kingdom
569246,23264,SET OF 3 WOODEN SLEIGH DECORATIONS,1,10/3/2011 9:57,2.5,14096,United Kingdom
569246,23265,SET OF 3 WOODEN TREE DECORATIONS,1,10/3/2011 9:57,2.46,14096,United Kingdom
569246,23265,SET OF 3 WOODEN TREE DECORATIONS,3,10/3/2011 9:57,2.5,14096,United Kingdom
569246,23266,SET OF 3 WOODEN STOCKING DECORATION,2,10/3/2011 9:57,2.46,14096,United Kingdom
569246,23266,SET OF 3 WOODEN STOCKING DECORATION,1,10/3/2011 9:57,2.5,14096,United Kingdom
569246,23268,SET OF 2 CERAMIC CHRISTMAS REINDEER,5,10/3/2011 9:57,2.92,14096,United Kingdom
569246,23275,SET OF 3 HANGING OWLS OLLIE BEAK,2,10/3/2011 9:57,2.46,14096,United Kingdom
569246,23284,DOORMAT KEEP CALM AND COME IN,2,10/3/2011 9:57,16.63,14096,United Kingdom
569246,23300,GARDENERS KNEELING PAD CUP OF TEA ,1,10/3/2011 9:57,3.29,14096,United Kingdom
569246,23301,GARDENERS KNEELING PAD KEEP CALM ,7,10/3/2011 9:57,3.29,14096,United Kingdom
569246,23309,SET OF 60 I LOVE LONDON CAKE CASES ,1,10/3/2011 9:57,1.25,14096,United Kingdom
569246,23344,JUMBO BAG 50'S CHRISTMAS ,1,10/3/2011 9:57,4.13,14096,United Kingdom
569246,37500,TEA TIME TEAPOT IN GIFT BOX,4,10/3/2011 9:57,8.29,14096,United Kingdom
569246,47504H,ENGLISH ROSE SPIRIT LEVEL ,1,10/3/2011 9:57,3.29,14096,United Kingdom
569246,47559B,TEA TIME OVEN GLOVE,1,10/3/2011 9:57,2.46,14096,United Kingdom
569246,47566,PARTY BUNTING,3,10/3/2011 9:57,10.79,14096,United Kingdom
569246,47591D,PINK FAIRY CAKE CHILDRENS APRON,1,10/3/2011 9:57,4.13,14096,United Kingdom
569246,47593B,SCOTTIE DOGS BABY BIB,2,10/3/2011 9:57,0.83,14096,United Kingdom
569246,51014A,"FEATHER PEN,HOT PINK",12,10/3/2011 9:57,0.83,14096,United Kingdom
569246,51014L,"FEATHER PEN,LIGHT PINK",1,10/3/2011 9:57,0.83,14096,United Kingdom
569246,71477,COLOUR GLASS. STAR T-LIGHT HOLDER,2,10/3/2011 9:57,6.63,14096,United Kingdom
569246,72812,LARGE ZINC GLASS CANDLEHOLDER,5,10/3/2011 9:57,4.13,14096,United Kingdom
569246,72816,SET/3 CHRISTMAS DECOUPAGE CANDLES,1,10/3/2011 9:57,2.46,14096,United Kingdom
569246,72817,SET OF 2 CHRISTMAS DECOUPAGE CANDLE,5,10/3/2011 9:57,1.63,14096,United Kingdom
569246,82001S,VINYL RECORD FRAME SILVER,1,10/3/2011 9:57,7.46,14096,United Kingdom
569246,82567,"AIRLINE LOUNGE,METAL SIGN",2,10/3/2011 9:57,1.63,14096,United Kingdom
569246,82616B,FRAPPUCINO SCARF KNITTING KIT,1,10/3/2011 9:57,2.46,14096,United Kingdom
569246,82616C,MIDNIGHT GLAMOUR SCARF KNITTING KIT,1,10/3/2011 9:57,2.46,14096,United Kingdom
569246,84031B,CHARLIE LOLA BLUE HOT WATER BOTTLE ,2,10/3/2011 9:57,4.13,14096,United Kingdom
569246,84032A,CHARLIE+LOLA PINK HOT WATER BOTTLE,4,10/3/2011 9:57,3.29,14096,United Kingdom
569246,84032B,CHARLIE + LOLA RED HOT WATER BOTTLE,3,10/3/2011 9:57,3.29,14096,United Kingdom
569246,84077,WORLD WAR 2 GLIDERS ASSTD DESIGNS,7,10/3/2011 9:57,0.63,14096,United Kingdom
569246,84347,ROTATING SILVER ANGELS T-LIGHT HLDR,3,10/3/2011 9:57,4.96,14096,United Kingdom
569246,84380,SET OF 3 BUTTERFLY COOKIE CUTTERS,2,10/3/2011 9:57,2.46,14096,United Kingdom
569246,84596B,SMALL DOLLY MIX DESIGN ORANGE BOWL,13,10/3/2011 9:57,0.83,14096,United Kingdom
569246,84596F,SMALL MARSHMALLOWS PINK BOWL,12,10/3/2011 9:57,0.83,14096,United Kingdom
569246,84596G,SMALL CHOCOLATES PINK BOWL,11,10/3/2011 9:57,0.83,14096,United Kingdom
569246,84692,BOX OF 24 COCKTAIL PARASOLS,3,10/3/2011 9:57,0.83,14096,United Kingdom
569246,84755,COLOUR GLASS T-LIGHT HOLDER HANGING,8,10/3/2011 9:57,1.24,14096,United Kingdom
569246,84792,ENCHANTED BIRD COATHANGER 5 HOOK,1,10/3/2011 9:57,9.13,14096,United Kingdom
569246,84915,HAND TOWEL PINK FLOWER AND DAISY,1,10/3/2011 9:57,4.13,14096,United Kingdom
569246,84926F,PSYCHEDELIC TILE COASTER,1,10/3/2011 9:57,2.46,14096,United Kingdom
569246,84947,ANTIQUE SILVER TEA GLASS ENGRAVED,1,10/3/2011 9:57,2.46,14096,United Kingdom
569246,84971S,SMALL HEART FLOWERS HOOK ,4,10/3/2011 9:57,1.63,14096,United Kingdom
569246,84988,SET OF 72 PINK HEART PAPER DOILIES,1,10/3/2011 9:57,2.92,14096,United Kingdom
569246,85039B,S/4 IVORY MINI ROSE CANDLE IN BOWL,1,10/3/2011 9:57,1.63,14096,United Kingdom
569246,85049A,TRADITIONAL CHRISTMAS RIBBONS,8,10/3/2011 9:57,2.46,14096,United Kingdom
569246,85049E,SCANDINAVIAN REDS RIBBONS,1,10/3/2011 9:57,2.46,14096,United Kingdom
569246,85049H,URBAN BLACK RIBBONS ,1,10/3/2011 9:57,0.83,14096,United Kingdom
569246,85053,FRENCH ENAMEL CANDLEHOLDER,1,10/3/2011 9:57,4.13,14096,United Kingdom
