569667,22596,CHRISTMAS STAR WISH LIST CHALKBOARD,12,10/5/2011 13:42,1.25,17521,United Kingdom
569667,23129,HEART SHAPED HOLLY WREATH,4,10/5/2011 13:42,4.15,17521,United Kingdom
569667,23333,IVORY WICKER HEART MEDIUM,12,10/5/2011 13:42,1.25,17521,United Kingdom
569667,23330,DECORATIVE WICKER HEART MEDIUM,12,10/5/2011 13:42,1.25,17521,United Kingdom
569667,23298,SPOTTY BUNTING,3,10/5/2011 13:42,4.95,17521,United Kingdom
569667,84832,ZINC WILLIE WINKIE  CANDLE STICK,12,10/5/2011 13:42,0.85,17521,United Kingdom
569667,21915,RED  HARMONICA IN BOX ,12,10/5/2011 13:42,1.25,17521,United Kingdom
569667,22759,SET OF 3 NOTEBOOKS IN PARCEL,12,10/5/2011 13:42,1.65,17521,United Kingdom
569667,20982,12 PENCILS TALL TUBE SKULLS,12,10/5/2011 13:42,0.85,17521,United Kingdom
569667,20981,12 PENCILS TALL TUBE WOODLAND,12,10/5/2011 13:42,0.85,17521,United Kingdom
569667,20983,12 PENCILS TALL TUBE RED RETROSPOT,12,10/5/2011 13:42,0.85,17521,United Kingdom
569667,21172,PARTY METAL SIGN ,12,10/5/2011 13:42,1.45,17521,United Kingdom
569667,22178,VICTORIAN GLASS HANGING T-LIGHT,6,10/5/2011 13:42,1.95,17521,United Kingdom
569667,84949,SILVER HANGING T-LIGHT HOLDER,6,10/5/2011 13:42,1.65,17521,United Kingdom
569667,84946,ANTIQUE SILVER T-LIGHT GLASS,12,10/5/2011 13:42,1.25,17521,United Kingdom
569667,23403,LETTER HOLDER HOME SWEET HOME,4,10/5/2011 13:42,3.75,17521,United Kingdom
569667,23397,FOOT STOOL HOME SWEET HOME ,2,10/5/2011 13:42,9.95,17521,United Kingdom
569667,23399,HOME SWEET HOME HANGING HEART,12,10/5/2011 13:42,0.85,17521,United Kingdom
569667,23396,LE JARDIN BOTANIQUE CUSHION COVER,4,10/5/2011 13:42,3.75,17521,United Kingdom
569667,23393,HOME SWEET HOME CUSHION COVER ,4,10/5/2011 13:42,3.75,17521,United Kingdom
569667,23228,FILIGREE HEART BIRD WHITE ,24,10/5/2011 13:42,1.25,17521,United Kingdom
569667,21136,PAINTED METAL PEARS ASSORTED,8,10/5/2011 13:42,1.69,17521,United Kingdom
569667,84879,ASSORTED COLOUR BIRD ORNAMENT,8,10/5/2011 13:42,1.69,17521,United Kingdom
569668,23469,CARD HOLDER LOVE BIRD SMALL,6,10/5/2011 13:47,4.15,16040,United Kingdom
569668,22121,NOEL WOODEN BLOCK LETTERS ,3,10/5/2011 13:47,5.95,16040,United Kingdom
569668,22423,REGENCY CAKESTAND 3 TIER,2,10/5/2011 13:47,12.75,16040,United Kingdom
569668,22139,RETROSPOT TEA SET CERAMIC 11 PC ,6,10/5/2011 13:47,4.95,16040,United Kingdom
569668,21891,TRADITIONAL WOODEN SKIPPING ROPE,12,10/5/2011 13:47,1.45,16040,United Kingdom
569668,22619,SET OF 6 SOLDIER SKITTLES,4,10/5/2011 13:47,3.75,16040,United Kingdom
569668,22865,HAND WARMER OWL DESIGN,12,10/5/2011 13:47,2.1,16040,United Kingdom
569668,22867,HAND WARMER BIRD DESIGN,12,10/5/2011 13:47,2.1,16040,United Kingdom
569668,23409,PHOTO FRAME LINEN AND LACE LARGE,6,10/5/2011 13:47,3.75,16040,United Kingdom
569668,23410,CURIO CABINET LINEN AND LACE ,6,10/5/2011 13:47,8.15,16040,United Kingdom
569668,23110,PARISIENNE KEY CABINET ,2,10/5/2011 13:47,5.75,16040,United Kingdom
569668,23397,FOOT STOOL HOME SWEET HOME ,2,10/5/2011 13:47,9.95,16040,United Kingdom
569668,85123A,WHITE HANGING HEART T-LIGHT HOLDER,6,10/5/2011 13:47,2.95,16040,United Kingdom
569668,21733,RED HANGING HEART T-LIGHT HOLDER,6,10/5/2011 13:47,2.95,16040,United Kingdom
569668,84970S,HANGING HEART ZINC T-LIGHT HOLDER,12,10/5/2011 13:47,0.85,16040,United Kingdom
569668,21257,VICTORIAN SEWING BOX MEDIUM,2,10/5/2011 13:47,7.95,16040,United Kingdom
569668,23215,JINGLE BELL HEART ANTIQUE SILVER,12,10/5/2011 13:47,2.08,16040,United Kingdom
569668,22154,ANGEL DECORATION 3 BUTTONS ,48,10/5/2011 13:47,0.42,16040,United Kingdom
569668,22158,3 HEARTS HANGING DECORATION RUSTIC,16,10/5/2011 13:47,2.95,16040,United Kingdom
569669,22941,CHRISTMAS LIGHTS 10 REINDEER,1,10/5/2011 13:47,8.5,14730,United Kingdom
569669,22689,DOORMAT MERRY CHRISTMAS RED ,1,10/5/2011 13:47,8.25,14730,United Kingdom
569669,23390,DOLLY GIRL MINI BACKPACK,1,10/5/2011 13:47,4.15,14730,United Kingdom
569669,22277,COSMETIC BAG VINTAGE ROSE PAISLEY,1,10/5/2011 13:47,2.1,14730,United Kingdom
569669,23515,EMBROIDERED RIBBON REEL DAISY ,1,10/5/2011 13:47,2.08,14730,United Kingdom
569669,23517,EMBROIDERED RIBBON REEL REBECCA ,1,10/5/2011 13:47,2.89,14730,United Kingdom
569669,21987,PACK OF 6 SKULL PAPER CUPS,1,10/5/2011 13:47,0.65,14730,United Kingdom
569669,22952,60 CAKE CASES VINTAGE CHRISTMAS,1,10/5/2011 13:47,0.55,14730,United Kingdom
569669,22596,CHRISTMAS STAR WISH LIST CHALKBOARD,3,10/5/2011 13:47,1.25,14730,United Kingdom
569669,22554,PLASTERS IN TIN WOODLAND ANIMALS,1,10/5/2011 13:47,1.65,14730,United Kingdom
569669,84536A,ENGLISH ROSE NOTEBOOK A7 SIZE,2,10/5/2011 13:47,0.42,14730,United Kingdom
569669,23372,SET 36 COLOUR PENCILS DOLLY GIRL,2,10/5/2011 13:47,1.25,14730,United Kingdom
569669,47504K,ENGLISH ROSE GARDEN SECATEURS,1,10/5/2011 13:47,0.79,14730,United Kingdom
569669,23328,SET 6 SCHOOL MILK BOTTLES IN CRATE,2,10/5/2011 13:47,3.75,14730,United Kingdom
569669,21587,COSY HOUR GIANT TUBE MATCHES,3,10/5/2011 13:47,2.55,14730,United Kingdom
569669,22798,ANTIQUE GLASS DRESSING TABLE POT,1,10/5/2011 13:47,2.95,14730,United Kingdom
569669,21989,PACK OF 20 SKULL PAPER NAPKINS,1,10/5/2011 13:47,0.85,14730,United Kingdom
569669,23131,MISTLETOE HEART WREATH CREAM,1,10/5/2011 13:47,4.15,14730,United Kingdom
569669,21094,SET/6 RED SPOTTY PAPER PLATES,1,10/5/2011 13:47,0.85,14730,United Kingdom
569669,21988,PACK OF 6 SKULL PAPER PLATES,1,10/5/2011 13:47,0.85,14730,United Kingdom
569669,21987,PACK OF 6 SKULL PAPER CUPS,5,10/5/2011 13:47,0.65,14730,United Kingdom
569669,85123A,WHITE HANGING HEART T-LIGHT HOLDER,1,10/5/2011 13:47,2.95,14730,United Kingdom
569669,23234,BISCUIT TIN VINTAGE CHRISTMAS,1,10/5/2011 13:47,2.89,14730,United Kingdom
569669,85024C,PINK SMALL JEWELLED PHOTOFRAME,2,10/5/2011 13:47,1.65,14730,United Kingdom
569669,23314,VINTAGE CHRISTMAS TABLECLOTH,1,10/5/2011 13:47,12.5,14730,United Kingdom
569669,23332,IVORY WICKER HEART LARGE,1,10/5/2011 13:47,1.65,14730,United Kingdom
569669,22910,PAPER CHAIN KIT VINTAGE CHRISTMAS,1,10/5/2011 13:47,2.95,14730,United Kingdom
569669,23103,JINGLE BELL HEART DECORATION,4,10/5/2011 13:47,1.65,14730,United Kingdom
569669,22537,MAGIC DRAWING SLATE DINOSAUR,1,10/5/2011 13:47,0.42,14730,United Kingdom
569669,22534,MAGIC DRAWING SLATE SPACEBOY ,2,10/5/2011 13:47,0.42,14730,United Kingdom
569669,23090,VINTAGE GLASS T-LIGHT HOLDER,12,10/5/2011 13:47,0.83,14730,United Kingdom
569669,23234,BISCUIT TIN VINTAGE CHRISTMAS,1,10/5/2011 13:47,2.89,14730,United Kingdom
569669,22909,SET OF 20 VINTAGE CHRISTMAS NAPKINS,2,10/5/2011 13:47,0.85,14730,United Kingdom
569669,23397,FOOT STOOL HOME SWEET HOME ,1,10/5/2011 13:47,9.95,14730,United Kingdom
569669,23313,VINTAGE CHRISTMAS BUNTING,2,10/5/2011 13:47,4.95,14730,United Kingdom
569669,21988,PACK OF 6 SKULL PAPER PLATES,5,10/5/2011 13:47,0.85,14730,United Kingdom
569669,21989,PACK OF 20 SKULL PAPER NAPKINS,2,10/5/2011 13:47,0.85,14730,United Kingdom
569669,23321,SMALL WHITE HEART OF WICKER,2,10/5/2011 13:47,1.65,14730,United Kingdom
569669,22588,CARD HOLDER GINGHAM HEART,1,10/5/2011 13:47,2.89,14730,United Kingdom
569669,23332,IVORY WICKER HEART LARGE,1,10/5/2011 13:47,1.65,14730,United Kingdom
569669,21929,JUMBO BAG PINK VINTAGE PAISLEY,1,10/5/2011 13:47,2.08,14730,United Kingdom
569669,20712,JUMBO BAG WOODLAND ANIMALS,1,10/5/2011 13:47,2.08,14730,United Kingdom
569669,22385,JUMBO BAG SPACEBOY DESIGN,1,10/5/2011 13:47,2.08,14730,United Kingdom
569669,23301,GARDENERS KNEELING PAD KEEP CALM ,3,10/5/2011 13:47,1.65,14730,United Kingdom
569669,79160,HEART SHAPE WIRELESS DOORBELL,1,10/5/2011 13:47,2.1,14730,United Kingdom
569669,85123A,WHITE HANGING HEART T-LIGHT HOLDER,1,10/5/2011 13:47,2.95,14730,United Kingdom
569669,85025B,EAU DE NILE HEART SHAPE PHOTO FRAME,2,10/5/2011 13:47,1.65,14730,United Kingdom
569669,22588,CARD HOLDER GINGHAM HEART,1,10/5/2011 13:47,2.89,14730,United Kingdom
569669,22662,LUNCH BAG DOLLY GIRL DESIGN,2,10/5/2011 13:47,1.65,14730,United Kingdom
569669,21094,SET/6 RED SPOTTY PAPER PLATES,4,10/5/2011 13:47,0.85,14730,United Kingdom
569669,23407,SET OF 2 TRAYS HOME SWEET HOME,2,10/5/2011 13:47,9.95,14730,United Kingdom
569669,22992,REVOLVER WOODEN RULER ,1,10/5/2011 13:47,1.95,14730,United Kingdom
569669,22991,GIRAFFE WOODEN RULER,1,10/5/2011 13:47,1.95,14730,United Kingdom
569669,21080,SET/20 RED RETROSPOT PAPER NAPKINS ,1,10/5/2011 13:47,0.85,14730,United Kingdom
569669,23390,DOLLY GIRL MINI BACKPACK,1,10/5/2011 13:47,4.15,14730,United Kingdom
569669,21329,DINOSAURS  WRITING SET ,1,10/5/2011 13:47,1.65,14730,United Kingdom
569669,21385,IVORY HANGING DECORATION  HEART,1,10/5/2011 13:47,0.85,14730,United Kingdom
569669,21086,SET/6 RED SPOTTY PAPER CUPS,5,10/5/2011 13:47,0.65,14730,United Kingdom
569669,23343,JUMBO BAG VINTAGE CHRISTMAS ,2,10/5/2011 13:47,2.08,14730,United Kingdom
569669,20866,BLUE ROSE FABRIC MIRROR,1,10/5/2011 13:47,1.25,14730,United Kingdom
569669,47504H,ENGLISH ROSE SPIRIT LEVEL ,2,10/5/2011 13:47,0.79,14730,United Kingdom
569669,47504K,ENGLISH ROSE GARDEN SECATEURS,1,10/5/2011 13:47,0.79,14730,United Kingdom
569669,72351A,SET/6 TURQUOISE BUTTERFLY T-LIGHTS,1,10/5/2011 13:47,2.1,14730,United Kingdom
569669,21992,VINTAGE PAISLEY STATIONERY SET,3,10/5/2011 13:47,1.25,14730,United Kingdom
569669,22197,POPCORN HOLDER,4,10/5/2011 13:47,0.85,14730,United Kingdom
569669,21098,CHRISTMAS TOILET ROLL,2,10/5/2011 13:47,1.25,14730,United Kingdom
569669,22800,ANTIQUE TALL SWIRLGLASS TRINKET POT,1,10/5/2011 13:47,3.75,14730,United Kingdom
569669,21078,SET/20 STRAWBERRY PAPER NAPKINS ,2,10/5/2011 13:47,0.85,14730,United Kingdom
569669,21080,SET/20 RED RETROSPOT PAPER NAPKINS ,1,10/5/2011 13:47,0.85,14730,United Kingdom
569669,23187,FRENCH STYLE STORAGE JAR BONBONS,2,10/5/2011 13:47,0.29,14730,United Kingdom
569669,23425,STORAGE TIN HOME SWEET HOME,3,10/5/2011 13:47,2.49,14730,United Kingdom
569669,21448,12 DAISY PEGS IN WOOD BOX,2,10/5/2011 13:47,1.65,14730,United Kingdom
569669,21059,PARTY INVITES DINOSAURS,5,10/5/2011 13:47,0.85,14730,United Kingdom
569669,85184C,SET 4 VALENTINE DECOUPAGE HEART BOX,2,10/5/2011 13:47,2.95,14730,United Kingdom
569669,22093,MOTORING TISSUE BOX,2,10/5/2011 13:47,0.39,14730,United Kingdom
569669,23345, DOLLY GIRL BEAKER,1,10/5/2011 13:47,1.25,14730,United Kingdom
569669,23371,SET 36 COLOUR PENCILS SPACEBOY ,1,10/5/2011 13:47,1.25,14730,United Kingdom
569669,85035A,GARDENIA 3 WICK MORRIS BOXED CANDLE,2,10/5/2011 13:47,4.25,14730,United Kingdom
569669,85034A,3 GARDENIA MORRIS BOXED CANDLES,2,10/5/2011 13:47,4.25,14730,United Kingdom
569669,22554,PLASTERS IN TIN WOODLAND ANIMALS,1,10/5/2011 13:47,1.65,14730,United Kingdom
569669,22557,PLASTERS IN TIN VINTAGE PAISLEY ,2,10/5/2011 13:47,1.65,14730,United Kingdom
569669,22551,PLASTERS IN TIN SPACEBOY,2,10/5/2011 13:47,1.65,14730,United Kingdom
569669,22294,HEART FILIGREE DOVE  SMALL,2,10/5/2011 13:47,1.25,14730,United Kingdom
569669,22295,HEART FILIGREE DOVE LARGE,1,10/5/2011 13:47,1.65,14730,United Kingdom
569669,21385,IVORY HANGING DECORATION  HEART,1,10/5/2011 13:47,0.85,14730,United Kingdom
569669,22295,HEART FILIGREE DOVE LARGE,1,10/5/2011 13:47,1.65,14730,United Kingdom
569669,23377,PACK OF 12 DOLLY GIRL TISSUES,2,10/5/2011 13:47,0.39,14730,United Kingdom
569669,20866,BLUE ROSE FABRIC MIRROR,1,10/5/2011 13:47,1.25,14730,United Kingdom
569669,20867,PINK ROSE FABRIC MIRROR,2,10/5/2011 13:47,1.25,14730,United Kingdom
569669,22326,ROUND SNACK BOXES SET OF4 WOODLAND ,1,10/5/2011 13:47,2.95,14730,United Kingdom
569669,21981,PACK OF 12 WOODLAND TISSUES ,3,10/5/2011 13:47,0.39,14730,United Kingdom
569669,79160,HEART SHAPE WIRELESS DOORBELL,2,10/5/2011 13:47,2.1,14730,United Kingdom
569669,21742,LARGE ROUND WICKER PLATTER ,1,10/5/2011 13:47,5.95,14730,United Kingdom
569669,21481,FAWN BLUE HOT WATER BOTTLE,2,10/5/2011 13:47,3.75,14730,United Kingdom
569669,22505,MEMO BOARD COTTAGE DESIGN,2,10/5/2011 13:47,4.95,14730,United Kingdom
569669,20726,LUNCH BAG WOODLAND,1,10/5/2011 13:47,1.65,14730,United Kingdom
569669,22630,DOLLY GIRL LUNCH BOX,2,10/5/2011 13:47,1.95,14730,United Kingdom
569669,22382,LUNCH BAG SPACEBOY DESIGN ,1,10/5/2011 13:47,1.65,14730,United Kingdom
569669,22276,WASH BAG VINTAGE ROSE PAISLEY,1,10/5/2011 13:47,2.55,14730,United Kingdom
569669,22092,BLUE PAISLEY TISSUE BOX,3,10/5/2011 13:47,0.39,14730,United Kingdom
569669,47594B,SCOTTIES DESIGN WASHBAG,1,10/5/2011 13:47,1.95,14730,United Kingdom
569669,21430,SET/3 RED GINGHAM ROSE STORAGE BOX,1,10/5/2011 13:47,3.75,14730,United Kingdom
569669,79160,HEART SHAPE WIRELESS DOORBELL,1,10/5/2011 13:47,2.1,14730,United Kingdom
569669,23074,EMBOSSED HEART TRINKET BOX,2,10/5/2011 13:47,2.08,14730,United Kingdom
569669,22621,TRADITIONAL KNITTING NANCY,2,10/5/2011 13:47,1.65,14730,United Kingdom
569669,21891,TRADITIONAL WOODEN SKIPPING ROPE,2,10/5/2011 13:47,1.45,14730,United Kingdom
569669,22666,RECIPE BOX PANTRY YELLOW DESIGN,1,10/5/2011 13:47,2.95,14730,United Kingdom
569669,22654,DELUXE SEWING KIT ,1,10/5/2011 13:47,5.95,14730,United Kingdom
569669,22652,TRAVEL SEWING KIT,2,10/5/2011 13:47,1.65,14730,United Kingdom
569669,22782,SET 3 WICKER STORAGE BASKETS ,1,10/5/2011 13:47,24.95,14730,United Kingdom
569669,22457,NATURAL SLATE HEART CHALKBOARD ,2,10/5/2011 13:47,2.95,14730,United Kingdom
569669,22500,SET OF 2 TINS JARDIN DE PROVENCE,1,10/5/2011 13:47,4.95,14730,United Kingdom
569669,22497,SET OF 2 TINS VINTAGE BATHROOM ,1,10/5/2011 13:47,4.25,14730,United Kingdom
569669,22629,SPACEBOY LUNCH BOX ,1,10/5/2011 13:47,1.95,14730,United Kingdom
569669,22147,FELTCRAFT BUTTERFLY HEARTS,4,10/5/2011 13:47,1.45,14730,United Kingdom
569670,21901,"KEY FOB , BACK DOOR ",1,10/5/2011 13:47,0.65,14730,United Kingdom
569670,16216,LETTER SHAPE PENCIL SHARPENER,5,10/5/2011 13:47,0.06,14730,United Kingdom
569670,21933,PINK VINTAGE PAISLEY PICNIC BAG,1,10/5/2011 13:47,1.65,14730,United Kingdom
569670,20970,PINK FLORAL FELTCRAFT SHOULDER BAG,1,10/5/2011 13:47,3.75,14730,United Kingdom
569670,22587,FELTCRAFT HAIRBAND RED AND BLUE,1,10/5/2011 13:47,0.85,14730,United Kingdom
569670,22494,EMERGENCY FIRST AID TIN ,2,10/5/2011 13:47,1.25,14730,United Kingdom
569670,22208,WOOD STAMP SET THANK YOU,2,10/5/2011 13:47,0.83,14730,United Kingdom
569670,22210,WOOD STAMP SET BEST WISHES,1,10/5/2011 13:47,0.83,14730,United Kingdom
569670,22737,RIBBON REEL CHRISTMAS PRESENT ,1,10/5/2011 13:47,1.65,14730,United Kingdom
569670,22952,60 CAKE CASES VINTAGE CHRISTMAS,1,10/5/2011 13:47,0.55,14730,United Kingdom
569670,23389,SPACEBOY MINI BACKPACK,1,10/5/2011 13:47,4.15,14730,United Kingdom
569670,22689,DOORMAT MERRY CHRISTMAS RED ,1,10/5/2011 13:47,8.25,14730,United Kingdom
569670,23295,SET OF 12 MINI LOAF BAKING CASES,1,10/5/2011 13:47,0.83,14730,United Kingdom
569670,22065,CHRISTMAS PUDDING TRINKET POT ,2,10/5/2011 13:47,0.39,14730,United Kingdom
569670,23091,ZINC HERB GARDEN CONTAINER,2,10/5/2011 13:47,6.25,14730,United Kingdom
569670,23090,VINTAGE GLASS T-LIGHT HOLDER,6,10/5/2011 13:47,0.83,14730,United Kingdom
569670,22909,SET OF 20 VINTAGE CHRISTMAS NAPKINS,2,10/5/2011 13:47,0.85,14730,United Kingdom
569670,22587,FELTCRAFT HAIRBAND RED AND BLUE,1,10/5/2011 13:47,0.85,14730,United Kingdom
569670,21098,CHRISTMAS TOILET ROLL,2,10/5/2011 13:47,1.25,14730,United Kingdom
569670,84519B,CARROT CHARLIE+LOLA COASTER SET,1,10/5/2011 13:47,1.25,14730,United Kingdom
569670,22367,CHILDRENS APRON SPACEBOY DESIGN,1,10/5/2011 13:47,1.95,14730,United Kingdom
569670,23292,SPACEBOY CHILDRENS CUP,1,10/5/2011 13:47,1.25,14730,United Kingdom
569670,22988,SOLDIERS EGG CUP ,1,10/5/2011 13:47,1.25,14730,United Kingdom
569670,23101,SILVER STARS TABLE DECORATION,1,10/5/2011 13:47,0.83,14730,United Kingdom
569670,21587,COSY HOUR GIANT TUBE MATCHES,1,10/5/2011 13:47,2.55,14730,United Kingdom
569670,22952,60 CAKE CASES VINTAGE CHRISTMAS,1,10/5/2011 13:47,0.55,14730,United Kingdom
569670,22738,RIBBON REEL SNOWY VILLAGE,1,10/5/2011 13:47,1.65,14730,United Kingdom
569670,22739,RIBBON REEL CHRISTMAS SOCK BAUBLE,1,10/5/2011 13:47,1.65,14730,United Kingdom
569670,23372,SET 36 COLOUR PENCILS DOLLY GIRL,1,10/5/2011 13:47,1.25,14730,United Kingdom
569670,23371,SET 36 COLOUR PENCILS SPACEBOY ,1,10/5/2011 13:47,1.25,14730,United Kingdom
569670,23412,HEART MIRROR ANTIQUE WHITE,1,10/5/2011 13:47,7.5,14730,United Kingdom
569670,22138,BAKING SET 9 PIECE RETROSPOT ,1,10/5/2011 13:47,4.95,14730,United Kingdom
569670,22326,ROUND SNACK BOXES SET OF4 WOODLAND ,1,10/5/2011 13:47,2.95,14730,United Kingdom
569670,22096,PINK PAISLEY SQUARE TISSUE BOX ,2,10/5/2011 13:47,0.39,14730,United Kingdom
569670,23389,SPACEBOY MINI BACKPACK,1,10/5/2011 13:47,4.15,14730,United Kingdom
569670,23461,SWEETHEART BIRD HOUSE,1,10/5/2011 13:47,4.15,14730,United Kingdom
569670,22580,ADVENT CALENDAR GINGHAM SACK,1,10/5/2011 13:47,5.95,14730,United Kingdom
569670,72818,CHRISTMAS DECOUPAGE CANDLE,3,10/5/2011 13:47,0.39,14730,United Kingdom
569670,85093,CANDY SPOT EGG WARMER HARE,3,10/5/2011 13:47,0.39,14730,United Kingdom
569670,85094,CANDY SPOT EGG WARMER RABBIT,4,10/5/2011 13:47,0.19,14730,United Kingdom
569670,20984,12 PENCILS TALL TUBE POSY,3,10/5/2011 13:47,0.29,14730,United Kingdom
569670,23313,VINTAGE CHRISTMAS BUNTING,2,10/5/2011 13:47,4.95,14730,United Kingdom
569670,21990,MODERN FLORAL STATIONERY SET,1,10/5/2011 13:47,1.25,14730,United Kingdom
569670,21992,VINTAGE PAISLEY STATIONERY SET,2,10/5/2011 13:47,1.25,14730,United Kingdom
569670,20992,JAZZ HEARTS PURSE NOTEBOOK,2,10/5/2011 13:47,0.39,14730,United Kingdom
569670,22778,GLASS CLOCHE SMALL,1,10/5/2011 13:47,3.95,14730,United Kingdom
569670,21587,COSY HOUR GIANT TUBE MATCHES,2,10/5/2011 13:47,2.55,14730,United Kingdom
569670,22197,POPCORN HOLDER,4,10/5/2011 13:47,0.85,14730,United Kingdom
569670,23301,GARDENERS KNEELING PAD KEEP CALM ,1,10/5/2011 13:47,1.65,14730,United Kingdom
569670,20754,RETROSPOT RED WASHING UP GLOVES,4,10/5/2011 13:47,2.1,14730,United Kingdom
569670,22629,SPACEBOY LUNCH BOX ,1,10/5/2011 13:47,1.95,14730,United Kingdom
569670,47504H,ENGLISH ROSE SPIRIT LEVEL ,2,10/5/2011 13:47,0.79,14730,United Kingdom
569670,22666,RECIPE BOX PANTRY YELLOW DESIGN,1,10/5/2011 13:47,2.95,14730,United Kingdom
569670,47504K,ENGLISH ROSE GARDEN SECATEURS,2,10/5/2011 13:47,0.79,14730,United Kingdom
569670,22382,LUNCH BAG SPACEBOY DESIGN ,1,10/5/2011 13:47,1.65,14730,United Kingdom
569670,20724,RED RETROSPOT CHARLOTTE BAG,1,10/5/2011 13:47,0.85,14730,United Kingdom
569670,22661,CHARLOTTE BAG DOLLY GIRL DESIGN,1,10/5/2011 13:47,0.85,14730,United Kingdom
569670,20726,LUNCH BAG WOODLAND,1,10/5/2011 13:47,1.65,14730,United Kingdom
569670,22383,LUNCH BAG SUKI DESIGN ,1,10/5/2011 13:47,1.65,14730,United Kingdom
569670,22092,BLUE PAISLEY TISSUE BOX,2,10/5/2011 13:47,0.39,14730,United Kingdom
569670,22271,FELTCRAFT DOLL ROSIE,1,10/5/2011 13:47,2.95,14730,United Kingdom
569670,22273,FELTCRAFT DOLL MOLLY,1,10/5/2011 13:47,2.95,14730,United Kingdom
569670,22557,PLASTERS IN TIN VINTAGE PAISLEY ,1,10/5/2011 13:47,1.65,14730,United Kingdom
569670,22551,PLASTERS IN TIN SPACEBOY,1,10/5/2011 13:47,1.65,14730,United Kingdom
569670,22554,PLASTERS IN TIN WOODLAND ANIMALS,1,10/5/2011 13:47,1.65,14730,United Kingdom
569670,23311,VINTAGE CHRISTMAS STOCKING ,3,10/5/2011 13:47,2.55,14730,United Kingdom
569670,23343,JUMBO BAG VINTAGE CHRISTMAS ,1,10/5/2011 13:47,2.08,14730,United Kingdom
569670,23344,JUMBO BAG 50'S CHRISTMAS ,1,10/5/2011 13:47,2.08,14730,United Kingdom
569670,22768,FAMILY PHOTO FRAME CORNICE,1,10/5/2011 13:47,9.95,14730,United Kingdom
569670,22689,DOORMAT MERRY CHRISTMAS RED ,2,10/5/2011 13:47,8.25,14730,United Kingdom
569670,23412,HEART MIRROR ANTIQUE WHITE,2,10/5/2011 13:47,7.5,14730,United Kingdom
569670,22402,MAGNETS PACK OF 4 VINTAGE COLLAGE,1,10/5/2011 13:47,0.39,14730,United Kingdom
569670,22988,SOLDIERS EGG CUP ,2,10/5/2011 13:47,1.25,14730,United Kingdom
569670,22977,DOLLY GIRL CHILDRENS EGG CUP,2,10/5/2011 13:47,1.25,14730,United Kingdom
569670,22400,MAGNETS PACK OF 4 HOME SWEET HOME,4,10/5/2011 13:47,0.39,14730,United Kingdom
569670,23508,MINI PLAYING CARDS DOLLY GIRL ,2,10/5/2011 13:47,0.42,14730,United Kingdom
569670,23507,MINI PLAYING CARDS BUFFALO BILL ,3,10/5/2011 13:47,0.42,14730,United Kingdom
569670,23311,VINTAGE CHRISTMAS STOCKING ,4,10/5/2011 13:47,2.55,14730,United Kingdom
569670,22736,RIBBON REEL MAKING SNOWMEN ,1,10/5/2011 13:47,1.65,14730,United Kingdom
569670,85093,CANDY SPOT EGG WARMER HARE,9,10/5/2011 13:47,0.39,14730,United Kingdom
569670,22736,RIBBON REEL MAKING SNOWMEN ,1,10/5/2011 13:47,1.65,14730,United Kingdom
569670,22952,60 CAKE CASES VINTAGE CHRISTMAS,4,10/5/2011 13:47,0.55,14730,United Kingdom
569670,22734,SET OF 6 RIBBONS VINTAGE CHRISTMAS,2,10/5/2011 13:47,2.89,14730,United Kingdom
569670,23313,VINTAGE CHRISTMAS BUNTING,2,10/5/2011 13:47,4.95,14730,United Kingdom
569670,22910,PAPER CHAIN KIT VINTAGE CHRISTMAS,1,10/5/2011 13:47,2.95,14730,United Kingdom
569670,22738,RIBBON REEL SNOWY VILLAGE,2,10/5/2011 13:47,1.65,14730,United Kingdom
569670,23293,SET OF 12 FAIRY CAKE BAKING CASES,1,10/5/2011 13:47,0.83,14730,United Kingdom
569670,23508,MINI PLAYING CARDS DOLLY GIRL ,1,10/5/2011 13:47,0.42,14730,United Kingdom
569670,22402,MAGNETS PACK OF 4 VINTAGE COLLAGE,1,10/5/2011 13:47,0.39,14730,United Kingdom
569670,23507,MINI PLAYING CARDS BUFFALO BILL ,1,10/5/2011 13:47,0.42,14730,United Kingdom
569670,23508,MINI PLAYING CARDS DOLLY GIRL ,1,10/5/2011 13:47,0.42,14730,United Kingdom
569670,22402,MAGNETS PACK OF 4 VINTAGE COLLAGE,1,10/5/2011 13:47,0.39,14730,United Kingdom
569670,23345, DOLLY GIRL BEAKER,1,10/5/2011 13:47,1.25,14730,United Kingdom
569670,84997C,CHILDRENS CUTLERY POLKADOT BLUE,1,10/5/2011 13:47,4.15,14730,United Kingdom
569670,23314,VINTAGE CHRISTMAS TABLECLOTH,1,10/5/2011 13:47,12.5,14730,United Kingdom
569670,22909,SET OF 20 VINTAGE CHRISTMAS NAPKINS,3,10/5/2011 13:47,0.85,14730,United Kingdom
569670,22630,DOLLY GIRL LUNCH BOX,1,10/5/2011 13:47,1.95,14730,United Kingdom
569670,23318,BOX OF 6 MINI VINTAGE CRACKERS,2,10/5/2011 13:47,2.49,14730,United Kingdom
569670,84818,DANISH ROSE PHOTO FRAME,1,10/5/2011 13:47,0.79,14730,United Kingdom
569670,22946,WOODEN ADVENT CALENDAR CREAM,2,10/5/2011 13:47,16.95,14730,United Kingdom
569670,23377,PACK OF 12 DOLLY GIRL TISSUES,1,10/5/2011 13:47,0.39,14730,United Kingdom
569670,23187,FRENCH STYLE STORAGE JAR BONBONS,4,10/5/2011 13:47,0.29,14730,United Kingdom
569670,22326,ROUND SNACK BOXES SET OF4 WOODLAND ,1,10/5/2011 13:47,2.95,14730,United Kingdom
569670,23392,SPACEBOY ROCKET LOLLY MAKERS,1,10/5/2011 13:47,2.08,14730,United Kingdom
569670,22326,ROUND SNACK BOXES SET OF4 WOODLAND ,1,10/5/2011 13:47,2.95,14730,United Kingdom
569670,22630,DOLLY GIRL LUNCH BOX,1,10/5/2011 13:47,1.95,14730,United Kingdom
569670,21098,CHRISTMAS TOILET ROLL,2,10/5/2011 13:47,1.25,14730,United Kingdom
569670,23012,GLASS APOTHECARY BOTTLE PERFUME,1,10/5/2011 13:47,3.95,14730,United Kingdom
569670,22410,MONEY BOX HOUSEKEEPING DESIGN,2,10/5/2011 13:47,1.25,14730,United Kingdom
569670,23343,JUMBO BAG VINTAGE CHRISTMAS ,2,10/5/2011 13:47,2.08,14730,United Kingdom
569670,22539,MINI JIGSAW DOLLY GIRL,1,10/5/2011 13:47,0.42,14730,United Kingdom
569670,22545,MINI JIGSAW BUNNIES,1,10/5/2011 13:47,0.42,14730,United Kingdom
569670,22530,MAGIC DRAWING SLATE DOLLY GIRL ,1,10/5/2011 13:47,0.42,14730,United Kingdom
569670,23372,SET 36 COLOUR PENCILS DOLLY GIRL,1,10/5/2011 13:47,1.25,14730,United Kingdom
569670,21587,COSY HOUR GIANT TUBE MATCHES,2,10/5/2011 13:47,2.55,14730,United Kingdom
569670,21479,WHITE SKULL HOT WATER BOTTLE ,1,10/5/2011 13:47,4.25,14730,United Kingdom
569670,22722,SET OF 6 SPICE TINS PANTRY DESIGN,1,10/5/2011 13:47,3.95,14730,United Kingdom
569670,23187,FRENCH STYLE STORAGE JAR BONBONS,6,10/5/2011 13:47,0.29,14730,United Kingdom
569670,22505,MEMO BOARD COTTAGE DESIGN,2,10/5/2011 13:47,4.95,14730,United Kingdom
569670,20685,DOORMAT RED RETROSPOT,1,10/5/2011 13:47,8.25,14730,United Kingdom
569670,21524,DOORMAT SPOTTY HOME SWEET HOME,1,10/5/2011 13:47,8.25,14730,United Kingdom
569670,21932,SCANDINAVIAN PAISLEY PICNIC BAG,2,10/5/2011 13:47,1.65,14730,United Kingdom
569670,21122,SET/10 PINK POLKADOT PARTY CANDLES,1,10/5/2011 13:47,1.25,14730,United Kingdom
569670,21933,PINK VINTAGE PAISLEY PICNIC BAG,4,10/5/2011 13:47,1.65,14730,United Kingdom
569670,79160,HEART SHAPE WIRELESS DOORBELL,1,10/5/2011 13:47,2.1,14730,United Kingdom
569670,23397,FOOT STOOL HOME SWEET HOME ,1,10/5/2011 13:47,9.95,14730,United Kingdom
569670,22796,PHOTO FRAME 3 CLASSIC HANGING,1,10/5/2011 13:47,9.95,14730,United Kingdom
569670,85015,SET OF 12  VINTAGE POSTCARD SET,2,10/5/2011 13:47,0.65,14730,United Kingdom
569671,22910,PAPER CHAIN KIT VINTAGE CHRISTMAS,40,10/5/2011 13:54,2.55,16020,United Kingdom
569671,23376,PACK OF 12 VINTAGE CHRISTMAS TISSUE,24,10/5/2011 13:54,0.39,16020,United Kingdom
569671,22909,SET OF 20 VINTAGE CHRISTMAS NAPKINS,12,10/5/2011 13:54,0.85,16020,United Kingdom
569671,23314,VINTAGE CHRISTMAS TABLECLOTH,2,10/5/2011 13:54,12.5,16020,United Kingdom
569671,22950,36 DOILIES VINTAGE CHRISTMAS,12,10/5/2011 13:54,1.45,16020,United Kingdom
569671,23436,VINTAGE CHRISTMAS GIFT BAG LARGE ,12,10/5/2011 13:54,1.25,16020,United Kingdom
569671,23373,VINTAGE CHRISTMAS PAPER GIFT BAG,10,10/5/2011 13:54,0.82,16020,United Kingdom
569671,23353,6 GIFT TAGS VINTAGE CHRISTMAS ,12,10/5/2011 13:54,0.83,16020,United Kingdom
569671,23234,BISCUIT TIN VINTAGE CHRISTMAS,6,10/5/2011 13:54,2.89,16020,United Kingdom
569671,22734,SET OF 6 RIBBONS VINTAGE CHRISTMAS,6,10/5/2011 13:54,2.89,16020,United Kingdom
569671,23374,RED SPOT PAPER GIFT BAG,10,10/5/2011 13:54,0.82,16020,United Kingdom
569671,23438, RED SPOT GIFT BAG LARGE,12,10/5/2011 13:54,1.25,16020,United Kingdom
569671,23312,VINTAGE CHRISTMAS GIFT SACK,4,10/5/2011 13:54,4.15,16020,United Kingdom
569671,22158,3 HEARTS HANGING DECORATION RUSTIC,8,10/5/2011 13:54,2.95,16020,United Kingdom
569671,23328,SET 6 SCHOOL MILK BOTTLES IN CRATE,4,10/5/2011 13:54,3.75,16020,United Kingdom
569671,22083,PAPER CHAIN KIT RETROSPOT,6,10/5/2011 13:54,2.95,16020,United Kingdom
